source,keyword,title,authors,doi,publication_date,journal,abstract
PubMed,valvular heart disease,Surgical Outcome of Supra-Valvular Aortic Stenosis: A 50-Year Single-Centre Experience.,Thibault Schaeffer; Tommaso Bellastrada; Doris Kienmoser; Muneaki Matsubara; Jonas Palm; Teresa Lemmen; Nicole Piber; Paul Philipp Heinisch; Alfred Hager; Peter Ewert; Jürgen Hörer; Masamichi Ono,10.1093/ejcts/ezag062,2026-02-05,European journal of cardio-thoracic surgery : official journal of the European Association for Cardio-thoracic Surgery,"This study aimed to evaluate and compare the long-term outcomes of 3 different surgical techniques (McGoon, Doty, and Brom) for supra-valvular aortic stenosis (SVAS) and to identify the risk factors affecting mortality and morbidity.
We performed a single-centre retrospective analysis of all patients who underwent surgery for SVAS between August 1974 and January 2025. The outcomes were analysed using survival and competing risk analysis, and risk factors were identified using Cox regression models.
A total of 75 patients were identified, 26 (35%) profited from the McGoon technique, 33 (44%) patients received a Doty repair, and 16 (21%) underwent Brom repair. Williams-Beuren syndrome was associated with 45 (60%) patients. Associated anomalies included pulmonary stenosis in 40 (53%) patients, aortic coarctation in 24 (32%), and abnormal coronary arteries in 14 (19%). Transplant-free survival at 15 years was 92%, and no difference was found between surgical techniques (P = .339). Abnormal coronary arteries were a risk factor for major adverse cardiac events (odds ratio 8.666, P = .011) and mortality (hazard ratio [HR] 4.285, P = .030). Cumulative incidence of reoperation at 15 years was 18%, with no difference between surgical techniques (P = .299). However, patients with pulmonary stenosis (HR 3.450, P = .020) had a higher risk of reoperation.
Survival after surgical repair of SVAS is over 90% at 15 years regardless of the surgical technique. Abnormal coronary arteries are responsible for higher operative mortality. Concomitant pulmonary artery stenosis is at a higher risk of reoperation, suggesting more severe arterial disease."
PubMed,valvular heart disease,Prevalence of diabetic cardiomyopathy in low- and middle-income countries: a systematic review protocol.,A Arowolo; L D M Bennie; W Mahmoud; R Johnson; M E Engel,10.1186/s13643-026-03117-w,2026-02-14,Systematic reviews,"The burden of type 2 diabetes mellitus (T2DM) is rising rapidly in low- and middle-income countries (LMICs). Diabetic cardiomyopathy (DbCM), defined as myocardial dysfunction occurring independently of coronary artery disease, hypertension, or significant valvular disease, is an important complication of T2DM and may progress to overt heart failure if undiagnosed. While well characterised in high-income settings, DbCM prevalence and distribution in LMICs remain poorly defined. This systematic review aims to estimate the pooled prevalence of DbCM among adults with T2DM in LMICs.
This protocol follows the Preferred Reporting Items for Systematic Reviews and Meta-Analyses Protocols (PRISMA-P) guidelines and the Joanna Briggs Institute (JBI) Manual for Evidence Synthesis. A comprehensive search will be conducted in PubMed, Scopus, Web of Science, Embase, AJOL, and EBSCOhost, supplemented by regional databases and grey literature sources. Observational studies conducted in LMICs that report the prevalence of DbCM among adults with T2DM will be considered. DbCM must be diagnosed using objective cardiac imaging after exclusion of alternative causes of myocardial dysfunction. Two reviewers will independently screen, extract data, and assess risk of bias using a tool adapted for prevalence studies.
Where data are sufficiently comparable, pooled prevalence estimates will be calculated using random-effects meta-analysis. Prevalence proportions will be modelled using generalised linear mixed models with a logit link function to account for within- and between-study variability. Statistical heterogeneity will be assessed using the I2 statistic and explored through subgroup analyses by demographic, clinical, and regional characteristics. Where meta-analysis is not appropriate, findings will be synthesised using a structured narrative approach.
This review is expected to report pooled prevalence estimates of DbCM across LMICs and to describe regional variation. Differences in diagnostic approaches, glycaemic control, diabetes duration, age, sex, and geographical region are anticipated to contribute to heterogeneity and will be explored where data permit.
By synthesising available evidence on the prevalence of DbCM in LMICs, this review will clarify the burden of disease and provide evidence to inform health system planning and guide future research and prevention efforts aimed at reducing diabetes-related heart failure."
PubMed,valvular heart disease,[Research progress on acute left ventricular apical ballooning caused by left ventricular outflow tract obstruction with obstructive hypertrophic cardiomyopathy].,C Z Shen; X F Ouyang; Q You,10.3760/cma.j.cn112148-20251113-00800,2026-02-24,Zhonghua xin xue guan bing za zhi,
PubMed,valvular heart disease,[Feasibility study of intelligent structural-functional analysis of cardiomyopathy based on four-dimensional modeling from cardiac magnetic resonance sequences].,S Song; Y J Wang; D Fu; H J Yin; K N Zhou; L Wang; X H Zhang; X Lou; F Cao,10.3760/cma.j.cn112148-20251009-00703,2026-02-24,Zhonghua xin xue guan bing za zhi,"Objective: To construct and preliminarily validate the four-dimensional cardiac mesh model based on cardiac magnetic resonance (CMR) imaging for the evaluation of cardiac structure and function in patients with cardiomyopathy. Methods: A total of 70 patients who underwent CMR examinations were enrolled from the UK Biobank database as the training set. A four-dimensional mesh model of the cardiac left and right ventricles was constructed using CMR images that passed quality control. Additionally, a validation set consisting of 30 patients who underwent CMR examinations at the First Medical Center of the Chinese People's Liberation Army General Hospital from March 2021 to October 2024 were included. These patients were classified into three groups based on clinical diagnosis: dilated cardiomyopathy (DCM) group, hypertrophic cardiomyopathy (HCM) group, and control group (no cardiomyopathy). The trained model was applied to analyze the CMR images of the validation set patients, calculating various cardiac structure and function parameters, including left ventricular volume index, left ventricular ejection fraction, left myocardial mass index, and strain. Differences in these parameters between the DCM or HCM groups and the control group were compared, and linear mixed models were used for statistical analysis of inter-group differences. Results: The age of patients in the training set was (62.2±10.3) years, with 58 (83%) males. The age of patients in the validation set was (56.5±13.9) years, with 21 (70%) males, including 8 patients in the HCM group, 9 in the DCM group, and 13 in the control group. The left ventricular ejection fraction in the DCM group was lower than that in the control group ((39.34±3.73) % vs. (53.56±2.98) %, P=0.006 3). The linear mixed model analysis showed that the left ventricular volume index and various strain parameters in the DCM group were significantly higher than those in the control group (all P<0.001). The left myocardial mass index in the HCM group was higher than that in the control group ((94.21±9.10) g/m² vs. (56.36±11.33) g/m², P<0.001). The analysis results of the linear mixed model were consistent with it (P<0.001). Conclusions: The preliminary results confirm that the four-dimensional cardiac mesh model based on CMR imaging constructed in this study could integrate and evaluate multiple parameters of cardiac structure and function in patients with cardiomyopathy. It has the potential to become an intelligent imaging diagnostic tool for cardiac diseases."
PubMed,deep learning,Novel algorithm for knee localization and diagnosis and grading of knee osteoarthritis based on a priori information: data from OAI.,Chunbo Deng; Chengbao Peng; Yingwei Sun; Guan Wang; Jing Liu; Xueyong Liu,10.1186/s12880-026-02235-0,2026-02-17,BMC medical imaging,"To develop and evaluate a deep learning-based method for fully automatic segmentation of the knee joint and to diagnose and classify knee osteoarthritis (KOA ) using prior information.
All X-rays were obtained from the Osteoarthritis Initiative (OAI). We comprehensively consider the a priori information of knee data, redesign the KOA assessment process, and propose the Anchor-free Knee Probability Calculation Net (AKPCNet) knee joint region of interest extraction algorithm by calculating the probability of each point as the left and right knee joint centroids, determining the location of the centroid of the knee joint, and then extracting the region of fixed size resolution around the centroid. We propose Attention Pooling, a global pooling optimization algorithm, and an attention pooling based low-order feature reinforcement network (APLFRNet) to improve the KL classification accuracy of KOA. The performance of the classification models was assessed using the area under the receiver operating characteristic curve (ROC AUC) and balancing accuracy.
In total, 35,000 knee radiographs (anteroposterior view) were obtained from the Osteoarthritis Initiative (OAI). The accuracy of automatic recognition of left and right knee joint center points was 97.8% and 97.4%, respectively. The balancing accuracy of knee osteoarthritis assessment of five classifications according to the grading was 73.23%, the balancing accuracy of three classifications (KL0-1 vs.KL2vs.KL3-4) for estimating severity reached 82.22%, the accuracy rate of two classifications (KL0-1vs. KL2-4) for diagnosis was 87.6%. The accuracy of early diagnosis (KL0 vs. KL1 and KL0 vs. KL2) was 66.58% and 87.1%, respectively average areas under the curve of the five classifications, three classifications, and two classifications were 0.90,0.95 and 0.94 respectively.
Our new algorithm can accurately assess the severity of knee osteoarthritis (KOA) and provide decision support for research and clinical practice."
PubMed,deep learning,Threat discrimination of real-world social interactions in schizotypal traits.,Akila Kadambi; Sophia Baia; Elinor Yeo; Hongjing Lu,10.3758/s13423-025-02821-3,2026-02-17,Psychonomic bulletin & review,"Threat detection is compromised across the schizophrenia spectrum, often revealed by paranoia and delusions. Threat difficulties extend to nonclinical populations with liability toward schizophrenia. A key source of these difficulties may be due to hyper-sensitivity to social stressors in real-world environments. In a large, nonclinical sample (N = 161), we measured the influence of social context to threat detection in social interactions. Social interactions were captured in naturalistic videos and validated as threatening or nonthreatening. Deep learning models were employed to re-render the videos by parsing different amounts of social context depicted in these interactions. Then, we measured how threat detection was influenced by individual variability in schizotypal and autistic traits as a function of social context. Individuals with high schizotypal traits showed reduced threat discrimination ability in the presence of more social context, but better threat detection when the interactions were primarily reduced to body kinematics. The effect was more pronounced in individuals higher on suspicious tendencies and odd belief traits in schizotypy, and social communication traits in the autism spectrum. These results suggest that disruptions from social context may underlie threat detection difficulties across the schizophrenia spectrum."
PubMed,deep learning,Assumption-Agnostic Deep Learning Framework for Holistic Clinical Trial Monitoring.,Shaoming Yin; Zheyang Wu; Jianchang Lin,10.1007/s43441-026-00915-1,2026-02-17,Therapeutic innovation & regulatory science,"Recently developed machine learning-enabled approaches to quality tolerance limit (QTL) surveillance offer efficiencies over labour-intensive source data verification. However, their reliance on parametric assumptions, restriction to Poisson or Bernoulli data types, and treatment of subject visits as independent observations limit their performance in the heterogeneous, longitudinal settings typical of modern clinical trials. We propose an assumption-agnostic framework for anomaly detection that combines two key components: (1) a hierarchical, non-parametric, multi-dimensional deviation scoring scheme based on discrepancies between reconstructed and observed values, and (2) a long short-term memory autoencoder that learns the joint temporal distribution of all numeric variables. Together, these components enable continuous, centralized detection of anomalies-including QTL deviations-across all numeric data types and hierarchical levels (program, study, site, and participant). The framework ingests streaming data from electronic data capture systems, vendors, and embedded numeric representations of text, inferring a shared latent manifold that captures complex cross-domain relations and intra-subject dynamics without relying on predefined mappings or historical priors. As new data accrue, deviation score thresholds are continuously updated to maintain robust performance. We evaluated the framework using simulations modeled on real-world trial structures and anomaly patterns, along with a supporting case study. Results demonstrate substantial improvements in anomaly signal discrimination, significant reductions in unnecessary follow-up, and strong computational scalability. Anchored in the risk-based monitoring paradigm articulated in ICH E6(R3), the proposed framework provides sponsors with a practical toolset for earlier hazard detection, enhanced participant safety, and streamlined trial operations."
PubMed,deep learning,"Estimating changes in center pivot irrigation in the High Plains Aquifer using a hybrid GIS-remote sensing deep learning approach, 2001 to 2023.",Todd D Fagin; Jacqueline M Vadjunec; Lanah M Hinsdale,10.1007/s10661-026-15061-2,2026-02-17,Environmental monitoring and assessment,"Since the introduction of center pivot irrigation (CPI) technologies in the 1950s, there has been a precipitous increase in irrigated cropland in the U.S. High Plains. While CPI has helped ""drought proof"" agriculture operations, thereby enhancing food security and permitting the expansion of agriculture operations in this semi-arid, drought-prone region, it has also contributed to groundwater depletion, which now threatens the very livelihoods of those who have become dependent on these technologies. Further compounding the issue, groundwater is a shared resource often underlying numerous jurisdictional boundaries and governed by a patchwork of regulations. It is therefore incumbent to develop spatially explicit models of CPI changes over time. However, given both the geographic extent and spatial and spectral variations of the phenomena, traditional photogrammetric and remote sensing methods to detect CPI dynamics have been inadequate or difficult to replicate. To address this, we utilized a hybrid GIS-remote sensing approach that combines multi-year Landsat imagery extracted from Google Earth Engine with Esri's deep learning framework for ArcGIS to rapidly estimate CPI extent with the High Plains Aquifer of the U.S. Great Plains for every other year from 2001 to 2023. Our results show an overall trend of increasing CPI throughout the region, with a net increase from ~ 3,779,777 ha under CPI in 2001 to ~ 5,293,245 ha in 2023 (+ 40% increase), with similar patterns emerging at both the state and county levels. Our method is practical, replicable, and extensible with readily available imagery datasets and deep learning tools, and accurately estimated CPI (~ 89.79% overall accuracy on average) in the region, providing a framework for continued monitoring of CPI changes."
PubMed,deep learning,Prediction of Major Stroke (NIHSS > 5) Based on MR Perfusion Imaging Using a 3D ResNet.,Christoph C Kurmann; Adnan Mujanovic; Morin Beyeler; Leander Clénin; Philipp Becker; Roman Rohner; Richard McKinley; Shaokai Zheng; Marta Olive Gadea; Eike Immo Piechowiak; Tomas Dobrocky; Sara Pilgram-Pastor; Valerian Altersberger; Bruce Campbell; Thomas Raphael Meinel; David Seiffge; Urs Fischer; Jan Gralla; Johannes Kaesmacher,10.1007/s00062-026-01623-x,2026-02-17,Clinical neuroradiology,"Prediction of stroke symptoms from perfusion patterns in ischemic stroke imaging would be desirable for decision making in relevant clinical scenarios as for example after incomplete mechanical thrombectomy or in perioperative strokes. Aim was to train a model to detect a major stroke defined as NIHSS > 5.
Retrospective study of patients from the prospectively collected local Stroke Registry with large-/medium-vessel anterior circulation or without occlusion from 01/2015-12/2021 (N = 982, median age 74.5 (IQR 64.3-82), 47.5% female). Splits into training-set (80%), validation-set (10%) and temporally separated internal test-set (10%). Admission MR-perfusion Tmax-maps from 6 different MR-scanners were used as input for an 18-layer 3D-ResNet to predict major stroke (NIHSS > 5). Association of reported and predicted NIHSS > 5 with 90-days modified Rankin Scale (mRS) > 2 was tested using multivariate logistic regression.
Vessel occlusion was observed in 80% and NIHSS > 5 in 50% of all patients. On the internal test-set, Receiver Operating Characteristic area under the curve (ROC-AUC) was 0.87 (95%-CI ± 0.04) and Precision-Recall-AUC (PR-AUC) 0.85 (95%-CI ± 0.05). Accuracy was 78%, weighted F1-score 0.78. Including only vessel occlusions in the internal test-set, ROC-AUC was 0.81 (95%-CI ± 0.05) and PR-AUC 0.87 (95%-CI ± 0.05), accuracy was 73%, weighted F1-score 0.73. Reported NIHSS > 5 (aOR 2.03, 95%-CI 0.94-4.38, p = 0.07) and predicted NIHSS > 5 (aOR 3.61, 95%-CI 0.88-14.88, p = 0.08) both predicted 90-days mRS > 2, with similar model performance (BIC: 310.6 vs. 310.7; AIC: 252.4 vs. 252.5).
Prediction of a major stroke (NIHSS > 5) from MR-perfusion Tmax-maps was feasible and performed well on our internal test set."
PubMed,deep learning,EchoNet++: A multilingual soccer match audio commentary dataset.,Fahad Majeed; Maria Nazir; Marco Agus; Jens Schneider,10.1038/s41598-026-39884-8,2026-02-17,Scientific reports,"We present a robust, multilingual, and multistage audio analysis pipeline for automatic processing of professional soccer match broadcasts. Rather than proposing a new standalone ASR model, this work introduces a reproducible end-to-end system and systematic component-level analysis that reveal how preprocessing, segmentation, transcription, and translation jointly affect performance under real-world broadcast conditions. The pipeline performs audio extraction, denoising, speech segmentation, transcription, and translation in a unified framework, enabling scalable, language-agnostic audio understanding. Audio is extracted from match videos using FFmpeg, transformed into the frequency domain via FFT, and filtered with a Butterworth bandpass filter (300 Hz-7 kHz) to isolate speech-relevant frequencies. We apply deep learning-based denoising using Demucs and segment speech regions using Silero VAD, followed by categorization of commentator and spectator streams based on temporal and density cues. Each speech segment is transcribed using multiple Automatic Speech Recognition (ASR) models, including Whisper variants (Medium, Large, Turbo) and Insanely Fast Whisper, and non-English transcripts are translated into English. All results, including transcriptions, translations, and metadata (timestamps, segment labels, and language codes), are exported as match-structured JSON files. We evaluate our pipeline on full-match videos from Europe's top leagues, achieving low word error rates, accurate language detection, and consistent segmentation across diverse acoustic conditions. To support reproducible research and downstream tasks such as summarization and analytics, we will publicly release the dataset and processing pipeline."
PubMed,deep learning,De novo covalent drug generation with enhanced drug-likeness and safety.,Wenbo Zhang; Tianxiao Liu; Xiaoying Dong; Saisai Sun; Xiaojun Yao; Pengyong Li; Lin Gao,10.1038/s42003-026-09725-5,2026-02-17,Communications biology,"Covalent drugs have long played an essential role in therapeutics, yet computational design approaches remain largely confined to virtual screening of existing libraries. Despite recent advances in deep generative models for drug discovery, methods specifically tailored to de novo covalent drug generation are still lacking. Here we introduce CovaGEN, a conditional latent diffusion framework for the de novo design of covalent inhibitors with enhanced drug-likeness and safety. CovaGEN generates ligands from a drug-like latent space while conditioning on target sequences and employing a classifier to guide the formation of desirable covalent warheads. A reinforcement learning strategy further optimizes the safety profiles of generated molecules. Experimental results demonstrate that CovaGEN effectively generates covalent drugs with the desired covalent warheads, exhibiting strong target protein affinity, favorable drug-likeness, and low toxicity. When applied to EGFR T790M and Mpro, the generated compounds exhibit higher probabilities of covalent binding. Overall, CovaGEN offers a pioneering approach for the de novo design of covalent inhibitors, advancing the discovery of covalent drugs with improved properties."
PubMed,deep learning,Explainable AI in education: integrating educational domain knowledge into the deep learning model for improved student performance prediction.,Ming Qiang; Ziyang Liu; Ru Zhang,10.1038/s41598-026-40538-y,2026-02-18,Scientific reports,"Although deep learning models, especially the Artificial Neural Network (ANN), are widely used for student performance prediction, their ""black-box"" nature often leads to unreliable learned relationships that contradict educational domain knowledge, limiting both trustworthiness and further performance improvement. Based on Shapley Additive Explanations (SHAP), this study developed an ANN using a public dataset containing 395 Portuguese high school students' mathematics performance records. The analysis identified key features influencing students' mathematics performance and revealed that the original correlations learned by the ANN were inconsistent with established educational domain knowledge. To address this issue, we proposed the Student Performance Prediction Explanation (SPPE) algorithm for optimizing ANN, which reassessed the contribution of 30 features under the guidance of educational domain knowledge. Both global and local interpretability analyses were conducted to examine the process of importance changes. Furthermore, this study found that after aligning the model with educational domain knowledge, the prediction accuracy of the proposed ANN achieved a 26.9% improvement compared with the original model. In addition, it outperformed some typical traditional machine learning algorithms. Additional experiments further confirmed that the proposed SPPE strategy is applicable to various ANN architectures, supporting its robustness across model structures within this dataset and reinforcing its generalizability and practical value. The findings of this study demonstrated that integrating educational domain knowledge can improve student performance prediction, contributing to the development of interpretable neural network frameworks and offering actionable insights for other educational applications."
