source,keyword,title,authors,doi,publication_date,journal,abstract
Crossref,valvular heart disease,RELATION OF HEART WEIGHT WITH AGE AND WEIGHT OF CADAVER,Jolly Agarwal; Virendra Kumar,10.21761/jms.v2i01.10838,2027-07-25,SRMS JOURNAL OF MEDICAL SCIENCE,"Introduction: Height, weight, and age of person has significant impact on the normal size of&#x0D; heart. These parameters need to be considered when cut-off values indicating the need for&#x0D; treatment or even surgery are established. The aim of present work is to study the relation of&#x0D; weight of the heart with age and weight of cadaver.&#x0D; Material and Methods: The study was performed in the Department of Anatomy, Shri Ram&#x0D; Murti Smarak Institute of Medical Sciences, Bareilly on 30 hearts from embalmed cadavers.&#x0D; The hearts were procured from the cadavers available in our department. The heart was&#x0D; thoroughly cleaned and measurements were taken.&#x0D; Results: The mean heart weight was 223.37 ± 57.78 g. Significant relationship between age of&#x0D; the cadaver and weight of the heart (p=0.0004), weight of cadaver and weight of heart&#x0D; (p=0.0001) was observed.&#x0D; Conclusion: The above study provides valuable data of the heart in our geographical location,&#x0D; which may be useful for cardiac surgeons and physicians."
Crossref,valvular heart disease,Association of Helicobacter pylori toxins cagA and vacA with Parkinson's Disease,Enas A. Daef; Mona H. Abdel-Rahim; Eman M. Farghly; Eman M.H. Khedr; Mona S. Embarek,10.21608/ejmm.2026.483634.2350,2027-04-01,Egyptian Journal of Medical Microbiology,
Crossref,valvular heart disease,Diagnostic and Prognostic Utility of IL-17 and TNF-α in Psoriasis: Insights into Early Detection and Disease Severity,Dhamya K. Sarhan; Jenan M. Ghani; Baneen A. Abd Ulrahman; Intisar R. Sharba; Jinan M. Abd,10.21608/ejmm.2026.482466.2339,2027-04-01,Egyptian Journal of Medical Microbiology,
Crossref,valvular heart disease,Interleukin-30 Level in Patients with Psoriasis Vulgaris and its Relation to Disease Severity,Heba E.S. Hassan; Nessma A. Nosser; Nora M. Darwish; Fatma F. El Dakrory,10.21608/ejmm.2026.487292.2402,2027-04-01,Egyptian Journal of Medical Microbiology,
Crossref,valvular heart disease,Detection of Serum Levels of Interleukin-37 In Patients with Vitiligo and Its Correlation with Disease Activity,Mona G. Nada; Nancy M. Mamdouh; Mera M.G. Anan,10.21608/ejmm.2026.489043.2422,2027-04-01,Egyptian Journal of Medical Microbiology,
Crossref,valvular heart disease,The Role of Nuclear Enriched Abundant Transcript 1 (NEAT1) as a Novel Marker in Diagnosis of Systemic Lupus Erythematosus Disease in Benha University Hospital,"Amany K. Shahat; Ahmed S. Osman; El-Sayed M. Abd-Elghany; Neama L. Ismail; Noha H, Ibrahim",10.21608/ejmm.2026.484722.2369,2027-04-01,Egyptian Journal of Medical Microbiology,
Crossref,valvular heart disease,Comparison of Mexican Systemic Lupus Erythematosus Disease Activity Index pediatric lupus nephritis with Cyclophosphamid and Mycophenolate mofetil after induction period,Gartika Sapartini; Kevin Immanuel; Reni Ghrahani; Budi Setiabudiawan,10.7199/ped.oncall.2027.24,2027,Pediatric Oncall,
Crossref,valvular heart disease,Seroprevalence of Varicella Zoster Virus and Its Association with Interleukin-12/23p40-Mediated Immune Dysregulation in Patients with Myocardial Cardiac Disease: A Case-Control Study,Wisal Salman S. Abd,10.21608/ejmm.2026.477367.2290,2027-01-01,Egyptian Journal of Medical Microbiology,
Crossref,valvular heart disease,"Correlation Between T-Cell Subsets (CD4⁺/CD8⁺), IL-17 Levels, and Multidrug-Resistant Bacterial Infections in Patients with Chronic Kidney Disease",Baedaa A. Jassim; Sundus J. Muhammad,10.21608/ejmm.2026.477574.2293,2027-01-01,Egyptian Journal of Medical Microbiology,
Crossref,valvular heart disease,Improving Citrus Leaf Disease Segmentation and Classification with a Game Theoretical U-Net Convolutional LightGBM model,K. Rama Gangi Reddy; K.S. Thirunavukkarasu,10.1504/ijiei.2027.10072915,2027,International Journal of Intelligent Engineering Informatics,
Crossref,valvular heart disease,Spectrum of Congenital Heart Diseases in Early Childhood (1-60 months): Insights from a Sub-Himalayan Tertiary Care Centre,Shikha Verma; Meenu Yadav; Seema Sharma; Milap Sharma; Kavya Sharma,10.7199/ped.oncall.2027.46,2027,Pediatric Oncall,
Crossref,valvular heart disease,Enhanced Diagnostic Performance of a Combined Immunological Biomarker Panel for Celiac Disease,Kawakib I. Al-zubaidy; Sanaa S. Atia; Fatima G. Ali; Hind A.N. Al-Ajwady,10.21608/ejmm.2026.481694.2335,2027-01-01,Egyptian Journal of Medical Microbiology,
Crossref,valvular heart disease,An Intelligent Approach with Integrated Feature Selection for Accurate Parkinson's Disease Diagnosis,Pravin Madhukar Dhanrao; B.K. Madhavi; Haard Patel; Debabrata Swain; Sashikala Mishra; Het Prajapati; Shrey Joshi,10.1504/ijims.2027.10072985,2027,International Journal of Internet Manufacturing and Services,
Crossref,valvular heart disease,Prognostic Value of Exercise-Induced Left Ventricular Functional Reserve Assessed by Left Ventricular Global Strain in Heart Failure With Preserved Ejection Fraction,Darae Kim; Jihoon Kim; Eun Kyoung Kim; Sung-A Chang; Sung-Ji Park; Jin-Oh Choi; Joonghyun Ahn; Jeong Hoon Yang,10.4070/kcj.2025.0440,2027,Korean Circulation Journal,
Crossref,deep learning,Learner profiles and the process of Learning in the Higher Educational Context,Christos Skourlas; Petros Belsis,10.15556/ijiim.02.01.003,2115-03-05,International Journal on Integrated Information Management,
Crossref,deep learning,WEB-BASED COLLABORATIVE LEARNING AND KNOWLEDGE SHARING IN INFORMAL BUSINESS NETWORKS,George Stalidis; Costis Papadimitrakopoulos; Theocharis Tsakiris,10.15556/ijiim.01.02.002,2114-12-10,International Journal on Integrated Information Management,
Crossref,deep learning,Availability and Utilization of Tools and Equipment for Teaching and Learning Garment Making Trade in the Senior Secondary Schools in Edo State,,10.20431/2349-0381.0303002,2106,"International Journal of Humanities, Social Sciences and Education",
Crossref,deep learning,Title Pending 8122,,10.3998/mjcsl.8122,2036-05-11,Michigan Journal of Community Service Learning,
Crossref,deep learning,Title Pending 8219,,10.3998/mjcsl.8219,2036-04-13,Michigan Journal of Community Service Learning,
Crossref,deep learning,Title Pending 8273,,10.3998/mjcsl.8273,2036-03-03,Michigan Journal of Community Service Learning,
Crossref,deep learning,Title Pending 7452,,10.3998/mjcsl.7452,2036-01-19,Michigan Journal of Community Service Learning,
Crossref,deep learning,Title Pending 6294,,10.3998/mjcsl.6294,2034-12-20,Michigan Journal of Community Service Learning,
Crossref,deep learning,Title Pending 5730,,10.3998/mjcsl.5730,2034-11-18,Michigan Journal of Community Service Learning,
Crossref,deep learning,Title Pending 3643,,10.3998/mjcsl.3643,2033-09-06,Michigan Journal of Community Service Learning,
Crossref,deep learning,Title Pending 4120,,10.3998/mjcsl.4120,2033-03-28,Michigan Journal of Community Service Learning,
Crossref,deep learning,Title Pending 2741,,10.3998/mjcsl.2741,2032-09-28,Michigan Journal of Community Service Learning,
Crossref,deep learning,Machine Learning Application for SAIs,Tiare Rivera,10.56251/watu4873,2030-10-20,International Journal of Government Auditing,
Crossref,deep learning,Integration of Biomechanics and Digital Technology: Using Kinovea for Motion Analysis and Learning for Beginner Athletes,Muhammad Nur Hudha; Riezky Maya Probosari; Annisa Nur Khasanah; Supurwoko; Salsabila Kholifahtun Nisa’; Gifran Rihla Gifarka Latief,10.58524/jcss.v4i2.890,2029-11-29,Journal of Coaching and Sports Science,"Background: The integration of biomechanics with digital motion-analysis technologies has introduced new approaches for examining movement efficiency, kinematic characteristics, and technical patterns in walking and running activities. Kinovea, as an accessible motion-analysis software, provides both visual and quantitative feedback. However, its application in supporting technique development among beginner athletes remains insufficiently explored. Aim: This study aims to describe the use of Kinovea in biomechanics training and examine its contribution to the awareness of kinematic characteristics and movement techniques among beginner athletes. Methods: A descriptive qualitative design involved 72 beginner athletes aged 18–25 years selected through purposive sampling. Data were collected over 16 weeks through interviews, field observations, and motion video recordings analyzed using Kinovea. Kinematic data focused on joint angles, stride behavior, and movement phases during walking, running, and the flight phase. Qualitative data were analyzed using content analysis with NVivo 12, while kinematic results were interpreted descriptively to identify performance patterns and areas for technical refinement. Result: Kinematic analysis showed coordinated joint-angle patterns across all phases. Walking analysis identified arm swing angles of 50.9°–58.8° and leg separation angles of 64.3°–67.2°, indicating a stable gait rhythm. The running analysis revealed knee angles of 68.8°–69.8° and elbow angles of 87.6°–89.1°, indicating efficient propulsive mechanics. The flight phase demonstrated knee angles of 81.2°–87.8° and elbow angles of 80.4°–88.3°, suggesting effective momentum use and postural stability. These measurements supported stride-efficiency assessment and technique evaluation. Qualitative findings revealed that Kinovea enabled athletes to interpret movement phases and identify technical inefficiencies through slow-motion and frame-by-frame visualization. Conclusion: Kinovea supports basic motion analysis by providing clear kinematic information and helping beginner athletes observe and refine their movement techniques. The findings also offer practical value for coaches by enabling more precise identification of inefficient patterns and guiding targeted corrections during early-stage training."
Crossref,deep learning,Sparsity Learning via Structured Functional Factor Augmentation,Hanteng Ma; Ziliang Shen; Xingdong Feng; Xin Liu,10.5705/ss.202025.0205,2029,Statistica Sinica,
Crossref,deep learning,Cyber Defense Digital Twins: A Federated Learning and Zero-Trust AI Architecture for Autonomous Threat Prediction and Response,Sivaramakrishnan Narayanan,10.32628/cseit251116279,2028-08-27,"International Journal of Scientific Research in Computer Science, Engineering and Information Technology","Modern enterprise networks operate under persistent threats that exploit cloud-native misconfigurations, identity sprawl, and API vulnerabilities at machine speed. Existing security operations center (SOC) architectures remain largely reactive, signature-dependent, and incapable of predicting multi-stage lateral movement. This paper proposes the Cognitive Cyber Defense Digital Twin (CCDT), a unified architecture integrating federated learning (FL), graph neural network (GNN)-based attack-path forecasting, adversarially hardened detection models, and autonomous Security Orchestration, Automation, and Response (SOAR) with deception engineering. The CCDT constructs a continuously synchronized digital replica of organizational assets and employs reinforcement learning-based red agents to stress-test detection models. A federated intelligence mesh enables cross-organizational privacy-preserving gradient sharing. Experimental evaluations against CICIDS-2018 and LANL datasets demonstrate 52% faster attack-path detection, 41% reduction in false positive rate, and 60% reduction in mean-time-to-respond (MTTR) compared to traditional SOC baselines. Integrated Explainable AI (XAI) modules using SHAP values enable audit-ready compliance reporting. The CCDT represents a paradigm shift from reactive monitoring to predictive, autonomous, and privacy-preserving cyber defense for hybrid cloud environments."
Crossref,deep learning,The Nexus of Leadership and Learning: Exploring Female Principals' Influence on the Teaching-Learning Process in Secondary Schools,Muhammad Niqab; Salma Tabbasum; Shakil Ahmad,10.55737/qjss.vii-i.26473,2028-02-28,Qlantic Journal of Social Sciences,"The research paper will set out to debate the role played by the leadership competencies of principals in the teaching and learning process. The research will embrace a quantitative research design that will seek to answer the question concerning the relationship that exists between leadership skills of possessed by the  principals and the ongoing teaching-learning process in the female secondary schools using a co-relational study design. A survey instrument comprising of 37 items, which measured the leadership skills possessed by the selected principals and the prevailing teaching learning process, was used in the collection of data. Questionnaires for this study were administered to 108 male and female educators who were serving in secondary schools in Tehsil Wari, upper Dir and among them 100 questionnaires were submitted and were deemed to be useful in the analysis. The data in hand were calculated using Statistical Package of the Social Sciences (SPSS) version-27 and the obtained results indicated that the collected data was normally distributed. The findings revealed that all the variables of the study had great correlations. The analysis of the data was done through linear regression to measure the effect that the leadership skills of the principals had on the teaching learning process and this indicated that leadership skills of the principals have statistically significant effect on the teaching learning process. The policies derived out of this research can be a good guide to both the policymakers and organizational leaders because they can provide a good outline on how to empower the leaders in charge of the principals and as well as exert more influence on the effective teaching and learning processes."
Crossref,deep learning,Transforming Education through Technology: The Case of COVID 19 Digital Learning in Nagaland,K Hinoca Assumi,10.71126/nijre.v2i1.16,2028-02-28,Naveen International Journal of Research in Education (NIJRE),"Through the perspective of the COVID-19 pandemic and the disruption and opportunity it engendered, this chapter follows a transformative effect of EdTech and Digital education in India particularly in Nagaland through analysis. Drawing upon national policy frameworks, conceptual literature on educational technology, and contextual evidence based on the case of Nagaland, the chapter considers the rapid migration to digital learning as an emergency strategy (in response to the ongoing institution closures) based on the stark shifts in pedagogical practice, access to education services, and preparedness. The findings show that, including the ability of national programmes such as NEP 2020, SWAYAM, DIKSHA, PM e-VIDYA, and others, to promote access to digital tools was low within periphery or hill areas (e.g., Nagaland), due to lack of infrastructural resources, digital divide, unprepared teachers and economic/social divides, and more. The pandemic exposed the deep social and infrastructure divides in connectivity, device availability, assessment and learner engagement, with implications that were especially grave in rural and tribal settings. Although it accelerated the pace of innovation and the application of blended and low-tech learning practices teachers have been experimenting with digital platforms and the post-COVID recovery process, including remedial programmes and hybrid instruction. The chapter also discusses that blended learning is the most fitting, viable and sustainable approach for reaching the technological level in the field of educational technology at Nagaland. It implies that technology-mediated education can improve equity, quality, and resilience, but only under the conditions of inclusive policy design, strong digital infrastructure, vigorous teacher capability building, and culturally appropriate digital content. Keywords: Educational technology, digital learning, COVID-19, Nagaland, online education, Challenges, blended learning"
Crossref,deep learning,Left Ventricle Extraction Using a DENSENET-U-Net Integrated Deep Learning Approach,X. Ignatious Viola; R. Shoba Rani; G. Savitha; R. Surekha,10.1504/ijims.2028.10076630,2028,International Journal of Internet Manufacturing and Services,
Crossref,deep learning,The Application of C/S Mode Multimedia Network in English Teaching and Learning under the Background of Informatisation,Shasha Yu,10.1504/ijcsyse.2028.10078446,2028,International Journal of Computational Systems Engineering,
OpenAlex,aortic stenosis,"Is There a Unified Etiology of Hypoplastic Left Heart Syndrome? Evaluating Genetic, Structural, and Hemodynamic Models of Disease Initiation",R. Leonhard; Zachary Beau Phillips; Jamie Wilson; Zaid Abu-Mowis; John DiGiorgi; Epiphany N. Wilson; Zane Borenstein; Laura Wilson; Richard Tang; Elizabeth H. Stephens; Adrian Crucean; Michael Shillingford; Giles J. Peek; Mark Steven Bleiweis; J Steven Alexander; Jeffrey Phillip Jacobs,10.3390/pathophysiology33020033,2026-05-20,Pathophysiology,"Background: Hypoplastic left heart syndrome (HLHS) is defined as “a spectrum of congenital cardiovascular malformations with normally aligned great arteries without a common atrioventricular junction, characterized by underdevelopment of the left heart with significant hypoplasia of the left ventricle including atresia, stenosis, or hypoplasia of the aortic or mitral valve, or both valves, and hypoplasia of the ascending aorta and aortic arch”. Without treatment, HLHS is usually lethal in the neonate. Many hypotheses have been advanced to explain the etiology of HLHS; however, no single theory appears to fully explain the phenotypic variability seen in HLHS. Furthermore, many of these theories offer no explanations regarding the precipitating events which lead to the development of HLHS. Objective: This review considers and critically evaluates the strengths and weaknesses of the leading theories proposed to explain the pathogenesis of HLHS—including hemodynamic disturbances, primary myocardial structural defects, valvar malformations, and genetic or epigenetic alterations that may provoke developmental and anatomic abnormalities. After presenting each model, we propose a novel, comprehensive, and data-driven framework which may assist researchers in developing models for the pathogenesis of the various subtypes of HLHS. Methods: Key findings from human fetal imaging, histopathology, genetic studies, and animal models were considered, as well as the hypothetical contribution of each in observed HLHS phenotypes. The rationales for these findings as causal factors initiating individual HLHS patterns, as well as how they might contribute to HLHS in general, were critically analyzed. Results: The flow theory is strongly supported by animal models and in utero interventions that demonstrate the impact of altered hemodynamics on cardiac morphogenesis. However, the flow theory fails to identify initial causes of disturbed flow or related histological features of HLHS like endocardial fibroelastosis. The myocardial and valve-first models suggest an important role in developmental defects, but do not necessarily have a strong experimental basis that provides explanations for how they mediate HLHS. Genetic studies in patients with HLHS have identified several candidate causal mutations. However, such genetic causes of HLHS exhibit incomplete phenotypic penetrance and clinical impact. A multifactorial framework attempts to integrate these diverse mechanisms and may provide the most coherent explanation that can accommodate the heterogeneity and variable presentation of HLHS. Such a framework may identify multiple forces that drive disease but does not provide useful pathways for future research about HLHS. Conclusions: No single hypothesis has fully explained how HLHS is initiated, progresses, and presents with the clinical conditions that are encountered by cardiac surgeons and cardiologists. The most current models suggest that the spectrum of HLHS reflects acomplex interaction between genetic susceptibility, flow-dependent cardiac remodeling, and environmental factors in utero. A multifactorial model integrates these diverse mechanisms and may provide the most coherent explanation for the various phenotypic variations in HLHS. Based on our analysis of the most current data and the strengths and weaknesses of the current theoretical frameworks, we propose a novel research strategy aimed at identifying specific cardiac progenitor cell populations whose dysregulation may represent a unifying explanation for the etiology of the various phenotypes of HLHS. Based on the arguments made throughout this manuscript that evaluate the various genetic, structural, and hemodynamic models of initiation of disease, we believe that the significant phenotypic variability across the spectrum of HLHS (i.e., the different anatomic subtypes for “classic” HLHS) most likely reflects different underlying etiologies and mechanisms. At the very least, it is very likely that the timing of the insult is critical in determining anatomic subtype. Based on the published data and the arguments within this manuscript, it seems naive to think that there is a single unifying mechanism explain all forms of HLHLS."
OpenAlex,aortic stenosis,What is the relationship between aortic stenosis and acquired von Willebrand disease?,Tripdatabase,10.5281/zenodo.20313701,2026-05-20,Zenodo (CERN European Organization for Nuclear Research),"Aortic stenosis is associated with acquired von Willebrand syndrome due to increased shear stress causing loss of VWF multimers, often resolving with valve replacement."
OpenAlex,aortic stenosis,Clinical Impact of Myocardium at Risk in Transcatheter Aortic Valve Implantation,C A Cristina Aurigemma; Giuliano Costa; Giulia Laterra; Thomas Pilgrim; Ignacio J. Amat Santos; Ole De Backer; Won-Keun Kim; Henrique Barbosa Ribeiro; Francesco Saia; M Bunc; Didier Tchetche; Philippe Garot; Flavio Luciano Ribichini; Darren Mylotte; Yusuke Watanabe; Francesco Bedogni; Tullio Tesorio; T Rheude; G Sardella; Marco Tocci; A Franzone; Roberto Valvo; Sofia Sammartino; Mikko Savontaus; Hendrik Wienemann; Italo Porto; Caterina Gandolfo; Alessandro Iadanza; Markus Mach; Azeem Latib; Luigi Biasco; Maurizio Taramasso; Federico De Marco; Valentina Frittitta; Elena Dipietro; Claudia Reddavid; Orazio Strazzieri; Federica Agnello; Alessandro Comis; Mariachiara Calì; Mohamed Abdel-Wahab; Giulio Giuseppe Stefanini; Daijiro Tomii; Philippe Nuyens; Lars Søndergaard; Alessandro Santo Bortone; Marco Zimarino; Sergio F. Camara; Tullio Palmerini; Mateusz Orzałkiewicz; Klemen Steblovnik; Alexandre Gautier; Paolo Alberto Del Sole; Andrea Mainardi; Mattia Lunardi; Hideyuki Kawashima; Enrico Criscione; Vincenzo Cesario; Fausto Biancari; Federico Zanin; Giovanni Esposito; M Adam; Eberhard Grube; S Baldus; VINCENZO DE MARZO; Elisa Piredda; Stefano Cannata; Fortunato Iacovelli; Martin Andreas; Domenico Angellotti; Carmelo Sgroi; Erion Xhepa; Faraj Kargoli; Corrado Tamburino; Francesco Burzotta; Marco Barbanti; for the REVASC-TAVI Registry,10.1161/circinterventions.125.015770,2026-05-20,Circulation Cardiovascular Interventions,"BACKGROUND: The best management of coronary artery disease in patients with severe aortic stenosis undergoing transcatheter aortic valve implantation (TAVI) is debated. We investigated the clinical impact of the residual extent of myocardium at risk in patients undergoing TAVI. METHODS: Patients enrolled in the REVASC-TAVI (Management of Myocardial Revascularization in Patients Undergoing TAVI With Coronary Artery Disease) international multicenter registry were stratified according to the myocardium jeopardized by coronary artery disease using the British Cardiovascular Intervention Society Jeopardy Score (BCIS-JS) after a planned coronary revascularization. A planned revascularization included percutaneous coronary interventions performed before TAVI, during TAVI, or within 1 month after TAVI. The study population was divided according to the residual BCIS-JS (rBCIS-JS): patients with extensive residual myocardial at risk (rBCIS-JS &gt;4 group) and patients without extensive residual myocardial at risk (rBCIS-JS ≤4 group). The primary study end point was the composite of all-cause death, nonfatal myocardial infarction, nonfatal stroke, and rehospitalization for heart failure at 2 years. RESULTS: Among the 2407 patients enrolled, 294 pairs of patients were selected by propensity matching and compared. At 2-year follow-up, the incidence of the primary end point was higher in patients with rBCIS-JS &gt;4 compared with patients with rBCIS-JS ≤4 (37.5% versus 23.0%, P =0.004). A significantly lower rate of myocardial infarction was reported in patients with BCIS-JS ≤4 (8.2% versus 2.6%, P =0.011). At multivariate analysis, rBCIS-JS &gt;4 (hazard ratio, 1.43 [95% CI, 1.11–1.84]; P =0.005) independently predicted 2-year major adverse cardiac and cerebrovascular events. CONCLUSIONS: In patients with concomitant coronary artery disease and severe aortic stenosis, the residual myocardial risk significantly affects TAVI outcomes. In particular, a rBCIS-JS &gt;4 is associated with higher rates of major adverse cardiac and cerebrovascular events at 2 years."
