source,keyword,title,authors,doi,publication_date,journal,abstract
PubMed,aortic stenosis,Stone Heart Syndrome After Aortic Valve Replacement for Severe Aortic Stenosis: A Case Report.,Lampriani Papageorgiou,10.7759/cureus.101968,2026-01,Cureus,"Stone heart syndrome (SHS) is a rare but catastrophic complication of cardiac surgery, characterized by irreversible ischemic myocardial contracture following prolonged global myocardial ischemia, and is almost uniformly fatal once established. We report the case of a 55-year-old woman with severe symptomatic aortic stenosis who underwent elective mechanical aortic valve replacement. Preoperative echocardiography showed preserved ventricular dimensions with low-normal systolic function. Due to technical difficulties during mini-sternotomy, a prolonged aortic cross-clamp time was required with repeated cardioplegia. Failure to wean from cardiopulmonary bypass was followed by complete left ventricular akinesia, immobile left-sided valves, and minimal right ventricular activity despite maximal support. Full sternotomy revealed a rigid, non-compliant myocardium consistent with SHS. Central veno-arterial extracorporeal membrane oxygenation was instituted without myocardial recovery. The patient died from multiorgan failure on postoperative day three. SHS results from profound myocardial ischemia, causing adenosine triphosphate depletion, calcium overload, and irreversible actin-myosin binding. Prevention, achieved through meticulous myocardial protection and strict minimization of ischemic time, remains the only effective strategy against this devastating and irreversible complication of cardiac surgery."
PubMed,aortic stenosis,Emergent surgical repair via minimally invasive left anterior thoracotomy for left ventricular perforation during transfemoral transcatheter aortic valve implantation: a case report.,Feiyu Wu; Qifeng Zhu; Xianbao Liu,10.1093/ehjcr/ytag083,2026-02,European heart journal. Case reports,"Transcatheter aortic valve implantation (TAVI) is an effective and safe treatment for severe aortic stenosis. Despite advancements reducing complications, rare life-threatening events like ventricular perforation remain significant challenges. This case details the management of an acute left ventricular perforation during TAVI.
A 74-year-old woman with symptomatic severe bicuspid aortic stenosis underwent transfemoral TAVI. Sudden haemodynamic collapse occurred during the device delivery. Transoesophageal echocardiography demonstrated massive pericardial effusion, attributed to guidewire-induced left ventricular perforation. The patient maintained haemodynamic stability with pericardial drainage on cardiopulmonary bypass (CPB). However, pericardial effusion recurred after transitioning from CPB to extracorporeal membrane oxygenation support. Cardiac surgeons repaired the laceration at the apex and achieved haemostasis through minimally invasive left anterior thoracotomy, successfully resolving the intraoperative crisis and rescuing the patient.
This case illustrates that ventricular perforation/rupture during TAVI, while rare, constitutes a fatal complication. To mitigate this risk, enhanced preoperative risk stratification and intraprocedural monitoring for left or right ventricular perforation/rupture are imperative. Prompt recognition and intervention-including pericardiocentesis, CPB initiation, and surgical haemostasis-are critical upon occurrence. Innovatively employing minimally invasive left anterior thoracotomy for repair in this case significantly reduced surgical trauma, facilitating rapid postoperative recovery."
Crossref,aortic stenosis,Sialography and endoscopy-based classification of salivary duct stenosis,Jing Yang; Xiao-Tong Ling; Dan-Ni Zheng; Xiao-Yun Xu; Liu-Yang Qu; Deng-Gao Liu,10.1016/j.jormas.2026.102734,2026-09,Journal of Stomatology Oral and Maxillofacial Surgery,
Crossref,aortic stenosis,Dual-parameter risk stratification based on device landing zone calcification and aortic annular perimeter for paravalvular regurgitation after self-expanding TAVR,Jun Shu; Didi Wen; Jingji Xu; Yu Mao; Hui Ma; Jing Zhang; Yao Zhao; Jian Yang; Minwen Zheng,10.1016/j.ejro.2025.100719,2026-06,European Journal of Radiology Open,
Crossref,aortic stenosis,"Corrigendum to “Engineering aortic valves via transdifferentiating fibroblasts into valvular endothelial cells without using viruses or iPS cells” [Bioact. Mater. 45 (2025), 181–200]",Peng Tang; Fuxiang Wei; Weihua Qiao; Xing Chen; Chenyang Ji; Wanzhi Yang; Xinyu Zhang; Sihan Chen; Yanyan Wu; Mingxing Jiang; Chenyu Ma; Weiqiang Shen; Qi Dong; Hong Cao; Minghui Xie; Ziwen Cai; Li Xu; Jiawei Shi; Nianguo Dong; Junwei Chen; Ning Wang,10.1016/j.bioactmat.2025.12.014,2026-06,Bioactive Materials,
Crossref,aortic stenosis,Intelligent diagnosis of aortic lesion using non-contrast CT: An integrated approach combining deep learning and morphological characteristics,Mingliang Yang; Aoxue Mei; Xiaolin Guo; Jianxing Hu; Yue Zhang; Xiangbing Bian; Jiayu Huang; Sulian Su; Jinhao Lyu; Xin Lou,10.1016/j.bspc.2026.109823,2026-06,Biomedical Signal Processing and Control,
Crossref,aortic stenosis,Automated measurement of aortic parameters using deep learning and computer vision,Ivan Blekanov; Gleb Kim; Fedor Ezhov; Evgenii Larin; Lev Kovalenko; Anthony Nwohiri; Egor Razumilov,10.1016/j.bspc.2026.109673,2026-06,Biomedical Signal Processing and Control,
Crossref,aortic stenosis,Sex-specific anatomical challenges in TAVR: A closer look at bicuspid aortic valve stenosis,Pingjun Huang; Chu Liu; Jiameng Li; Lei Li; Yongquan Sun; Jiqiang Bu; Yu Liu; Tengyue Zhao,10.1016/j.ijcrp.2026.200591,2026-06,International Journal of Cardiology Cardiovascular Risk and Prevention,
Crossref,aortic stenosis,CT angiography features of organ malperfusion and imaging biomarker for postoperative adverse complications in acute type A aortic dissection,Xiaohan Zhong; Zhou Liu; Lu Dai; Shuanglei Zhao; Hongkai Zhang; Jiajun Liang; Yeting Lou; Yue Ren; Meili Wang; Yuyong Liu; Hongjia Zhang; Wenjian Jiang,10.1016/j.ijcrp.2026.200605,2026-06,International Journal of Cardiology Cardiovascular Risk and Prevention,
Crossref,aortic stenosis,Aortic dissection and opioid use: Two autopsy cases and potential pathological implications,Luca Tomassini; Erika Buratti; Rino Froldi; Roberto Scendoni,10.1016/j.fsir.2026.100456,2026-06,Forensic Science International: Reports,
Crossref,aortic stenosis,Radial artery stenosis: An uncommon culprit in acute digital Ischemia,Zhong Jie Chia; Shao Hui Koh,10.1016/j.visj.2026.102475,2026-06,Visual Journal of Emergency Medicine,
Crossref,aortic stenosis,Nanomaterial interventions in abdominal aortic aneurysm (AAA): From microenvironment modulation to vascular reconstruction,Han Jiang; Ting Li; Yumeng Yan; Yu Lun,10.1016/j.colsurfb.2026.115548,2026-06,Colloids and Surfaces B: Biointerfaces,
Crossref,aortic stenosis,Colchicine therapy in transcatheter aortic valve replacement: Modulating inflammation and outcomes,Hamza A. Abdul-Hafez; Ameer Awashra; Malik Ahmad; Abdullah Raed Hawawrah; Bayan Mahafdah; Mohammed AbuBaha; Ibrahim Alazizi; Abdalhakim Shubietah; Mohamed S. Elgendy; Ahmed Emara,10.1016/j.ijcrp.2026.200575,2026-06,International Journal of Cardiology Cardiovascular Risk and Prevention,
Crossref,aortic stenosis,Transcarotid access for thoracic endovascular aortic repair in the repair of a descending thoracic aorta pseudoaneurysm,Adrienne Green; Shiza Bari; Christine Kariya; Kwame Amankwah,10.1016/j.jvscit.2026.102149,2026-06,"Journal of Vascular Surgery Cases, Innovations and Techniques",
Crossref,aortic stenosis,Long-Term Outcomes of Hybrid Treatment for Thoracoabdominal Aortic Aneurysms: A 19-year Single-Center Experience,Takashi Shuto; Takayuki Kawashima; Norio Hongo; Yoshiki Asayama; Shinji Miyamoto,10.1016/j.avsg.2026.01.023,2026-06,Annals of Vascular Surgery,
Crossref,aortic stenosis,Recent Patents of Stent Grafts for Intravascular Aortic Repair,Yiwen Wang; Yuxin Zhang,10.2174/0118722083355380250716073539,2026-06,Recent Patents on Biotechnology,"Introduction:                     Endovascular aortic repair involves the placement of stents through minimally invasive methods to seal rupture sites near the aortic inflow tract, thereby preventing blood entry into the false lumen and promoting thrombosis, which reduces the risk of aortic rupture. Endovascular stents typically consist of a metal framework and a flexible membrane graft designed to reopen obstructed aortic segments and maintain blood flow through the true lumen. Consequently, stents are widely used to treat aortic expansion diseases and aortic occlusive stenosis. However, traditional stents have limitations in terms of adaptability to complex anatomical structures, long-term durability, biomechanical stability, and reliance on radial support force for fixation, lacking active fixation mechanisms. These shortcomings remain the primary causes of postoperative complications, significantly impacting the quality of life for patients with aortic dissection.                                                           Methods:                     The research status of the endovascular stent was discussed in depth, and the main factors for the optimal design of the stent (geometry, pattern configuration, additional fixtures, and optimization methods) were analyzed and summarized according to the complications targeted by the repair device.                                                           Results:                     The composition structure, working principle, and development status of the stent grafts under review are elaborated in detail. Stent grafts attempt to alleviate postoperative complications through three approaches: enhancing the flexibility of the stent framework, improving the fit between the vessel wall and the stent, and reducing vascular injury. Blood flow guiding channels are established to alleviate the obstruction of branch blood flow. Additional self-anchoring devices are added to adapt to the dynamic remodeling of blood vessels.                                                           Discussion:                     The effects of various factors, including geometric parameters, structural design, and parameter optimization techniques, on the optimization of stent primary mechanical performance are discussed. The current research status of functional improvement methods for stents is also summarized.                                                           Conclusion:                     Refining the quantitative relationship between stent structural parameters and mechanical performance, as well as exploring the balance criteria between flexibility and radial support force, represent promising directions for future development. These objectives necessitate further in-depth analysis and research."
Crossref,aortic stenosis,Cochlear nerve canal stenosis: Association with the TECTA gene,Beilei Duan; Line Wang; Si Zhang; Zhen Zhu; Wenrui Zheng; Benjamin Heifetz; Kevin A. Peng,10.1016/j.xocr.2026.100733,2026-06,Otolaryngology Case Reports,
Crossref,aortic stenosis,Federated learning for prenatal detection of interrupted aortic arch using fetal ultrasound imaging,Jiancheng Han; Heqing Wang; Yifan Feng; Qi Yang; Jingtan Li; Haojie Zhang; Yihua He; Jiang Liu; Toru Nakamura; Yang Cao; Naidi Sun; Kun Qian; Bin Hu; Xinru Gao; Yan Xia; Zongjie Weng; Björn W. Schuller; Yoshiharu Yamamoto,10.1016/j.bspc.2026.109795,2026-06,Biomedical Signal Processing and Control,
Crossref,aortic stenosis,Abdominal Cancer Risk after Endovascular Abdominal Aortic Aneurysm Repair Compared With Open Repair: A Systematic Review and Meta-Analysis,Burak Bozkurt; Mehmet Inanc Yesilkaya; Ozan Erturk; Selen Ozturk,10.1016/j.avsg.2026.01.018,2026-06,Annals of Vascular Surgery,
Crossref,aortic stenosis,Non-rheumatic calcific aortic valve disease as a global driver of heart failure: Burden and three-decade trends,Lin Zhu; Yanqing Gong; Zijie An; Liumei Mo; Jian Rong; Zhenhao Liu,10.1016/j.hrtlng.2025.102690,2026-05,Heart &amp; Lung,
Crossref,aortic stenosis,Diagnostic performance of aortic valve calcium scoring for severe aortic stenosis in patients with chronic kidney disease,Hesham Sheashaa; Juan M. Farina; Isabel G. Scalia; Kamal Awad; Mohammed Tiseer Abbas; Milagros Pereyra; Sherif Ahmed; Fatmaelzahraa Abdelfattah; Mahshad Razaghi; Abdelrahman Hafez; Ramzi Ibrahim; Said Alsidawi; Steven J. Lester; David Fortuin; John Sweeney; Kristen Sell-Dottin; Chadi Ayoub; Reza Arsanjani,10.1016/j.ijcard.2026.134217,2026-05,International Journal of Cardiology,
Crossref,aortic stenosis,Clinical Outcomes of Cuff Anastomosis Combined with Single-Branched Frozen Elephant Trunk for Acute Type A Aortic Dissection,Yuexin Huang; Feng Nong; Mengting Zeng; Qiuying Liao; Rizhu Li; Hua Lu; Xiaoshen Zhang,10.1016/j.avsg.2026.01.005,2026-05,Annals of Vascular Surgery,
Crossref,mitral regurgitation,Effect of obesity in minimally invasive mitral valve surgery,Cristina Barbero; Marco Pocar; Stefano Salizzoni; Dario Brenna; Valentina Aloi; Cecilia Capozza; Claudia Filippini; Anna Chiara Trompeo; Mauro Rinaldi,10.1016/j.hrtlng.2026.102730,2026-07,Heart &amp; Lung,
Crossref,mitral regurgitation,Early cardiac rehabilitation supported by levosimendan infusion and mitral valve repair in acute myocardial infarction complicated by cardiogenic shock,Alessandro Villaschi; Silvia Di Lauro; Fabrizio Calloni; Anastasia Toccafondi; Jacopo Oreglia; Alice Sacco; Nuccia Morici,10.1016/j.ijcrp.2026.200603,2026-06,International Journal of Cardiology Cardiovascular Risk and Prevention,
Crossref,mitral regurgitation,STrategies for antithrombotic tRreatment following transcatheter edge-to-edge repair in patients with severe mitral regurgitation: Rationale and design of STAR-TEER trial,Chuangshi Wang; Zizheng Liu; Ziping Li; Xiaofang Yan; Cheng Wang; Ning Zhou; Fengwen Zhang; Wenbin Ouyang; Guangzhi Zhao; Jianrui Ma; Shouzheng Wang; Xiangbin Pan,10.1016/j.ahj.2026.107362,2026-06,American Heart Journal,
Crossref,mitral regurgitation,Comprehensive assesment of right ventricular function in patients with primary mitral regurgitation,Jiaxu Jiang; Lu Sun; Qiuxia Hong; Jingwen Zhang; Xiangxiu Chen; Lishuang Kang; Xiaoping Leng; Hairu Li,10.1016/j.ijcard.2026.134232,2026-05,International Journal of Cardiology,
Crossref,mitral regurgitation,Concomitant Mitral Valve Surgery During Surgical Treatment of Hypertrophic Obstructive Cardiomyopathy,Thierry Bové; Lukas Impens; Justine Leleu; Frank Timmermans; Katrien François,10.1016/j.amjcard.2026.01.013,2026-04,The American Journal of Cardiology,
Crossref,mitral regurgitation,Outcomes of Patients With Mitral Stenosis With Prior Percutaneous Mitral Commissurotomy Undergoing Mitral Valve Surgery,Nattanon Ruangsubvilai; Krittapas Au-yeung; Chawalit Wongbuddha; Alon Shechter; Vivek Patel; Danon Kaewkes,10.1016/j.amjcard.2025.12.023,2026-04,The American Journal of Cardiology,
Crossref,mitral regurgitation,Association of pre-intubation bag-valve-mask ventilation with hypoxemia and regurgitation in the ED: A multicenter cohort study,Jin Takahashi; Haruka Tsuji; Hiraku Funakoshi; Hiroshi Okamoto; Yusuke Hagiwara; Hiroko Watase; Takao Ono; Sakina Kadomatsu; Tatsuhiko Hata; Kohei Hasegawa; Takashi Shiga; Tadahiro Goto,10.1016/j.ajem.2026.01.012,2026-04,The American Journal of Emergency Medicine,
Crossref,mitral regurgitation,Ruptured mitral chordae and widespread calcified intracranial emboli: An unusual presentation of native valve endocarditis,Omar Bokhari; Faisal AlMashuf; Michael Thorne,10.1016/j.jstrokecerebrovasdis.2026.108586,2026-04,Journal of Stroke and Cerebrovascular Diseases,
Crossref,mitral regurgitation,"Bench Testing of a New, Semirigid, Saddle-Shaped, Complete Mitral Annuloplasty Ring Designed to Circularize During Transcatheter Mitral Valve-in-Ring Procedures",Keith B. Allen; Daniel J. Romary; Elizabeth A. Grier; Chetan P. Huded; Duc T. Pham; Douglas R. Johnston; Panos N. Vardas; John R. Davis; Adnan K. Chhatriwalla,10.1016/j.shj.2025.100791,2026-04,Structural Heart,
Crossref,mitral regurgitation,Outcomes of Re-Repair vs Replacement After Failed Primary Mitral Regurgitation Repair: The Society of Thoracic Surgeons Adult Cardiac Surgery Database Analysis,Michael E. Ibrahim; Omar Toubat; Alexandra E. Sperry; Levi Bonnell; Christian Elenbaas; Isao Anzai; Paul N. Fiorilli; Robert O. Bonow; Robert L. Smith; Robert H. Habib; Michael A. Acker; Wilson Y. Szeto,10.1016/j.athoracsur.2025.11.017,2026-03,The Annals of Thoracic Surgery,
Crossref,mitral regurgitation,Epicardial connection after radiofrequency mitral isthmus ablation,Naohiko Kawaguchi; Yasuaki Tanaka; Kenji Okubo; Joonmo Chang; Hirotaka Yano; Emiko Nakashima; Hiroyuki Hikita; Tetsuo Sasano; Atsushi Takahashi,10.1016/j.hrthm.2025.11.047,2026-03,Heart Rhythm,
Crossref,mitral regurgitation,Diagnostic Challenge and Surgical Management of Accessory Mitral Valve Tissue,Lynn De Cuyper; Stefaan Bouchez; Nicolas Cloet; Guy Van Camp; Filip Casselman,10.1053/j.jvca.2025.11.024,2026-03,Journal of Cardiothoracic and Vascular Anesthesia,
Crossref,mitral regurgitation,Risk of periprocedural regurgitation of gastric contents in patients on glucagon-like peptide-1 receptor agonists: a two-centre nested case–control study,Wilton A. van Klei; Justyna Bartoszko; Joshua Andrusiak; Michael Santema; Marije Marsman,10.1016/j.bja.2025.12.033,2026-03,British Journal of Anaesthesia,
Crossref,mitral regurgitation,Aortic Regurgitation as the Next Frontier in the TAVR Space,Stephan Nienaber; Jonathan Curio; Giuseppe Tarantini; Hendrik Wienemann; Matti Adam,10.1016/j.amjcard.2025.11.029,2026-03,The American Journal of Cardiology,
Crossref,mitral regurgitation,A Zebra Hiding Beneath an Elephant: How A Giant Ascending Aortic Aneurysm Masked the Underlying Rare Cause of Aortic Regurgitation,Cyril Nijs; John Mitchell; Anne-Sophie Dincq; Aïmane Biyou; Martial Gillet; Grégory Kalscheuer; Philippe Eucher; Richard Coulie,10.1053/j.jvca.2025.12.010,2026-03,Journal of Cardiothoracic and Vascular Anesthesia,
Crossref,mitral regurgitation,Atrial fibrillation and clinical outcomes after mitral transcatheter edge-to-edge repair: A mechanism-stratified cohort study,Hadar Horowitz; Itshak Amsalem; Shemy Carasso; Yael Yan Postell; Mohammad Karmi; Elad Asher; Moshe Rav Acha; Michael Glikson; Sharon Bruoha; Mony Shuvy,10.1016/j.ijcard.2025.134095,2026-03,International Journal of Cardiology,
Crossref,mitral regurgitation,Renal Response After Mitral Valve Repair: Clinically Meaningful Relationship,Luis Nombela-Franco,10.1016/j.shj.2025.100757,2026-03,Structural Heart,
Crossref,mitral regurgitation,Transcatheter Aortic Valve Replacement for Severe Native Aortic Valve Regurgitation: A Multicenter and International Registry,Sant Kumar; Ashish Pershad; David Elison; EiEi Thwe; Jacopo Farina; Ahmad Jabri; Ivan Hanson; Amr Abbas; Pedro A. Villablanca; Nezar Falluji; Simone Biscaglia; Carlo Tumscitz; Timothy Byrne; Francesco Saia; Soundos Moualla; Hursh Naik,10.1016/j.shj.2025.100762,2026-03,Structural Heart,
Crossref,mitral regurgitation,"Degenerative Mitral Disease: The Valve We Repair, The Future We Shape",Vinay Badhwar,10.1016/j.athoracsur.2025.09.004,2026-03,The Annals of Thoracic Surgery,
Crossref,valvular heart disease,Giant Cells in Health and Disease-A Review,Sonal Gupta,10.21276/ijchmr.2016.2.2.10,2106-06-20,International Journal Of Community Health And Medical Research,
Crossref,valvular heart disease,Contemporary Disease Management in Quebec,Amédé Gogovor; Michelle Savoie; Yola Moride; Marilyn Krelenbaum; Terrence Montague,10.12927/hcq.2013.19495,2088-01-15,Healthcare Quarterly,
Crossref,valvular heart disease,Chronic Disease Prevention and Management: Implications for Health Human Resources in 2020,Margo Orchard; Esther Green; Terrence Sullivan; Anna Greenberg; Verna Mai,10.12927/hcq.2013.19496,2088-01-15,Healthcare Quarterly,
Crossref,valvular heart disease,What a Study on Ultraprocessed Fake Meat and Heart Disease Really Found,Lori Y,10.1038/scientificamerican072077-2xmzfca9smsvxelw1jobgf,2077-07,Scientific American,
Crossref,valvular heart disease,Woman Receives Genetically Modified Pig Kidney Transplant after Heart Pump Surgery,Tanya L,10.1038/scientificamerican072077-4hozib8kpx2m6wjvhqi1zz,2077-07,Scientific American,
Crossref,valvular heart disease,Water Lily or Camelotte Sign in Pulmonary Hydatid Cyst – An Orphan Disease,Sudheer Tale; Soibampahel M; Mrudula K; Ritisha B; Subodh K; Girish S,10.23880/cclsj-16000132,2028-11-11,Cell &amp; Cellular Life Sciences Journal,"A 20 – year – old male without any previous comorbidity presented to pulmonary medicine outpatient department with complaints of dull aching chest pain on right side, dry cough and shortness of breath for the pastone year. He was non vegetarian and had no addictions. On general physical examination his vitals were stableand respiratory system examination revealed decreased breath sounds in the right hemithorax. All his routineblood investigations were normal. Chest radiograph revealed homogenous opacity in the right middle andlower zones. Contrast enhanced computed tomography of thorax and abdomen showed a well defined encapsulatedcystic lesion of size 12x10x14cm with internal floating membranes (water lily sign or Camelotte sign) with masseffect on adjacent lung parenchyma causing atelectasis and compression of adjacent vessels (Figure 1). Hydatid serology (IgG) was positive. Patient was treated symptomatically and referred for surgical intervention."
Crossref,valvular heart disease,RELATION OF HEART WEIGHT WITH AGE AND WEIGHT OF CADAVER,Jolly Agarwal; Virendra Kumar,10.21761/jms.v2i01.10838,2027-07-25,SRMS JOURNAL OF MEDICAL SCIENCE,"Introduction: Height, weight, and age of person has significant impact on the normal size of&#x0D; heart. These parameters need to be considered when cut-off values indicating the need for&#x0D; treatment or even surgery are established. The aim of present work is to study the relation of&#x0D; weight of the heart with age and weight of cadaver.&#x0D; Material and Methods: The study was performed in the Department of Anatomy, Shri Ram&#x0D; Murti Smarak Institute of Medical Sciences, Bareilly on 30 hearts from embalmed cadavers.&#x0D; The hearts were procured from the cadavers available in our department. The heart was&#x0D; thoroughly cleaned and measurements were taken.&#x0D; Results: The mean heart weight was 223.37 ± 57.78 g. Significant relationship between age of&#x0D; the cadaver and weight of the heart (p=0.0004), weight of cadaver and weight of heart&#x0D; (p=0.0001) was observed.&#x0D; Conclusion: The above study provides valuable data of the heart in our geographical location,&#x0D; which may be useful for cardiac surgeons and physicians."
Crossref,valvular heart disease,Improving Citrus Leaf Disease Segmentation and Classification with a Game Theoretical U-Net Convolutional LightGBM model,K. Rama Gangi Reddy; K.S. Thirunavukkarasu,10.1504/ijiei.2027.10072915,2027,International Journal of Intelligent Engineering Informatics,
Crossref,valvular heart disease,An Intelligent Approach with Integrated Feature Selection for Accurate Parkinson's Disease Diagnosis,Pravin Madhukar Dhanrao; B.K. Madhavi; Haard Patel; Debabrata Swain; Sashikala Mishra; Het Prajapati; Shrey Joshi,10.1504/ijims.2027.10072985,2027,International Journal of Internet Manufacturing and Services,
Crossref,valvular heart disease,Oral Contraceptive Use and Acute Ischemic Stroke Risk in Patients with Moyamoya Disease,Shoko HARA; Shota TAKAHASHI; Ayako FUDONO; Kotoi TSURANE; Bongguk KIM; Motoki INAJI; Yoji TANAKA; Tadashi NARIAI; Naoyuki MIYASAKA; Taketoshi MAEHARA,10.2176/jns-nmc.2025-0140,2026-12-31,NMC Case Report Journal,
Crossref,valvular heart disease,Augmentation of comorbidity assessment of peripheral artery disease using gait biomechanics with self-organization based learning model,Nazia Sultana; PK Kumar,10.1016/j.ijcce.2025.07.002,2026-12,International Journal of Cognitive Computing in Engineering,
Crossref,valvular heart disease,A hybrid deep learning approach based on optimized feature selection on environmental multi-disease predictive models,Selvi. S; Vanathi. A,10.1016/j.ijcce.2025.11.006,2026-12,International Journal of Cognitive Computing in Engineering,
Crossref,valvular heart disease,Fitness and exercise effects on brain age: A randomized clinical trial,Lu Wan; Cristina Molina-Hidalgo; Mary E. Crisafio; George Grove; Regina L. Leckie; Thomas W. Kamarck; Chaeryon Kang; Mia DeCataldo; Anna L. Marsland; Matthew F. Muldoon; Mark R. Scudder; Javier Rasero; Peter J. Gianaros; Kirk I. Erickson,10.1016/j.jshs.2025.101079,2026-12,Journal of Sport and Health Science,
Crossref,valvular heart disease,Disease-related communication difficulties and dyadic coping among patients with breast cancer and their spouses: An actor–partner interdependence model,Lingling Yang; Xi Zhang; Meina Yang; Liping Zhang; Rong Wang; Ting Wang,10.1016/j.apjon.2025.100829,2026-12,Asia-Pacific Journal of Oncology Nursing,
Crossref,valvular heart disease,Global hotspots and development trends in the new generation of artificial heart valves based on bibliometric analysis from 1991 to 2024,Shiping Chen; Jiamin Peng; Zhiyi Ye; Xingshuang Ma; Ming Sun; Nasser Fatouraee; Jifu Mao; Guixue Wang; Lu Wang,10.1016/j.advim.2025.100005,2026-12,Advanced Interventional Materials,
Crossref,valvular heart disease,"Methanol extract of Smritisagara Rasa attenuates neurobehavior, neurochemical and stress indicators in rotenone-induced Drosophila model of Parkinson's disease",G Gopinath; Ramesha Hanumanthappa; Raifa Abdul Aziz; P.C. Kiran; Hemalatha Nanjaiah; Iranna B. Kotturshetty; Shamprasad Varija Raghu; Manjunath Ajanal; Devaraju Kuramkote Shivanna,10.1016/j.abst.2025.11.003,2026-11,Advances in Biomarker Sciences and Technology,
