source,keyword,title,authors,doi,publication_date,journal,abstract
PubMed,valvular heart disease,Modified Del Nido Cardioplegia with a 1:4 Crystalloid-to-Blood Ratio Versus Blood-Based St. Thomas Cardioplegia in Isolated Aortic Valve Replacement.,Peter Jakub; Tomáš Toporcer; Matúš Marcin; Michal Trebišovský; Anton Bereš; Marián Homola; Štefan Lukačín; Adrián Kolesár,10.3390/jcdd13060263,2026-06-11,Journal of cardiovascular development and disease,"The aim of this study was to retrospectively compare modified Del Nido and blood-based St. Thomas cardioplegia in adult patients undergoing isolated aortic valve replacement (AVR). This retrospective study included adult patients undergoing isolated AVR because of aortic valve stenosis between 2024 and 2025. Patients were stratified into blood-based St. Thomas and modified Del Nido groups. The main modification of the Del Nido solution was the adjustment of the crystalloid-to-blood ratio to 1:4. Preoperative and perioperative variables, as well as postoperative biomarkers, including high-sensitivity troponin I, creatine kinase (CK), CK-MB, and lactate, were analyzed. A total of 93 patients were included in the study (blood-based St. Thomas: n = 22; modified Del Nido: n = 71). No significant differences were observed in cardiopulmonary bypass time [98 min (IQR 84-110) vs. 90 min (IQR 74-110); p = 0.184] or aortic cross-clamp time [75 min (IQR 67-86) vs. 73 min (IQR 62-87); p = 0.345]. High-sensitivity troponin I levels at 24 h were numerically, but not statistically significantly, lower in the blood-based St. Thomas group [1961 ng/L (IQR 1367-4423) vs. 2819 ng/L (IQR 1698-5054); p = 0.240]. CK levels at 6 h were comparable between the groups [8.4 μkat/L (IQR 6.5-10.1) vs. 8.5 μkat/L (IQR 6.0-12.7); p = 0.632], as were CK-MB and lactate levels at all evaluated time points. In exploratory multivariable analyses adjusted for age, sex, preoperative LVEF, cardiopulmonary bypass time, and aortic cross-clamp time, cardioplegia type was not independently associated with postoperative biomarker levels. The less frequent dosing and membrane-stabilizing properties of modified Del Nido cardioplegia did not translate into statistically significant clinical or biochemical advantages in the setting of relatively short, isolated AVR procedures."
Crossref,aortic stenosis,Staged Full-endoscopic Foraminotomy for Multilevel Lumbar Stenosis with Scoliosis: A Case Report,Takayuki KITAHARA; Yuji NAGAO; Takafumi OHSHIMA; Naoto ONO; Saori SOEDA; Makoto TAKEUCHI; Kosuke SUGIURA; Hiroaki MANABE; Masatoshi MORIMOTO; Fumitake TEZUKA; Hiroshi KAGEYAMA; Junzo FUJITANI; Koichi SAIRYO,10.2176/jns-nmc.2025-0339,2026-12-31,NMC Case Report Journal,
Crossref,aortic stenosis,Two Cases of Lumbar Spinal Canal Stenosis with Dorsal Meningovertebral Ligaments: Potential Risk of Dural Laceration,Kyohei KIN; Ryoji TOMINAGA; Kento TAKEBAYASHI; Hiroki IWAI; Hisashi KOGA,10.2176/jns-nmc.2025-0354,2026-12-31,NMC Case Report Journal,
Crossref,aortic stenosis,Vasodilatory study of Mitragyna speciosa (Korth.) Havil methanolic extract using rats aortic ring assay,Hui Wei Loh; Wan Yin Tew; Chong Seng Yan; Chi Yuan Low; Zurina Hassan; Qiyue Qiu; Bin Yang; Zheng Zhang; Ruiling Zhang; Nelson Jeng Yeou Chear; Mun Fei Yam,10.1016/j.jep.2026.122057,2026-12,Journal of Ethnopharmacology,
Crossref,aortic stenosis,An antibody-conjugated polymer nanoparticle that targets inflammatory site for abdominal aortic aneurysm antioxidant stress therapy,Youjin Huang; Qi'’nan Yin; Qin Zhang; Jinping Liu; Ya Wu; Yong Liu,10.1016/j.bioadv.2026.214968,2026-11,Biomaterials Advances,
Crossref,aortic stenosis,M1 macrophage-derived exosomal miR-155-5p exacerbates aortic dissection via SMAD5-Mediated regulation of vascular smooth muscle cell phenotype,Dengwei Cao; Xinyi Li; Shaoping Zhu; Jianfeng Chen; Haoxiang Li; Jiajun Shi; Xiaoqi Xiong; Jiahui Liu; Yumou Wang; Zhe Dong; Jiangping Song; Jinping Liu,10.1016/j.bioactmat.2026.05.057,2026-11,Bioactive Materials,
Crossref,aortic stenosis,Colchicine attenuates diet-induced early aortic vascular remodeling in mice via modulation of inflammatory and cell death-associated pathways,Amira I. Shrief; Sally Abdallah Mostafa; Dina S. Elshenawy; Mamdouh Eldesoqui; Somaya Saad; Yomna F. Hassan,10.1016/j.tice.2026.103720,2026-11,Tissue and Cell,
Crossref,aortic stenosis,Comparative phenotypic analysis of primary aortic VSMCs versus TGF - β/PDGF - BB differentiated MSCs in rat,Pulkit Soni; Diksha Rani; Manish Kumar; Vaibhav Kushwaha; Anurag Thapliyal; Satyavir Yadav; Shashank Kumar Maurya; Sanjay Kumar Dey,10.1016/j.tice.2026.103714,2026-11,Tissue and Cell,
Crossref,aortic stenosis,DNMT3B attenuates the development of thoracic aortic aneurysm and dissection by suppressing TFEB-mediated autophagy in vascular smooth muscle cells,Yulin Bao; Yaxin Zhu; Yuting Niu; Yilu Hu; Dingkun Lu; Ruixia Xu; Xiaohan Fan,10.1016/j.bbadis.2026.168331,2026-10,Biochimica et Biophysica Acta (BBA) - Molecular Basis of Disease,
Crossref,aortic stenosis,The impact of FBN1 variant types on pregnancy-related aortic dissection in women with Marfan syndrome,Tae Yokouchi-Konishi; Chizuko Aoki-Kamiya; Mitsuhiro Tsuritani; Yasuki Ishihara; Yohei Miyashita; Yoshihiro Asano; Takeshi Yagyu; Hitoshi Matsuda; Hiroko Morisaki; Mai Temukai; Masami Sawada; Aiko Kakigano; Naoko Iwanaga; Takeshi Kanagawa; Reiko Neki; Jun Yoshimatsu,10.1016/j.ijcard.2026.134634,2026-10,International Journal of Cardiology,
Crossref,aortic stenosis,Metabolic mechanism analysis of abdominal aortic aneurysm tissues by internal extractive electrospray ionization mass spectrometry with minimal sample size,Manman Qin; Leting Wang; Dan Shan; Deqing Lin; Qinglin Chen; Shuxiang Yan; Liangliang Liao; Xinyi Luo; Yifeng Zhang; Jun Yu,10.1016/j.talanta.2026.129840,2026-10,Talanta,
Crossref,aortic stenosis,A physiology-constrained framework for non-invasive left atrial pressure assessment and post-procedural estimation in mitral stenosis,Qimin Zhang; Wenwen Liang; Shengzhang Wang; Minmin Sun,10.1016/j.bspc.2026.110809,2026-10,Biomedical Signal Processing and Control,
Crossref,aortic stenosis,Beyond luminal stenosis: Epicardial adipose tissue volume reflects coronary plaque burden according to CAD-RADS 2.0,Emine Meltem; Ibrahim Taskın Rakıcı; Mert Aric; Saime Turgut Gunes; Kubra Bozkurt; Ceyda Turan Bektas; Abdullah Soydan Mahmutoglu,10.1016/j.ejrad.2026.113023,2026-10,European Journal of Radiology,
Crossref,aortic stenosis,Mid-Term Outcomes of the PETTICOAT-Snowshoe Technique for Preventing Distal Stent Graft–Induced New Entry in Double-Barrel Type B Aortic Dissection,Yuki Orimoto; Hiroyuki Ishibashi; Takahiro Arima; Hiroki Mitsuoka; Yohei Kawai; Akio Kodama,10.1016/j.avsg.2026.04.065,2026-10,Annals of Vascular Surgery,
Crossref,aortic stenosis,Incidence and risk factors for aortic dissection in a community-based cohorts: The Atherosclerosis Risk in Communities (ARIC) and Multi-Ethnic Study of Atherosclerosis (MESA) studies,John Erhabor; Zeina Dardari; Kunihiro Matsushita; Seamus Whelton; Ron Blankstein; Zhiqi Yao; Erfan Tasgidhi; Weihong Tang; Michael E. Hall; Michael Khorsandi; Kunal Jha; Michael D. Shapiro; Khurram Nasir; Michael J. Blaha,10.1016/j.ajpc.2026.101665,2026-10,American Journal of Preventive Cardiology,
Crossref,aortic stenosis,Low back pain in the elderly: Abdominal aortic aneurysm as a diagnostic pitfall,Maroua Slouma; Sonia Khalbous; Mounir Lmaloum,10.1016/j.jbspin.2026.106070,2026-10,Joint Bone Spine,
Crossref,aortic stenosis,The influence of sex and valve phenotype on fibrocalcific composition in severe aortic stenosis evolves with age,Jun Shu; Jingji Xu; Didi Wen; Jin Zhang; Yao Zhao; Zhuofan Li; Zhuojie Lv; Minwen Zheng,10.1016/j.ejrad.2026.112979,2026-10,European Journal of Radiology,
Crossref,aortic stenosis,Clinical outcomes and impact of aortic valve replacement in concordant vs discordant high-gradient aortic stenosis,Hesham Sheashaa; Juan M. Farina; Kamal Awad; Mohammed Tiseer Abbas; Milagros Pereyra; Isabel G. Scalia; Fatmaelzahraa Abdelfattah; Sherif Ahmed; Mahshad Razaghi; Abdelrahman Hafez; Ramzi Ibrahim; Steven J. Lester; Said Alsidawi; Bamvi Fohtung; Rohit Mital; Kristen Sell-Dottin; Chadi Ayoub; Reza Arsanjani,10.1016/j.ahj.2026.107507,2026-10,American Heart Journal,
Crossref,aortic stenosis,In-hospital outcomes of valve-in-valve vs. native valve transcatheter aortic valve implantation in Brazil: A propensity-matched analysis,Pedro Calomeni; Marcella Sousa Abizaid; Fernando Bernardi; Fábio Sandoli de Brito; Pedro Alves Lemos; Fausto Feres; Dimytri Alexandre Siqueira; Ricardo Costa; Cleverson Zukowski; Rogério Sarmento-Leite; Fernanda Mangione; José Armando Mangione; Luiz Eduardo Koenig São Thiago; Valter Correira de Lima; Adriano Dias Dourado Oliveira; Marcos Antônio Marino; Carlos José Francisco Cardoso; Paulo Ricardo Avancini Caramori; Rogério Tadeu Tumelero; Antenor Lages Fortes Portela; Maurício Lopes Prudente; Leônidas Alvarenga Henriques; Fábio Solano de Freitas Souza; Cristiano Guedes Bezerra; Guy Fernandes de Almeida Prado Junior; Leandro Zacarias Figueiredo de Freitas; Ederlon Ferreira Nogueira; George César Ximenes Meireles; Renato Bastos Pope; Ênio Eduardo Guérios; Pedro Beraldo de Andrade; Luciano de Moura Santos; Vinicius Borges Cardozo Esteves; Alexandre Abizaid; Henrique Barbosa Ribeiro,10.1016/j.ijcard.2026.134600,2026-10,International Journal of Cardiology,
Crossref,aortic stenosis,Mega-aortic syndrome in Cogan syndrome,Philipp Jud; Rupert Horst Portugaller,10.1016/j.jbspin.2026.106064,2026-10,Joint Bone Spine,
Crossref,aortic stenosis,Echographic assessment of visceral perfusion under intra-aortic balloon pump support,Arudo Hiraoka; Genta Chikazawa,10.1016/j.jcrc.2026.155660,2026-10,Journal of Critical Care,
Crossref,mitral regurgitation,Corrigendum to “First-in-human study of the K-Clip™ transcatheter annular repair system for severe functional tricuspid regurgitation” [International Journal of Cardiology 390(2023) / IJCA 131174],Xiaochun Zhang; Qinchun Jin; Wenzhi Pan; Wei Li; Yingqiang Guo; Genshan Ma; Cuizhen Pan; Shasha Chen; Yuan Zhang; Lei Zhang; Mingfei Li; Shiqiang Hou; Yat-yin Lam; Thomas Modine; Alex Pui-Wai Lee; Juying Qian; Daxin Zhou; Junbo Ge,10.1016/j.ijcard.2026.134622,2026-10,International Journal of Cardiology,
Crossref,mitral regurgitation,Relationship between left atrial fibrosis and function in a selected cohort undergoing surgery for severe primary mitral regurgitation,Caterina Maffeis; Andrea Rossi; Elvin Tafciu; Stefania Rizzo; Monica De Gaspari; Vincenzo Giambruno; Venanzio Di Nicola; Giovanni B. Luciani; Cristina Basso; Flavio L. Ribichini,10.1016/j.ijcard.2026.134614,2026-10,International Journal of Cardiology,
Crossref,mitral regurgitation,Safety of multiple grasping attempts during transcatheter mitral valve repair with the PASCAL system,Florian Jürgens; Florian Schindhelm; Mohammed Abusharekh; Clara M.K. Brandts; Jürgen Kampf; Matthias Totzeck; Fadi Al-Rashid; Peter Lüdike; Tienush Rassaf; Amir A. Mahabadi,10.1016/j.ijcard.2026.134636,2026-10,International Journal of Cardiology,
Crossref,mitral regurgitation,"Comment on “accuracy of machine learning models for mitral regurgitation severity assessment: A systematic review and meta-analysis""",Sharyu Ikhar; Yogesh Nagargoje; Ruchita Shrivastava,10.1016/j.ijcrp.2026.200666,2026-09,International Journal of Cardiology Cardiovascular Risk and Prevention,
Crossref,mitral regurgitation,Ultrasound measurement of antral cross-sectional area to predict regurgitation during general anesthesia for cesarean section in laboring women: a prospective observational cohort study,Longyuan Shen; Qiuxia Jiang; Xiaojuan Yu; Quansheng Xiao; Shengzhao Wang; Xiongda Lin; Qichen Luo; Shaoqiang Huang,10.1016/j.accpm.2026.101773,2026-09,Anaesthesia Critical Care &amp; Pain Medicine,
Crossref,mitral regurgitation,"Direct-access, balloon-expandable mitral valve replacement under fibrillatory arrest in extensive mitral annular calcification",John Wheeler; Gilbert Tang; Dimosthenis Pandis; Ahmed El-Eshmawi,10.1016/j.xjse.2026.100130,2026-09,JTCVS Structural and Endovascular,
Crossref,mitral regurgitation,Case report: Salvage transcatheter aortic valve replacement for acute aortic regurgitation due to prosthetic valve endocarditis,Denizhan Ozdemir; Uttam Singh; Adishwar Singh; Raj R. Makkar,10.1016/j.crmic.2026.100165,2026-09,Cardiovascular Revascularization Medicine: Interesting Cases,
Crossref,mitral regurgitation,Massive mitral annular calcification with valvular involvement: Multimodality and longitudinal imaging correlation,Manuela Montatore; Gabriele Fanigliulo; Federica Masino; Ruggiero Tupputi; Roberto Maresca; Francesca Calò; Eluisa Muscogiuri; Giuseppe Guglielmi,10.1016/j.radcr.2026.05.087,2026-09,Radiology Case Reports,
Crossref,mitral regurgitation,Mechanical mitral prosthesis thrombosis despite normal disc mobility: A case report,Parvathy Sankar; Nicholas Mitchell; Aiden Van Loo; Mohammad Ghandhor; Mitchell Schwocho; Noora Neiroukh; Richard Bloomingdale,10.1016/j.crmic.2026.100168,2026-09,Cardiovascular Revascularization Medicine: Interesting Cases,
Crossref,mitral regurgitation,Blood-nulled late gadolinium enhancement increases sensitivity for subtle basal myocardial scar in mitral valve prolapse with annular disjunction,Amy Avakian; Muhammad Umair,10.1016/j.radcr.2026.05.076,2026-09,Radiology Case Reports,
Crossref,mitral regurgitation,Clinical and echocardiographic predictors of reintervention after percutaneous or surgical treatment of rheumatic mitral stenosis: A systematic review,S.A. Gómez-Gualdrón; J.S. Macias-Martinez; A.M. Pulido-Parra; S.A. Higuera-Leal; B.E. Vesga-Angarita,10.1016/j.cpcardiol.2026.103358,2026-09,Current Problems in Cardiology,
Crossref,mitral regurgitation,Multimodality imaging assessment of caseous mitral annular calcification in a hemodialysis patient undergoing atrial fibrillation ablation: A case report,Jingyan Niu; Wencai Huang; Jiani Zou,10.1016/j.radcr.2026.04.080,2026-08,Radiology Case Reports,
Crossref,mitral regurgitation,Survival of dogs with myxomatous mitral valve disease administered preclinical pimobendan in comparison to pimobendan-naïve dogs from the onset of congestive heart failure,G. McAulay; M. Hills; J. Dukes-McEwan; E. Dutton; A. Jakubczak; D. Singleton; E. Bode; W. Yangwanitset; M. Hezzell,10.1016/j.jvc.2026.05.001,2026-08,Journal of Veterinary Cardiology,
Crossref,mitral regurgitation,Prognostic interaction of aortic regurgitation and left atrial strain beyond guideline-based intervention criteria,Paola Ramos Cano; Juan Manuel Monteagudo Ruiz; Irene Carrión Sanchez; Ariana González Gómez; Ana García Martin; Rocío Hinojar-Baydes; Pablo Martínez-Vives; José Luis Zamorano Gómez; Covadonga Fernández Golfín-Lobán,10.1016/j.ijcard.2026.134533,2026-08,International Journal of Cardiology,
Crossref,mitral regurgitation,Diagnostic accuracy of right pulmonary vein-to-pulmonary artery ratio to identify congestive heart failure in dogs affected by myxomatous mitral valve disease,V. Patata; F. Porciello; M. Rishniw; D. Caivano; A. Corda; O. Domenech; T. Vezzosi; C. Guglielmini; H. Poser; F. Spina; F. Birettoni,10.1016/j.jvc.2026.03.003,2026-08,Journal of Veterinary Cardiology,
Crossref,mitral regurgitation,"Retraction Notice to “Lethal Case of Microbacterium paraoxydans Bloodstream Infection Associated with Mitral Endocarditis in Human: A Case Report, analyses of the 16S rDNA sequences and review of the literature” [Diagnostic Microbiology &amp; Infectious Disease 111 (2025) 116739]",Pierre Serandour; Chloe Plouzeau; Anthony Michau; Lauranne Broutin; Julie Cremniter; Christophe Burucoa; Maxime Pichon,10.1016/j.diagmicrobio.2026.117375,2026-08,Diagnostic Microbiology and Infectious Disease,
Crossref,mitral regurgitation,Kodamaea ohmeri–associated mitral valve endocarditis complicated by septic embolism of the right femoral artery: A case report,Yi-Jhen Chen; Meng-Yu Cheng; You-Cian Lin; Yu-Kai Lin; Hsiu-Hsien Lin; Yao-Ju Tseng; Yu-Tzu Lin; Mao-Wang Ho; Po-Ren Hsueh,10.1016/j.ijid.2026.108774,2026-08,International Journal of Infectious Diseases,
Crossref,mitral regurgitation,Cardiac Magnetic Resonance for the Prediction of Arrhythmic Events in Mitral Valve Prolapse: A Systematic Review and Meta-analysis,Christos A. Papanastasiou; Polydoros N. Kampaktsis; Zoi Papalamprakopoulou; Thomas Gossios; Theofilos Panagiotidis; Maria-Anna Bazmpani; Thomas Zegkos; Damianos N. Kokkinidis; Stefanos Votsis; Ioannis Tziatzios; Despoina Parcharidou; Vasileios Kamperidis; Georgios Efthimiadis; Andreas A. Giannopoulos; Apostolos Tsapas; Antonios Ziakas; Theodoros D. Karamitsos,10.1016/j.amjcard.2026.04.050,2026-08,The American Journal of Cardiology,
Crossref,deep learning,Learner profiles and the process of Learning in the Higher Educational Context,Christos Skourlas; Petros Belsis,10.15556/ijiim.02.01.003,2115-03-05,International Journal on Integrated Information Management,
Crossref,deep learning,WEB-BASED COLLABORATIVE LEARNING AND KNOWLEDGE SHARING IN INFORMAL BUSINESS NETWORKS,George Stalidis; Costis Papadimitrakopoulos; Theocharis Tsakiris,10.15556/ijiim.01.02.002,2114-12-10,International Journal on Integrated Information Management,
Crossref,deep learning,Availability and Utilization of Tools and Equipment for Teaching and Learning Garment Making Trade in the Senior Secondary Schools in Edo State,,10.20431/2349-0381.0303002,2106,"International Journal of Humanities, Social Sciences and Education",
Crossref,deep learning,Title Pending 8184,,10.3998/mjcsl.8184,2036-06-28,Michigan Journal of Community Service Learning,
Crossref,deep learning,Title Pending 8122,,10.3998/mjcsl.8122,2036-05-11,Michigan Journal of Community Service Learning,
Crossref,deep learning,Title Pending 8219,,10.3998/mjcsl.8219,2036-04-13,Michigan Journal of Community Service Learning,
Crossref,deep learning,Title Pending 8273,,10.3998/mjcsl.8273,2036-03-03,Michigan Journal of Community Service Learning,
Crossref,deep learning,Title Pending 7452,,10.3998/mjcsl.7452,2036-01-19,Michigan Journal of Community Service Learning,
Crossref,deep learning,Title Pending 6294,,10.3998/mjcsl.6294,2034-12-20,Michigan Journal of Community Service Learning,
Crossref,deep learning,Title Pending 5730,,10.3998/mjcsl.5730,2034-11-18,Michigan Journal of Community Service Learning,
Crossref,deep learning,Title Pending 3643,,10.3998/mjcsl.3643,2033-09-06,Michigan Journal of Community Service Learning,
Crossref,deep learning,Title Pending 4120,,10.3998/mjcsl.4120,2033-03-28,Michigan Journal of Community Service Learning,
Crossref,deep learning,Title Pending 2741,,10.3998/mjcsl.2741,2032-09-28,Michigan Journal of Community Service Learning,
Crossref,deep learning,Machine Learning Application for SAIs,Tiare Rivera,10.56251/watu4873,2030-10-20,International Journal of Government Auditing,
Crossref,deep learning,Integration of Biomechanics and Digital Technology: Using Kinovea for Motion Analysis and Learning for Beginner Athletes,Muhammad Nur Hudha; Riezky Maya Probosari; Annisa Nur Khasanah; Supurwoko; Salsabila Kholifahtun Nisa’; Gifran Rihla Gifarka Latief,10.58524/jcss.v4i2.890,2029-11-29,Journal of Coaching and Sports Science,"Background: The integration of biomechanics with digital motion-analysis technologies has introduced new approaches for examining movement efficiency, kinematic characteristics, and technical patterns in walking and running activities. Kinovea, as an accessible motion-analysis software, provides both visual and quantitative feedback. However, its application in supporting technique development among beginner athletes remains insufficiently explored. Aim: This study aims to describe the use of Kinovea in biomechanics training and examine its contribution to the awareness of kinematic characteristics and movement techniques among beginner athletes. Methods: A descriptive qualitative design involved 72 beginner athletes aged 18–25 years selected through purposive sampling. Data were collected over 16 weeks through interviews, field observations, and motion video recordings analyzed using Kinovea. Kinematic data focused on joint angles, stride behavior, and movement phases during walking, running, and the flight phase. Qualitative data were analyzed using content analysis with NVivo 12, while kinematic results were interpreted descriptively to identify performance patterns and areas for technical refinement. Result: Kinematic analysis showed coordinated joint-angle patterns across all phases. Walking analysis identified arm swing angles of 50.9°–58.8° and leg separation angles of 64.3°–67.2°, indicating a stable gait rhythm. The running analysis revealed knee angles of 68.8°–69.8° and elbow angles of 87.6°–89.1°, indicating efficient propulsive mechanics. The flight phase demonstrated knee angles of 81.2°–87.8° and elbow angles of 80.4°–88.3°, suggesting effective momentum use and postural stability. These measurements supported stride-efficiency assessment and technique evaluation. Qualitative findings revealed that Kinovea enabled athletes to interpret movement phases and identify technical inefficiencies through slow-motion and frame-by-frame visualization. Conclusion: Kinovea supports basic motion analysis by providing clear kinematic information and helping beginner athletes observe and refine their movement techniques. The findings also offer practical value for coaches by enabling more precise identification of inefficient patterns and guiding targeted corrections during early-stage training."
Crossref,deep learning,Sparsity Learning via Structured Functional Factor Augmentation,Hanteng Ma; Ziliang Shen; Xingdong Feng; Xin Liu,10.5705/ss.202025.0205,2029,Statistica Sinica,
Crossref,deep learning,Transfer Learning for High-dimensional Regression with Compositional Covariates: Application to Microbiome Studies,Qinqin Hu; Xiaojing Luo; Chencheng Ma; Wang Zhou,10.5705/ss.202025.0314,2029,Statistica Sinica,
Crossref,deep learning,Cyber Defense Digital Twins: A Federated Learning and Zero-Trust AI Architecture for Autonomous Threat Prediction and Response,Sivaramakrishnan Narayanan,10.32628/cseit251116279,2028-08-27,"International Journal of Scientific Research in Computer Science, Engineering and Information Technology","Modern enterprise networks operate under persistent threats that exploit cloud-native misconfigurations, identity sprawl, and API vulnerabilities at machine speed. Existing security operations center (SOC) architectures remain largely reactive, signature-dependent, and incapable of predicting multi-stage lateral movement. This paper proposes the Cognitive Cyber Defense Digital Twin (CCDT), a unified architecture integrating federated learning (FL), graph neural network (GNN)-based attack-path forecasting, adversarially hardened detection models, and autonomous Security Orchestration, Automation, and Response (SOAR) with deception engineering. The CCDT constructs a continuously synchronized digital replica of organizational assets and employs reinforcement learning-based red agents to stress-test detection models. A federated intelligence mesh enables cross-organizational privacy-preserving gradient sharing. Experimental evaluations against CICIDS-2018 and LANL datasets demonstrate 52% faster attack-path detection, 41% reduction in false positive rate, and 60% reduction in mean-time-to-respond (MTTR) compared to traditional SOC baselines. Integrated Explainable AI (XAI) modules using SHAP values enable audit-ready compliance reporting. The CCDT represents a paradigm shift from reactive monitoring to predictive, autonomous, and privacy-preserving cyber defense for hybrid cloud environments."
Crossref,deep learning,The Nexus of Leadership and Learning: Exploring Female Principals' Influence on the Teaching-Learning Process in Secondary Schools,Muhammad Niqab; Salma Tabbasum; Shakil Ahmad,10.55737/qjss.vii-i.26473,2028-02-28,Qlantic Journal of Social Sciences,"The research paper will set out to debate the role played by the leadership competencies of principals in the teaching and learning process. The research will embrace a quantitative research design that will seek to answer the question concerning the relationship that exists between leadership skills of possessed by the  principals and the ongoing teaching-learning process in the female secondary schools using a co-relational study design. A survey instrument comprising of 37 items, which measured the leadership skills possessed by the selected principals and the prevailing teaching learning process, was used in the collection of data. Questionnaires for this study were administered to 108 male and female educators who were serving in secondary schools in Tehsil Wari, upper Dir and among them 100 questionnaires were submitted and were deemed to be useful in the analysis. The data in hand were calculated using Statistical Package of the Social Sciences (SPSS) version-27 and the obtained results indicated that the collected data was normally distributed. The findings revealed that all the variables of the study had great correlations. The analysis of the data was done through linear regression to measure the effect that the leadership skills of the principals had on the teaching learning process and this indicated that leadership skills of the principals have statistically significant effect on the teaching learning process. The policies derived out of this research can be a good guide to both the policymakers and organizational leaders because they can provide a good outline on how to empower the leaders in charge of the principals and as well as exert more influence on the effective teaching and learning processes."
