source,keyword,title,authors,doi,publication_date,journal,abstract
PubMed,mitral regurgitation,Mitral Transcatheter Edge-to-Edge Repair Versus Guideline-Directed Medical Therapy for Functional Mitral Regurgitation With Heart Failure: An Updated Meta-analysis.,Lucas Cael Azevedo Ramos Bendaham; Mohamed Doma; Altair Pereira de Melo Neto; Capela Antonio Dicazeco Pascal; Hilária Saugo Faria; Ana Gabriela Ponte Farias; Elísio Bulhões; Amit N Vora; Andrew M Goldsweig,10.1016/j.jscai.2025.104165,2026-03,Journal of the Society for Cardiovascular Angiography & Interventions,"Mitral transcatheter edge-to-edge repair (MTEER) and guideline-directed medical therapy (GDMT) may be used to treat functional mitral regurgitation (FMR) with heart failure (HF). The optimal management of FMR is unclear.
We performed a contemporary systematic review and meta-analysis comparing MTEER vs GDMT. PubMed, Embase, and Cochrane Central were systematically searched for randomized controlled trials and propensity score matched studies comparing outcomes of MTEER plus GDMT vs GDMT alone in FMR with HF. Odds ratios and risk ratios (RRs) with 95% CI were estimated using random-effects models.
Three randomized controlled trials and 5 propensity score matched studies were identified (n = 2588) comparing MTEER (52.2%) vs GDMT alone (47.8%) for FMR with HF. MTEER was associated with lower risks of 12-month all-cause mortality (RR, 0.74; 95% CI, 0.58-0.95; P = .02), cardiovascular mortality (RR, 0.59; 95% CI, 0.38-0.93; P = .02), and HF hospitalization (RR, 0.64; 95% CI, 0.48-0.86; P < .001) compared with GDMT alone. Additionally, the MTEER group was more likely to achieve New York Heart Association class I/II at 12 months (odds ratio, 2.11; 95% CI, 1.48-2.99; P < .01) than the GDMT group. In contrast, the GDMT group had a significantly lower risk of mitral regurgitation recurrence than the MTEER group (RR, 2.20; 95% CI, 1.79-2.71; P < .01). There was no statistically significant difference in the risk of myocardial infarction or stroke between the groups.
MTEER reduced all-cause cardiovascular mortality and HF hospitalization in patients with FMR and HF compared with GDMT alone. Additionally, MTEER resulted in a significant improvement in functional status in these patients."
PubMed,mitral regurgitation,"Distance from tertiary care, pericardial effusion, and nutritional status predict all-cause mortality among Malawian children with rheumatic heart disease.",Jillian Olsen; Yamikani Chimalizeni; Jonathan Carapetis; Msandeni Chiume; Sarah Murphy Gunter; Mina Hosseinipour; Peter Kazembe; Subhrajit Lahiri; Treasure Mkaliainga; Kristy O Murray; Daniel Penny; Tayamika Tambala; Anirudh Vinnakota; Amy Sanyahumbi,10.64898/2026.02.28.26346960,2026-03-04,medRxiv : the preprint server for health sciences,"This study of Malawian children with rheumatic heart disease (RHD) sought to detect demographic, clinical, and echocardiographic risk factors for mortality.
Pediatric patients with RHD were recruited from March to October, 2018 from clinic rosters and inpatient consults in Lilongwe and Blantyre, Malawi. An echocardiogram was performed upon study enrollment. Cox regression analyses were performed to assess for factors associated with mortality over nearly 2 years of follow-up.
Of 118 patients, nearly two-thirds were female (64.4%) and median age was 12 (IQR 10-14). Just under half (47.0%) lived >40km from a tertiary care center. There was a high prevalence of severe mitral regurgitation (65.3%), and pericardial effusion was present in 18.6%. Nearly a quarter (23.7%) died during follow-up. In univariable Cox regression, living >40km from tertiary care, living in a remote area, moderate or severe malnutrition, taking a beta blocker, severe mitral stenosis, any severe valve disease, severe left atrial enlargement, and presence of a pericardial effusion were statistically significant risk factors for mortality (p<0.05). In the adjusted model, living >40km from tertiary care (HR 2.66, CI 1.06-6.07, p=0.037), malnutrition (mild HR 3.92, CI 1.03-14.91, p=0.045); moderate HR 7.41, CI 1.92-28.54, p=0.004; severe HR 4.91, CI 1.44-16.71, p=0.011), beta blocker use (HR 4.62, CI 1.63-13.10, p=0.004), and presence of a pericardial effusion (HR 6.96, CI 3.00-16.13, p<0.001) remained independent risk factors for mortality.
This study of Malawian children emphasizes the dire prognosis of RHD in under-resourced settings and provides potential area of focus for targeted intervention."
PubMed,mitral regurgitation,Valvulitis Matters: Linking Mitral Regurgitation to Inflammatory Burden in Kawasaki Disease.,Ja-Kyoung Yoon,10.4070/kcj.2025.0495,2026-02-10,Korean circulation journal,
PubMed,mitral regurgitation,Small Orifice Regurgitation Increasing Phenomenon During Transcatheter Edge-to-Edge Repair: Case Series.,Dawei Lin; Wei Li; Daxin Zhou; Wenzhi Pan,10.1002/ccd.70559,2026-03-22,Catheterization and cardiovascular interventions : official journal of the Society for Cardiac Angiography & Interventions,"Transcatheter edge-to-edge repair (TEER) has emerged as a prominent therapeutic approach for mitral regurgitation (MR) in recent years. For commissural, a higher grade of MR would be detected post-TEER compared to it during the procedure, while the mechanism hasn't been elucidated yet. Two patients with commissural MR underwent TEER at our center. Through these cases, we identifies and names a novel phenomenon (""small orifice regurgitation increasing"" [""SORI""]) in TEER procedures, providing key insights to better understand and prevent residual commissural MR."
PubMed,mitral regurgitation,[Evaluation of myocardial work in patients with mitral valve prolapse and severe regurgitation: predictive value for prolonged postoperative ICU stay].,C H Gu; C Y Cui; C H Wei; H F Liu; Y L Ma; J J Yuan; X Q Tian,10.3760/cma.j.cn112148-20260202-00074,2026-03-24,Zhonghua xin xue guan bing za zhi,"Objective: To quantitatively evaluate left ventricular myocardial work in patients with mitral valve prolapse with severe regurgitation (MVPSR) and normal left ventricular ejection fraction (LVEF) using pressure-strain loop (PSL) technology, and explore its predictive value for the duration of patients' postoperative stay in the intensive care unit (ICU). Methods: MVPSR patients with normal LVEF who were treated at Fuwai Huazhong Cardiovascular Hospital from May 2023 to June 2025 were included as the MVPSR group. All patients underwent cardiac valve repair or valve replacement surgery and underwent echocardiography before surgery. Subjects who were matched for gender, age, body mass index as well as comorbidities, and underwent echocardiography during the same period, and were excluded from MVPSR were selected as the non-MVPSR group. Left ventricular global longitudinal strain, longitudinal strain peak time dispersion and global work index, global work efficiency (GWE), global constructive work, global wasted work, as well as the longitudinal strain and work parameters for each segment (basal, mid, and apical segments) were assessed using PSL technology. The duration of ICU stay for patients in the MVPSR group after mitral valve surgery were recorded, and a prolonged ICU stay was defined as a duration >48 hours. The differences in left ventricular myocardial work parameters between the two groups were compared, and the impact of GWE on the duration of patients' early postoperative ICU stay was analyzed using a multifactor linear regression model. Receiver operating characteristic curve analysis was applied to evaluate the predictive performance of GWE for prolonged ICU stay. Results: There were 80 patients in the MVPSR group, aged (58.9±12.3) years, including 61 males. There were 58 patients in the non-MVPSR group, including 31 healthy subjects, aged (54.8±15.3) years, including 36 males. The postoperative ICU stay time in the MVPSR group was (37.0±16.8) hours. Compared with the non-MVPSR group, the MVPSR group had lower global work index, GWE and global constructive work, and higher global wasted work; the work efficiency and constructive work in the basal, intermediate and apical segments were all lower, and the wasted work was higher; the longitudinal strain and work index in the basal segment were both lower (all P<0.05). The results of the multi-factor linear regression model analysis showed that GWE was an independent influencing factor for postoperative ICU stay duration in MVPSR patients (β=-2.89, 95%CI -5.43--0.34, P=0.030). The area under the curve for GWE in predicting prolonged ICU stay time was 0.850 (95%CI 0.729-0.970). The receiver operating characteristic curve showed that the optimal cutoff value for GWE for predicting prolonged ICU stay was 92.5%, namely GWE≤92.5% predicting prolonged stay in ICU, with a sensitivity of 76.2% and a specificity of 82.4%. Conclusions: Patients with MVPSR and normal LVEF exhibit varying degrees of alterations in global and segmental left ventricular myocardial work parameters. GWE is negatively correlated with postoperative ICU length of stay and has certain predictive value for prolonged ICU stay after surgery."
PubMed,mitral regurgitation,[Application of transcatheter edge-to-edge repair in the treatment of papillary muscle rupture of mitral valve after acute myocardial infarction].,X Chen; Y W Lin; M L Su; X Chen; F Q Meng; H B Huang; Y E Yao; P P Yan; H M Wen; X J Wu; B Wang; Y Wang,10.3760/cma.j.cn112148-20250128-00076,2026-03-24,Zhonghua xin xue guan bing za zhi,"Objective: To preliminarily investigate the clinical feasibility, early efficacy, and safety of transcatheter edge-to-edge repair (TEER) in patients with acute mitral regurgitation caused by papillary muscle rupture complicating acute myocardial infarction (AMI). Methods: The study is a retrospective case series. A retrospective analysis was conducted on clinical data of 12 patients with AMI complicated by papillary muscle rupture and severe mitral regurgitation who underwent TEER at Xiamen Cardiovascular Hospital affiliated to Xiamen University from December 2021 to October 2024. Collected data included demographic characteristics, diagnostics and treatment processes, in-hospital outcomes data. Procedural success of TEER was defined as successful grasping of the anterior and posterior mitral leaflets and reduction of mitral regurgitation to grade 2+or less. Patients were followed up for 30 days post-procedure to evaluate survival status and the severity of mitral regurgitation. Results: The mean age of the patients was 67.4 years, with 10 males. Eleven patients were diagnosed with ST-segment elevation myocardial infarction, and 11 out of 12 cases involved complete rupture of the posteromedial papillary muscle. Cardiogenic shock was present in 10 patients and the median Society of Thoracic Surgeons score was 51.9%. Procedural success was achieved in all 12 patients, with mitral regurgitation reduced to ≤2+immediately post-procedure. Eleven patients survived to discharge, and no device-or procedure-related complications occurred during the perioperative period. During the follow-up period, 2 patients died and 1 was readmitted for acute heart failure. At the 30-day follow-up, 9 patients maintained a mitral regurgitation grade of ≤2+. Conclusions: TEER is technically feasible for treating acute severe mitral regurgitation caused by papillary muscle rupture following AMI. It can effectively reduce mitral regurgitation and improve hemodynamic status in selected high-risk patients in the short term. However, these findings necessitate further validation through larger-scale multicenter studies and long-term follow-up."
PubMed,mitral regurgitation,CT based Annular Dimensions in Transcatheter Mitral Valve Replacement: A Multicenter Registry Study.,Liliane Zillner; Mirjam G Wild; Michaela M Hell; Harald Herkner; Elmar W Kuhn; Tanja K Rudolph; Thomas Walter; Lenard Conradi; Andreas Zierer; Francesco Maisano; Marco Russo; Fabrizio Rosati; Andrea Colli; Miguel Piñón; David Reineke; Gaby Aphram; Tillmann Kerbel; Christophe Dubois; Jörg Hausleiter; Ralph Stephan van Bardeleben; Markus Mach; Iuliana Coti; Christian Loewe; Daniel Zimpfer; Alfred Kocher; Martin Andreas,10.1016/j.athoracsur.2026.03.015,2026-03-20,The Annals of thoracic surgery,"Transcatheter mitral valve replacement (TMVR) is a preferred interventional option for high-risk patients with severe mitral regurgitation who are ineligible for transcatheter edge-to-edge repair. However, the role of annular dimensions in risk stratification has been marginally explored in this distinct anatomical setting with preserved native leaflets in patients with varying degree of myocardial damage.
This subanalysis of the multicenter TENDER registry (NCT04898335) included 145 TMVR patients. Preprocedural 4D-CT-derived annular dimensions were evaluated for associations with cardiac and all-cause mortality.
At one year, all-cause mortality was 24.8% (n=36/145) and cardiac mortality was 5.5% (n=8/145). Cardiac deaths were associated with significantly larger annular parameters, including systolic and diastolic anteroposterior diameter (32.8±2.3 mm vs. 29.9±3.5 mm, p = 0.023; 33.2±2.5 mm vs. 30.3±3.4 mm, p = 0.018), systolic and diastolic annular perimeter (126.1±9.5 mm vs. 115.8±10.5 mm, p = 0.008; 125.6±10.4 mm vs. 115.8±12.7 mm, p = 0.034), and annular area (1271.7±193.2 mm2 vs. 1076.2±193.6 mm2, p = 0.006; 1262.7±209.9 mm2 vs. 1087.2±194.7 mm2, p = 0.015). Annular Area Loss, calculated as the difference between native diastolic mitral annular area and the geometric EOA of the implanted valve, was significantly greater in patients who died for cardiac reasons (999.72±225.72 mm2) compared to survivors (826.68±189.45 mm2; p = 0.022; OR=1.005, p = 0.030).
Larger annular dimensions and greater Annular Area Loss may predict one-year cardiac death. Possible mechanisms include impaired LV filling, artificial inflow-related outflow tract obstruction, and limited reverse remodeling. Comprehensive annular assessment may also enhance patient selection for future transseptal TMVR systems."
PubMed,mitral regurgitation,"Evaluation of Lung Disease in Adults with Osteogenesis Imperfecta: A Cross-Sectional, Multi-Center Study.",Chloe E Derocher; Erin M Carter; Debra Dyer; Deborah Krakow; Malinda Wu; Robert A Sandhaus; Cathleen L Raggio,10.1016/j.chest.2026.02.030,2026-03-20,Chest,"Osteogenesis imperfecta (OI) is a group of hereditary connective tissue disorders characterized by frequent fractures. Although cardiopulmonary impairment is a leading cause of mortality in the OI population, our understanding of the etiology of cardiopulmonary issues in OI remains limited.
What are the cardiopulmonary outcomes and differences in pulmonary function in a cohort of 60 adults with OI?
This IRB-approved, cross-sectional, multi-center study included 60 adults (39 F, 21 M) with OI. Spine radiographs (AP/lateral) were evaluated for scoliosis (curve >10°), using the largest curve for analysis. Restrictive physiology on PFT was defined by FEV1/FVC >80%. Chest CTs were qualitatively evaluated for evidence of lung disease and restriction. Cardiac health was assessed via echocardiogram and EKG. Analysis included descriptive statistics, non-parametric Kruskal Wallis tests, and bivariate correlation analysis using Spearman's rho coefficient (p<0.05).
Mean age was 42±15 years. Forty-three of 59 individuals (72.9%) presented with scoliosis. Two-thirds of participants had restrictive physiology on PFT, with no significant correlation between curve magnitude and pulmonary function (R=0.127, p=0.338). Forty-eight of 56 chest CTs (85.7%) showed abnormalities (bronchial wall thickening, ground glass, atelectasis, bronchiectasis). Bronchial wall thickening was common in both sexes and seen across all OI types. Thirty of 52 EKGs (57.7%) had abnormalities, including tachycardia, abnormal ventricular relaxation, and T-wave abnormalities. Forty-one of 50 participants (82%) had trace mitral, tricuspid, or pulmonic regurgitation on echocardiogram.
Given the weak correlation of pulmonary function and curve magnitude, respiratory impairment may be intrinsic to OI, rather than exclusively a secondary effect of scoliosis. High-resolution CT scanning of the lungs holds great utility for clinically evaluating pulmonary abnormalities in patients with OI. Future studies are necessary to better understand the etiology of bronchial wall thickening and bronchiectasis in OI."
PubMed,mitral regurgitation,Pulmonary hypertension in dogs with myxomatous mitral valve disease.,M Borgarelli; C M Bussadori,10.1016/j.jvc.2026.02.007,2026-02-26,Journal of veterinary cardiology : the official journal of the European Society of Veterinary Cardiology,"Pulmonary hypertension (PH) is a clinically significant and increasingly recognized complication of myxomatous mitral valve disease (MMVD) in dogs, contributing to worsening morbidity and mortality. The development of PH in the context of MMVD is associated with increased symptom burden, including exercise intolerance, syncope, and respiratory distress, and has been correlated with reduced survival times. Echocardiography is the primary modality for detection and monitoring, relying on Doppler estimation of tricuspid regurgitation velocity, but limitations in sensitivity and accuracy remain. Therapeutic strategies typically focus on management of the underlying MMVD and heart failure and to control left atrial pressure, with diuretics, angiotensin-converting enzyme inhibitors, and pimobendan. Sildenafil and other pulmonary vasodilators have been used with variable clinical benefits in dogs with MMVD and concurrent PH, though evidence remains limited and sometimes conflicting. Prognosis is influenced by both severity of valve disease and degree of pulmonary vascular involvement, underscoring the importance of timely recognition and individualized management. Understanding the interplay between MMVD and PH is critical for optimizing outcomes, guiding treatment decisions, and informing future clinical research in veterinary cardiology."
PubMed,mitral regurgitation,Survival After Coronary Artery Bypass Grafting With or Without Mitral Valve Repair for Moderate Ischemic Mitral Regurgitation.,Lianxin Chen; Xieraili Tiemuerniyazi; Ziang Yang; Liaoming He; Shengkang Huang; Yifeng Nan; Yangwu Song; Zhan Hu; Wei Zhao; Wei Feng,10.1016/j.athoracsur.2026.03.016,2026-03-19,The Annals of thoracic surgery,"The surgical management of moderate ischemic mitral regurgitation (IMR) in patients undergoing coronary artery bypass grafting (CABG) remains controversial, with limited real-world evidence, particularly from Asian populations.
We retrospectively analyzed 650 patients with moderate IMR who underwent isolated CABG (n=493) or CABG with mitral valve repair (n=157) between August 2009 and April 2024. Inverse probability of treatment weighting was applied to adjust for baseline differences. The primary endpoint was all-cause mortality; the secondary endpoint was major adverse cardiovascular and cerebrovascular events.
During a median follow-up of 36.6 months, CABG with mitral valve repair was associated with lower all-cause mortality (multivariable HR, 0.41; 95%CI, 0.22-0.79; weighted log-rank P=0.006) and fewer composite events (weighted log-rank P=0.001), mainly driven by fewer deaths and rehospitalizations for heart failure. Findings were consistent across sensitivity and subgroup analyses. Echocardiographic follow-up (median 11.6 months) showed greater improvement in mitral regurgitation (75.4% vs 50.4%, P<0.001) and a larger reduction in left ventricular end-diastolic diameter (4.0[0, 7.8] vs 3.0[-1.0, 6.0], P = 0.026). CABG with repair was associated with longer postoperative intubation, intensive care unit stay, and an increased risk of acute kidney injury, without increased early mortality.
In one of the largest Asian real-world cohorts, concomitant mitral valve repair during CABG for moderate IMR was associated with lower mortality and fewer major adverse cardiovascular and cerebrovascular events and greater echocardiographic improvement, but at the expense of increased perioperative morbidity."
PubMed,mitral regurgitation,Mitral Leaflet Fragment Embolization Causing Coronary Occlusion During Rescue Transcatheter Mitral Valve Repair for Acute Mitral Regurgitation.,Ryota Kosaki; Yasuhide Mochizuki; Yumi Yamamoto; Sakiko Gohbara; Rumi Hachiya; Hideaki Tanaka; Yuya Nakamura; Hiroto Fukuoka; Taka-Aki Matsuyama; Toshiro Shinke,10.1016/j.cjca.2026.02.051,2026-03-19,The Canadian journal of cardiology,"Transcatheter edge-to-edge repair (TEER) is increasingly used as rescue therapy for severe mitral regurgitation (MR) in patients with prohibitive surgical risk. Although procedural success has been reported even in cardiogenic shock, complications related to leaflet fragility in acute structural MR remain poorly recognized. We report a fatal case in which repeated leaflet grasping during TEER caused perforation and fragmentation of a fragile leaflet, resulting in embolization of native mitral leaflet tissue and acute coronary artery occlusion. Autopsy and histopathology confirmed the embolic material to be mitral leaflet tissue. This case highlights an unrecognized mechanism of coronary obstruction during TEER."
PubMed,mitral regurgitation,Rheumatic Heart Disease Is Not Over: Cardiac Cirrhosis and Multivalvular Sequelae in an Endemic Setting - A Case Series and Review.,Yashendra Sethi; Narendra Dev Yadav; Saurabh Singhal; Apoorv Pratap Singh; Ankita Singh; Shruti Agarwal; Amit Sharma; Chris Pavlovic; Thomas Pavlovic; Sameer Mehta,10.1016/j.cpcardiol.2026.103329,2026-03-19,Current problems in cardiology,"Rheumatic Heart Disease (RHD) remains a major cause of valvular morbidity in endemic regions despite declining incidence in high-income countries. While early disease manifests as acute rheumatic fever, contemporary presentations increasingly reflect advanced structural sequelae. Congestive hepatopathy and cardiac cirrhosis secondary to chronic right-sided failure remain under-recognized manifestations of advanced rheumatic valvular disease.
To describe three cases of advanced rheumatic multivalvular disease presenting predominantly with ascites and hepatic congestion and to integrate these observations with current literature on pulmonary hypertension, right ventricular remodeling, and cardiac cirrhosis.
We conducted a retrospective case series at a tertiary referral center in North-India. Inclusion criteria comprised adult patients with echocardiographically confirmed rheumatic valvular disease, preserved left ventricular ejection fraction (≥50%), right-sided heart failure manifestations, and evidence of congestive hepatopathy. Comprehensive clinical, echocardiographic, laboratory, and hepatic Doppler assessments were performed. A structured literature review contextualized the findings.
Three middle-aged women (46-52 years) presented with progressive dyspnea and tense ascites. All demonstrated severe left-sided rheumatic lesions (mitral stenosis or regurgitation), severe functional tricuspid regurgitation, pulmonary hypertension (PASP 55-64 mmHg), and preserved left ventricular systolic function (LVEF 58-62%). Marked left atrial enlargement (indexed volume 68-82 mL/m²) and varying degrees of right ventricular dysfunction (TAPSE 13-16 mm) were observed. High serum-ascites albumin gradients and hepatic Doppler abnormalities confirmed post-sinusoidal portal hypertension consistent with stage II-III congestive hepatopathy. All patients responded to diuretic therapy but were unsuitable for percutaneous intervention due to advanced rheumatic morphology and were referred for surgical valve replacement and tricuspid repair."
PubMed,mitral regurgitation,Pulmonary Hypertension Hyper-Responder to Valve-in-Valve TMVR Under Conscious Sedation.,Omar Sami Abdelhai; Ahmad Ghoneem; Pedro Villablanca; Brian O'Neill; Pedro Engel; James Lee; Jonathan Fang; Tyler Andrews; Domingo Palacios; Tiberio Frisoli,10.1016/j.jaccas.2026.107537,2026-03-21,JACC. Case reports,"Severe pulmonary hypertension (PH) is a relative contraindication to left-sided valve replacement given elevated risk of decompensation.
A 64-year-old woman with prior atrioventricular canal repair, bioprosthetic mitral valve replacement, and suprasystemic group II PH presented with recurrent heart failure admissions in the setting of severe bioprosthetic valve regurgitation. Considered at prohibitive risk for redo surgery, she underwent valve-in-valve transcatheter mitral valve replacement (TMVR) under intracardiac echocardiography (ICE) guidance and conscious sedation. Pulmonary artery systolic pressure decreased from the 110s to the 80s mm Hg postprocedure and to the 50s mm Hg with sildenafil optimization. At 9 months postprocedure, she had improved to NYHA functional class I-II status.
This case illustrates the safety and feasibility of ICE-guided TMVR without general anesthesia in patients with severe PH. It highlights a ""hyper-responder"" physiology after correction of left-sided valve pathology and optimization of pulmonary vasodilators.
ICE-guided TMVR under conscious sedation (in combination with pulmonary vasodilators) can be safe in select severe PH patients, achieving significantly lower pulmonary pressures with meaningful symptom improvement."
