source,keyword,title,authors,doi,publication_date,journal,abstract
PubMed,deep learning,Data-efficient learning for accurate identification of MAPK1 inhibitors using an active meta-deep learning framework.,Darlene Nabila Zetta; Tarapong Srisongkram,10.1186/s13321-026-01159-9,2026-02-03,Journal of cheminformatics,"Limited experimental data remains a key challenge in applying machine learning to drug discovery, particularly for cancer-related targets. In this study, we present a data-efficient active meta-deep learning framework to predict mitogen-activated protein kinase 1 (MAPK1) inhibitors, which are promising candidates for cancer-related therapies. Our approach integrates active learning (AL) with a meta-model that combines four deep architectures: a convolutional neural network, an attention, a graph convolutional network, and a graph neural network-attention, trained on molecular descriptors and graph-based representations. These models generate four probability-based features that feed into an attention-based meta-learner, improving predictive performance by 5.12% in the area under the precision-recall curve (AUPRC) and 5.48% in the Matthews correlation coefficient (MCC) using only 10% of the training data. Among the AL sampling strategies evaluated, entropy sampling showed competitive performance in selecting informative molecules for model improvement. Overall, our framework achieves an AUPRC of 0.835 ± 0.017 and MCC of 0.817 ± 0.017, on par with a traditional training method despite using only 26.7% of the training data. Compared to a conventional random forest model trained on brute-force, a 100% full training set, our approach shows a 10.6% improvement in AUPRC and modest gains in MCC, confirming the effectiveness of the proposed framework. Under severe class imbalance, balanced accuracy steadily increased across AL iterations, reaching values greater than 0.85 at the final iteration for all uncertainty-driven strategies. Molecular docking confirmed successful prioritization of the top four predicted compounds. Evaluation on an external MAPK1 data set demonstrated generalizability, with our approach achieving an AUPRC of 0.818 and an MCC of 0.403, comparable to the independent test set. These results highlight the potential of combining intelligent data selection with deep learning architectures through the meta-model to accelerate predictive performance in data-scarce drug discovery. Scientific contribution: This study contributes a novel, data-efficient active meta-deep learning framework for predicting MAPK1 inhibitors, addressing the challenge of limited experimental data in a cancer-specific target. By integrating AL with a meta-model composed of four deep architectures, the approach significantly enhances the predictive performance using only a fraction of the training data. The framework achieves superior metrics compared to traditional training methods, highlighting its potential to accelerate drug discovery in data-scarce settings."
PubMed,deep learning,Is wait a hard word for the patient? The impact of waiting time on revisit decisions in patients with respiratory infectious diseases in the post-epidemic era - findings from fever clinics in China.,Wenwen Liu; Wanzheng Zhao,10.1186/s12913-026-14135-8,2026-02-03,BMC health services research,
PubMed,deep learning,Explainable AI for critical care: a systematic review of interpretable models for sepsis and ICU mortality prediction.,V S Athukorala; W M K S Ilmini,10.1186/s12911-026-03344-0,2026-02-03,BMC medical informatics and decision making,
PubMed,deep learning,Machine Learning Models for Predicting Stroke-Associated Pneumonia: A Systematic Review and Meta-Analysis.,Bardia Hajikarimloo; Ibrahim Mohammadzadeh; Salem M Tos; Rana Hashemi; Alireza Khoshrou; Mohammadreza Amjadzadeh; Mandana Dehghan; Saba Aghajan; Ehsan Goudarzi; Dorsa Najari; Azin Ebrahimi; Mohammad Amin Habibi,10.1007/s12028-026-02450-1,2026-02-03,Neurocritical care,"Stroke-associated pneumonia (SAP) is a frequent and severe complication following stroke. Recently, several machine learning (ML) models have been developed to predict SAP. We aimed to evaluate the predictive performance of these models in SAP prediction. We searched PubMed, Embase, Scopus, and Web of Science up to 18 June 2025, for studies developing ML, deep learning (DL), or neural network (NN) models for SAP prediction. The pooled estimates of area under the curve (AUC), accuracy (ACC), sensitivity (SEN), specificity (SPE), and diagnostic odds ratio (DOR) were calculated using the R program. A total of 27 studies were included, with a prevalence of SAP at 18.9%. Most models were ML based (77.8%), and clinical data were the most common input (77.8%). The pooled AUC was 0.84 [95% (CI): 0.80-0.87], and the pooled ACC was 0.80 (95% CI: 0.76-0.84). SEN and SPE were 0.73 (95% CI: 0.63-0.81) and 0.85 (95% CI: 0.77-0.90), respectively. The pooled DOR was 15.4 (95% CI: 10.2-23.3), and the summary receiver operating characteristic (SROC) curve showed an AUC of 0.853 with a false positive rate of 0.153 (95% CI: 0.096-0.235). No significant differences were found between ischemic and hemorrhagic subgroups. ML-based models demonstrated promising performance in predicting SAP and can help physicians through the early identification of high-risk cases. However, further external validation and integration into clinical workflows are required before widespread clinical adoption."
PubMed,deep learning,Deep Learning-based Assessment of Eyelid and Periorbital Parameters: Assisting Diagnosis and Treatment Planning in Blepharoptosis.,Pengjie Chen; Lixia Lou; Shengqiang Shi; Ji Shao; Yiming Sun; Huimin Li; Xuan Zhang; Yilu Cai; Ziying Zhou; Xingru Huang; Juan Ye,10.1007/s10916-026-02339-8,2026-02-04,Journal of medical systems,"Blepharoptosis is a common eyelid disorder that impairs both vision and appearance, requiring accurate assessment for effective treatment. This study aimed to develop and evaluate a deep learning (DL)-based system for automatic measurement of eyelid and periorbital parameters and for classifying levator function (LF) in patients with blepharoptosis. We retrospectively included 1,177 patients who underwent ptosis surgery at a tertiary oculoplastic center from January 2016 to November 2021. LF was categorized into good (> 10 mm), fair (4-10 mm), and poor (≤ 4 mm) based on clinical evaluation. The DL model segmented eyelid and eyebrow regions and measured key parameters; manual measurements were performed for comparison. A multinomial logistic regression model incorporating DL-derived features and demographic data was used to predict LF grades. The DL system achieved high segmentation performance (Dice coefficient = 0.910) and strong agreement with manual measurements (ICC = 0.988 for MRD1; 0.902 for CBH). The regression model classified LF grades with an overall accuracy of 0.760 and an AUC of 0.829, within the range of ophthalmologist assessments (highest clinician accuracy = 0.767). This DL-based system offers an efficient, objective tool for periorbital assessment and LF grading, supporting personalized diagnosis and surgical planning in blepharoptosis management."
PubMed,deep learning,"ECG and PPG Signals-Based Premature Ventricular Contraction Detection Methods: A Review, Key Challenges, and Future Directions.",Shailesh Mohine; Nabasmita Phukan; M Sabarimalai Manikandan; Ram Bilas Pachori,10.1007/s13239-026-00819-z,2026-02-03,Cardiovascular engineering and technology,"Premature ventricular contraction (PVC) is a common cardiac arrhythmia, and its timely and automated detection is crucial for preventing life-threatening cardiovascular events and reducing clinical workload in long-term monitoring. This paper reviews state-of-the-art PVC detection methods based on electrocardiogram (ECG) and photoplethysmogram (PPG) signals, employing signal processing techniques, traditional machine learning, and deep learning approaches. The existing methods are categorized into three groups: threshold-based or heuristic-based techniques, conventional machine learning models, and deep learning frameworks. Additionally, the paper provides an overview of ECG and PPG signal databases and the benchmark metrics used for performance evaluation. Given that most methods utilize R-peak and systolic peak detection during preprocessing, we also review various preprocessing techniques for detecting R-peaks in ECG signals and systolic peaks in PPG signals. Based on the performance and key contributions of existing PVC detection methods, we highlight major challenges and future directions, considering the presence of various noise sources in ECG and PPG signals-particularly under ambulatory and exercise conditions-and the resource constraints of wearable or portable long-term ECG and/or PPG monitoring devices."
PubMed,deep learning,Noninvasive prediction of occult pT3a upstaging in localized ccRCC with radiogenomic insights and prognostic relevance.,Shichao Li; Chuhuai Wang; Feng Li; Mengmeng Gao; Kangwen He; Ziling Zhou; Weinuo Qu; Yaqi Shen; Qian Chu; Shan Wu; Jinrong Qu; Yudong Zhang; Zhen Li,10.1038/s41698-026-01315-2,2026-02-03,NPJ precision oncology,"Occult pathological T3a (pT3a) upstaging in cT1b-T2a clear cell renal cell carcinoma (ccRCC) correlated with poor prognosis and necessitated modifications in surgical planning. However, predicting it preoperatively remains challenging. In this multicenter study involving 1661 patients across five institutions and the KiTS23 dataset, RENALNet, a 3D deep learning framework trained on nephrographic-phase CT, was developed and validated. RENALNet outperformed radiomics models, further enhancing diagnostic accuracy when combined with radiologists of varying experience. Grad-CAM visualizations concentrated on anatomically significant invasion sites, improving interpretability. Risk scores derived from RENALNet were found to correlate with Ki-67 proliferation indices and effectively stratified 5-year progression-free survival, demonstrating both biological and prognostic relevance. Transcriptomic analysis revealed that high RENALNet risk was associated with gene expression signatures enriched in pathways such as epithelial-mesenchymal transition, IL6-JAK-STAT3 signaling, and PI3K-Akt signaling, highlighting its link to tumor aggressiveness. RENALNet thus offers a biologically interpretable framework for risk stratification in ccRCC, supporting surgical decision-making and advancing the integration of radiogenomic deep learning into precision oncology."
PubMed,deep learning,An explainable hybrid CNN-transformer model for sign language recognition on edge devices using adaptive fusion and knowledge distillation.,Ismail Lamaakal; Chaymae Yahyati; Yassine Maleh; Khalid El Makkaoui; Ibrahim Ouahbi,10.1038/s41598-026-38478-8,2026-02-03,Scientific reports,"Despite recent advances in deep learning (DL) for sign language recognition (SLR), most existing systems remain limited to monolingual datasets, lack interpretability, and are too computationally intensive for real-time edge deployment. With the growing need for inclusive and real-time communication technologies, efficient and deployable SLR systems are of critical importance. This paper presents TinyMSLR, an explainable, lightweight framework designed for isolated-sign (gloss) classification on resource-constrained devices. TinyMSLR combines a ConvNeXt-Tiny encoder for fine-grained local visual cues with a Swin Transformer encoder for long-range spatio-temporal context, and integrates an adaptive fusion gate to balance both streams. To further improve accuracy under strict compute and memory budgets, we introduce a dual-teacher knowledge distillation (KD) scheme that transfers complementary spatial and contextual knowledge from high-capacity CNN and Transformer teachers to the compact student model. We evaluate TinyMSLR in a controlled multilingual setting using two public datasets (DGS RWTH-PHOENIX-Weather 2014T and Mandarin CSL) by constructing a shared subset of 20 semantically aligned sign classes and segmenting RWTH continuous sequences into single-gloss clips. Therefore, all reported results correspond to isolated-sign recognition rather than continuous sentence-level multilingual CSLR. On this benchmark, TinyMSLR achieves 99.28% training accuracy and 99.01% validation accuracy, with an F1-score of 98.96%, while keeping the parameter count under 2.7M. Inference latency is 24 ms on standard CPUs and under 13.5 ms on edge GPUs. Overall, TinyMSLR demonstrates a practical accuracy-efficiency-explainability trade-off that is well aligned with deployment-ready multilingual isolated-sign systems on the edge."
PubMed,deep learning,An improved YOLOv11 network for marine debris detection in underwater environment.,Jing Yuanwei; Ding Yijiang; Wang Xuemei; Anis Salwa Mohd Khairuddin,10.1038/s41598-026-38305-0,2026-02-03,Scientific reports,
PubMed,deep learning,Energy-efficient intrusion detection with a protocol-aware transformer-spiking hybrid model.,M Ganesh Karthik; Vijay Keerthika; Srihari Varma Mantena; D Siri; Lakshmi Prasanna Yeluri; Kranthi Kumar Lella; B Rama Ganesh,10.1038/s41598-026-37367-4,2026-02-03,Scientific reports,"Recent intrusion detection studies have achieved high accuracy using deep learning and transformer-based models; however, many approaches suffer from high computational cost, limited energy efficiency, and poor detection of rare attack classes in imbalanced network traffic. To address these challenges, this study proposes a Transformer-Augmented Spiking Neural Network (TASNN) that integrates attention-driven contextual modeling with energy-efficient spiking computation for intrusion detection systems (IDS). The framework incorporates Protocol-Aware Adaptive Normalization (PAAN) and Pseudo-Flow Reconstruction (PFR) to improve robustness to heterogeneous traffic patterns. An adaptive spike encoding strategy, including Multi-Scale Adaptive Spike Encoding (MASE) and Eventified Delta Coding (EDC), converts tabular features into sparse spiking representations. In addition, a Cross-Modal Gating (XMG) mechanism dynamically regulates spiking activity, while Spike-Aware Information Fusion (SAIF) supports stable and interpretable feature selection. Experimental evaluation on benchmark datasets demonstrates that TASNN achieves improved classification performance and reduced computational overhead compared to existing methods, highlighting its suitability for energy-constrained and edge-based intrusion detection scenarios."
PubMed,deep learning,Correction: Detecting mangrove seedlings from UAV imagery using deep learning for restoration monitoring.,Yuri Shendryk; Maria P Vilas,10.1038/s41598-026-37788-1,2026-02-03,Scientific reports,
PubMed,deep learning,Immunochromatographic SERS sensor-deep learning combined strategy for intelligent diagnosis of chronic kidney disease.,Zengshan Yu; Zhibin Zhang; Shan Guo; Zelong Li; Hao Chen; Jichuan Gai; Jiyuan Wei; Shiqi Xu; Mingli Wang; Guochao Shi,10.1007/s00604-026-07862-6,2026-02-03,Mikrochimica acta,"A combined ""immunochromatographic surface-enhanced Raman scattering (SERS) sensor-deep learning"" detection strategy is proposed. Specifically, we first prepared an immunochromatographic SERS sensor with excellent surface enhancement capability for the specific recognition of neutrophil gelatinase-associated lipocalin (NGAL) molecules in serum, significantly enhancing the detection sensitivity of the target molecule. Subsequently, we integrated deep learning algorithms to perform preprocessing, feature extraction, and pattern recognition analysis on complex SERS spectral signals, overcoming the limitations of traditional algorithms in handling high-dimensional nonlinear data. This approach enables rapid, sensitive, and highly specific detection of NGAL. The platform achieves a detection limit as low as 0.1059 ng/mL with a broad linear detection range. For clinical validation, serum samples from 14 volunteers were analyzed. Six deep learning models were employed to classify the acquired clinical spectral data, with the Residual Network (ResNet) model achieving a classification accuracy of 98.81%, a loss value of only 0.0877, and an area under the receiver operating characteristic curve (AUC) of 99.97%. In addition, in the analysis of new samples, the classification and prediction of data from patients and normal individuals were successfully achieved. The proposed ""immunoassay surface-enhanced Raman scattering sensor - deep learning"" combined detection strategy has demonstrated extraordinary potential in the rapid, sensitive and specific detection of NGAL, providing crucial technical support for the intelligent discrimination of chronic kidney disease."
PubMed,deep learning,FHGNet: A Feature-Centric Hierarchical Network with Graph Attention Layer for Supraventricular Tachycardia Classification.,Xiaolin Ju; Tao Liu; Bowen Luo; Heling Cao; Zhan Gao; Haiyan Pan,10.1007/s12539-025-00802-7,2026-02-03,"Interdisciplinary sciences, computational life sciences","Automated electrocardiogram (ECG) classification plays a critical role in arrhythmia diagnosis. However, current deep learning-based methodologies frequently fail to account for physiological rhythms and clinical diagnostic reasoning, thereby compromising their reliability and interpretability. This study proposes a clinically inspired multi-lead oscillatory Transformer framework, named FHGNet, to enhance the precision and interoperability of classifying ventricular tachycardia (VT) and supraventricular tachycardia (SVT). The proposed architecture integrates R-peak detection for heartbeat segmentation and adaptive-length patch extraction with R-wave positional encoding to enhance temporal awareness. It employs a convolutional neural network (CNN) to capture intra-beat morphological features (QRS morphology), a Transformer with FANLayer to model inter-beat rhythmic patterns, and a graph attention network (GAT) to fuse multi-lead dependencies. Additionally, a two-stage classifier is designed to enhance the detection of rare arrhythmia classes. Experimental evaluations on the MIT-BIH Supraventricular Arrhythmia dataset demonstrate FHGNet achieves a macro F1-score of 91.35% outperforming baselines. Ablation studies reveal that removing GAT reduces F1 by 2.42% in multi-lead scenarios, while the two-stage design improves minority class recall by 5.82%. Attention visualization confirms the model focuses on clinically relevant features, such as ST-T segment energy ratios and inter-lead phase differences, aligning with established diagnostic criteria. Additionally, the interpretability of FHGNet is further enhanced by two aspects: 1) Explicit integration of physiological priors (e.g., RR interval variability, intra-beat positional information) in dynamic feature engineering, which enables the model to align with clinicians' rhythm analysis logic; 2) The two-stage classifier strictly follows the clinical diagnostic workflow (first screening abnormalities, then subclassifying), making the decision-making process traceable. This work provides an interpretable, clinically adaptive framework for high-accuracy ECG classification, potentially reducing reliance on invasive electrophysiological studies."
PubMed,deep learning,Deep reinforcement learning for resource allocation and scalable numerology in NR-U enabled multi-RAT HetNets.,Noha A Elmosilhy; Mahmoud M Elmesalawy; Ahmed M Abd El-Haleem; Ibrahim I Ibrahim,10.1038/s41598-026-36539-6,2026-02-03,Scientific reports,
PubMed,deep learning,Detection of Swallowing Abnormalities in Pediatric FEES Recordings Using Rule-Based and Model-Based Methods.,Soolmaz Abbasi; Hisham Al-Kassem; Hamdy El-Hakim; Jacob Jaremko; Abhilash Hareendranathan,10.1007/s10278-026-01845-y,2026-02-03,Journal of imaging informatics in medicine,"Pediatric swallowing dysfunction (SwD) poses serious health risks, including aspiration, malnutrition, and recurrent respiratory infections, making early and accurate diagnosis essential for preventing long-term sequelae such as chronic lung disease and growth failure. Fiberoptic endoscopic evaluation of swallowing (FEES) is widely used for direct visualization of the swallowing mechanism in children, offering advantages over fluoroscopy such as bedside accessibility and radiation-free imaging. During FEES, patients swallow green-dyed liquid with an endoscope positioned in the throat. Interpreting FEES recordings is a subjective, time-consuming process that requires specialized expertise. Automated, objective analysis tools would be useful to support clinical decision-making. In this study, we propose a hybrid framework for classifying pediatric FEES recordings as normal or abnormal. The approach combines a rule-based analysis which detects the green-tinted swallowed liquid, with a transformer-based deep learning model. Frames are first filtered using a Siamese network to exclude irrelevant or low-quality frames, followed by quantification of the green frame ratio based on frames containing green patches. A confidence-guided decision strategy classifies clear-cut cases via thresholding, while delegating uncertain cases to the deep learning model for further evaluation. Evaluation on 142 pediatric FEES videos (45 normal and 97 with abnormalities) showed that the hybrid approach outperformed both the deep learning and rule-based methods individually, achieving 89.4% accuracy, 96.6% precision, and 93.3% specificity for aspiration. Our results indicate that by combining rule-based and deep learning strategies, we could reliably detect swallowing abnormalities from pediatric FEES videos with accuracies comparable to experts."
PubMed,deep learning,A dual-stream deep learning framework for continuous sign language recognition to enhance communication accessibility in the Ha'il region.,Haifa Harrouch; Hanene Guesmi; Hany Alalfy; Maher Jebali,10.1038/s41598-026-38912-x,2026-02-03,Scientific reports,"Human-Computer Interaction (HCI) depends critically on hand gesture recognition, which also provides the basis of sign language communication for those with hearing problems. In automatic sign language identification systems, however, the contribution of non-manual elements like head posture and facial emotions has sometimes been disregarded. In order to fully capture the diversity of sign language modalities and to enhance the quality of life of deaf people in the region of Ha'il, we present in this study a dual-stream convolutional neural network (TS-CNN) that separately models hand motions and head positions. We provide fusion techniques that improve feature correlation and representation in order to guarantee efficient cooperation between the two streams. Moreover, we use a Feature Enhancement Module (FEM) to enhance gloss-level prediction accuracy and fine temporal alignment. Two benchmark datasets, RWTH-PHOENIX-Weather 2014 and CSL Split II, are used to assess the TS-CNN framework and show a notable increase in recognition performance. Competitive Word Error Rates (WER) obtained by TS-CNN from experimental data validate its performance in simulating the complicated multimodal character of continuous sign language recognition."
Crossref,aortic stenosis,Sialography and endoscopy-based classification of salivary duct stenosis,Jing Yang; Xiao-Tong Ling; Dan-Ni Zheng; Xiao-Yun Xu; Liu-Yang Qu; Deng-Gao Liu,10.1016/j.jormas.2026.102734,2026-09,Journal of Stomatology Oral and Maxillofacial Surgery,
Crossref,aortic stenosis,Dual-parameter risk stratification based on device landing zone calcification and aortic annular perimeter for paravalvular regurgitation after self-expanding TAVR,Jun Shu; Didi Wen; Jingji Xu; Yu Mao; Hui Ma; Jing Zhang; Yao Zhao; Jian Yang; Minwen Zheng,10.1016/j.ejro.2025.100719,2026-06,European Journal of Radiology Open,
Crossref,aortic stenosis,"Corrigendum to “Engineering aortic valves via transdifferentiating fibroblasts into valvular endothelial cells without using viruses or iPS cells” [Bioact. Mater. 45 (2025), 181–200]",Peng Tang; Fuxiang Wei; Weihua Qiao; Xing Chen; Chenyang Ji; Wanzhi Yang; Xinyu Zhang; Sihan Chen; Yanyan Wu; Mingxing Jiang; Chenyu Ma; Weiqiang Shen; Qi Dong; Hong Cao; Minghui Xie; Ziwen Cai; Li Xu; Jiawei Shi; Nianguo Dong; Junwei Chen; Ning Wang,10.1016/j.bioactmat.2025.12.014,2026-06,Bioactive Materials,
Crossref,aortic stenosis,Automated measurement of aortic parameters using deep learning and computer vision,Ivan Blekanov; Gleb Kim; Fedor Ezhov; Evgenii Larin; Lev Kovalenko; Anthony Nwohiri; Egor Razumilov,10.1016/j.bspc.2026.109673,2026-06,Biomedical Signal Processing and Control,
Crossref,aortic stenosis,Aortic dissection and opioid use: Two autopsy cases and potential pathological implications,Luca Tomassini; Erika Buratti; Rino Froldi; Roberto Scendoni,10.1016/j.fsir.2026.100456,2026-06,Forensic Science International: Reports,
Crossref,aortic stenosis,Colchicine therapy in transcatheter aortic valve replacement: Modulating inflammation and outcomes,Hamza A. Abdul-Hafez; Ameer Awashra; Malik Ahmad; Abdullah Raed Hawawrah; Bayan Mahafdah; Mohammed AbuBaha; Ibrahim Alazizi; Abdalhakim Shubietah; Mohamed S. Elgendy; Ahmed Emara,10.1016/j.ijcrp.2026.200575,2026-06,International Journal of Cardiology Cardiovascular Risk and Prevention,
Crossref,aortic stenosis,Non-rheumatic calcific aortic valve disease as a global driver of heart failure: Burden and three-decade trends,Lin Zhu; Yanqing Gong; Zijie An; Liumei Mo; Jian Rong; Zhenhao Liu,10.1016/j.hrtlng.2025.102690,2026-05,Heart &amp; Lung,
Crossref,aortic stenosis,Clinical Outcomes of Cuff Anastomosis Combined with Single-Branched Frozen Elephant Trunk for Acute Type A Aortic Dissection,Yuexin Huang; Feng Nong; Mengting Zeng; Qiuying Liao; Rizhu Li; Hua Lu; Xiaoshen Zhang,10.1016/j.avsg.2026.01.005,2026-05,Annals of Vascular Surgery,
