source,keyword,title,authors,doi,publication_date,journal,abstract
OpenAlex,mitral regurgitation,Contemporary Operator Procedural Volumes and Outcomes for TAVR and MTEER in the US,A. Allen Seals; Saket R. Girotra; Huaying Dong; Yang Song; Pratik Manandhar; Ayman Elbadawi; James A. de Lemos; Adnan K. Chhatriwalla; J. Carroll; Ralph G. Brindis; Thomas J. Graetz; Vinod Thourani; Wayne Batchelor; Robert W Yeh; Sreekanth Vemulapalli,10.1001/jamacardio.2025.5645,2026-01-08,JAMA Cardiology,"Importance Recent evidence suggests that hospital-level associations between procedural volume and outcomes for transcatheter aortic valve replacement (TAVR) and mitral transcatheter edge-to-edge repair (MTEER) may be plateauing. Less is known about the operator volumes–outcomes association in the contemporary era. Objective To determine whether an operator-level volume-outcomes association exists for TAVR and MTEER in the contemporary era. Design, Setting, and Participants This cohort study examined data from patients undergoing TAVR or MTEER between January 2020 and December 2023 included in the Society of Thoracic Surgeons (STS)/American College of Cardiology (ACC) Transcatheter Valve Therapies (TVT) Registry, a national all-comers real-world registry. Consecutive patients undergoing TAVR for aortic stenosis or MTEER for mitral regurgitation were included. Data analysis was performed from October 2024 to December 2025. Exposure TAVR or MTEER. Main Outcomes and Measures The primary outcome measures were (1) 30-day all-cause mortality, (2) a 30-day composite outcome, and (3) in-hospital procedural complications following TAVR or MTEER. Data from the STS/ACC TVT Registry were analyzed for patients undergoing TAVR or MTEER between 2020 and 2023. The primary analysis assessed the association between operator volume and 30-day outcomes using a 2-level random-effects logistic regression model. The interaction between operator and hospital volumes and the association between TAVR and MTEER outcomes were also evaluated. Results A total of 358 943 patients underwent TAVR at 827 hospitals (7524 operators; median [IQR] annual volume, 24 [11-47]), and 51 407 patients underwent MTEER at 493 hospitals (2483 operators; median [IQR] annual volume, 12 [7-19]). For TAVR, median (IQR) patient age was 79.0 (73.0-85.0) years, and 152 186 patients (42.4%) were female; for MTEER, median (IQR) patient age was 79.0 (71.0-84.0) years, and 23 402 patients (45.5%) were female. Low-volume operators demonstrated inferior process of care measures compared with high-volume operators. In adjusted analyses, a higher risk of 30-day mortality (odds ratio [OR], 1.13; 95% CI, 1.02-1.26; P = .02) and in-hospital complications (OR, 1.09; 95% CI, 1.03-1.16; P = .005) was observed for low-volume TAVR operators (&amp;amp;lt;15/y) compared with high-volume operators (&amp;amp;gt;37/y). For MTEER, in-hospital complications (OR, 1.31; 95% CI, 1.11-1.56; P = .002) were higher for low-volume operators (&amp;amp;lt;8/y) compared with high-volume operators (&amp;amp;gt;16/y), while 30-day mortality was not different (OR, 1.16; 95% CI, 0.96-1.41; P = .12). Associations were consistent across hospital volume strata. Operator-level outcomes for TAVR and MTEER were not correlated. Conclusions and Relevance In this cohort study, results from a large, contemporary US registry demonstrate a persistent inverse association between operator volume and patient outcomes for both TAVR and MTEER. These findings may help inform future policies aimed at ensuring optimal outcomes."
OpenAlex,mitral regurgitation,Renal resistive index for risk stratification and functional evaluation after transcatheter mitral valve repair: the ReRISE study,Hannah Billig; Sophie Hofmann; Marc Ulrich Becher; Marc Adrian Rogmann; Johanna Vogelhuber; Sebastian Zimmer; Georg Nickenig; Can Öztürk,10.1007/s00392-025-02841-y,2026-01-08,Clinical Research in Cardiology,"Abstract Background The renal resistive index (RRI) is increasingly used as a non-invasive marker of cardiorenal interaction. We aimed to determine (i) whether baseline RRI predicts survival after mitral transcatheter edge-to-edge repair (M-TEER) and (ii) whether RRI changes in response to the procedure. Methods In this prospective, single-center cohort we enrolled consecutive patients with severe mitral regurgitation who underwent M-TEER between October 2020 and December 2021 (trial registration number 412/20, date of registration 02.09.2020). Baseline demographics, estimated laboratory parameters, comprehensive echocardiography, and Doppler-derived RRI were collected before and 3 months after intervention. The primary endpoint was all-cause mortality. Associations were analyzed with multivariable Cox regression. Renal endpoints were not systematically collected and were therefore not included as clinical outcome measures. Results Among 109 patients (53.2% women), the median baseline RRI was 0.71 (IQR 0.67–0.75) and showed no correlation with eGFR, left-ventricular ejection fraction, or echocardiographic measurements of mitral regurgitation at baseline. Higher RRI was associated with all-cause mortality, and in exploratory post hoc analyses an RRI cutoff &gt; 0.70 remained predictive independent of baseline renal function (HR 5.37, p 0.07). RRI improved significantly 3 months after M-TEER (0.67; IQR 0.63–0.70; p &lt; 0.001), particularly in patients with a post-procedural MR reduction of at least 1 grade. However, the change in RRI showed no correlation with mortality or changes in renal function. Conclusions A baseline RRI above 0.70 was independently associated with mortality following M–TEER, underscoring its potential prognostic relevance. The marked post-procedural decline in RRI, especially in patients with relevant MR improvement, suggests that RRI reflects hemodynamic rather than renal filtration changes. Given the limited sample size and number of events, these findings should be considered exploratory and hypothesis-generating, requiring validation in larger multicenter cohorts. Graphical Abstract"
OpenAlex,mitral regurgitation,Paroxysmal hypotension and hypoxemia caused by severe dynamic secondary mitral and tricuspid regurgitation after acute myocardial infarction,Weiya Li; Si Liang Wang; Yujia Liang; Xin Wei; Mao Chen,10.1093/eschf/xvaf014,2026-01-08,ESC Heart Failure,"Abstract A 57-year-old male patient developed paroxysmal hypotension and hypoxemia during endotracheal extubation post-acute myocardial infarction revascularization. The underlying cause was severe dynamic mitral regurgitation (MR) and secondary tricuspid regurgitation (TR). After successful extubation and weaning, the patient’s MR nearly resolved. Discharged in improved condition with guideline-directed medical therapy, the patient was soon readmitted for heart failure with pulmonary edema. The transthoracic echocardiogram confirmed recurrent, worsening MR.​ Transcatheter edge-to-edge repair was successfully performed, reducing the patient’s severe MR to trivial and resolving TR completely. At 1-year follow-up, the patient remained stable with improved cardiac function and no readmissions for cardiac causes."
OpenAlex,mitral regurgitation,Outcomes of edge-to-edge mitral valve repair in patients with mitral regurgitation evaluated for heart transplantation,Flavia Di Cosmo; Lucas Barreiro Mesa; Mart�n Ruiz Ortiz; Cristina Urbano S�nchez; and Manuel Pan �lvarez-Ossorio; Dolores Mesa Rubio,10.24875/recice.m25000554,2026-01-07,REC interventional cardiology (English Edition),
OpenAlex,mitral regurgitation,Patch exclusion of caseating annular calcification cavity in the atrioventricular groove during mitral valve replacement,Salvatore Poddi; Shinya Unai; Gosta Pettersson; Haytham Elgharably,10.1510/mmcts.2025.126,2026-01-07,Multimedia Manual of Cardio-Thoracic Surgery,"Caseous liquefaction is a rare variant of mitral annular calcification that can lead to cavity formation in the atrioventricular groove. We report a case of mitral valve replacement in a 76-year-old woman with a large caseous cavity, coronary artery disease, severe mitral valve stenosis and atrial fibrillation. Preoperative computed tomography showed a large caseous cavity (3 x 3.5 cm) in the posterior annulus extending into the atrioventricular groove. After unroofing and evacuation, the cavity was excluded with a pericardial patch. The lower edge of the patch was sutured to the ventricular side of the cavity; valve sutures passed through the residual posterior leaflet, the upper edge of the patch and the atrial edge of the cavity. The mitral prosthesis was then secured. The patient was weaned from cardiopulmonary bypass without complications. Intraoperative echocardiography demonstrated a well-seated mitral prosthesis with no valvular or paravalvular leaks. Postoperative imaging confirmed successful exclusion of the cavity in the atrioventricular groove. The postoperative echocardiogram revealed a mean gradient of 4 mmHg across the mitral prosthesis and no mitral regurgitation. Patch exclusion of the caseous cavity is a safe and feasible approach to support implanting a mitral prosthesis and obliterating a cavity."
OpenAlex,mitral regurgitation,Comparing Transcatheter Edge-to-Edge Repair (TEER) to Surgical Approaches for Patients with Secondary Mitral Regurgitation,Iain Slater; Jordan Maddra,,2026-01-06,JMU Scholoraly Commons (James Madison University),Comparing Transcatheter edge-to-edge repair to surgical approaches for secondary mitral regurgitation
OpenAlex,mitral regurgitation,Automatic Morphological Evaluation Using Three-Dimensional Transeophageal Echocardiography of Patients with Mitral Prolapse and Insufficiency: Comparison with Patients Without Cardiac Chambers Alterations,Marcelo L C Vieira; Ana C T Rodrigues; Edgar Daminelo; A. Reche; Gustavo P Almeida; Alessandra J Oliveira; Luiz O A Santos; Rafael Bonafim Piveta; Rodrigo A. C. Meirelles; Claudia Monaco; Fernando C Oliveira; Fernando A Solis; Wercules Oliveira; Alessandro C Lianza; Adriana Sañudo; Edgar B Lira Filho; Sérgio A F Curcio; Robinson Poffo; Cláudio Henrique Fischer; Samira S Morhy,10.20944/preprints202601.0344.v1,2026-01-06,Preprints.org,"Background: There is paucity of information concerning automatic mitral valve apparatus analysis of patients with mitral valve prolapse (MVP). Objectives: We aimed to study with an automatic three-dimensional transesophageal echocardiography (TEE) dedicated software patients with moderate and severe mitral regurgitation when compared to patients with no structural cardiac chamber alterations (patients with patent foramen ovale (PFO) who underwent TEE) . Methods: We employed a TEE software dedicated to automatic analysis of 34 parameters of the mitral valve apparatus comparing MVP patients with moderate and severe mitral regurgitation and patients with PFO without cardiac chamber structural alterations. Mitral valve effective regurgitant orifice (ERO) and regurgitant volume were correlated to automatic MVP parameters. Results: 59 MVP patients and 43 PFO patients were analysed. All MVP patients presented P2 mitral valve prolapse, 15 (25.4 % ) with both posterior and anterior prolapse. Twenty-seven automatic parameters (79%) were different concerning MVP and PFO patients (p&amp;lt; 0.05): diameters, area, perimeter, height, angle, coaptation width, lenght, closure line lenght, annulus. ERO was 0.43 + 0.11 cm2 , and regurgitant volume: 62.2 + 14.9 ml/beat. Automatic analysis correlated to 75 percentile ERO MVP patients (ERO&amp;gt; 0.48 cm2): Posterior Leafltet Area (r:0.74, p:0.031); Posterior Leafltet Lenght (r:0.73, p:0.032); Tenting area (r:0,41, p:0.048). Conclusions: Automatic mitral valve parameters analysis were different concerning MVP and no structural cardiac chamber (PFO) patients. 75 percentile ERO MVP patients (ERO&amp;gt; 0.48 cm2) correlated to posterior leaflet parameters.This anatomic information could be useful to planning and surgical treatment of mitral valve prolapse patients."
OpenAlex,mitral regurgitation,Early and intermediate outcomes of cavitron ultrasonic surgical aspiration to treat mitral annular calcification,Wendy Jin; Sabet W Hashim; R H G McKay; Jeff Mather; Susan Collazo; David W. Yaffee,10.1093/ejcts/ezag016,2026-01-06,European Journal of Cardio-Thoracic Surgery,"Abstract OBJECTIVES Severe mitral annular calcification (MAC) carries an increased risk of perioperative complications in patients undergoing mitral valve surgery and may be considered a prohibitive surgical risk. Cavitron ultrasonic surgical aspiration (CUSA) has been reported as a method for controlled debridement of severe MAC during mitral valve surgery, however experience in the literature is limited. METHODS We assessed 30-day and intermediate-term outcomes in 67 consecutive patients (mean age: 72 (SD 9) years; female sex: 65.7% (44/67)) with severe MAC who underwent mitral valve repair or replacement for mitral stenosis and/or regurgitation using CUSA between 3/2021 and 12/2024. Operations included isolated mitral valve replacement (41.8% (28/67)), isolated mitral valve repair (4.5% (3/67)), mitral and aortic valve replacement (37.3% (25/67), mitral valve replacement with coronary bypass (6.0% (4/67)), and mitral and aortic valve replacement with coronary bypass (10.4% (7/67)). Intermediate survival was estimated using the Kaplan–Meier method. RESULTS Mortality rate was 6.0% (4/67), stroke was 3.0% (2/67), and new postoperative atrial fibrillation was 29.0% (20/67). There were no atrioventricular groove ruptures. At a median echocardiographic follow-up time of 361 days (IQR 112, 671) moderate paravalvular leak occurred in 3.0% (1/67). Mid-term all-cause mortality was 9.0% at a mean follow-up time of 42.5 (95% CI 39.0, 46.0) months. CONCLUSIONS The use of CUSA to debride severe mitral annular calcification in patients undergoing mitral valve surgery is associated with acceptable short-term morbidity and mortality and durable intermediate-term results. This technique allows surgical intervention in patients who may otherwise be deemed prohibitive surgical risk."
OpenAlex,mitral regurgitation,Comparative study of transcatheter aortic valve implantation versus conventional surgical aortic valve replacement in the treatment of severe aortic stenosis with reverse ventricular remodeling,Haoyan Li; Sumin Yang; Wenlong Yan; Xiaodong Chen; Xun Chi,10.3389/fcvm.2025.1712400,2026-01-06,Frontiers in Cardiovascular Medicine,"Introduction This study aimed to compare echocardiographic outcomes and analyze the changes in ventricular remodeling at different time points after surgery in patients with severe aortic stenosis (AS) undergoing either surgical aortic valve replacement (SAVR) or transcatheter aortic valve replacement (TAVR). Methods This retrospective study consecutively enrolled 175 patients with severe AS who underwent either SAVR or TAVR. Transthoracic echocardiograms obtained at baseline, 30 days, and 1 year after the procedure were analyzed by multiple echocardiographers at our institution. Results At baseline, the TAVR group was significantly older (74 ± 7 years vs. 62 ± 9 years, p &amp;lt; 0.001) and had a higher prevalence of hypertension (53.5% vs. 31.0%, p = 0.003), coronary artery disease (38.4% vs. 23.0%, p = 0.028), and atrial fibrillation (16.3% vs. 2.3%, p = 0.002). Additionally, the TAVR cohort demonstrated significantly worse cardiac functional status ( p &amp;lt; 0.001). Compared to TAVR patients, SAVR patients ( N = 87) exhibited a more pronounced reduction in left ventricular end-systolic dimension (−0.5 ± 0.65 cm vs. −0.2 ± 0.47 cm, p &amp;lt; 0.001) and left ventricular end-diastolic dimension (−0.6 ± 0.64 cm vs. −0.3 ± 0.55 cm, p &amp;lt; 0.001) at the 1-month follow-up. A decrease in left ventricular mass was observed in both groups from baseline to 1 month postoperatively, with the SAVR group showing a significantly greater reduction (LV mass: −67.3 ± 59.31 g vs. −38.2 ± 46.49 g, p = 0.003; LVMI: −39.1 ± 33.93 g/m 2 vs. −22.5 ± 27.08 g/m 2 , p = 0.005). However, these differences were not sustained at the 1-year follow-up. SAVR patients experienced a transient decline in right ventricular function at 1 month, which recovered by 1 year postoperatively. At the 1-year follow-up, the TAVR group experienced a higher incidence of Major Adverse Cardiac Events (MACE) ( p = 0.01), despite showing significant improvement in the severity of both mitral and tricuspid regurgitation compared to baseline ( p &amp;lt; 0.001). Although pulmonary artery pressure improved in both groups after AVR, the SAVR group demonstrated significantly lower pressure at 1 year ( p &amp;lt; 0.001). Conclusion In patients with severe aortic stenosis, SAVR was associated with more significant regression of left ventricular dimensions and mass at 1 month compared to TAVR, alongside a transient impairment of right ventricular function. By 1 year postoperatively, however, no significant differences in ventricular remodeling were observed between the two groups."
OpenAlex,mitral regurgitation,Extreme Clinico-Echocardiographic Discordance in End-Stage Degenerative Mitral Regurgitation: A Fatal Case of Silent Ventricular Burn-Out,O. Taoussi; M. Zoubidi; M. Mokhtari; Ghali Benouna; F. Merzouk,10.12691/ajmcr-14-1-1,2026-01-05,American Journal of Medical Case Reports,
OpenAlex,mitral regurgitation,Intraoperative Discovery of Bioprosthetic Mitral Valve Thrombus on TEE During HeartMate 3 Implantation: Implications for Anesthetic Management and Surgical Planning,Jenny Huang; Lida Shaygan,10.1177/10892532251414559,2026-01-05,Seminars in Cardiothoracic and Vascular Anesthesia,"We present the case of a 73-year-old female with chemotherapy-induced cardiomyopathy, severe mitral regurgitation status post bioprosthetic mitral valve (MV) replacement one year prior, and atrial fibrillation, admitted for evaluation for left ventricular assist device (LVAD) implantation. While her preoperative transthoracic echocardiogram (TTE) did not reveal a discrete mass, it showed a mean mitral gradient of 7 mmHg; intraoperative transesophageal echocardiography (TEE) identified a 2 cm × 1.2 cm thrombus on the bioprosthetic MV. Given these findings, the surgical team decided to replace the mitral valve concurrently with LVAD implantation. Although this approach is not routine, the goal was to improve her quality of life and reduce postoperative complications. Post-procedure TEE showed an improved MV mean gradient of 3 mmHg with no evidence of paravalvular leak. The patient was subsequently discharged home in stable condition without any thromboembolic events. This case highlights the challenges of managing complex valvular pathology in patients undergoing LVAD placement."
OpenAlex,mitral regurgitation,Study of the energy efficiency of various drive systems of an innovative implantable left ventricular assist device,Ryszard Jasiński; K. Tesch; Leszek Dąbrowski; Jan Rogowski,10.1038/s41598-025-34855-x,2026-01-05,Scientific Reports,"This paper presents the results of studies of the energy efficiency of an innovative implantable left ventricular assist device. One of the advantages of the proposed LVAD is in cases where end-stage left ventricular failure is accompanied by mitral valve regurgitation and pulmonary hypertension. Another advantage is minimally invasive implantation with minimal thoracic trauma, without disrupting the breathing process, which shortens the length of hospital stay. The best drive system for converting the rotary motion of the servo motor into reciprocating motion of the piston of the suction-discharge device was chosen. Two types of drive were considered, namely a yoke mechanism and a crank mechanism that were evaluated in terms of energy efficiency of the entire device. One of the most important conclusions is that both mechanisms have comparable operating parameters for balloon inflation and similar electrical energy consumption which amounts to comparable operating times for these mechanisms. However, the energy consumption of the yoke mechanism is slightly higher. At the same time the pressure in the left ventricle and aorta is slightly lower in comparison with a yoke mechanism. Furthermore, the results of the study also showed that the balloon pressures were significantly higher with crank drive, which may cause the balloons to wear out more quickly. The mass flow rates generated by both drives are similar with a slight advantage for the yoke mechanism. Finally, typical aortic, atrial and left ventricular pressure plots during the cardiac cycle are also shown."
OpenAlex,mitral regurgitation,A COMPREHENSIVE APPROACH TO CORONARY ARTERY DISEASE (HRIDROG): EVIDENCE FROM AN AYURVEDIC CASE STUDY,"Acharya Manish1, Dr. Gitika Chaudhary*2, Dr. Richa3, Dr. Mohit Gautam4, Dr. Tanu Rani5, Prabha Chandrasekharan6",10.5281/zenodo.18151203,2026-01-05,Zenodo (CERN European Organization for Nuclear Research),"Coronary artery disease (CAD) or Hridrog and hypertension (HTN) are closely linked, with hypertension being a major risk factor for the development and progression of CAD. This relationship involves mechanisms like endothelial dysfunction, arterial stiffness, and accelerated atherosclerosis, which contribute to impaired coronary perfusion and increased cardiovascular risk. Various studies have highlighted the high prevalence of CAD among hypertensive patients and the role of blood pressure management in reducing cardiovascular events. Ayurveda offers a holistic approach, focusing on doshic balance, detoxification, and lifestyle interventions to manage CAD and HTN. A case study was conducted at Jeena Sikho Lifecare Limited Clinic, Guwahati, involving a 46-year-old female diagnosed with CAD. The patient presented with symptoms of breathlessness, bradycardia, chest tightness, and weakness. After receiving Ayurvedic treatment, significant improvements were noted. Coronary angiography revealed severe CAD with Triple Vessel Disease, but follow-up echocardiography indicated stable left ventricular function, with no worsening of mitral regurgitation or development of new symptoms. The patient’s condition stabilized with preserved heart function, highlighting the efficacy of integrating Ayurvedic therapies alongside conventional treatment for CAD management. This case study underscores the potential of Ayurveda in managing CAD, improving symptoms, and promoting overall health. Holistic Ayurvedic therapies, including dietary adjustments, lifestyle modifications, and Ayurvedic interventions, appear to offer significant benefits in conjunction with standard medical care for cardiovascular diseases."
OpenAlex,mitral regurgitation,A COMPREHENSIVE APPROACH TO CORONARY ARTERY DISEASE (HRIDROG): EVIDENCE FROM AN AYURVEDIC CASE STUDY,"Acharya Manish1, Dr. Gitika Chaudhary*2, Dr. Richa3, Dr. Mohit Gautam4, Dr. Tanu Rani5, Prabha Chandrasekharan6",10.5281/zenodo.18151204,2026-01-05,Zenodo (CERN European Organization for Nuclear Research),"Coronary artery disease (CAD) or Hridrog and hypertension (HTN) are closely linked, with hypertension being a major risk factor for the development and progression of CAD. This relationship involves mechanisms like endothelial dysfunction, arterial stiffness, and accelerated atherosclerosis, which contribute to impaired coronary perfusion and increased cardiovascular risk. Various studies have highlighted the high prevalence of CAD among hypertensive patients and the role of blood pressure management in reducing cardiovascular events. Ayurveda offers a holistic approach, focusing on doshic balance, detoxification, and lifestyle interventions to manage CAD and HTN. A case study was conducted at Jeena Sikho Lifecare Limited Clinic, Guwahati, involving a 46-year-old female diagnosed with CAD. The patient presented with symptoms of breathlessness, bradycardia, chest tightness, and weakness. After receiving Ayurvedic treatment, significant improvements were noted. Coronary angiography revealed severe CAD with Triple Vessel Disease, but follow-up echocardiography indicated stable left ventricular function, with no worsening of mitral regurgitation or development of new symptoms. The patient’s condition stabilized with preserved heart function, highlighting the efficacy of integrating Ayurvedic therapies alongside conventional treatment for CAD management. This case study underscores the potential of Ayurveda in managing CAD, improving symptoms, and promoting overall health. Holistic Ayurvedic therapies, including dietary adjustments, lifestyle modifications, and Ayurvedic interventions, appear to offer significant benefits in conjunction with standard medical care for cardiovascular diseases."
