source,keyword,title,authors,doi,publication_date,journal,abstract
OpenAlex,deep learning,Unsupervised Deep-learning Methods for Low-dose Computed Tomography Reconstruction,Ran An,10.17638/03194237,2027-01-01,University of Liverpool,"Computed tomography (CT) has become an indispensable imaging technique in medical diagnostics and industrial applications, owing to its non-invasive nature and high resolution in visualizing object internal structures. While X-ray CT (X-ray computed tomography) significantly enhances lesion detection capabilities, excessive exposure to X-ray radiation raises substantial health concerns, including elevated cancer risks and potential genetic damage. Although low-dose CT (LDCT) protocols reduce radiation safety concerns, they inevitably introduce severe noise and artifacts, which might compromise diagnostic accuracy. Recent advances in supervised deep learning approaches have demonstrated remarkable success in LDCT reconstruction. However, the reliance on paired training data severely limits their deployment in practical CT applications. This fundamental constraint highlights the critical importance of developing unsupervised reconstruction methods. Although existing unsupervised LDCT methods have made notable progress, they still face challenges requiring systematic solutions. This thesis makes three contributions to advance the field of unsupervised LDCT reconstruction: 1. Current dual-domain self-supervised LDCT denoising methods typically neglect the heterogeneity of the non-stationary Gaussian noise levels in low-dose sinograms and usually treat them as common images without appropriately controlling the denoising strength. The denoisers employed by them, which are based on classic convolutional neural networks (CNN), will lead to blurring artifacts in the reconstructed images if directly used for sinogram denoising. In addition, the denoising strength in the sinogram and image domains must be well-balanced to avoid introducing over-blurring or secondary artifacts in the reconstructed images, but existing approaches do not focus on this crucial point. To address these limitations, this thesis proposes a novel end-to-end dual-domain self-supervised framework for LDCT denoising. It employs Dropblock layers to adaptively localize the effect of convolution for sinogram denoising and sets a weighted average between the denoised sinograms and their noisy counterparts to better control the denoising strength, thus effectively reducing the blurring artifacts and leading to a well-balanced dual-domain denoising. Numerical experiments demonstrate the effectiveness and superior performance of the proposed method. 2. Existing normalizing flows (NFs)-based unsupervised LDCT reconstruction methods face challenges in both image quality and computational efficiency. On one hand, they typically utilize a two-way transformation strategy between noisy images and latent variables, which could easily lead to detail loss and secondary artifacts in the reconstructed images. On the other hand, training NFs on high-resolution CT images is computationally intensive. Although conditional normalizing flows (CNFs) can mitigate computational costs by learning conditional probabilities, existing approaches rely on labeled data for conditionalization, leaving unsupervised CNFs-based LDCT reconstruction a challenge. To tackle these issues, this thesis proposes a novel unsupervised LDCT iterative reconstruction algorithm based on CNFs. The proposed method employs a strict one-way transformation strategy during the alternating optimization in the dual spaces to prevent detail loss and secondary artifacts, and proposes a novel unsupervised conditionalization strategy for CNFs, thus achieving efficient training and inference on high-resolution images. The proposed method illustrates high-quality and relatively fast unsupervised reconstruction. Experiments across two datasets demonstrate the superior performance of the proposed method by rivaling several state-of-the-art methods. 3. Current diffusion model-based LDCT reconstruction methods solely employ the prior distributions learned from normal-dose CT data but neglect the valuable priors in low-dose data, which contain information about the characteristics of low-dose noise and artifacts. In addition, their reconstruction speed suffers from multiple sampling steps, presenting low efficiency. Breaking new ground in prior utilization, this thesis proposes a novel unsupervised LDCT iterative reconstruction algorithm based on dual denoising diffusion probabilistic models (DDPM), which leverages both normal-dose and low-dose priors. Specifically, the proposed method employs two DDPMs to learn the prior distributions from normal-dose and low-dose images, respectively, and incorporates them into a joint iterative reconstruction framework. To accelerate the reconstruction, partial diffusion sampling and single-pass deterministic reconstruction strategy are utilized in the proposed method, as well as the spaced OS-SART approaches. Experiments at different dose levels demonstrate the outstanding performance and fast speed of the proposed reconstruction algorithm. Through these innovations and contributions, this thesis addresses some significant challenges in current deep-learning-based unsupervised LDCT reconstruction methods, and proposes three novel unsupervised reconstruction algorithms. The proposed methods effectively improve the performance and efficiency of LDCT reconstruction under different unsupervised learning conditions, and provide some new perspectives and inspirations for future research."
OpenAlex,deep learning,From Sparse to Dense: Label-Efficient Weakly Supervised Segmentation for Images and Videos,Jian Wang,10.17638/03195330,2027-01-01,University of Liverpool,"Obtaining high-quality annotated data has become a primary bottleneck for training deep learning models, particularly for dense prediction tasks like semantic segmentation and video salient object segmentation. The demand for meticulous, pixel-level labeling makes fully-supervised approaches prohibitively expensive and limits their scalability. This thesis directly confronts this issue by proposing and systematically investigating a label-efficient ""sparse-to-dense'' paradigm. The core objective is to develop innovative frameworks that can learn from sparse, inexpensive weak supervision—such as image-level tags or scribbles—and intelligently propagate this minimal information to generate complete, pixel-accurate dense predictions. The major part of this thesis focuses on the ""sparse-to-dense'' challenge within Weakly Supervised Semantic Segmentation (WSSS) for images, where models learn from only image-level tags. Dominant approaches rely on Class Activation Maps (CAMs) as initial object seeds. However, CAMs inherently activate only the most discriminative object regions, leading to incomplete pseudo-labels. This gives rise to the central problem of activation densification: the critical process of expanding these sparse activations to cover the full extent of an object. Our research addresses this challenge through a progressive, multi-faceted strategy. Our exploration begins with a foundational framework (C3) designed to rectify the intrinsic flaws of initial CAMs. We propose a synergistic mutual calibration method. This method leverages the discrepancies between the two maps to generate local prototypes, which are simultaneously utilized to complete missing object parts and suppress background noise, yielding a significantly more accurate and complete initial seed. This foundational work immediately reveals the limitation of single-prototype instability and its inability to capture diverse features. Building on this foundation, we then develop architecture-specific strategies to address deeper limitations of the prototype-based approach. For Convolutional Neural Networks (CNNs) (C4), the use of a single prototype proves insufficient to capture significant intra-class variation. In response, we introduce an Optimal Transport (OT)-assisted framework that effectively mines multiple, diverse prototypes, thereby yielding more comprehensive activation maps. However, while C4 solves the intra-class diversity problem, the inherent local context constraint of the CNN architecture becomes the new bottleneck, fundamentally limiting the quality of globally-aware feature extraction needed for optimal multi-prototype assignment. This limitation necessitates a shift in architectural focus from CNNs to Vision Transformers. In the ViT architecture (C5), a new challenge arises where the token gap between the discriminative class token and varied patch tokens leads to incomplete activation. To bridge this gap, we leverage a tailored application of Optimal Transport, where the algorithm is tasked with learning a comprehensive proxy to ensure complete object activation. Despite these architectural advances (C3-C5), the overall WSSS performance hit a ceiling. This is fundamentally limited by the sparse supervision of class labels, which cannot provide precise boundary information. To break this ceiling, our WSSS exploration culminates in a universal enhancement strategy (C6) that transcends architecture-specific designs by leveraging Visual Foundation Models (VFMs). We resolve the conflict between the discriminative nature of initial CAMs and the VFM's need for holistic prompts. By modeling the CAM foreground as a graph and employing spectral analysis, our method intelligently selects a diverse set of prompt points that represent the overall structure of the foreground object. This guides the VFM to generate superior, boundary-aware supervision that can universally enhance any WSSS pipeline. Subsequently, the thesis extends the ""sparse-to-dense'' paradigm to the dynamic domain of video, addressing Weakly Supervised Video Salient Object Segmentation (WSVSOS) (C7) from sparse scribble annotations. In this specific context, the challenge evolves into spatio-temporal densification, which requires both full-object coverage within each frame and temporal consistency across the video sequences. To this end, we introduce the core CFMR framework, which utilizes Spatio-Temporal co-regulation. This framework is subsequently enhanced (CFMR+) by integrating the VFM guidance strategy from C6, which provides high-quality spatial priors essential for ensuring both high spatial detail and inter-frame consistency. By enforcing both intra-frame and cross-frame consistency between these two streams, our method effectively propagates the sparse initial signal to generate dense and temporally coherent saliency masks. In conclusion, this thesis presents a comprehensive and cohesive investigation into label-efficient segmentation tasks, offering a suite of innovative and effective strategies for the ""sparse-to-dense'' challenge. Our work establishes a progressive roadmap that systematically overcomes architectural and semantic limitations, culminating in highly robust and generalized densification pipelines. Our extensive experimental results on standard benchmarks validate the state-of-the-art performance of these methods, providing robust solutions to a long-standing problem in the computer vision field."
OpenAlex,deep learning,Identification of Meat Contamination using Deep Learning,Annual Methodological Archive Research Review,10.5281/zenodo.18130810,2026-12-31,Zenodo (CERN European Organization for Nuclear Research),
OpenAlex,deep learning,Identification of Meat Contamination using Deep Learning,Annual Methodological Archive Research Review,10.5281/zenodo.18130809,2026-12-31,Zenodo (CERN European Organization for Nuclear Research),
OpenAlex,deep learning,ANALISIS KEEFEKTIFAN LINGKUNGAN BELAJAR DEEP LEARNING TERHADAP KEMAMPUAN LITERASI EKONOMI SISWA SMA NEGERI 3 KOTA TERNATE,Marlen Tjiwili; Ode Zulaeha; Jufita Umalekhoa,10.5281/zenodo.18415747,2026-12-27,Zenodo (CERN European Organization for Nuclear Research),"Kemampuan literasi ekonomi merupakan aspek penting dalam pembelajaran ekonomi karena berkaitan dengan kemampuan siswa dalam memahami konsep ekonomi, berpikir logis, membuat keputusan rasional, serta mampu menerapkan pengetahuan ekonomi dalam kehidupan sehari-hari. Namun, kenyataannya banyak siswa yang masih mengalami kesulitan dalam menghubungkan teori dengan praktik ekonomi yang nyata. Hal ini disebabkan oleh pendekatan pembelajaran yang masih berpusat pada guru dan bersifat hafalan, sehingga kurang memberikan ruang bagi siswa untuk berpikir kritis dan mendalam. Oleh karena itu, diperlukan inovasi dalam lingkungan belajar yang dapat menumbuhkan pemahaman konseptual serta kemampuan berpikir tingkat tinggi.Penelitian ini bertujuan untuk menganalisis keefektifan lingkungan belajar berbasis deep learning terhadap peningkatan kemampuan literasi ekonomi siswa SMA negeri 3 kota ternate. Metode penelitian yang digunakan adalah kuasi-eksperimen dengan desain pretest-posttest control group. Subjek penelitian adalah siswa kelas XI IPS SMA negeri 3 Kota Ternate, dengan pembagian dua kelompok: eksperimen dan kontrol. Kelompok eksperimen mengikuti pembelajaran dengan pendekatan deep learning, sedangkan kelompok kontrol menggunakan metode konvensional. Data dikumpulkan melalui tes literasi ekonomi dan observasi proses pembelajaran. Hasil analisis menunjukkan adanya peningkatan signifikan pada skor literasi ekonomi siswa di kelompok eksperimen. Siswa yang belajar dalam lingkungan deep learning menunjukkan kemampuan yang lebih tinggi dalam memahami konsep ekonomi, menganalisis isu, serta mengaitkan materi dengan realitas sosial dan ekonomi. Penerapan lingkungan belajar deep learning terbukti efektif dalam meningkatkan literasi ekonomi siswa SMA negeri 3 kota ternate. Model ini dapat menjadi alternatif yang relevan untuk meningkatkan kualitas pembelajaran ekonomi agar lebih kontekstual, partisipatif, dan berorientasi pada pengembangan pemahaman mendalam."
OpenAlex,deep learning,ANALISIS KEEFEKTIFAN LINGKUNGAN BELAJAR DEEP LEARNING TERHADAP KEMAMPUAN LITERASI EKONOMI SISWA SMA NEGERI 3 KOTA TERNATE,Marlen Tjiwili; Ode Zulaeha; Jufita Umalekhoa,10.5281/zenodo.18415748,2026-12-27,Zenodo (CERN European Organization for Nuclear Research),"Kemampuan literasi ekonomi merupakan aspek penting dalam pembelajaran ekonomi karena berkaitan dengan kemampuan siswa dalam memahami konsep ekonomi, berpikir logis, membuat keputusan rasional, serta mampu menerapkan pengetahuan ekonomi dalam kehidupan sehari-hari. Namun, kenyataannya banyak siswa yang masih mengalami kesulitan dalam menghubungkan teori dengan praktik ekonomi yang nyata. Hal ini disebabkan oleh pendekatan pembelajaran yang masih berpusat pada guru dan bersifat hafalan, sehingga kurang memberikan ruang bagi siswa untuk berpikir kritis dan mendalam. Oleh karena itu, diperlukan inovasi dalam lingkungan belajar yang dapat menumbuhkan pemahaman konseptual serta kemampuan berpikir tingkat tinggi.Penelitian ini bertujuan untuk menganalisis keefektifan lingkungan belajar berbasis deep learning terhadap peningkatan kemampuan literasi ekonomi siswa SMA negeri 3 kota ternate. Metode penelitian yang digunakan adalah kuasi-eksperimen dengan desain pretest-posttest control group. Subjek penelitian adalah siswa kelas XI IPS SMA negeri 3 Kota Ternate, dengan pembagian dua kelompok: eksperimen dan kontrol. Kelompok eksperimen mengikuti pembelajaran dengan pendekatan deep learning, sedangkan kelompok kontrol menggunakan metode konvensional. Data dikumpulkan melalui tes literasi ekonomi dan observasi proses pembelajaran. Hasil analisis menunjukkan adanya peningkatan signifikan pada skor literasi ekonomi siswa di kelompok eksperimen. Siswa yang belajar dalam lingkungan deep learning menunjukkan kemampuan yang lebih tinggi dalam memahami konsep ekonomi, menganalisis isu, serta mengaitkan materi dengan realitas sosial dan ekonomi. Penerapan lingkungan belajar deep learning terbukti efektif dalam meningkatkan literasi ekonomi siswa SMA negeri 3 kota ternate. Model ini dapat menjadi alternatif yang relevan untuk meningkatkan kualitas pembelajaran ekonomi agar lebih kontekstual, partisipatif, dan berorientasi pada pengembangan pemahaman mendalam."
OpenAlex,deep learning,Sentiment Analysis Performance of Lora-Enhanced Llm's,Tunahan TİMUÇİN,10.5281/zenodo.18418626,2026-12-11,Zenodo (CERN European Organization for Nuclear Research),"On social media platforms, the increase in the number of users and the resulting increase in thedata produced by users have accelerated the prominence of some technologies. The most well-known of these areas is Natural Language Processing (NLP), where sentiment analysis of usercontent is performed. Sentiment analysis is mostly applied to short texts. In this study,experimental comparisons of large language models (LLMs), known deep learning and machinelearning algorithms are made using a dataset containing content from Twitter (X) users. Inaddition to this comparison, the LoRA (Low-Rank Adaption) strategy was applied to theDistilBERT model, one of the transformer-based large language models that forms the basis ofthe study, and the success of this fine-tuning method, which is lower cost and parameterefficient, was demonstrated. 8 different algorithms were included in the study: MachineLearning algorithms (Logistic Regression, Support Vector Machines (SVM), Random Forest,XGBoost), Deep Learning Algorithms (Convolutional Neural Network (CNN), Long Short-Term Memory (LSTM)) and Transformer-Based Algorithms (DistilBERT and DistilBERTfine-tuned with LoRA). According to the results obtained, the LoRA-supported DistilBERTalgorithm was the highest-performing algorithm with 82.38% accuracy. The results show thattransformer-based architectures are much more efficient than classical deep learning andmachine learning algorithms, especially in textual classification processes, when supported bynew methods and strategies that increase efficiency in terms of fine-tuning, such as LoRA. It isanticipated that this study will be an important guide in applications such as sentiment analysis,where model selection is important."
OpenAlex,deep learning,Sentiment Analysis Performance of Lora-Enhanced Llm's,Tunahan TİMUÇİN,10.5281/zenodo.18418625,2026-12-11,Zenodo (CERN European Organization for Nuclear Research),"On social media platforms, the increase in the number of users and the resulting increase in thedata produced by users have accelerated the prominence of some technologies. The most well-known of these areas is Natural Language Processing (NLP), where sentiment analysis of usercontent is performed. Sentiment analysis is mostly applied to short texts. In this study,experimental comparisons of large language models (LLMs), known deep learning and machinelearning algorithms are made using a dataset containing content from Twitter (X) users. Inaddition to this comparison, the LoRA (Low-Rank Adaption) strategy was applied to theDistilBERT model, one of the transformer-based large language models that forms the basis ofthe study, and the success of this fine-tuning method, which is lower cost and parameterefficient, was demonstrated. 8 different algorithms were included in the study: MachineLearning algorithms (Logistic Regression, Support Vector Machines (SVM), Random Forest,XGBoost), Deep Learning Algorithms (Convolutional Neural Network (CNN), Long Short-Term Memory (LSTM)) and Transformer-Based Algorithms (DistilBERT and DistilBERTfine-tuned with LoRA). According to the results obtained, the LoRA-supported DistilBERTalgorithm was the highest-performing algorithm with 82.38% accuracy. The results show thattransformer-based architectures are much more efficient than classical deep learning andmachine learning algorithms, especially in textual classification processes, when supported bynew methods and strategies that increase efficiency in terms of fine-tuning, such as LoRA. It isanticipated that this study will be an important guide in applications such as sentiment analysis,where model selection is important."
OpenAlex,deep learning,Universal Audio Generation,Antoine Laurent; Sameer Khurana; Anthony Larcher; Dominik Klement; Mickaël Rouvier; Santiago Cuervo; Adel Moumen; Antonio Almudévar; Haroun Elleuch; Peter Gazdik; Dominik Boboš; Juraj Novosad; Hugo Riguidel; Salima Mdhaffar; Radim Kudla; Zili Huang; Elric Zhang; Laura Cristina Alonzo Canul; Ricard Marxer; Tuan Nguyen,,2026-09-01,SPIRE - Sciences Po Institutional REpository,This report describe the research done during the third ESPERANTO/JSALT workshop from the 10th June 2024 to the 2nd of August 2024.
OpenAlex,deep learning,Diseño y construcción de un sistema predictivo de congestión de tráfico basado en aprendizaje automático,Zehan Li,,2026-07-17,UPM Digital Archive (Technical University of Madrid),"Resumen: Este proyecto desarrolla un sistema de predicción de la intensidad del tráfico urbano mediante técnicas de aprendizaje profundo, con el objetivo de mejorar la toma de decisiones de movilidad. A diferencia de otras plataformas centradas en la visualización del estado actual, la solución propuesta busca anticipar comportamientos futuros, y se plantea como una alternativa abierta, replicable y específicamente orientada a la predicción. Para lograrlo, se ha diseñado una arquitectura modular basada en el lenguaje Python, capaz de integrar múltiples fuentes de datos abiertos: registros históricos del tráfico, datos históricos de situación meteorológica, y coordenadas espaciales de los sensores de medición. El sistema aplica un proceso de limpieza, interpolación temporal y transformación de variables, incluyendo la codificación cíclica del tiempo y la conversión espacial a coordenadas UTM, lo que permite una fusión precisa entre datos geográficos y meteorológicos mediante técnicas como la ponderación por distancia inversa (IDW). El modelo predictivo se basa en una red neuronal LSTM, especialmente adaptada para secuencias temporales multivariables. Se entrena utilizando una estrategia de ventana deslizante a 32 muestras (7 horas y 45 minutos) para predecir la intensidad de tráfico en el siguiente intervalo. El sistema incorpora además mecanismo de IterableDataset para manejar grandes volúmenes de datos de entrenamiento sin comprometer la estabilidad del entorno. Los resultados obtenidos muestran una precisión robusta en escenarios de validación, con errores de predicción (MAE y RMSE) aceptable. Además, se ha desarrollado una interfaz web interactiva, que permite el despliegue local del sistema, con capacidad de ingestión de datos en tiempo real y visualización directa de las predicciones. Ente trabajo demuestra la viabilidad técnica y operativa de aplicar aprendizaje profundo al análisis de tráfico urbano, y sienta las bases para su evolución futura hacia sistemas más generalizables, robustos y útiles en contexto reales de ciudad inteligente. Abstract This Project develops an urban traffic intensity prediction system using deep learning techniques, with the aim of improving mobility decision-making. Unlike other platforms focused on visualizing the current state, the proposed solution seeks to anticipate future behaviors, and is positioned as an open, replicable alternative specifically oriented towards prediction. To achieve this, a modular architecture based on the Python language has been designed, capable of integrating multiple open data sources: historical traffic records, historical weather situation data, and spatial coordinates of measurement sensors. The system applies a process of cleaning, temporal interpolation, and variable transformation, including cyclic encoding of time and spatial conversion to UTM coordinates, allowing for precise fusion between geographical and meteorological data through techniques such as inverse distance weighting (IDW). The predictive model is based on an LSTM neural network, especially adapted for multivariate time sequences. It is trained using a sliding window strategy of 32 samples (7 hours and 45 minutes) to predict traffic intensity in the next interval. The system additionally incorporates an IterableDataset mechanism to handle large volumes of training data without compromising the stability of the environment. The obtained results show robust accuracy in validation scenarios, with acceptable prediction errors (MAE and RMSE). Furthermore, an interactive web interface has been developed, allowing for the local deployment of the system, with the capacity for real-time data ingestion and direct visualization of predictions. This work demonstrates the technical and operational feasibility of applying deep learning to urban traffic analysis and lays the groundwork for its future evolution towards more generalizable, robust, and useful systems in real smart city contexts."
