source,keyword,title,authors,doi,publication_date,journal,abstract
PubMed,mitral regurgitation,Assessing the impact of transcatheter edge-to-edge repair on reverse remodeling in secondary mitral regurgitation: a systematic review and meta-analysis.,Adolf Lichtfusz; Nina Galdzytska; Dorottya Gergő; Bence Szabó; Péter Hegyi; Zsolt Molnár; Gábor Duray; Judit Papp,10.3389/fcvm.2025.1714337,2025,Frontiers in cardiovascular medicine,"Transcatheter edge-to-edge repair (TEER) is a minimally invasive approach to reduce secondary mitral regurgitation (SMR) in patients with heart failure. However, there is limited evidence on its effectiveness in achieving reverse remodeling. Our aim was to assess the effects of TEER over time and to compare the effects of TEER plus GDMT vs. GDMT alone on echocardiographic parameters.
A systematic search of MEDLINE, EMBASE, and CENTRAL was conducted from inception to November 16, 2023. Eligible studies included patients with SMR treated with TEER and echocardiographic follow-ups. We evaluated changes in left ventricular end-diastolic diameter (LVEDD), left ventricular end-systolic diameter (LVESD), left ventricular end-diastolic volume (LVEDV), left ventricular end-systolic volume (LVESV), left atrial volume (LAV), left ventricular ejection fraction (LVEF) and NTproBNP levels.
Of 9,290 identified studies, 38 met inclusion criteria. After TEER, statistically significant reductions were observed in LVEDD (-1.63 mm), LVESD (-1.20 mm), LVEDV (-14.21 mL), and LVESV (-9.24 mL). Changes in LAV (-5.70 mL) and LVEF (+1.10%) were not statistically or clinically meaningful. NT-proBNP decreased substantially (-1,340 pg/mL). In comparative analyses, TEER plus GDMT did not show statistically significant differences vs. GDMT alone for any parameter, including LVEDD (-1.02 mm), LVEDV (-11.98 mL), LVEF (-0.14%), and LVESV (-5.29 mL). TEER reduced grade 3-4 MR from 99% to 9%.
identifier CRD42023483404.
TEER results in statistically significant but clinically small changes in echocardiographic parameters, and no clear advantage over GDMT alone. These findings should be interpreted with caution given the high heterogeneity and low certainty of evidence. Further studies are needed to define which SMR patient subgroups may derive meaningful reverse-remodeling benefit from TEER.
https://www.crd.york.ac.uk/prospero/display_record.php?RecordID=483404, PROSPERO CRD42023483404."
PubMed,mitral regurgitation,"Image-based, whole-system hemodynamic modeling of mitral regurgitation and its impact on the right ventricular function.",Mia Bonini; Marc Hirschvogel; Maximilian Balmus; Yunus Ahmed; Hao Xu; Alistair Young; Paul C Tang; David Nordsletten,10.3389/fcvm.2025.1673443,2025,Frontiers in cardiovascular medicine,"Mitral regurgitation (MR) is a common valvular disease associated with complications such as pulmonary hypertension, atrial fibrillation, and heart failure. However, its full impact on the cardiovascular system, especially on right heart function, is not yet fully understood. Understanding this relationship is important because the right ventricle (RV) is critical for maintaining cardiovascular function. Dysfunction of the RV, which may be contributed by conditions like MR, is strongly associated with poor clinical outcomes. Despite its importance, comprehensively studying MR's effect on the RV has been challenging due to the complex, interdependent nature of cardiovascular dynamics, limited patient data, and the difficulty in synthesizing disparate information to clarify the left heart-right heart connection.
The primary goal of this study is to investigate the effects of MR on cardiovascular hemodynamics and RV function by integrating 3D models of the left heart with a closed-loop 0D models of the entire cardiovascular system. We further conduct detailed analyses using patient-specific models to explore how various system modifications impact the RV, providing insights into the nuanced effects of MR on the right heart.
This analysis provides several clinically relevant insights. First, progressive MR markedly increases RV afterload and predisposes the RV to dysfunction, even when intrinsic RV contractility is preserved or enhanced. Second, MR-specific severity indices and left-heart metrics alone fail to capture the true burden on the right heart; RV impairment can progress despite stable or only modestly changing MR descriptors. Finally, these findings highlight the need to incorporate direct assessment of RV structure and function into the evaluation of MR, as RV vulnerability plays a critical role in determining patient risk and guiding management decisions."
PubMed,mitral regurgitation,Atrial lead entanglement during transcatheter mitral valve-in-ring implantation in patient with dual-chamber implantable cardioverter-defibrillator: case report.,Suryo Ardi Hutomo; Xiang Chen; Bin Wang; Yan Er Yao; Yan Wang,10.1093/ehjcr/ytaf653,2026-02,European heart journal. Case reports,"Ring annuloplasty failure after mitral valve repair frequently occurs after long-term follow up. Valve-in-ring transcatheter mitral valve replacement (TMVR) is an emerging therapeutic option for this high surgical risk condition. While a dual-chamber implantable cardioverter-defibrillator (ICD) is frequently utilized for sudden cardiac death prevention in this population, valve-in-ring TMVR intraprocedural difficulty associated with atrial lead presence is rarely known.
A 76-year-old male, with history of coronary artery bypass graft surgery and mitral ring annuloplasty experienced recurrence of severe mitral regurgitation. Due to high surgical mortality risk and unsuitable anatomy of mitral valve for transcatheter edge-to-edge repair, this patient underwent mitral valve-in-ring TMVR. Using transvenous-transseptal access, a 26 mm SAPIEN-3 prosthetic valve was delivered to the mitral area. However, as the patient has a history of dual-chamber ICD, a prosthetic valve cannot pass through during delivery, due to atrial lead entanglement. To overcome this difficulty, atrial septum balloon dilatation manoeuvre was done to facilitate valve delivery, which resulted in successful prosthetic valve delivery and deployment at the mitral position with satisfactory results.
Valve delivery difficulty due to atrial lead entanglement can occur during valve-in-ring TMVR in patients with dual-chamber ICD implantation history. Atrial septum balloon dilatation can be performed to overcome this problem."
PubMed,mitral regurgitation,Impact of Right Heart Catheterization and the 2022 ESC/ERS Definition of Pulmonary Hypertension in Patients With Mitral Regurgitation Undergoing Valve Repair/Replacement.,Mark Güpfert; Lukas Weber; Philipp K Haager; Philipp Baier; Sebastian Kopp; Johannes Rigger; Joannis Chronis; Marc Gerhard; Hans Rickli; Micha T Maeder,10.1002/pul2.70265,2026-01,Pulmonary circulation,"In patients with mitral regurgitation (MR), the role of invasive hemodynamics is not well defined. We evaluated the value of right heart catheterization (RHC) and the 2022 ESC/ERS pulmonary hypertension (PH) definition prior to a mitral valve procedure for the prediction of PH several months thereafter. We studied 274 patients (mean age 68 ± 11 years) with at least moderate MR (84% degenerative, 11% functional, 5% combined) undergoing RHC (baseline) followed by surgical (70%) or transcatheter (30%) valve repair/replacement who had an echocardiogram after a median follow-up of 3 months. PH was defined as a mean pulmonary artery pressure (mPAP) > 20 mmHg and was subclassified by mean pulmonary artery wedge pressure (mPAWP) and pulmonary vascular resistance (PVR). The PH follow-up probability was assessed by peak tricuspid regurgitant velocity and indirect PH signs. At baseline, 143/274 (52%) patients had any PH: 40 had isolated post-capillary, 65 had combined pre- and post-capillary (CpcPH), 27 had pre-capillary, and 11 had unclassified PH. Follow-up PH probability was low in 149, intermediate in 73, or high in 42 patients. There was a progressive increase in baseline mPAP, mPAWP, and PVR (p < 0.001 for all) in patients with low, intermediate or high follow-up PH probability. Patients with baseline CpcPH had a nearly 11-fold higher risk (odds ratio 10.7) for a high follow-up PH probability compared to those without PH. In conclusion, in MR patients the hemodynamic constellation according to the 2022 ESC/ERS PH definition predicts the PH probability several months after a mitral valve procedure."
PubMed,mitral regurgitation,Candida guilliermondii endocarditis in a patient with prosthetic mitral valve: a case report.,Saravana Priya J K; Gomathi Manju Balasubramaniam; Ramani C P,10.22034/cmm.2025.345248.1654,2025,Current medical mycology,"Candida endocarditis, though rare, presents significant risks, especially in prosthetic valve recipients. Candida guilliermondii is an uncommon causative pathogen, necessitating a high index of suspicion, advanced diagnostics, and prompt antifungal therapy to improve patient outcomes.
A 57-year-old male with a history of rheumatic heart disease and prior mitral valve replacement presented with fever, chills, and generalized body aches for 10 days. Laboratory investigations revealed microcytic hypochromic anemia, while echocardiography demonstrated prosthetic valve vegetation with mild to moderate aortic regurgitation. Blood cultures confirmed C. guilliermondii infection.
Early recognition, multidisciplinary collaboration, and tailored antifungal therapy are pivotal for favorable outcomes in C. guilliermondii prosthetic valve endocarditis. This case highlights the importance of comprehensive diagnostics and vigilant patient management to mitigate complications and improve prognosis."
PubMed,mitral regurgitation,An Unusual Case of Acquired Dilated Cardiomyopathy Due to Long-Standing Patent Ductus Arteriosus.,Eleni Giannopoulou; Damianos Tsilivarakis; Maria Lekaditi; Stavroula Kosmopoulou,10.7759/cureus.101436,2026-01,Cureus,"Patent ductus arteriosus (PDA) is a common congenital cardiac condition in neonates. Its frequency is substantially higher in preterm infants, and it is frequently associated with other congenital heart defects. Its persistence into adulthood has become increasingly uncommon due to advances in neonatal screening, echocardiographic diagnosis, and timely therapeutic intervention. The hemodynamic burden imposed by PDA depends on the magnitude of the left-to-right shunt and may result in both short- and long-term complications. While small shunts may remain asymptomatic throughout life, moderate and large shunts can cause pulmonary congestion, cardiac volume overload, organ hypoperfusion, and even death, early in life. When left untreated, particularly in small-to-moderate defects that may not initially meet the criteria for intervention, chronic shunting may progressively result in pulmonary hypertension and heart failure. In adults, heart failure related to PDA is usually associated with preserved or moderately reduced left ventricular ejection fraction (LVEF), whereas severe systolic dysfunction and acquired dilated cardiomyopathy are exceptionally rare. Here, we present the case of a 70-year-old male who was admitted with progressive dyspnea, orthopnea, dry cough, and bilateral lower extremity edema over one month. His medical history included PDA diagnosed in childhood, without intervention or regular follow-up. On admission, physical examination revealed signs of acute heart failure, including tachypnea, jugular venous distension, pulmonary congestion, and marked peripheral edema. Cardiac auscultation demonstrated a prominent second heart sound and systolic murmurs consistent with mitral and tricuspid regurgitation, and a characteristic continuous, ""machinery"" murmur suggestive of PDA. Electrocardiography showed sinus rhythm with frequent atrial and ventricular premature beats, poor R-wave progression in the precordial leads, and nonspecific ST-T abnormalities in the limb leads. Chest radiography demonstrated cardiomegaly, pulmonary vascular congestion, alveolar edema, and bilateral pleural effusions. Laboratory evaluation revealed elevated natriuretic peptide levels and mildly increased high-sensitivity cardiac troponin I, consistent with the setting of acute heart failure. Transthoracic echocardiography revealed dilation of all four chambers and severe biventricular systolic dysfunction, with an LVEF of 25%, mild mitral and tricuspid insufficiency, and increased systolic pressure in the pulmonary artery. A moderate left-to-right shunt was found. Evaluation by coronary angiography ruled out obstructive coronary artery disease. Further assessment with cardiac magnetic resonance imaging demonstrated a persistent communication between the aortic isthmus and the main pulmonary artery, confirming PDA. A diagnosis of acquired dilated cardiomyopathy secondary to long-standing left-to-right shunt, likely precipitated by frequent atrial and ventricular arrhythmias, was established. Although the patient was a candidate for transcatheter percutaneous ductal closure, he declined any intervention, and optimized guideline-directed medical therapy was initiated. This case represents an exceptionally rare presentation of PDA in adulthood and highlights the importance of lifelong medical surveillance in patients with congenital heart defects."
PubMed,mitral regurgitation,The High Price of Interrupted Follow-Up: Catastrophic Progression of Homozygous Familial Hypercholesterolemia-A Case Report and Literature Review.,Parham Dastjerdi; Mahdieh Aghababaei; Reza Nikfar; Maryam Aghakouchakzadeh; Reza Mohseni-Badalabadi; Kaveh Hosseini,10.1002/ccr3.72028,2026-02,Clinical case reports,"Familial hypercholesterolemia (FH) is the most common monogenic lipid disorder, primarily resulting from mutations in LDLR, APOB, and PCSK9 genes. These mutations cause persistently high levels of low-density lipoprotein cholesterol (LDL-C), predisposing affected individuals to premature atherosclerotic cardiovascular disease (ASCVD). Homozygous FH (HoFH), a rare but severe form, manifests early in life with cutaneous xanthomas and accelerated coronary and aortic disease. Early diagnosis and aggressive, lifelong management are crucial, yet challenges remain, particularly when follow-up is interrupted. We report the case of a 20-year-old female diagnosed with HoFH at age 13 after presenting with xanthomas. Initial evaluation revealed mild to moderate aortic stenosis and early coronary artery involvement. Genetic testing confirmed a homozygous LDLR mutation. Despite treatment with atorvastatin and evolocumab, partial lipid control was achieved, and follow-up was disrupted during the COVID-19 pandemic. At 20 years, she presented with worsening dyspnea, paroxysmal nocturnal dyspnea, and orthopnea. Advanced imaging documented severe heart failure with an ejection fraction of 20%, significant ventricular dilation, severe mitral regurgitation, and calcified aortic stenosis. Coronary angiography demonstrated critical coronary stenoses, while subsequent adjustments in her lipid-lowering regimen, including rosuvastatin, ezetimibe, increased evolocumab dosing, and bempedoic acid, failed to stabilize her condition. Despite recommendations for surgical intervention, the patient's critical status precluded operative management, and she tragically died on the day of her scheduled follow-up. This case underscores the aggressive natural history of HoFH and the dire consequences of interrupted follow-up care. Early detection and sustained, multidisciplinary management are essential to mitigate rapid cardiovascular deterioration in HoFH patients. Consistent monitoring and prompt therapeutic adjustments remain pivotal in improving outcomes and reducing the high mortality risk associated with advanced aortic and coronary complications in these patients."
PubMed,mitral regurgitation,Prognostic implications of impaired three-dimensional left atrial function and stiffness in primary mitral regurgitation.,Christian E Berg-Hansen; Rasmus Bach Sindre; Lisa M D Grymyr; Cecilie Linn Aas; Stig Urheim; Judy Hung; Dana Cramariuc,10.1186/s12947-026-00368-4,2026-02-16,Cardiovascular ultrasound,"In patients with mitral regurgitation (MR), cardiac remodeling by two-dimensional (2D) echocardiography is variable and less suitable for individualized risk assessment. We evaluated whether three-dimensional (3D) peak LA reservoir strain (LASr) and stiffness improve risk prediction in primary MR.
In the prospective 3D Echocardiography and Cardiovascular Prognosis in Mitral Regurgitation (3D-PRIME) study, 110 patients with moderate or greater primary MR underwent 2D/3D echocardiographic assessment of LASr and LA stiffness (i.e. (mitral E-wave/ annular e’ velocity)/ LASr). The primary outcome was a composite of death, heart failure worsening and mitral valve intervention.
During 24 [17–26] months follow-up, the primary outcome occurred in 59 patients. In multivariable Cox analyses, low 3D LASr (HR 2.1, 95% CI 1.1–4.3) and increased 3D LA stiffness (HR 3.5, 95% CI 1.6–7.4) predicted higher risk of adverse events after adjustment for left ventricular (LV) global longitudinal strain (GLS), MR severity, LV end-systolic volume and maximum LA volume (p < 0.05). In likelihood ratio tests, 3D LASr or LA stiffness (but not the corresponding 2D indices) increased the predictive value of a model including LV GLS and current indications for intervention in primary MR (χ2 -increase from 58 to 63 / 70, p < 0.05).
In moderate or greater primary MR, impaired LA function by 3D echocardiography is associated with higher risk of disease progression towards death, worsening heart failure and mitral valve intervention. Our findings lay the groundwork for future multicenter studies to explore the value of routine assessment of 3D LA remodeling in the follow-up of patients with primary MR.
3D LA strain and stiffness and clinical outcomes in primary MR [Image: see text]"
PubMed,mitral regurgitation,Ruptured Mitral Chordae and Widespread Calcified Intracranial Emboli: An Unusual Presentation of Native Valve Endocarditis.,Omar Bokhari; Faisal AlMashuf; Michael Thorne,10.1016/j.jstrokecerebrovasdis.2026.108586,2026-02-13,Journal of stroke and cerebrovascular diseases : the official journal of National Stroke Association,"Calcified cerebral embolism (CCE) is an uncommonly diagnosed, potentially fatal cause of acute ischemic stroke. In many instances, its detection may be missed completely. Knowledge of CCE is crucial as it is associated with high recurrence rate and worse clinical outcome.
A 67-year-old woman with multiple comorbidities and vascular risk factors presented with acute neurologic symptoms. Computed Tomography (CT) stroke protocol imaging revealed multiple cerebral infarcts with numerous calcified intracranial emboli, suggesting a cardiac source. Echocardiography demonstrated a large mitral valve vegetation with ruptured chordae and severe mitral regurgitation, consistent with native infective endocarditis. Despite medical and surgical management, her course was complicated by recurrent ischemic strokes and death.
We present an unprecedented case of CCE following spontaneous mitral valve rupture showing the ""Stardust"" sign on CT head. To our knowledge, this novel cause of CCE and radiological finding have not been previously reported, which is of diagnostic value. This care report highlights a novel pathophysiological mechanism of CCE."
PubMed,mitral regurgitation,Mechanisms of atrial fibrillation in mitral regurgitation patients: Insights from noninvasive electrocardiographic imaging.,Ramya Vijayakumar; Tari-Ann Yates; Martha McGilvray; Nicholas Razo; Laurie A Sinn; Richard B Schuessler; Christian W Zemlin; Yoram Rudy; Ralph J Damiano; Matthew R Schill,10.1016/j.jelectrocard.2026.154209,2026-02-11,Journal of electrocardiology,"Noninvasive Electrocardiographic Imaging (ECGI) was used to define the mechanisms of atrial fibrillation (AF) in mitral regurgitation (MR), which remain poorly understood.
Seventeen patients with degenerative MR and AF undergoing were studied. Thirteen age-matched patients with lone AF provided a control group. Epicardial electrograms were constructed noninvasively with ECGI using 256 body surface electrocardiograms and patient-specific heart-torso geometry from delayed-enhancement magnetic resonance imaging (DE-MRI) or computed tomography (CT) scans. Bi-atrial epicardial activation time maps and phase maps were generated. AF drivers were classified as focal (radial activation) or rotors (high curvature wavefront rotating about a center). Left atrial (LA) fibrosis was quantified from the DE-MRI scans in 5 MR patients.
The LA and right atrium (RA) harbored 61% and 36% of drivers, respectively and the anterior inter-atrial groove had 3% of the sources. 51% of the drivers were mapped in the posterior LA. One third of drivers occurred repeatedly. The left PV and LA appendage regions had the most repetitive drivers. Activation patterns varied from single macro-reentry to simultaneous wavelets resulting in wave breaks and collisions. Driver distribution and activation patterns remained similar between MR and lone AF groups, except stable rotors were not observed in MR. DE-MRI maps showed bi-atrial fibrosis. Drivers and discontinuous wavefront propagation were often localized in fibrotic regions.
AF activation patterns in MR were complex and exhibited spatio-temporal variability. Bi-atrial drivers were present. The posterior LA harbored the highest percentage of drivers. This region also exhibited fibrosis in a subset of patients, suggesting that it may play a role in creating the AF substrate."
PubMed,mitral regurgitation,Robotic mitral valve repair and simultaneous on-pump coronary artery bypass grafting to the left anterior descending artery.,Naonori Kawamoto; Kizuku Yamashita; Kota Suzuki; Takashi Kakuta; Ayumi Ikuta; Kohei Tonai; Rieko Kutuzawa; Satsuki Fukushima,10.1016/j.athoracsur.2026.01.035,2026-02-12,The Annals of thoracic surgery,"Robotic cardiac surgery has advanced substantially in recent years; however, its application remains limited in patients with concomitant coronary artery and valvular disease. We report two patients with severe mitral regurgitation and proximal LAD stenosis who successfully underwent robotic mitral valve repair combined with on-pump coronary artery bypass grafting to the LAD using a robotically harvested internal mammary artery. Both procedures yielded favorable outcomes. This approach demonstrates the feasibility and potential clinical utility of robotic, minimally invasive surgery in appropriately selected patients with mitral valve disease complicated by LAD lesions, expanding the therapeutic possibilities for this challenging patient population."
PubMed,mitral regurgitation,Not All Regurgitation Is Created Equal - Trajectory and Prognosis of Mitral and Tricuspid Regurgitation after Transcatheter Aortic Valve Implantation.,Kitae Kim; Neil P Fam,10.1016/j.cjca.2026.01.062,2026-02-12,The Canadian journal of cardiology,
PubMed,mitral regurgitation,Impact of Changes in Renal Function on Outcomes Following Mitral Transcatheter Edge-To-Edge Repair.,Parth N Patel; Olivia L Hulme; Marc Allard-Ratick; Jay Khambhati; Amanda Stebbins; Andrzej S Kosinski; Sreekanth Vemulapalli; Sammy Elmariah,10.1016/j.shj.2025.100747,2026-03,Structural heart : the journal of the Heart Team,"Hemodynamic changes following mitral transcatheter edge-to-edge repair (mTEER) may impact estimated glomerular filtration rate (eGFR), but whether changes in eGFR following mTEER are associated with subsequent clinical outcomes is not known. The objective of the study was to investigate procedure-related changes in eGFR and clinical outcomes following mTEER.
We studied patients in the Transcatheter Valve Therapy registry undergoing mTEER between 2013 and 2022 with available baseline and discharge eGFR. Multivariable linear regression identified baseline characteristics associated with changes in eGFR following mTEER. Cox proportional hazards models examined the adjusted association between improved (≥10% increase in eGFR), unchanged, and worsened renal function (≥10% decrease in eGFR) and survival at 1 year.
Among 48,472 patients undergoing mTEER, 15.7% experienced improved renal function and 13.7% had worsened renal function. Cardiogenic shock within 24 hours, age >80, Black race, diabetes, heart failure within 2 weeks, and female sex were strongly associated with worsened renal function after mTEER. Compared to the group with no change in renal function, improved renal function was associated with a decreased risk of 1-year mortality (adjusted hazard ratio: 0.77; 95% CI 0.69-0.86, p < 0.001), whereas worsened renal function was associated with an increased risk of death at 1 year (adjusted hazard ratio: 2.85; 95% CI 2.64-3.08, p < 0.001).
Approximately 30% of patients experience marked changes in renal function following mTEER.A greater than 10% increase or decrease in eGFR is independently associated with differences in 1-year survival. Careful attention to patients at greatest risk for worsened renal function after mTEER is warranted."
