source,keyword,title,authors,doi,publication_date,journal,abstract
Crossref,valvular heart disease,"Adverse effects following E-cigarette use among users with psychiatric illnesses: Risks associated with dual vaping, multiple comorbidities and persistent psychiatric issues",Vidya Purushothaman; Raphael E. Cuomo,10.1016/j.etdah.2026.100271,2026-12,"Emerging Trends in Drugs, Addictions, and Health",
Crossref,valvular heart disease,A hybrid deep learning approach based on optimized feature selection on environmental multi-disease predictive models,Selvi. S; Vanathi. A,10.1016/j.ijcce.2025.11.006,2026-12,International Journal of Cognitive Computing in Engineering,
Crossref,valvular heart disease,Fitness and exercise effects on brain age: A randomized clinical trial,Lu Wan; Cristina Molina-Hidalgo; Mary E. Crisafio; George Grove; Regina L. Leckie; Thomas W. Kamarck; Chaeryon Kang; Mia DeCataldo; Anna L. Marsland; Matthew F. Muldoon; Mark R. Scudder; Javier Rasero; Peter J. Gianaros; Kirk I. Erickson,10.1016/j.jshs.2025.101079,2026-12,Journal of Sport and Health Science,
Crossref,valvular heart disease,Global hotspots and development trends in the new generation of artificial heart valves based on bibliometric analysis from 1991 to 2024,Shiping Chen; Jiamin Peng; Zhiyi Ye; Xingshuang Ma; Ming Sun; Nasser Fatouraee; Jifu Mao; Guixue Wang; Lu Wang,10.1016/j.advim.2025.100005,2026-12,Advanced Interventional Materials,
Crossref,valvular heart disease,Disease-related communication difficulties and dyadic coping among patients with breast cancer and their spouses: An actor–partner interdependence model,Lingling Yang; Xi Zhang; Meina Yang; Liping Zhang; Rong Wang; Ting Wang,10.1016/j.apjon.2025.100829,2026-12,Asia-Pacific Journal of Oncology Nursing,
Crossref,valvular heart disease,The Liver-Vascular Axis in Metabolic Dysfunction-Associated Steatotic Liver Disease: Pathogenic Pathways and Emerging Targets,Toru Miyoshi,10.30548/vascfail.10.1_1,2026-12-01,Vascular Failure,
Crossref,valvular heart disease,Antibiotic inhibiting ternary complex formation in ribosomal translation in Gram positive bacteria,Wlodek Mandecki; Emanuel Goldman,10.1016/j.inv.2026.100048,2026-12,Invention Disclosure,
Crossref,deep learning,Learner profiles and the process of Learning in the Higher Educational Context,Christos Skourlas; Petros Belsis,10.15556/ijiim.02.01.003,2115-03-05,International Journal on Integrated Information Management,
Crossref,deep learning,WEB-BASED COLLABORATIVE LEARNING AND KNOWLEDGE SHARING IN INFORMAL BUSINESS NETWORKS,George Stalidis; Costis Papadimitrakopoulos; Theocharis Tsakiris,10.15556/ijiim.01.02.002,2114-12-10,International Journal on Integrated Information Management,
Crossref,deep learning,Availability and Utilization of Tools and Equipment for Teaching and Learning Garment Making Trade in the Senior Secondary Schools in Edo State,,10.20431/2349-0381.0303002,2106,"International Journal of Humanities, Social Sciences and Education",
Crossref,deep learning,Title Pending 8273,,10.3998/mjcsl.8273,2036-03-03,Michigan Journal of Community Service Learning,
Crossref,deep learning,Title Pending 7452,,10.3998/mjcsl.7452,2036-01-19,Michigan Journal of Community Service Learning,
Crossref,deep learning,Title Pending 6294,,10.3998/mjcsl.6294,2034-12-20,Michigan Journal of Community Service Learning,
Crossref,deep learning,Title Pending 5730,,10.3998/mjcsl.5730,2034-11-18,Michigan Journal of Community Service Learning,
Crossref,deep learning,Title Pending 3643,,10.3998/mjcsl.3643,2033-09-06,Michigan Journal of Community Service Learning,
Crossref,deep learning,Title Pending 4120,,10.3998/mjcsl.4120,2033-03-28,Michigan Journal of Community Service Learning,
Crossref,deep learning,Title Pending 2741,,10.3998/mjcsl.2741,2032-09-28,Michigan Journal of Community Service Learning,
Crossref,deep learning,Machine Learning Application for SAIs,Tiare Rivera,10.56251/watu4873,2030-10-20,International Journal of Government Auditing,
Crossref,deep learning,Integration of Biomechanics and Digital Technology: Using Kinovea for Motion Analysis and Learning for Beginner Athletes,Muhammad Nur Hudha; Riezky Maya Probosari; Annisa Nur Khasanah; Supurwoko; Salsabila Kholifahtun Nisa’; Gifran Rihla Gifarka Latief,10.58524/jcss.v4i2.890,2029-11-29,Journal of Coaching and Sports Science,"Background: The integration of biomechanics with digital motion-analysis technologies has introduced new approaches for examining movement efficiency, kinematic characteristics, and technical patterns in walking and running activities. Kinovea, as an accessible motion-analysis software, provides both visual and quantitative feedback. However, its application in supporting technique development among beginner athletes remains insufficiently explored. Aim: This study aims to describe the use of Kinovea in biomechanics training and examine its contribution to the awareness of kinematic characteristics and movement techniques among beginner athletes. Methods: A descriptive qualitative design involved 72 beginner athletes aged 18–25 years selected through purposive sampling. Data were collected over 16 weeks through interviews, field observations, and motion video recordings analyzed using Kinovea. Kinematic data focused on joint angles, stride behavior, and movement phases during walking, running, and the flight phase. Qualitative data were analyzed using content analysis with NVivo 12, while kinematic results were interpreted descriptively to identify performance patterns and areas for technical refinement. Result: Kinematic analysis showed coordinated joint-angle patterns across all phases. Walking analysis identified arm swing angles of 50.9°–58.8° and leg separation angles of 64.3°–67.2°, indicating a stable gait rhythm. The running analysis revealed knee angles of 68.8°–69.8° and elbow angles of 87.6°–89.1°, indicating efficient propulsive mechanics. The flight phase demonstrated knee angles of 81.2°–87.8° and elbow angles of 80.4°–88.3°, suggesting effective momentum use and postural stability. These measurements supported stride-efficiency assessment and technique evaluation. Qualitative findings revealed that Kinovea enabled athletes to interpret movement phases and identify technical inefficiencies through slow-motion and frame-by-frame visualization. Conclusion: Kinovea supports basic motion analysis by providing clear kinematic information and helping beginner athletes observe and refine their movement techniques. The findings also offer practical value for coaches by enabling more precise identification of inefficient patterns and guiding targeted corrections during early-stage training."
Crossref,deep learning,Cyber Defense Digital Twins: A Federated Learning and Zero-Trust AI Architecture for Autonomous Threat Prediction and Response,Sivaramakrishnan Narayanan,10.32628/cseit251116279,2028-08-27,"International Journal of Scientific Research in Computer Science, Engineering and Information Technology","Modern enterprise networks operate under persistent threats that exploit cloud-native misconfigurations, identity sprawl, and API vulnerabilities at machine speed. Existing security operations center (SOC) architectures remain largely reactive, signature-dependent, and incapable of predicting multi-stage lateral movement. This paper proposes the Cognitive Cyber Defense Digital Twin (CCDT), a unified architecture integrating federated learning (FL), graph neural network (GNN)-based attack-path forecasting, adversarially hardened detection models, and autonomous Security Orchestration, Automation, and Response (SOAR) with deception engineering. The CCDT constructs a continuously synchronized digital replica of organizational assets and employs reinforcement learning-based red agents to stress-test detection models. A federated intelligence mesh enables cross-organizational privacy-preserving gradient sharing. Experimental evaluations against CICIDS-2018 and LANL datasets demonstrate 52% faster attack-path detection, 41% reduction in false positive rate, and 60% reduction in mean-time-to-respond (MTTR) compared to traditional SOC baselines. Integrated Explainable AI (XAI) modules using SHAP values enable audit-ready compliance reporting. The CCDT represents a paradigm shift from reactive monitoring to predictive, autonomous, and privacy-preserving cyber defense for hybrid cloud environments."
Crossref,deep learning,The Nexus of Leadership and Learning: Exploring Female Principals' Influence on the Teaching-Learning Process in Secondary Schools,Muhammad Niqab; Salma Tabbasum; Shakil Ahmad,10.55737/qjss.vii-i.26473,2028-02-28,Qlantic Journal of Social Sciences,"The research paper will set out to debate the role played by the leadership competencies of principals in the teaching and learning process. The research will embrace a quantitative research design that will seek to answer the question concerning the relationship that exists between leadership skills of possessed by the  principals and the ongoing teaching-learning process in the female secondary schools using a co-relational study design. A survey instrument comprising of 37 items, which measured the leadership skills possessed by the selected principals and the prevailing teaching learning process, was used in the collection of data. Questionnaires for this study were administered to 108 male and female educators who were serving in secondary schools in Tehsil Wari, upper Dir and among them 100 questionnaires were submitted and were deemed to be useful in the analysis. The data in hand were calculated using Statistical Package of the Social Sciences (SPSS) version-27 and the obtained results indicated that the collected data was normally distributed. The findings revealed that all the variables of the study had great correlations. The analysis of the data was done through linear regression to measure the effect that the leadership skills of the principals had on the teaching learning process and this indicated that leadership skills of the principals have statistically significant effect on the teaching learning process. The policies derived out of this research can be a good guide to both the policymakers and organizational leaders because they can provide a good outline on how to empower the leaders in charge of the principals and as well as exert more influence on the effective teaching and learning processes."
Crossref,deep learning,Transforming Education through Technology: The Case of COVID 19 Digital Learning in Nagaland,K Hinoca Assumi,10.71126/nijre.v2i1.16,2028-02-28,Naveen International Journal of Research in Education (NIJRE),"Through the perspective of the COVID-19 pandemic and the disruption and opportunity it engendered, this chapter follows a transformative effect of EdTech and Digital education in India particularly in Nagaland through analysis. Drawing upon national policy frameworks, conceptual literature on educational technology, and contextual evidence based on the case of Nagaland, the chapter considers the rapid migration to digital learning as an emergency strategy (in response to the ongoing institution closures) based on the stark shifts in pedagogical practice, access to education services, and preparedness. The findings show that, including the ability of national programmes such as NEP 2020, SWAYAM, DIKSHA, PM e-VIDYA, and others, to promote access to digital tools was low within periphery or hill areas (e.g., Nagaland), due to lack of infrastructural resources, digital divide, unprepared teachers and economic/social divides, and more. The pandemic exposed the deep social and infrastructure divides in connectivity, device availability, assessment and learner engagement, with implications that were especially grave in rural and tribal settings. Although it accelerated the pace of innovation and the application of blended and low-tech learning practices teachers have been experimenting with digital platforms and the post-COVID recovery process, including remedial programmes and hybrid instruction. The chapter also discusses that blended learning is the most fitting, viable and sustainable approach for reaching the technological level in the field of educational technology at Nagaland. It implies that technology-mediated education can improve equity, quality, and resilience, but only under the conditions of inclusive policy design, strong digital infrastructure, vigorous teacher capability building, and culturally appropriate digital content. Keywords: Educational technology, digital learning, COVID-19, Nagaland, online education, Challenges, blended learning"
Crossref,deep learning,Left Ventricle Extraction Using a DENSENET-U-Net Integrated Deep Learning Approach,X. Ignatious Viola; R. Shoba Rani; G. Savitha; R. Surekha,10.1504/ijims.2028.10076630,2028,International Journal of Internet Manufacturing and Services,
Crossref,deep learning,Distributed Algorithms for High-Dimensional Statistical Inference and Structure Learning with Heterogeneous Data,Hongru Zhao; Xiaotong Shen,10.5705/ss.202025.0087,2028,Statistica Sinica,
Crossref,deep learning,Botnet Detection in Network Security by means of Deep Neural Network - DBoTPM,Sankarsan Panda; Julia Faith S; C. Manonmani; Sheshang Degadwala,10.1504/ijcis.2028.10073178,2028,International Journal of Critical Infrastructures,
Crossref,deep learning,Zero-Day Intrusion Detection System: Training on Small Datasets with Advanced Data Augmentation and Ensemble Learning,Mehaboob Mujawar; Aasheesh Raizada; Abdullah Gubbi,10.1504/ijims.2028.10075219,2028,International Journal of Internet Manufacturing and Services,
Crossref,deep learning,Doubly Robust Transfer Learning Under Sub-group Shift for Cohort-level Missing Indicator Covariates,Huali Zhao; Tianying Wang,10.5705/ss.202025.0245,2028,Statistica Sinica,
OpenAlex,deep learning,The Role of Collective Bricolage in Creating University Governance Structures: The Example of the Galileo Observatory,Ariel Mendez; Amandine Pascal,,2050-01-01,Cairn.info,"This study investigates the concept of “collective bricolage” within the framework of creating a universe science observatory in France. In the face of significant transformations in higher education and research, this article examines how university stakeholders can employ collective bricolage to adapt to institutional mandates for restructuring. Drawing on Lévi-Strauss’s notion of bricolage and the theoretical contributions of Duymedjian and Rüling (2010), this research investigates how this bricolage can be implemented in the absence of conventional or normative space to support the process, and particularly within a context characterized by conflictual relationships. The case study analyzes the collective bricolage process and its components, demonstrating that the dialectical nature of collective bricolage facilitates the creation of robust governance structures through the negotiation and recombination of resources and rationales from the diverse actors involved."
OpenAlex,deep learning,The nature and tensions of environmental management control in local authorities,Christophe Maurel; Christophe Favoreu; London Proofreaders,,2050-01-01,Cairn.info,"This exploratory research aims to characterize, on the one hand, the concept of environmental management control (EMC) through the practices that underpin it, and, on the other hand, the tensions associated with it and the implementation of these practices in public organizations. Although EMC is attracting growing interest within the public sector, it seems to be facing technical and governance difficulties. A grid for analyzing management tools and the theory of organizational paradoxes is used to address the issue of characterizing EMC practices and the associated tensions in the local public sector. Various municipalities were mobilized to explore and characterize their first experiences of implementing EMC. Our results enable us to characterize both the tools used and the tensions generated between the objectives pursued in terms of resource management, dialogue with the socio-economic environment, and behavioral orientation."
OpenAlex,deep learning,The Social and Solidarity Economy and Public Authorities in South Korea : Constructing a Complementary Relationship,Éric Bidet; Casper Hendrik Claassen; Junki Kim,,2050-01-01,Cairn.info,"This article examines the historical trajectory of the Social and Solidarity Economy (SSE) in South Korea, where it has experienced spectacular development over the past fifteen years, analyzing it through the lens of its relationship with public authorities. The longitudinal analysis conducted for the period 1910-2020 is based on a mixed methodology that combines often incomplete and heterogeneous descriptive statistics, documentary analysis, examination of institutional documents, thematic interviews, and case studies. It also mobilizes the theoretical framework of social origins theory established by Salamon and Anheier (1998) and the typology of relationships between the nonprofit sector and public authorities proposed by Young (2000) to demonstrate that the typical relationship between SSE and public authorities follows fluctuating models specific to each historical period and tends toward a complementary relationship marked by reciprocal influences and growing SSE autonomy. We thus observe the establishment of a hybrid bottom up and top down process through which the SSE tends to become not only a service provider but also a partner to public authorities in the formulation of public policy. The complementary relationship between SSE and public authorities creates a coupling/decoupling dynamic that combines the advantages of SSE agility (Room, 2011) and the intervention capacity of the developmental state (Woo-Cumings, 1999)."
OpenAlex,deep learning,"Depth of Processing, learner aptitude, and the acquisition of L2 English grammatical structures",Shweta Nigam,10.48683/1926.00128861,2031-01-01,CentAUR (University of Reading),"Depth of Processing (DoP) is central to several models of instructed second language acquisition (ISLA) (Leow, 2015). While DoP has been extensively examined in vocabulary learning (e.g., Laufer &amp; Hulstijn, 2001), its role in the acquisition of grammatical structures, particularly through oral and audio-visual modalities remains comparatively underexplored. Drawing on the Levels of Processing framework (Craik &amp; Lockhart, 1972), this study investigated whether task-induced processing depth influences the acquisition of third conditionals and comparatives, and whether language aptitude (LLAMA B, D, F) predicts learning gains. Using a pretest–posttest design, four intact classes involving 108 Grade 8 EFL learners in India were assigned to one of the three experimental conditions differing in level and type of processing: Low DoP, High DoP Explicit, and High DoP Implicit. The treatment task required the participants to listen to an audio-visual story containing the target structures (third conditionals and comparatives) and complete analytic tasks (varying in different groups) before listening to the story for a second time. The oral performance of the participants was analysed for accuracy, and frequency of use of the target structures. A grammaticality judgement test (GJT) and an elicited imitation task (EIT) were used to assess the participants’ gains in the knowledge of the target structures. In addition, language aptitude (LLAMA B, D, F) was measured and modelled as a predictor of gain scores. Results showed a significant effect of processing condition on GJT performance with the High DoP Implicit group outperforming the High DoP Explicit group on total scores and comparatives. In contrast, ANCOVA analyses indicated no significant group differences on EIT outcomes once pretest performance was controlled, with pretest scores strongly predicting posttest performance. In oral production, processing effects were structure-specific: the Low DoP group showed greater accuracy gains for comparatives, while both High DoP groups revealed increased frequency of use of third conditionals. However, across all four measures, multiple regression analyses indicated that LLAMA B, D, and F did not significantly predict gain scores. Overall, the findings support a processing-by-structure pattern: deeper processing benefits were most evident for the more salient structure (comparatives) on an explicit, written measure, whereas complex, low-salience forms (third conditionals) showed limited accuracy change but increased frequency of use under deeper processing."
OpenAlex,deep learning,Combating Data and Target Shifts in Visual Tasks,Zhaorui Tan,10.17638/03194353,2031-01-01,University of Liverpool,"The rapid advancement of deep learning models for visual tasks has led to significant progress in many domains. However, a key challenge remains: ensuring that models can generalize effectively to unseen samples or novel classes, especially in real-world scenarios where training data-target pairs are often limited or unavailable, and test data may exhibit shifts in both data and targets. This thesis addresses the problem of shifts across data and targets, proposing novel methods to improve model generalization and transferability in complex settings. The thesis identifies the different shift scenarios for visual tasks and presents their problem forms. The research first relaxes the static target distribution assumption in Multi-Domain Generalization (mDG) tasks, introducing the General Multi-Domain Generalization (GMDG) objective to improve generalization under varying data shifts. Specifically, Extensive experiments validate that GMDG is feasible for classification, segmentation, and regression tasks. Further considering extreme target distribution shifts where even unknown novel classes emerge, the study also explores logical regularization techniques for tasks such as Generalized Category Discovery (GCD), mDG+GCD, and Class Incremental Learning (CIL), proposing a sample-based logical regularization term (L-Reg) to enhance data-, target-, and all-shift generalization. Additionally, a partial logic framework is introduced to address challenges in CIL, enabling models to retain room for unknown classes during training. This is further extended by the Partial-Logic Regularization (PL-Reg), which improves generalization across GCD, mDG+GCD, and transferability for CIL tasks. Furthermore, the thesis proposes a novel Semantic-aware Data Augmentation (SADA) framework for cross-modality generalization in text-to-image synthesis (T2Isyn), text-image retrieval (TIR), and image-text retrieval (ITR) tasks. This framework ensures semantic preservation across text and image modalities, improving both semantic consistency and image quality in cross-modality tasks. The methods proposed in this thesis offer significant advancements in visual generalization and transfer scenarios, providing theoretical insights and practical solutions for handling data shifts, target shifts, and multi-modalities in complex scenarios. Extensive experiments validate the effectiveness of the proposed methods, demonstrating their superior performance across a range of tasks."
OpenAlex,deep learning,Antecedents and consequences of Green-tech FDI in emerging markets,Zhuoran Liu,10.17638/03195308,2031-01-01,University of Liverpool,"As environmental pressures intensify, attracting sustainable foreign direct investment (FDI), particularly green-tech FDI, has become a critical pathway for emerging markets to achieve environmental sustainability. However, existing research remains fragmented, offering limited insights into why green-tech FDI enters emerging markets and how it affects regional green innovation. This thesis addresses these gaps by systematically examining both the antecedents and consequences of green-tech FDI through three empirical studies using regional data from China. Study 1 and Study 2 focus on the antecedents of green-tech FDI. Study 1 examines how host-country conditions can attract green-tech FDI, highlighting the role of environmental management information disclosure (EMID) by domestic firms in reducing information gaps and strengthening green market–seeking motives. Study 2 shifts attention to the active decision-making of green-tech FDI, showing that under uncertainty, green-tech foreign investors engage in identity-based bandwagon learning by imitating peers with similar green identities, thereby mitigating investment risks. Study 3 turns to the consequences of green-tech FDI. It demonstrates that, due to the technological complexity of green innovation and limited absorptive capacity in emerging markets, green-tech FDI may generate crowding-out effects rather than purely positive spillovers. Adopting a network perspective, the study further finds that universities play a key moderating role: through broad linkages and deep collaborations, they help mitigate negative spillovers and facilitate the diffusion of green technologies. Together, the three studies advance the literature on sustainable FDI by differentiating green-tech FDI from general FDI and identifying the specific mechanisms that shape its entry decisions and local innovation outcomes. Practically, the findings provide guidance for emerging-market governments and firms on how to attract and manage sustainable investment, balance growth with environmental objectives, and strengthen local innovation ecosystems."
