source,keyword,title,authors,doi,publication_date,journal,abstract
OpenAlex,mitral regurgitation,"Anesthetic Management of High-Risk Mitral Valve Replacement in a Young Adult with Posterior Leaflet Prolapse, Biventricular Dysfunction Risk, and Pulmonary Hypertension: A Case Report",Vera Muharrami; Robfadli Purnanda; Elwistrihady,10.37275/bsm.v10i6.1608,2026-04-13,Bioscientia Medicina Journal of Biomedicine and Translational Research,"Background: Mitral valve disease with concurrent pulmonary hypertension and biventricular dysfunction represents a complex surgical challenge requiring meticulous perioperative management. This case report presents the anesthetic approach to a 43-year-old male with severe mitral regurgitation secondary to posterior leaflet prolapse, Grade III diastolic dysfunction, and intermediate probability pulmonary hypertension undergoing elective mitral valve replacement. Case presentation: The patient presented with 6-month progressive dyspnea, chronic cough, bilateral lower-limb edema, and abdominal distension. Transthoracic echocardiography revealed severe mitral regurgitation with an effective regurgitant orifice area of 2.7 cm², bilateral atrial dilation, moderate tricuspid regurgitation, reduced tricuspid regurgitation jet velocity suggesting intermediate pulmonary hypertension probability, and preserved left ventricular ejection fraction of 68% with severely restrictive diastolic filling pattern. The patient underwent uncomplicated elective mitral valve replacement under general anesthesia with cardiopulmonary bypass. Intraoperative management emphasized hemodynamic stability through judicious fluid administration, careful anesthetic agent selection, and appropriate pulmonary vascular protection strategies. Cardiopulmonary bypass time was 125 minutes with an aortic cross-clamp time of 57 minutes. The postoperative course was uneventful with prompt extubation and discharge from intensive care on postoperative day three. Conclusion: This case illustrates the importance of comprehensive preoperative optimization, multimodal monitoring, and tailored intraoperative management in patients presenting with the complex intersection of severe organic mitral valve disease, pulmonary hypertension, and advanced diastolic dysfunction. The use of sevoflurane-based anesthesia, preservation of systemic vascular resistance, and lung-protective ventilation strategies contributed to favorable perioperative outcomes. This case highlights unique management considerations that may not be extensively detailed in standard anesthetic textbooks and demonstrates successful outcomes despite significant preoperative cardiac compromise."
OpenAlex,mitral regurgitation,Enterococcus faecalis–associated infective aortic endocarditis as a cause of arterial thromboembolism in a cat,Didem Algan; Tuğba Varlik; Mehmet Emin Akkaş; Juon Abbass; Melek Zübeyde Demirci; Kamil Tayfun Carli; Zeki Yılmaz,10.1007/s11259-026-11208-1,2026-04-13,Veterinary Research Communications,"<section aria-labelledby=""Abs1"" data-title=""Abstract"" lang=""en"" style=""box-sizing: inherit; outline: 0px;""><div class=""c-article-section"" id=""Abs1-section"" style=""box-sizing: inherit; clear: both; line-height: 1.8; margin-bottom: 48px; outline: 0px; scroll-margin-top: calc(var(--header-height) + 1rem + env(safe-area-inset-top,0));""><div class=""c-article-section__content"" id=""Abs1-content"" style=""box-sizing: inherit; padding-top: 8px; margin-bottom: 40px; outline: 0px; scroll-margin-top: calc(var(--header-height) + 1rem + env(safe-area-inset-top,0));""><p style=""box-sizing: inherit; margin-bottom: 32px; overflow-wrap: break-word; word-break: break-word; outline: 0px;"">Infective endocarditis (IE) is a rare but potentially fatal cause of feline arterial thromboembolism (ATE), most commonly affecting the mitral or aortic valves. Although&nbsp;<i style=""box-sizing: inherit; outline: 0px;"">Enterococcus faecalis</i>&nbsp;is rarely reported in cats, it can induce severe endocardial infection and systemic embolic complications. This case report describes a one-year-old neutered male British Longhair cat that presented with acute hindlimb paralysis and dyspnoea lasting one day. The cat had a three-month history of lower urinary tract infection, but no known cardiac disease. On admission, all the classical signs of arterial obstruction were evident. Laboratory tests revealed neutrophilic leukocytosis and markedly increased serum amyloid A, indicating systemic inflammation. Echocardiography revealed thickened aortic valve leaflets with irregular vegetations and severe regurgitation, with no evidence of intracardiac thrombus. Left ventricular systolic function assessed by two-dimensional speckle-tracking echocardiography was mildly reduced compared with reference values. Blood culture confirmed the presence of&nbsp;<i style=""box-sizing: inherit; outline: 0px;"">E. faecalis</i>, which was susceptible to β-lactams but intrinsically resistant to cephalosporins. Initial empirical therapy included furosemide, low-molecular-weight heparin, and broad-spectrum antibiotics. This was later adjusted to ampicillin–sulbactam, and metronidazole upon receiving the culture results. This report emphasises the importance of considering xone,<i style=""box-sizing: inherit; outline: 0px;"">E. faecalis</i>-associated infective aortic endocarditis in the diagnostic and therapeutic evaluation of feline ATE cases. </div></div></section><div class=""main-content"" style=""box-sizing: inherit; outline: 0px;""><section data-title=""Background"" style=""box-sizing: inherit; outline: 0px; caret-color: rgb(34, 34, 34); color: rgb(34, 34, 34); font-family: Merriweather, serif; font-size: 18px;""><div class=""c-article-section"" id=""Sec1-section"" style=""box-sizing: inherit; clear: both; line-height: 1.8; margin-bottom: 48px; outline: 0px; scroll-margin-top: calc(var(--header-height) + 1rem + env(safe-area-inset-top,0));""></div></section><br class=""Apple-interchange-newline""></div><div data-test=""cobranding-download"" style=""caret-color: rgb(0, 0, 0); color: rgb(0, 0, 0); font-style: normal; font-variant-caps: normal; font-weight: 400; letter-spacing: normal; orphans: 2; text-align: start; text-indent: 0px; text-transform: none; white-space: normal; widows: 2; word-spacing: 0px; -webkit-text-stroke-width: 0px; text-decoration-line: none; text-decoration-thickness: auto; text-decoration-style: solid; box-sizing: inherit; outline: 0px;""></div>"
OpenAlex,mitral regurgitation,A novel signal distribution-based approach to characterize atrial cardiomyopathy,Moritz Till Huttelmaier; M Vogel; Jonas Herting; Jan Traub; Fabian Kerwagen; Luca F. Gerres; Anna Frey; Stefan Störk; Stefan Frantz; Caroline Morbach; Alexander Gabel; Thomas H. Fischer,10.1007/s10840-026-02313-x,2026-04-13,Journal of Interventional Cardiac Electrophysiology,"Modern endocardial contact-mapping displays myocardial substrate based on impaired signal amplitude (SA). Previous methods for characterizing left atrial (LA) myocardium rely on arbitrary thresholds and manual tracing of low-voltage areas. The amplitude and distribution of signals above these thresholds remain unexamined. This study aimed to develop novel parameters for characterizing LA myocardium and LA cardiomyopathy (AC) based on the analysis of the full distribution of SAs across the entire LA. We retrospectively identified 50 adult patients who underwent primary pulmonary vein isolation (PVI) for paroxysmal or persistent AF. Selection criteria were (i) electroanatomical mapping (EA) in sinus rhythm (SR) with ≥5000 points/map; (ii) transthoracic echocardiography (TTE) acquired in SR within 48 h prior to PVI. Exclusion criterion was previous LA ablation. The pulmonary veins were manually excised from the EA maps, and the SA of each point was plotted. A novel set of variables describing the voltage distribution across the entire LA was analyzed. Based on the assumption of healthier and sicker individuals within the study cohort, cluster analysis was performed for every voltage distribution variable using Gaussian mixture modelling. Associations with total LVA, NT-proBNP, CHA₂DS₂-VA score and LA TTE parameters were assessed (proof of function). AF recurrence rates following PVI were investigated. The mean age of the studied sample (n = 48) was 62.5 ± 11 years, 62.5% were men, 66.7% showed persistent AF, median CHA2DS2-VA score was 1.5 (1, 3) and NT-proBNP was 190 (68, 413) pg/ml. A median of 5711 (5214, 6998) points/map were acquired. In this all-comer PVI cohort, mean SA was 2.4 ±0.96 mV, variance 2.27 ±1.07 mV2, skewness 1.43 ±0.59 and kurtosis 6.17 ±3.24. Variables did not differ between gender and subtypes of AF. For each variable, the sample was successfully stratified into groups mild and severe AC. Groups differed regarding NT-proBNP levels, CHA2DS2-VA score, LA TTE parameters and AF recurrence. We identified novel parameters to characterize LA myocardium by analyzing the full distribution of SAs across the entire LA using an open, investigator-independent strategy. SA-independent features including NTproBNP, CHA2DS2-VA score and echocardiographic measures of LA function consistently differed between mild and severe AC groups stratified by these novel parameters. This approach may not only facilitate a more precise characterization of AC but also advance automated analytic methods applicable during endocardial mapping and ablation of AF."
OpenAlex,valvular heart disease,"Retrospective Analysis of Totally Implantable Venous Access Ports which was Performed using the Patient’s Height as a Guide, and the Effect of Catheter Tip Position on Complications",Hakkıcan Akpolat; Serdar Demirgan; Sezen Kumaş Solak; Emine Sönmez; Rasim Onur Karaoğlu; Ayşin Selcan,10.4274/tjar.2026.252308,2026-04-15,Türk anesteziyoloji ve reanimasyon derneği dergisi,Positioning the catheter tip below the carina and preferring IJV as the first-choice catheterization site may reduce complications.
OpenAlex,valvular heart disease,Diagnostic performance of lung ultrasound compared to thoracic radiography in non-traumatized dogs and cats with respiratory distress in an emergency setting,Doris Bittenecker; Kaye Mohr; Florian Sänger; René Dörfelt; Katarzyna Kraszewska; Wolfgang Henninger; Gerhard Wess,10.3389/fvets.2026.1790755,2026-04-15,Frontiers in Veterinary Science,"Introduction Respiratory distress is a medical emergency requiring rapid diagnostic decision-making. This prospective observational study evaluated the efficiency and diagnostic performance of lung ultrasound (LUS) and thoracic radiography (TXR) in dogs and cats presenting with tachypnea. Imaging-based suspected diagnoses were compared with definitive diagnoses established by specialists using additional diagnostic procedures. The influence of observer experience on diagnostic accuracy was assessed. Methods Client-owned animals with suspected intrathoracic causes of respiratory distress underwent both LUS and TXR within 24 h of presentation, with a maximum interval of 1 h between examinations. Imaging was performed according to standardized protocols. Based on imaging findings, the suspected cause of breathing difficulties was categorized as: no detectable intrathoracic cause, cardiac-related respiratory distress, pulmonary disease, neoplasia, or pleural effusion of unknown etiology. Following stabilization, patients were referred to specialists for establishment of the definitive diagnosis. Concordance between suspected and definitive diagnoses was analyzed separately for each modality to assess diagnostic performance. Selected cases were re-evaluated in a blinded fashion by observers with three different levels of experience. Results A total of 144 animals (83 dogs and 61 cats) with acute respiratory distress were included. The suspected diagnosis based on LUS was concordant with the definitive diagnosis in 80.6% of cases, while TXR achieved 89.1%. Both modalities were correct in 77.5% of cases, and at least one modality was correct in 92.2%. Diagnostic accuracy of TXR was statistically significantly higher than that of LUS (absolute difference 8.5%). In dogs, the presence of a heart murmur was strongly associated with a cardiac cause of respiratory distress (odds ratio 10.9), whereas this association was not statistically significant in cats. In the blinded re-evaluation, TXR demonstrated higher interobserver agreement (Fleiss’ kappa = 0.69). The highest agreement was achieved by a less experienced observer, with a Cohen’s kappa of 0.8 for TXR. Conclusion Both LUS and TXR are valuable imaging modalities for initial classification of respiratory distress, each offering specific advantages depending on the underlying pathology. In most cases, these techniques provide sufficient information to guide initial therapeutic decisions; however, a multimodal approach is recommended for complex presentations."
OpenAlex,valvular heart disease,Hypocalcemia as a nontraditional risk factor for cardiovascular events and all-cause din patients with chronic kidney disease: insights from the Korean Cohort Study for Outcomes in Patients With Chronic Kidney Disease (KNOW-CKD),Sang Heon Suh; Hong Sang Choi; Chang Seong Kim; Eun Hui Bae; Kook-Hwan Oh; Jayoun Kim; Suah Sung; Young Youl Hyun; Jong Cheol Jeong; Sangjun Lee; Sue K. Park; Seong Kwon Ma; Soo Wan Kim; on behalf of the Korean Cohort Study for Outcomes in Patients With Chronic Kidney Disease (KNOW-CKD) Investigators,10.23876/j.krcp.25.266,2026-04-15,Kidney Research and Clinical Practice,"Hypocalcemia is significantly associated with the risk of adverse cardiovascular outcomes in patients with non-dialysis CKD. As a nontraditional risk factor for cardiovascular events and all-cause death in this population, the presence of hypocalcemia should urge more intense monitoring for the development of cardiovascular events."
OpenAlex,valvular heart disease,The Relationship Between Serum Amyloid A Protein and Short-Term Adverse Cardiovascular Outcomes in Older Patients with STEMI: A Prospective Study,Xinying Yang; Xinhui Wang; Chen Chen; Xianjing Xu; Xuanchao Cao; Yunfei Wang; Peng Qian; Hongyan Duan,10.21203/rs.3.rs-9015088/v1,2026-04-14,Research Square,
OpenAlex,valvular heart disease,A risk assessment nomogram for cardiac remodeling in the multimorbid geriatric patients: a retrospective study,B A Liu; Jian Xiao; Fei Li; Lan Hu; Ya Ting Liu; Dan Hong,10.1186/s12877-026-07462-2,2026-04-14,BMC Geriatrics,"Myocardial remodeling is a key precursor to heart failure and adverse cardiovascular outcomes. While comorbidities such as hypertension, diabetes, and chronic kidney disease are prevalent in the geriatric population. Early identification of risk factors for myocardial remodeling could improve clinical outcomes in this population. This retrospective study analyzed data from older patients (≥ 60 years) at Xiangya Hospital (n = 306). Clinical, echocardiographic, and biochemical data were collected, and myocardial remodeling was defined using standardized criteria. Multivariate logistic regression identified associated factors, which were incorporated into nomograms for left and right heart remodeling. Model performance was assessed using receiver operating characteristic curves, calibration plots, and decision curve analysis. The following factors were associated with myocardial remodeling: myocardiopathy, arrhythmia, valvular disease, PCI, diabetes mellitus, smoking history, male sex, renal function (including eGFR, urea, and uric acid), thyroid dysfunction, and albumin levels. This study developed nomograms that provide a practical tool for early risk stratification, enabling targeted monitoring and intervention in the geriatric population. The Ethics Committees at Xiangya Hospital, Central South University, accepted the study protocol with a waiver of informed consent (No. 2025060932)."
OpenAlex,valvular heart disease,Fisioterapia na insuficiência cardíaca: efeitos sobre qualidade de vida e tolerância ao esforço.,Darlyson Martins Garreto; Ian Gonçalves Lages dos Santos; Kalinne Araújo de Mesquita; Layla Grazyelle dos Santos Costa; Murilo de Jesus Mendes Souza Barros; Natália Meireles Costa Mascarenhas; Sauandra Muriely Sousa Freitas; Thamyres de Melo Lobo; Kathlleen Vitoria Vasconcelos Saturino,10.69849/9grtaf17,2026-04-14,Revista fisio&terapia.,"Introdução:Analisar a produção científica da última década (2016–2026) sobre as intervenções fisioterapêuticas na Insuficiência Cardíaca (IC), identificando as metodologias mais prevalentes e seu impacto na capacidade funcional e qualidade de vida. Metodologia: Trata-se de uma revisão bibliográfica de abordagem qualiquantitativa, realizada nas bases de dados PubMed e BVS. A estratégia de busca utilizou descritores controlados (DeCS/MeSH) cruzados por operadores booleanos. O processo de seleção seguiu as diretrizes do protocolo PRISMA, utilizando processamento automatizado em linguagem R para a triagem de 273 registros iniciais. Após a exclusão de duplicatas, modelos animais e revisões prévias, a amostra final foi composta por 170 artigos para leitura integral e extração de dados. Resultados e Discussão: A análise evidenciou o predomínio de protocolos de reabilitação cardiovascular convencional e exercícios sistêmicos (aeróbicos, resistidos e intervalados de alta intensidade), abordados em 96 publicações, reafirmando-os como referência terapêutica para melhora da fração de ejeção e redução de hospitalizações. Com um valor menos expressivo, mas com relevância crescente, destacaram-se estratégias adjuvantes como a estimulação elétrica neuromuscular (n=3), o treinamento muscular inspiratório (n=1) e métodos voltados ao desempenho funcional. A reabilitação domiciliar (home-based cardiac rehabilitation) emergiu como uma alternativa viável e segura, apresentando níveis de adesão superiores aos modelos ambulatoriais tradicionais. Conclusão: a intervenção fisioterapêutica consolida-se como pilar indispensável no manejo da IC. A diversificação das metodologias, integrando exercícios convencionais a terapias tecnológicas e domiciliares, permite uma assistência personalizada que reverte a intolerância ao esforço, promove autonomia e eleva significativamente a qualidade de vida e a dignidade dos pacientes."
OpenAlex,valvular heart disease,"Four-year cardiac geometry, blood pressure, and immune profiles after multisystem inflammatory syndrome in children",Yıldız Ekemen Keleş; Özgür Özdemir Şimşek; Yeliz Sevinç; Ulaş Karadaş; Zafer Çil; Dilek Yılmaz,10.1017/s1047951126112141,2026-04-14,Cardiology in the Young,"Four years after multisystem inflammatory syndrome in children, ventricular enlargement appears to reflect physiological scaling rather than persistent hypertrophy, supporting the need for continued long-term surveillance in this population."
OpenAlex,valvular heart disease,Cryoballoon-Based Left Atrial Appendage Isolation and Closure in Patients with Atrial Fibrillation—The LALALAND Pilot Study,Christian-H. Heeger; Samuel Reincke; S S Popescu; Sascha Hatahet; Behnam Subin; Anna Traub; Karl-Heinz Kuck; Charlotte Eitel; Roland R. Tilz,10.3390/jcm15082980,2026-04-14,Journal of Clinical Medicine,"Background: Atrial fibrillation (AF) remains the most common cardiac arrhythmia, with pulmonary vein isolation (PVI) established as the cornerstone of interventional treatment. However, in patients with persistent AF (PersAF), the success rates of PVI alone tend to be limited. A promising additional target is the left atrial appendage (LAA). In recent years, cryoballoon (CB) technology has become a tool for achieving durable PVI. Its application for LAAI has been investigated as a potentially advantageous alternative to radiofrequency ablation, and a positive effect on long-term outcome has been reported. However, the available data is limited. This study sought to investigate the clinical impact of CB-based LAAI in addition to PVI. Methods: This is a prospective, interventional, single-centre study. Consecutive patients with symptomatic PersAF were prospectively enrolled. In total 23 patients with PersAF underwent PVI plus LAAI using the CB system. Percutaneous LAA closure was performed within 2–3 months in all patients by implanting an endocardial LAA-closure device. Prior to LAA closure, LAAI durability was systematically assessed by invasive remapping studies. Results: A total of 100% of PVs were successfully isolated using the CB only (n = 91/91). Concerning LAAIs, a total of 21/23 (91%) remained isolated at the end of the procedure. After the ablation procedure including LAAI, all patients were scheduled for TEE assessment and LAA closure. TEE was performed after a mean of 54 ± 19 days. In 6/23 (26%) patients, LAA thrombus formation was detected after LAAI. A total of 23/23 patients (100%) received LAAC after a mean of 72 ± 45 days. Durability of LAAI was assessed utilizing a spiral mapping catheter in 23/23 patients (100%). In a total of 17/23 (74%) patients, durable LAA isolation was detected. Durable PVI of all PVs was detected in 16/23 (70%) patients. During a mean follow-up of 13 ± 3.4 months, stable sinus rhythm was maintained in 15 (65%) patients. The LAA showed reconnection in 3/23 (13%) patients, with arrhythmia recurrence. During follow-up, one stroke (318 days after LAAC) and one device thrombus (56 days after LAAC) occurred. Conclusions: While CB-based LAAI may offer benefits in managing persistent AF, it presents a significant risk of thrombus formation in the LAA, even with appropriate OAC. Early closure of the LAA following LAAI appears promising in mitigating these risks, but further evidence is needed to establish clear best practices."
OpenAlex,valvular heart disease,Pharmacogenomics of direct oral anticoagulants: a systematic review and meta-analysis,Hua Chai; Jiani Huo; Hao Chen,10.3389/fcvm.2026.1792186,2026-04-14,Frontiers in Cardiovascular Medicine,"Background Direct oral anticoagulants (DOACs) exhibit considerable individual variability in effectiveness and bleeding risk, possibly due to genetic differences. This study assessed how genetic polymorphisms impact the pharmacokinetics (PK) and outcomes of DOACs. Methods We searched the PubMed, Embase, Web of Science, and Cochrane Library databases for pharmacogenomic studies related to DOACs up to October 29, 2025. Meta-analyses were performed using RevMan 5.4 for evaluated results with ≥3 studies. Results Thirty-nine studies involving 13,300 patients were included, with 19 studies eligible for meta-analysis. For dabigatran, carriers of the CES1 rs2244613 C allele was associated with both lower trough concentration (C trough ) and reduced bleeding risk compared with AA homozygotes. CES1 rs8192935 and ABCB1 rs4148738 were also associated with dabigatran exposure. For rivaroxaban, the ABCB1 rs1045642 TT genotype was consistently associated with lower dose-adjusted C trough across four subgroups. Polymorphisms in ABCB1 rs1045642 were linked to altered bleeding risk, whereas ABCB1 (rs1128503, rs4148738, rs2032582), ABCG2 rs2231142, CYP3A5 rs776746, and CYP2J2 rs890293 showed no statistically significant association with bleeding events. For apixaban, ABCG2 rs2231142 may influence PK profiles, while ABCB1 rs1045642 was associated with a reduced risk of bleeding. In the case of edoxaban, polymorphisms in SLCO1B1 may affect metabolite exposure and contribute to variability in bleeding risk. Conclusion Genetic polymorphisms in CES1 , ABCB1 , and SLCO1B1 are associated with variability in the PK and bleeding risk of DOACs. However, due to the observational nature, heterogeneity, and limited sample sizes of included studies, current evidence is insufficient to support genotype-guided dosing in clinical practice. Large prospective studies are needed to validate these findings. Systematic Review Registration PROSPERO CRD420251240030."
