source,keyword,title,authors,doi,publication_date,journal,abstract
OpenAlex,aortic stenosis,Aortic valve stenosis promotes pathological shear stress-dependent epigenomic dysregulation in circulating T cells.,Yunyang Zhang; Jan Lucas Kleiner; Jimmy Zheng; Frank Splettstoesser; Sebastian Zimmer; Mark Coburn; Christina Weisheit; Stilla Frede; Mark Emile Pepin,10.64898/2026.05.17.722103,2026-05-19,bioRxiv (Cold Spring Harbor Laboratory),"Background. Calcific aortic valve stenosis (AVS) is the most prevalent valvular heart disease in Western adults, yet no disease-modifying therapy exists. High shear stress (HSS) generated by progressive valvular obstruction drives endothelial injury and immune-mediated inflammation, but the contribution of circulating T cells to AVS pathogenesis remains poorly defined. Objectives. We tested whether chronic HSS corresponds with epigenomic reprogramming of peripheral T cells proportionate with hemodynamic severity to yield a clinically informative proxy of disease. Methods. A prospective cohort of 70 participants was recruited for peripheral blood sampling, including 34 with severe symptomatic AVS (aortic valve area &lt;1.0 cm2, mean gradient &gt; 40 mmHg) scheduled for transcatheter aortic valve implantation and 36 age- and sex-matched controls. Peripheral T cells were isolated and profiled by genome-wide CpG methylation (Illumina MethylationEPIC) and RNA-sequencing. To test whether HSS directly activates inflammatory signaling, Jurkat T cells were exposed to 20 dyn/cm2 HSS via parallel-plate microfluidic chamber and concomitant CD3/CD28 stimulation, followed by assessment of NFAT nuclear translocation and NFAT target gene expression. Results. Unsupervised clustering of the 5,000 most-variable CpG loci resolved an epigenomic axis segregating AVS from control T cells (PC1 = 15.8% variance; P = 3.9x10-6). Multivariable-adjusted analysis identified 3,950 differentially methylated positions (1,889 hyper-, 2,061 hypo-methylated), enriched in promoter-associated CpG islands implicating aortic valve morphogenesis and immune adhesion pathways. Multi-omics factor analysis isolated a latent factor that independently associated with AVS (FDR = 1.8x10-3; AUC = 0.79), enriched for chemokine receptor binding and TNF-family signaling, and correlated with canonical HSS-responsive transcripts, consistent with a T cell-mediated shear stress activation. An 18-CpG elastic-net methylation risk score discriminated AVS from controls (AUC = 0.89) and independently predicted hemodynamic severity (P = 0.008). HSS augmented NFAT nuclear translocation in CD3/CD28-activated Jurkat T cells and induced NFAT-responsive inflammatory transcripts. Conclusions. Severe AVS is associated with promoter-enriched epigenomic remodeling of circulating T cells that converges on hemodynamic stress-dependent inflammatory programs. An 18-CpG methylation risk score outperforms clinical covariates and tracks hemodynamic severity, establishing peripheral T cell DNA methylation as a molecular corollary of AVS."
OpenAlex,aortic stenosis,Value of Coronary CT Angiography in Ruling Out Coronary Artery Disease in Elderly Patients Candidates to TAVI,Mattia Alexis Amico; Andrea Taddei; Matteo Casini; Carlo Fumagalli; Manlio Acquafresca; Mario Moroni; Angela Migliorini; Francesco Meucci; Carlo Di Mario; Niccolò Marchionni; Renato Valenti; Nazario Carrabba,10.3390/jpm16050272,2026-05-19,Journal of Personalized Medicine,"Background: Coronary computed tomography angiography (cCTA) is now indicated as a non-invasive tool for ruling out obstructive coronary artery disease (O-CAD) in patients who are candidates for transcatheter aortic valve implantation (TAVI) showing low-intermediate pre-test probability of O-CAD. In elderly and comorbid TAVI candidates, the safety and accuracy of cCTA as an alternative to invasive coronary angiography (ICA) for ruling out O-CAD remain to be established. Aim: To assess the feasibility, diagnostic accuracy, and clinical safety of cCTA for ruling out proximal O-CAD in elderly, comorbid, high-risk patients undergoing TAVI. Methods: We conducted a retrospective, single-center study including all consecutive patients with severe symptomatic aortic stenosis who underwent TAVI between January 2019 and December 2020. All patients underwent pre-TAVI cCTA. Patients with positive or non-diagnostic cCTA underwent ICA selectively (ICA group). In patients with no-O-CAD, ICA was omitted and proceeded directly to TAVI (no-ICA group). Accordingly, patients were divided into two groups: no-ICA and ICA group. Clinical follow-up was extended up to 5 years, with assessment of major adverse cardiovascular events (MACEs), mortality, heart failure hospitalizations, and unplanned revascularization. Results: Among 355 patients enrolled, 210 were included in the study. Among them, 140 (66.7%) had negative cCTA for O-CAD, and ICA was safely omitted in 132 patients (62.8%). cCTA was inconclusive in 43 patients (20.5%) and positive in 27 (12.9%). ICA confirmed O-CAD in 53 of 78 patients (67.9%) and PCI was performed in 35 of 53 (66.0%). The accuracy of cCTA for ruling in O-CAD was low (66.28%). During the follow-up period (1513 ± 508 days), the no-ICA group showed comparable outcomes to the ICA group in terms of periprocedural complications and long-term results—at both 1 and 5 years—for MACEs, heart failure hospitalizations, mortality and unplanned revascularization. Outcomes remain comparable between the two groups after performing matched-pair analyses. Conclusions: Our data show that cCTA may provide a reliable, safe, and effective alternative to ICA for ruling out obstructive CAD in elderly patients undergoing TAVI when image quality is diagnostic. A cCTA-based strategy allows deferral of ICA in most cases without compromising procedural safety or long-term clinical outcomes, enabling a personalized and tailored clinical pathway. Whether advanced CT techniques, such as CT-FFR and photon-counting CT, may help refine patient selection for invasive coronary assessment remains to be demonstrated."
OpenAlex,mitral regurgitation,Outcomes Associated with Mitral Regurgitation Reduction and Myocardial Work After Mitral Valve Transcatheter Edge-to-Edge Repair in Dogs,Soontaree Petchdee; Ying Xufeng; Suchada Huttayananont; Kotchapol Jaturanratsamee; Chattida Panprom; Wannisa Meepoo; Ratikorn Bootcha,10.20944/preprints202605.1279.v1,2026-05-20,Preprints.org,"Transcatheter edge-to-edge repair (TEER) is a recent minimally invasive method of managing mitral regurgitation (MR) in dogs with myxomatous mitral valve disease (MMVD). The goal of interventions is to minimize MR severity. The objective of this study was to determine the association between reduced MR and changes in myocardial work indices after TEER in dogs. Client-owned dogs with moderate-to-severe MR were enrolled in the study. TEER performance was completed with multimodal imaging guidance in all 10 dogs. Before and after the procedure, myocardial work was analyzed. MR severity, transmitral pressure gradients, left atrial and ventricular measurements, and index of myocardial work (GWI, GCW, GWW, and GWE) were calculated. TEER significantly reduced MR severity in the majority of dogs. MR decrease was associated with a greater efficiency of myocardial work, more constructive work, and less wasted energy. No significant negative associations of moderate post-procedure gradients with short-term clinical outcomes emerged. TEER-mediated reduction of MR improves myocardial function in dogs. However, long-term studies are also needed to examine the effects of residual MR and transmitral gradients on cardiac function and clinical outcome."
OpenAlex,mitral regurgitation,Outcomes of Robotic Mitral Valve Repair for Degenerative Mitral Valve Regurgitation in Patients Aged ≥80 Years　― Its Role in the Era of Expanding Transcatheter Edge-to-Edge Repair ―,Miho Kuroda; Taisuke Nakayama; Kasumi Tamagawa; Yuka Higuma; Kusumi Niitsuma; Miku Konaka; Ken Niitsuma; Yuto Yasumoto; Satoshi Okugi; Yujiro Hayashi; Ryo Tsuruta; Yujiro Ito; Hiroaki Yusa; Yoshitsugu Nakamura,10.1253/circrep.cr-26-0052,2026-05-20,Circulation Reports,
OpenAlex,mitral regurgitation,Aspects OF the Pediatric Non-Rheumatic Myocardial Disease Clinical AND Functional Course,Rasulova Nazokat Shavqiddin qizi; Raupov Abdurahmon Ortiq o’g’li,,2026-05-20,Neliti,"According to the World Health Organization, ""myocarditis is an inflammatory disease of the myocardium, accompanied by dysfunction of the heart, and is diagnosed on the basis of established histological, immunological and immunohistochemical criteria."" They can occur in children of all ages. Among children who died before the age of 10 months, they were found in 9% of cases. Clinically, non-rheumatic myocarditis in children is characterized by polymorphism, which can vary from asymptomatic forms to pronounced symptoms of severe refractory heart failure. All this indicates the relevance of studying this pathology in pediatric practice."
OpenAlex,mitral regurgitation,Sex and Atrial Fibrillation Independently Stratify Cardiac Remodeling and Outcomes in Heart Failure with Preserved Ejection Fraction,Diana-Ruxandra Hădăreanu; Flavia-Mihaela Stoiculescu; Călin-Dinu Hădăreanu; M Iovanescu; Anca Mihu-Marinescu; Georgică-Costinel Târtea; Ionuț Donoiu; Oana Munteanu-Mirea; Răzvan-Ilie Radu; Eugen-Nicolae Țieranu; O Istratoaie; Cristina Florescu,10.3390/biomedicines14051160,2026-05-20,Biomedicines,"Background/Objectives: Atrial fibrillation (AF) is common in heart failure with preserved ejection fraction (HFpEF) and is associated with worse symptoms and prognosis. Emerging evidence suggests that sex modifies the AF–HFpEF relationship through differences in atrial remodeling, comorbidity burden, and hemodynamic vulnerability. This study aimed to evaluate how sex and AF jointly relate to differences in cardiac structure, clinical characteristics, and outcomes in HFpEF. Methods: We retrospectively analyzed 622 patients with HFpEF admitted between January 2019 and May 2023. Patients were categorized into four predefined clinical subgroups: women without AF, women with AF, men without AF, and men with AF. The primary endpoint was first rehospitalization for HF decompensation. Results: Over a mean follow-up of 48.6 ± 16.4 months, 181 patients (29.1%) were rehospitalized for worsening HF, with the highest event burden observed in men with AF. Sex and AF were each associated with distinct clinical and remodeling profiles, without significant sex-by-AF interaction effects. AF was independently associated with a higher risk of HF rehospitalization (HR 1.45, 95% CI 1.06–1.99, p = 0.021), whereas female sex was protective (HR 0.71, 95% CI 0.53–0.97, p = 0.032). Men with AF exhibited the most adverse remodeling profile, characterized by the largest unindexed left atrial and left ventricular dimensions, the highest prevalence of significant tricuspid regurgitation, and the lowest event-free survival (HR 1.92, 95% CI 1.23–2.99, p = 0.004). In contrast, women with AF more frequently displayed concentric remodeling and significant mitral regurgitation. Independent predictors of rehospitalization included higher NYHA functional class and lower left ventricular EF within the preserved EF range. Conclusions: Sex and AF were independently associated with substantial differences in cardiac structure, clinical characteristics and prognosis in HFpEF. Men with AF represent the highest-risk subgroup, driven by more advanced structural remodeling and valvular dysfunction. These findings suggest that simple sex- and rhythm-based classification may provide complementary information for risk stratification and management in HFpEF. Further validation in independent cohorts is warranted."
OpenAlex,mitral regurgitation,"Prevalence, Genetics, and Imaging Characteristics of Patients with Mitral Valve Prolapse and Arrhythmogenic Right Ventricular Cardiomyopathy",Amy Hannah Rich; Lionel Tastet; Luca Cristin; Rohit Jhawar; Janet Tang; Melvin Scheinman; Francesca Delling,10.64898/2026.05.14.26353246,2026-05-19,medRxiv,"Background: Concomitant arrhythmogenic right ventricular cardiomyopathy (ARVC) and mitral valve prolapse (MVP) has only been described in case reports. Little is known about genetic and phenotypic characteristics of these patients. Objective: To describe the prevalence, genetics, and imaging characteristics of MVP in ARVC patients. Methods: We identified 111 definite ARVC cases through medical record review, arrhythmia/cardiomyopathy targeted gene panels, and contrast cardiac magnetic resonance data. MVP was diagnosed on echocardiography as mitral leaflet displacement greater than 2 mm above the annular plane in systole, with borderline MVP defined as less than or equal to 2 mm. Results: We found MVP/borderline MVP in 14% of ARVC patients. Cardiac arrest occurred in 20% of those with MVP/borderline MVP compared to 16% without valve abnormalities. Among 69 ARVC patients with identified genetic variants, PKP2 mutations were highly prevalent (64%), particularly in those with MVP (83%). Most MVPs had posterior prolapse (73%) and trace/mild mitral regurgitation (87%). None had mitral annular disjunction. ARVCs with MVP had higher LV mass (93 vs. 75 g/m2, p = 0.02) and a higher prevalence of LV wall motion abnormalities (27% vs. 5%, p = 0.02) compared to ARVCs without valve abnormalities. Conclusions: MVP is prevalent in ARVC and characterized by PKP2 variants in most cases. Typical features of arrhythmic MVP like bileaflet involvement and annular disjunction are rare in ARVC with MVP; features of arrhythmogenic left-sided cardiomyopathy (increased LV mass index and wall motion abnormalities) are more common. Further studies are needed to understand the role of MVP in arrhythmic risk stratification of ARVC."
OpenAlex,mitral regurgitation,Role of Exercise Stress Elastography for Investigating Shortness of Breath,Takahiro Sakamoto; Kazuto Yamaguchi; Seita Yamasaki; Kazuaki Tanabe,10.1253/circrep.cr-26-0048,2026-05-19,Circulation Reports,
OpenAlex,mitral regurgitation,Echocardiography for the Assessment of Coronary Artery Disease,ParimalaPrasanna Simha; Lakshmi Adalagere Sathyanarayana,10.5005/jp-journals-10089-0225,2026-05-19,Journal of Acute Care,"Review ARticlecauses of shock such as cardiac tamponade, acute severe valvular disease, aortic dissection, or pulmonary embolism. 1,3A schematic representation of the progression of manifestations with varying degrees of obstruction to the coronary artery from normal caliber to full blockade is shown in Figure 1.Focused protocols and mnemonics can facilitate rapid assessment in the emergency and intensive care environments.The A-F mnemonic (A-aorta, B-both ventricles, C-contractility, D-dimensions, E-effusions, F-further evaluation) provides a pragmatic framework for systematic evaluation.In chronic coronary syndromes, echocardiography is integrated with anatomic imaging (CTCA, invasive angiography) to evaluate ischemia burden, viability, and microvascular dysfunction, increasingly within multimodality imaging pathways. [4][5][6] Assessment o f IschemIA, InfArctIon, A n d VIAbIlIty Regional Wall Motion AbnormalitiesRegional wall motion abnormalities (RWMA) remain the cornerstone echocardiographic sign of acute or chronic echocArdIogrAphy I n contemporAry coronAry Artery dIseAsecAreEchocardiography is recommended as first-line imaging in patients with suspected or established coronary artery disease (CAD) for differential diagnosis of chest pain, assessment of global and regional ventricular function, and evaluation of hemodynamic instability. 1,2urrent European Society of Cardiology (ESC) and American Heart Association (AHA)/American College of Cardiology (ACC) guidelines emphasize early transthoracic echocardiography (TTE) to identify regional wall motion abnormalities (RWMA), quantify left ventricular ejection fraction (LVEF), detect complications, and guide revascularization and device strategies. 1,2In ACS, echocardiography complements electrocardiography (ECG) and high-sensitivity troponin by rapidly confirming or excluding myocardial ischemia, detecting mechanical complications, and distinguishing alternative 1,"
OpenAlex,mitral regurgitation,A 22-Year-Old Postpartum Female with Quadriparesis Secondary to Sjögren's Syndrome: A Case Report,Dr. G Nithin Kumar; Dr. Naveen S Angadi,10.25258/ijddt.16.29s.30,2026-05-19,International Journal of Drug Delivery Technology,"Background: Sjögren's syndrome is a chronic autoimmune exocrinopathy that may involve multiple organ systems. Renal involvement in the form of distal renal tubular acidosis (dRTA) can lead to severe hypokalemia, occasionally manifesting as acute flaccid motor weakness, which can mimic neuromuscular or endocrine emergencies in postpartum females. Case Presentation: A 22-year-old woman, six months postpartum, presented with acute onset progressive quadriparesis associated with severe lower limb pain and one brief episode of loss of consciousness. Initial clinical suspicion included Sheehan's syndrome due to postpartum status and hypotension. Examination showed symmetric quadriparesis with preserved reflexes. Investigations revealed persistent hypokalemia and normal anion gap metabolic acidosis. Autoimmune evaluation demonstrated ANA, Anti-Ro/SSA and Anti-La/SSB positivity. Schirmer's test confirmed ocular dryness. She was diagnosed with Sjögren's syndrome–associated distal RTA. Potassium and bicarbonate therapy led to rapid improvement. In postpartum women presenting with quadriparesis, autoimmune dRTA should be considered, especially when persistent hypokalemia accompanies metabolic acidosis. Early diagnosis of Sjögren's syndrome enables targeted therapy and prevents long-term complications."
OpenAlex,mitral regurgitation,Variations in Diagnosis and Management of Hemodynamically Significant Patent Ductus Arteriosus Across Neonatal Intensive Care Units in the Children’s Hospitals Neonatal Consortium,Sharada Gowda; Philip Levy; Shannon Hamrick; Sarah Keene; Shawn Sen; Ayan Rajgarhia; Rakesh Rao; Molly Ball; Mark Weems,10.21203/rs.3.rs-9611532/v1,2026-05-19,Research Square,
OpenAlex,mitral regurgitation,When an Atrial Septal Defect Is No Longer Silent: A Case Report of a Large Symptomatic Defect Presenting in Adulthood,Joshua D Greendyk; Afif Hossain; Vinesh R Jonnala; William E Allen,10.7759/cureus.109183,2026-05-19,Cureus,"Atrial septal defects (ASDs) are among the most common forms of congenital heart disease diagnosed in adulthood. Ostium secundum defects represent the majority of cases and may remain clinically silent for decades. Delayed diagnosis can lead to progressive right-sided cardiac chamber dilation, pulmonary hypertension, arrhythmias, and heart failure. The choice between percutaneous and surgical closure depends on anatomical characteristics such as defect size and the adequacy of surrounding septal rims. We report the case of a 49-year-old woman with hypertension, type 2 diabetes mellitus, and hyperlipidemia who presented with one week of substernal chest pain, palpitations, and progressive dyspnea on exertion consistent with New York Heart Association (NYHA) functional class III limitation. Physical examination revealed a holosystolic murmur best heard along the tricuspid area with inspiratory accentuation. Transthoracic echocardiography identified a large secundum ASD measuring 35 mm × 22 mm with elevated pulmonary artery systolic pressure and right-sided chamber dilation. Transesophageal echocardiography confirmed a large defect with minimal aortic rim and limited atrioventricular valve rim, precluding percutaneous closure. Cardiac catheterization demonstrated bidirectional shunting with a Qp/Qs ratio of 2.65 and normal pulmonary vascular resistance. The patient subsequently underwent successful surgical ASD closure using a bovine pericardial patch. Her postoperative course was uncomplicated, with complete resolution of symptoms and normalization of pulmonary artery pressures on follow-up echocardiography six months later. This case highlights the potential for large ASDs to remain undiagnosed until adulthood, when progressive right-sided cardiac remodeling leads to symptomatic disease. Early detection through timely echocardiographic evaluation is critical to facilitate timely intervention and may expand eligibility for less invasive percutaneous repair. Prompt recognition and closure of hemodynamically significant ASDs can prevent irreversible cardiopulmonary complications and significantly improve long-term outcomes."
OpenAlex,mitral regurgitation,Conventional cardiac resynchronization therapy upgrading and its effect on functional mitral regurgitation in patients with pacing-induced cardiomyopathy,Agne Adukauskaite; Dalia Adukauskiene; Thomas Senoner; Valentin Bilgeri; Philipp Spitaler; Andrea Rubatscher; Wilfried Schgör; Markus Stühlinger; Bernhard Erich Pfeifer; Florian Hintringer; Wolfgang Dichtl; Fabian Barbieri,10.3389/fcvm.2026.1758374,2026-05-19,Frontiers in Cardiovascular Medicine,"Background Data on the effects of conventional cardiac resynchronization therapy (CRT) upgrading by implantation of a left ventricular lead via the coronary sinus on functional mitral regurgitation (MR) in patients with pacing-induced cardiomyopathy are scarce. Methods This analysis of the UPGRADE study, an investigator-initiated randomized controlled trial to evaluate the effect of conventional CRT on central sleep apnea, evaluated the significance of CRT on MR in all included patients. Differences in all-cause mortality were assessed in patients with significant MR during long-term follow-up. Results Overall, 54 patients were included in the trial. MR was found in the majority of patients [mild: n = 30 (55.6%), moderate: n = 15 (27.8%), severe: n = 6 (11.1%)], while “none/trace” MR was observed in only three (5.6%) patients. CRT was associated with a significant reduction in MR [“none/trace”: n = 5 (9.6%), mild: n = 37 (71.2%), moderate: n = 6 (11.5%), severe: n = 4 (7.7%); p = 0.035)] after 3–5 months, with all patients either having an improvement in MR grading or it remaining unchanged. Notably, only two patients with severe MR improved to either a mild or moderate level. CRT upgrading was linked to a significant amelioration of vena contracta width [2 mm (1.0–4.3) at baseline versus 2 mm (1.0–3.0) post-CRT; r = 0.73, 95% CI 0.53–0.85, p &amp;lt; 0.001]. The presence of significant MR at baseline was associated with impaired survival during long-term follow-up [MR &amp;lt; 2: n = 14 (42.4%), MR ≥ 2: n = 19 (90.5%); hazard ratio 0.25 (95% CI 0.12–0.54); log rank p &amp;lt; 0.001]. Conclusion Conventional CRT upgrading in patients with pacing-induced cardiomyopathy was associated with significant improvement in MR grading. The presence of moderate or severe MR at baseline was associated with impaired outcomes during long-term follow-up, suggesting that these patients represent a high-risk cohort."
OpenAlex,mitral regurgitation,Acromelic dysplasias: similarities and differences in clinical and molecular findings in 12 Turkish patients,N. Güneş; S. Türk; H. Onur; K. Gur; C. Yüksel Elgin; E. Çifçi Sunamak; D. Uludağ Alkaya; A. Güler Eroğlu; B. TÜYSÜZ,10.1007/s00431-026-07075-2,2026-05-19,European Journal of Pediatrics,"The purpose of this study is to compare the natural history of clinical and radiologic features in patients with acromelic dysplasias. Twelve patients from nine families with genetically confirmed dysplasia types with acromelia were included in the study, and eight of them were followed-up for a median of 8.1 years. Monoallelic disease-causing variants were identified in FBN1 (acromicric dysplasia, n = 3) and GNAS (Albright hereditary osteodystrophy (AHO), n = 1). Biallelic disease-causing variants in ADAMTSL2 (geleophysic dysplasia type 1, n = 4), ADAMTS10 (Weill-Marchesani syndrome type 1 (WMS1), n = 3), and ADAMTS17 (Weill-Marchesani syndrome type 4 (WMS4), n = 1) were identified. Five novel variants were detected. Short stature was present in all patients. In all patients with geleophysic dysplasia, height normalized during follow-up, and in two, initial acromelia and broad phalanges on hand radiographs resolved over time. Pseudomuscular build, joint limitations, tiptoe walking, and delayed bone age were common findings in geleophysic dysplasia, while patients with WMS1 also had pseudomuscular build, joint limitations, and delayed bone age. Acromicric dysplasia showed mild joint limitation. Intellectual disability was observed only in the WMS4 patient. Spherophakia was specific to patients with WMS. Heterotopic ossification was present in the AHO patient. CONCLUSION: These findings underscore the clinical and genetic heterogeneity of acromelic dysplasias and emphasize that integrated clinical and molecular evaluation is essential for accurate classification and follow-up. WHAT IS KNOWN: • Acromelic dysplasias are rare connective tissue disorders characterized by short stature, brachydactyly, and joint stiffness, caused by variants in genes involved in extracellular matrix organization and TGF-β- related signaling. WHAT IS NEW: • Five novel variants in ADAMTSL2, ADAMTS10, and ADAMTS17 expand the molecular spectrum of acromelic phenotypes. • Tiptoe walking, in association with early findings including short stature, acromelia, and broad proximal phalanges on radiographs, may suggest ADAMTSL2-related geleophysic dysplasia."
