source,keyword,title,authors,doi,publication_date,journal,abstract
Crossref,valvular heart disease,What a Study on Ultraprocessed Fake Meat and Heart Disease Really Found,Lori Y,10.1038/scientificamerican072077-2xmzfca9smsvxelw1jobgf,2077-07,Scientific American,
Crossref,valvular heart disease,Woman Receives Genetically Modified Pig Kidney Transplant after Heart Pump Surgery,Tanya L,10.1038/scientificamerican072077-4hozib8kpx2m6wjvhqi1zz,2077-07,Scientific American,
Crossref,valvular heart disease,Water Lily or Camelotte Sign in Pulmonary Hydatid Cyst – An Orphan Disease,Sudheer Tale; Soibampahel M; Mrudula K; Ritisha B; Subodh K; Girish S,10.23880/cclsj-16000132,2028-11-11,Cell &amp; Cellular Life Sciences Journal,"A 20 – year – old male without any previous comorbidity presented to pulmonary medicine outpatient department with complaints of dull aching chest pain on right side, dry cough and shortness of breath for the pastone year. He was non vegetarian and had no addictions. On general physical examination his vitals were stableand respiratory system examination revealed decreased breath sounds in the right hemithorax. All his routineblood investigations were normal. Chest radiograph revealed homogenous opacity in the right middle andlower zones. Contrast enhanced computed tomography of thorax and abdomen showed a well defined encapsulatedcystic lesion of size 12x10x14cm with internal floating membranes (water lily sign or Camelotte sign) with masseffect on adjacent lung parenchyma causing atelectasis and compression of adjacent vessels (Figure 1). Hydatid serology (IgG) was positive. Patient was treated symptomatically and referred for surgical intervention."
Crossref,valvular heart disease,RELATION OF HEART WEIGHT WITH AGE AND WEIGHT OF CADAVER,Jolly Agarwal; Virendra Kumar,10.21761/jms.v2i01.10838,2027-07-25,SRMS JOURNAL OF MEDICAL SCIENCE,"Introduction: Height, weight, and age of person has significant impact on the normal size of&#x0D; heart. These parameters need to be considered when cut-off values indicating the need for&#x0D; treatment or even surgery are established. The aim of present work is to study the relation of&#x0D; weight of the heart with age and weight of cadaver.&#x0D; Material and Methods: The study was performed in the Department of Anatomy, Shri Ram&#x0D; Murti Smarak Institute of Medical Sciences, Bareilly on 30 hearts from embalmed cadavers.&#x0D; The hearts were procured from the cadavers available in our department. The heart was&#x0D; thoroughly cleaned and measurements were taken.&#x0D; Results: The mean heart weight was 223.37 ± 57.78 g. Significant relationship between age of&#x0D; the cadaver and weight of the heart (p=0.0004), weight of cadaver and weight of heart&#x0D; (p=0.0001) was observed.&#x0D; Conclusion: The above study provides valuable data of the heart in our geographical location,&#x0D; which may be useful for cardiac surgeons and physicians."
Crossref,valvular heart disease,Improving Citrus Leaf Disease Segmentation and Classification with a Game Theoretical U-Net Convolutional LightGBM model,K. Rama Gangi Reddy; K.S. Thirunavukkarasu,10.1504/ijiei.2027.10072915,2027,International Journal of Intelligent Engineering Informatics,
Crossref,valvular heart disease,An Intelligent Approach with Integrated Feature Selection for Accurate Parkinson's Disease Diagnosis,Pravin Madhukar Dhanrao; B.K. Madhavi; Haard Patel; Debabrata Swain; Sashikala Mishra; Het Prajapati; Shrey Joshi,10.1504/ijims.2027.10072985,2027,International Journal of Internet Manufacturing and Services,
Crossref,valvular heart disease,Augmentation of comorbidity assessment of peripheral artery disease using gait biomechanics with self-organization based learning model,Nazia Sultana; PK Kumar,10.1016/j.ijcce.2025.07.002,2026-12,International Journal of Cognitive Computing in Engineering,
Crossref,valvular heart disease,A hybrid deep learning approach based on optimized feature selection on environmental multi-disease predictive models,Selvi. S; Vanathi. A,10.1016/j.ijcce.2025.11.006,2026-12,International Journal of Cognitive Computing in Engineering,
Crossref,valvular heart disease,Disease-related communication difficulties and dyadic coping among patients with breast cancer and their spouses: An actor–partner interdependence model,Lingling Yang; Xi Zhang; Meina Yang; Liping Zhang; Rong Wang; Ting Wang,10.1016/j.apjon.2025.100829,2026-12,Asia-Pacific Journal of Oncology Nursing,
Crossref,valvular heart disease,"Methanol extract of Smritisagara Rasa attenuates neurobehavior, neurochemical and stress indicators in rotenone-induced Drosophila model of Parkinson's disease",G Gopinath; Ramesha Hanumanthappa; Raifa Abdul Aziz; P.C. Kiran; Hemalatha Nanjaiah; Iranna B. Kotturshetty; Shamprasad Varija Raghu; Manjunath Ajanal; Devaraju Kuramkote Shivanna,10.1016/j.abst.2025.11.003,2026-11,Advances in Biomarker Sciences and Technology,
Crossref,valvular heart disease,Multi-omics integration and machine learning reveal biomarker networks and therapeutic targets in Alzheimer's disease,Shreya Satyanarayan Bhat; Vidya Niranjan; Trilok Chandran; Spoorthi R. Kulkarni; Samridhi Makkar; Vishwam Dixit; Cherishma K. Subhasa; Adarsh Vishal,10.1016/j.abst.2025.12.004,2026-11,Advances in Biomarker Sciences and Technology,
Crossref,valvular heart disease,"Investigating the Relationship Between Postpartum Depression, Antenatal Depression, Corona Disease Anxiety, and Personality Traits During the COVID-19 Pandemic",Hanieh Soltani Nejad; Fatemeh Mohtasham; Mahjoubeh Ramezanzadeh; Azam Zare Arashlouei; Atefeh Ahmadi; Adele Dadvar; Saleheh Iranmanesh; Motahare Mirmahmoodi,10.2174/0126667975320431240915165722,2026-10,Coronaviruses,"Introduction and Aim:                     Postpartum depression has a profound impact, both physically and psychologically, on both the mother and her newborn. With a focus on the prevalent psychological complications following the onset of this condition, this study aimed to explore the correlation between antenatal depression and Corona disease anxiety, personality traits, and postpartum depression during the COVID-19 pandemic.                                                           Materials and Methods:                     This cross-sectional descriptive-analytical study investigated women receiving care at health centers affiliated with Kerman University of Medical Sciences during the last month of their pregnancy and the postpartum period in 2022. Following the acquisition of informed consent, participants were assessed using various measures, including demographic and obstetric information, the Edinburgh Postnatal Depression Scale, the Corona Disease Anxiety Scale (CDAS), and the NEO Personality Inventory-Revised during their third trimester of pregnancy. The same group of participants completed the Edinburgh Depression Scale and the Corona Disease Anxiety Scale (CDAS) 4-6 weeks after childbirth.                                                           Results and Discussion:                     There was a significant correlation between family income, unwanted pregnancy as perceived by both the mother and father, and antenatal depression. Additionally, marital satisfaction played a significant role in postpartum depression. Furthermore, antenatal depression was significantly associated with neuroticism, agreeableness, and physical symptoms related to Corona disease anxiety. Personality traits, with the exception of extroversion and conscientiousness, and various domains of Corona disease anxiety, excluding psychological symptoms, were also significantly associated with postpartum depression.                                                           Conclusion:                     During pandemics or epidemics, such as the COVID-19 outbreak, experiencing mental distress during pregnancy can contribute to mental health issues during the postpartum period. This risk is particularly true in individuals with unique personality traits, emphasizing the need for increased focus on mental health within prenatal care during these crises."
Crossref,valvular heart disease,The Severity of Disease and Hospital Length of Stay for the First and Second Admission of COVID-19 Patients: An Observational Study from Southeastern Iran,Milad Ahmadi Gohari; Mohammad Hossein Mehrolhassani; Shoboo Rahmati; Elham Sharifpoor; Hossein Mirzaei; Yunes Jahani,10.2174/0126667975341163241129050027,2026-10,Coronaviruses,"Background:                     This study aimed to investigate the severity of disease and length of hospital stay for COVID-19 patients admitted to a hospital in southeastern Iran.                                                           Method:                     This cross-sectional study was conducted in Kerman, Iran. Data were collected from patients who visited Afzalipour Hospital in Kerman more than twice during the COVID-19 epidemic from the end of February 2020 to March 21, 2021. We conducted two key analyses: 1. Mixed effect logistic regression was used to check the relationship between the variables and COVID-19 severity. 2. Mixed effect linear regression was used to check the relationship between the variables and the length of stay in the hospital.                                                           Results:                     The findings indicated that the most important risk factors for the severity of COVID-19 were heart diseases (OR=1.67,95%CI:1.20-2.30), increasing age (OR=2.23 for age&gt;54, 95%CI:1.70- 2.90), male gender (OR=1.47,95%CI:1.10-1.96), respiratory diseases other than asthma, and frequency of admission (OR=1.60,95%CI:1.20-2.15). All patients who underwent readmission experienced a shorter duration of hospitalization during their subsequent admission (OR=0.94,95%CI:0.91,0.96) and had a higher mortality rate (30% within 14 days, 26.6% between 14-90 days). Patients readmitted at intervals of 14-90 days and greater than 90 days exhibited lower disease severity compared to those readmitted within the 0-14 day period.                                                           Conclusion:                     Examining readmissions, the severity of COVID-19, and the length of hospital stay in affected patients are important factors for planning and allocating resources for COVID-19 management and treatment. These factors can help policymakers develop effective clinical guidelines for hospitalization or outpatient treatment of COVID-19 patients and contribute to reducing the burden of disease in the community."
Crossref,valvular heart disease,An evolutionarily conserved module links TIR signaling to disease resistance,XiaoFei Du; Yu Zhang; Hailong Guo,10.1016/j.ncrops.2025.100083,2026-10,New Crops,
Crossref,valvular heart disease,Molecular Profiling of High-Risk MDR Escherichia coli and K. pneumoniae in Chronic Liver Disease: Correlating fimH Overexpression and Biofilm Intensity with Genotypic Diversity,Ban A. Bader; Shatha T. Ahmed,10.21608/ejmm.2026.449444.2027,2026-10-01,Egyptian Journal of Medical Microbiology,
Crossref,valvular heart disease,The Effects of Bread Fortification with Lupin seeds and Psyllium Husk on Nonalcoholic Fatty Liver Disease in Rats,Shaimaa H Negm; Walaa A.M. Eid; Hany Gaber El-Masry,10.1016/j.jfutfo.2025.06.006,2026-09,Journal of Future Foods,
Crossref,valvular heart disease,Antiglomerular basement membrane disease(Goodpasture syndrome) associated with ANCA-negative central nervous system vasculitis,,10.5546/aap.2025-10816.eng,2026-08-01,Archivos Argentinos de Pediatria,
Crossref,deep learning,Learner profiles and the process of Learning in the Higher Educational Context,Christos Skourlas; Petros Belsis,10.15556/ijiim.02.01.003,2115-03-05,International Journal on Integrated Information Management,
Crossref,deep learning,WEB-BASED COLLABORATIVE LEARNING AND KNOWLEDGE SHARING IN INFORMAL BUSINESS NETWORKS,George Stalidis; Costis Papadimitrakopoulos; Theocharis Tsakiris,10.15556/ijiim.01.02.002,2114-12-10,International Journal on Integrated Information Management,
Crossref,deep learning,Availability and Utilization of Tools and Equipment for Teaching and Learning Garment Making Trade in the Senior Secondary Schools in Edo State,,10.20431/2349-0381.0303002,2106,"International Journal of Humanities, Social Sciences and Education",
Crossref,deep learning,Title Pending 6294,,10.3998/mjcsl.6294,2034-12-20,Michigan Journal of Community Service Learning,
Crossref,deep learning,Title Pending 5730,,10.3998/mjcsl.5730,2034-11-18,Michigan Journal of Community Service Learning,
Crossref,deep learning,Title Pending 3643,,10.3998/mjcsl.3643,2033-09-06,Michigan Journal of Community Service Learning,
Crossref,deep learning,Title Pending 4120,,10.3998/mjcsl.4120,2033-03-28,Michigan Journal of Community Service Learning,
Crossref,deep learning,Title Pending 2741,,10.3998/mjcsl.2741,2032-09-28,Michigan Journal of Community Service Learning,
Crossref,deep learning,Integration of Biomechanics and Digital Technology: Using Kinovea for Motion Analysis and Learning for Beginner Athletes,Muhammad Nur Hudha; Riezky Maya Probosari; Annisa Nur Khasanah; Supurwoko; Salsabila Kholifahtun Nisa’; Gifran Rihla Gifarka Latief,10.58524/jcss.v4i2.890,2029-11-29,Journal of Coaching and Sports Science,"Background: The integration of biomechanics with digital motion-analysis technologies has introduced new approaches for examining movement efficiency, kinematic characteristics, and technical patterns in walking and running activities. Kinovea, as an accessible motion-analysis software, provides both visual and quantitative feedback. However, its application in supporting technique development among beginner athletes remains insufficiently explored. Aim: This study aims to describe the use of Kinovea in biomechanics training and examine its contribution to the awareness of kinematic characteristics and movement techniques among beginner athletes. Methods: A descriptive qualitative design involved 72 beginner athletes aged 18–25 years selected through purposive sampling. Data were collected over 16 weeks through interviews, field observations, and motion video recordings analyzed using Kinovea. Kinematic data focused on joint angles, stride behavior, and movement phases during walking, running, and the flight phase. Qualitative data were analyzed using content analysis with NVivo 12, while kinematic results were interpreted descriptively to identify performance patterns and areas for technical refinement. Result: Kinematic analysis showed coordinated joint-angle patterns across all phases. Walking analysis identified arm swing angles of 50.9°–58.8° and leg separation angles of 64.3°–67.2°, indicating a stable gait rhythm. The running analysis revealed knee angles of 68.8°–69.8° and elbow angles of 87.6°–89.1°, indicating efficient propulsive mechanics. The flight phase demonstrated knee angles of 81.2°–87.8° and elbow angles of 80.4°–88.3°, suggesting effective momentum use and postural stability. These measurements supported stride-efficiency assessment and technique evaluation. Qualitative findings revealed that Kinovea enabled athletes to interpret movement phases and identify technical inefficiencies through slow-motion and frame-by-frame visualization. Conclusion: Kinovea supports basic motion analysis by providing clear kinematic information and helping beginner athletes observe and refine their movement techniques. The findings also offer practical value for coaches by enabling more precise identification of inefficient patterns and guiding targeted corrections during early-stage training."
Crossref,deep learning,Distributed Algorithms for High-Dimensional Statistical Inference and Structure Learning with Heterogeneous Data,Hongru Zhao; Xiaotong Shen,10.5705/ss.202025.0087,2028,Statistica Sinica,
Crossref,deep learning,Botnet Detection in Network Security by means of Deep Neural Network - DBoTPM,Sankarsan Panda; Julia Faith S; C. Manonmani; Sheshang Degadwala,10.1504/ijcis.2028.10073178,2028,International Journal of Critical Infrastructures,
Crossref,deep learning,Zero-Day Intrusion Detection System: Training on Small Datasets with Advanced Data Augmentation and Ensemble Learning,Mehaboob Mujawar; Aasheesh Raizada; Abdullah Gubbi,10.1504/ijims.2028.10075219,2028,International Journal of Internet Manufacturing and Services,
Crossref,deep learning,Simultaneous Estimation and Dataset Selection for Transfer Learning in High Dimensions by a Non-convex Penalty,Zeyu Li; Dong Liu; Yong He; Xinsheng Zhang,10.5705/ss.202024.0423,2028,Statistica Sinica,
Crossref,deep learning,Enhancing Real Time Decision Intelligence through Federated Learning Integration in Edge Computing Networks,M.S. Bennet Praba; M.Vinay Kumar; K.B. Anusha; Nitin Tiwari; Nidal Al Said; K. Kandan,10.1504/ijcis.2028.10073919,2028,International Journal of Critical Infrastructures,
Crossref,deep learning,Uncertainty Quantification for Large-Scale Deep Neural Networks via Post-StoNet Modeling,Yan Sun; Faming Liang,10.5705/ss.202024.0294,2028,Statistica Sinica,
Crossref,deep learning,Dancing in the Rain: The Effectiveness of Mobile Platform for Learning Ten Qira’at,Muhammad Shahrizan Shahrudin; Mu’azah Md. Aziz; Ainul Maulid Ahmad; Abdul Hakim Mahadzir; Muhd Thoriq Asshiddiq Che Ahmad,10.6007/ijarbss/v14-i5/21493,2027-05-02,International Journal of Academic Research in Business and Social Sciences,
Crossref,deep learning,Harnessing IoT anu Machine Learning for Predictive Smart Irrigation Systems: Optimising Water Use and Crop Yield,D. Prathyusha; Pranusha Dogga; Dogga Aswani; Selvani Deepthi,10.1504/ijsse.2027.10068719,2027,International Journal of System of Systems Engineering,
Crossref,deep learning,Efficient Learning of DAG Structures in Heavy-tailed Data,Wei Zhou; Xueqian Kang; Wei Zhong; Junhui Wang,10.5705/ss.202024.0199,2027,Statistica Sinica,
Crossref,deep learning,Prediction of The Recycled Aggregate Concrete Compressive Strength Using Novel Machine Learning Model and Metaheuristic Algorithms,Xiuyuan Li; Zhiyong Wang,10.1504/ijcis.2027.10069677,2027,International Journal of Critical Infrastructures,
Crossref,deep learning,Efficient digital forensic in IoT environment: a hybrid framework using deep-federated learning,Waad Almadud; Asma Abdulghani Al Shargabi,10.1504/ijesdf.2027.10073649,2027,International Journal of Electronic Security and Digital Forensics,
OpenAlex,mitral regurgitation,Successful use of immunoadsorption therapy in advanced dilated cardiomyopathy: A case report,Rendan Zhang; Lvwen Ning; Y. M. Liu; Zhixiong Tan; Lu Kong; Xiaoqing Quan; Xiehui Chen,10.1097/md.0000000000047080,2026-01-09,Medicine,"Rationale: Dilated cardiomyopathy (DCM) is a major cause of chronic heart failure, and some patients continue to deteriorate despite guideline-directed medical therapy. Immunoadsorption (IA), which removes pathogenic autoantibodies, has been proposed as a potential adjunctive therapy, but its clinical use remains limited. This case illustrates the potential benefits of IA in advanced, treatment-refractory DCM. Patient concerns: A 53-year-old woman with a 9-year history of DCM presented with recurrent chest tightness and dyspnea. Despite long-term guideline-directed medical therapy, her symptoms progressively worsened. Diagnoses: The patient had chronic DCM initially diagnosed in the peripartum period, with a left ventricular ejection fraction (LVEF) of 11% at onset. Before IA, echocardiography demonstrated severe systolic dysfunction (LVEF 22%–24%) with significant mitral regurgitation, and laboratory evaluation showed markedly elevated pro-BNP (4454 pg/mL). Interventions: The patient underwent two sessions of immunoadsorption in September 2024, followed by high-dose intravenous immunoglobulin (IVIG) as per standard protocols. Outcomes: Following treatment, her symptoms improved, pro-BNP decreased to 2109 pg/mL, and repeat echocardiography showed an increase in LVEF to 29.2%. Lessons: This case suggests that immunoadsorption may offer clinical benefit in patients with advanced, refractory DCM. While promising, IA remains experimental and requires further investigation in larger, controlled studies."
OpenAlex,mitral regurgitation,Effects of Levosimendan in Patients with Severe Mitral Insufficiency and Left Ventricular Dysfunction Undergoing Transcatheter Edge-to-Edge Repair: A Systematic Review and Meta-Analysis,Stephanie Gladys Kühne; Deborah Penet; Simon Wölbert; Eva Harmel; Damyan Penev; Sebastien Elvinger; Mauro Chiarito; Philip W. J. Raake; Dario Bongiovanni,10.3390/jcdd13010040,2026-01-09,Journal of Cardiovascular Development and Disease,"Severe mitral regurgitation (MR) is one of the most common valvular heart diseases and is frequently associated with advanced left ventricular (LV) systolic dysfunction. Transcatheter edge-to-edge repair (TEER) offers effective symptom relief but may induce abrupt hemodynamic changes leading to afterload mismatch and acute LV failure. Levosimendan may help mitigate this complication by improving contractility, yet evidence supporting its use in this setting is scarce. Therefore, the aim of this study was to systematically evaluate the evidence on the effects of Levosimendan in patients with severe MR and LV dysfunction undergoing TEER. We performed a comprehensive search of PubMed, Embase, Scopus, and Google Scholar. Primary outcomes were postprocedural LV ejection fraction (LVEF) and systolic pulmonary artery pressure (sPAP). Secondary outcomes included procedural success, procedure duration, and in-hospital complications. Five studies comprising 315 patients (n = 141 Levosimendan, n = 174 controls) met the inclusion criteria. Pooled analysis showed no significant difference in postprocedural LVEF between Levosimendan-treated patients and controls (mean difference 0.45%, 95% CI [−1.46–2.35] p = 0.65) and no significant change from baseline. Similarly, postprocedural sPAP did not differ significantly. Procedural success was higher with Levosimendan, and procedure duration was shorter. These hypothesis-generating findings highlight the need for larger, prospective randomized trials to clarify the role of Levosimendan in this setting."
OpenAlex,mitral regurgitation,Interplay between medical and interventional therapies in valvular heart disease and heart failure: an expert opinion paper,Matteo Pagnesi; Mauro Riccardi; Francesco Maisano; Elena-Laura Antohi; Vassilis I. Barberis; Abdelhamid Magdy; Henrike Arfsten; Julia Grapsa; Nicole Karam; Denisa Muraru; Karl-Philipp Rommel; Anna Sannino; Wilfried Müllens; Marianna Adamo; Marco Metra,10.1093/eschf/xvaf027,2026-01-08,ESC Heart Failure,"Abstract Heart failure (HF) and valvular heart disease (VHD) often coexist and share complex pathophysiological pathways. Traditional management strategies follow a step-by-step approach, prioritizing guideline-directed medical therapy (GDMT) and reserving interventional (surgical or percutaneous) options only in case of persistent symptoms or worsening HF after GDMT. However, greater experience with the use of percutaneous procedures, even in high-risk patients, could support a more integrated approach, which exploits the synergistic effects of medical and interventional therapies to increase the tolerability of one vs the other, thereby improving quality of life and outcomes through their synergic effects. This expert opinion paper summarizes current data and evolving practices in the management of VHD in patients with HF, including secondary mitral regurgitation, aortic stenosis, aortic regurgitation, and tricuspid regurgitation."
