source,keyword,title,authors,doi,publication_date,journal,abstract
Crossref,deep learning,The Nexus of Leadership and Learning: Exploring Female Principals' Influence on the Teaching-Learning Process in Secondary Schools,Muhammad Niqab; Salma Tabbasum; Shakil Ahmad,10.55737/qjss.vii-i.26473,2028-02-28,Qlantic Journal of Social Sciences,"The research paper will set out to debate the role played by the leadership competencies of principals in the teaching and learning process. The research will embrace a quantitative research design that will seek to answer the question concerning the relationship that exists between leadership skills of possessed by the  principals and the ongoing teaching-learning process in the female secondary schools using a co-relational study design. A survey instrument comprising of 37 items, which measured the leadership skills possessed by the selected principals and the prevailing teaching learning process, was used in the collection of data. Questionnaires for this study were administered to 108 male and female educators who were serving in secondary schools in Tehsil Wari, upper Dir and among them 100 questionnaires were submitted and were deemed to be useful in the analysis. The data in hand were calculated using Statistical Package of the Social Sciences (SPSS) version-27 and the obtained results indicated that the collected data was normally distributed. The findings revealed that all the variables of the study had great correlations. The analysis of the data was done through linear regression to measure the effect that the leadership skills of the principals had on the teaching learning process and this indicated that leadership skills of the principals have statistically significant effect on the teaching learning process. The policies derived out of this research can be a good guide to both the policymakers and organizational leaders because they can provide a good outline on how to empower the leaders in charge of the principals and as well as exert more influence on the effective teaching and learning processes."
Crossref,deep learning,Transforming Education through Technology: The Case of COVID 19 Digital Learning in Nagaland,K Hinoca Assumi,10.71126/nijre.v2i1.16,2028-02-28,Naveen International Journal of Research in Education (NIJRE),"Through the perspective of the COVID-19 pandemic and the disruption and opportunity it engendered, this chapter follows a transformative effect of EdTech and Digital education in India particularly in Nagaland through analysis. Drawing upon national policy frameworks, conceptual literature on educational technology, and contextual evidence based on the case of Nagaland, the chapter considers the rapid migration to digital learning as an emergency strategy (in response to the ongoing institution closures) based on the stark shifts in pedagogical practice, access to education services, and preparedness. The findings show that, including the ability of national programmes such as NEP 2020, SWAYAM, DIKSHA, PM e-VIDYA, and others, to promote access to digital tools was low within periphery or hill areas (e.g., Nagaland), due to lack of infrastructural resources, digital divide, unprepared teachers and economic/social divides, and more. The pandemic exposed the deep social and infrastructure divides in connectivity, device availability, assessment and learner engagement, with implications that were especially grave in rural and tribal settings. Although it accelerated the pace of innovation and the application of blended and low-tech learning practices teachers have been experimenting with digital platforms and the post-COVID recovery process, including remedial programmes and hybrid instruction. The chapter also discusses that blended learning is the most fitting, viable and sustainable approach for reaching the technological level in the field of educational technology at Nagaland. It implies that technology-mediated education can improve equity, quality, and resilience, but only under the conditions of inclusive policy design, strong digital infrastructure, vigorous teacher capability building, and culturally appropriate digital content. Keywords: Educational technology, digital learning, COVID-19, Nagaland, online education, Challenges, blended learning"
Crossref,deep learning,Left Ventricle Extraction Using a DENSENET-U-Net Integrated Deep Learning Approach,X. Ignatious Viola; R. Shoba Rani; G. Savitha; R. Surekha,10.1504/ijims.2028.10076630,2028,International Journal of Internet Manufacturing and Services,
Crossref,deep learning,Distributed Algorithms for High-Dimensional Statistical Inference and Structure Learning with Heterogeneous Data,Hongru Zhao; Xiaotong Shen,10.5705/ss.202025.0087,2028,Statistica Sinica,
Crossref,deep learning,Botnet Detection in Network Security by means of Deep Neural Network - DBoTPM,Sankarsan Panda; Julia Faith S; C. Manonmani; Sheshang Degadwala,10.1504/ijcis.2028.10073178,2028,International Journal of Critical Infrastructures,
OpenAlex,aortic stenosis,Geometry-Driven Changes in Pressure and Flow Dynamics in Control and Coarcted Aortic Hemodynamics,Md Arifuzzaman; Mette Olufsen; Mansoor A. Haider,,2026-05-14,VCU Scholars Compass (Virginia Commonwealth University),
OpenAlex,aortic stenosis,Outcomes of Transcatheter Aortic Valve Implantation with Abbott’s Portico Compared to Edwards’ SAPIEN 3: A Systematic Review and Meta-Analysis,Mirosław Gozdek; Mariusz Kowalewski; Tomasz Urbanowicz; Giuseppe Maria Raffa,10.3390/jcm15103573,2026-05-07,Journal of Clinical Medicine,"Background/Objectives: Nowadays, transcatheter aortic valve implantation (TAVI) is widespread in patients with severe aortic valve stenosis. New prosthesis designs are becoming available to address the shortcomings of their predecessors and improve clinical outcomes. Methods: Electronic databases were screened for studies comparing outcomes of TAVI with Portico and SAPIEN 3. In a random-effects meta-analysis the pooled incidence rates of procedural, clinical and functional outcomes, according to VARC-2 definitions, were assessed. Results: Thirteen observational studies and one multi-center randomized clinical trial enrolling 20,522 patients (Portico N = 3001 and SAPIEN 3 N = 17,521) were included in the analysis. The need for more than one prosthesis during initial implantation was significantly higher among Portico recipients compared to SAPIEN 3 recipients: (RR 2.72 [1.36, 5.45] p = 0.005). Pre- and post-dilatation were performed more frequently in the Portico group (RR 1.53 [1.12, 2.09], p = 0.008 and RR 4.21 [2.83, 6.26], p &lt; 0.00001, respectively). Moderate-to-severe paravalvular leak (PVL) was significantly more common in the Portico arm (RR 3.27 [1.80, 5.91] p &lt; 0.0001). In contrast, the mean gradient and rate of prosthesis–patient mismatch (PPM) was significantly lower in the Portico group (MD −31.58 [−37.02; −26.14] mmHg and RR 0.42 [0.32, 0.55], p &lt; 0.00001). Recipients of Portico demonstrated over 60% higher risk of permanent pacemaker implantation (PPI) compared to SAPIEN 3 (RR 1.62 [1.25, 2.10], p = 0.0002). Other procedural and short-term clinical outcomes, including neurologic events, major vascular complications, life threatening or major bleeding, acute kidney injury, myocardial infarction and mortality did not differ between the devices. A difference in mortality was observed at the 1-year follow-up (RR 1.26 [1.06, 1.51], p = 0.01; I2 = 5%). Conclusions: The evidence shows good short-term outcomes for both valves. Compared to SAPIEN 3, Portico was associated with a significantly higher rate of moderate-to-severe PVL and PPI, but a lower mean gradient and incidence of PPM. A significantly higher 1-year mortality was observed in the Portico group."
OpenAlex,aortic stenosis,Association of C-reactive protein to albumin ratio with the risk of left ventricular aneurysm formation,Dong Hu; Dongyang Wu; T. Huang; Guangji Wang; Qinshuo Zhao; Shaoshao Zhang; Xin Guo; B Y Liu; Man-Hua CHEN; Yi Zhou,10.1038/s41598-026-39318-5,2026-05-07,Scientific Reports,"The C-reactive protein (CRP) to albumin ratio (CAR) has emerged as a novel marker of inflammation. However, its potential predictive value for the development of left ventricular aneurysm (LVA) has not yet been evaluated. This study aims to explore the association between CAR and the risk of LVA in patients experiencing acute ST-segment elevation myocardial infarction (STEMI). This study recruited 551 patients in the first cohort and 471 patients in the validation cohort. Multivariable logistic regression analysis, restricted cubic splines (RCS) analysis, and receiver operating characteristic were conducted to assess the predictive value of CAR for LVA. The prevalence of LVA were 14.5% in the first cohort and 13.6% in the validation cohort. Multivariable logistic regression analysis indicated that individuals in the highest quartile of CAR (Q4) were significantly associated with the risk of LVA formation compared to those in the lowest quartile (Q1) in both cohorts (First cohort: OR = 3.26, 95% CI = 1.51–7.05, P = 0.003; Validation cohort: OR = 4.05, 95% CI = 1.71–9.60, P = 0.002). RCS analysis demonstrated a positive and nonlinear association between CAR and the risk of LVA (overall P < 0.05, nonlinear P < 0.05). Furthermore, the discriminative ability of CAR for LVA is 0.72 in the first cohort and 0.74 in the validation cohort, exceeding that of both CRP and albumin alone. Subgroup analyses further corroborated the robustness of our findings. Elevated CAR was independently linked to an increased risk of LVA development in patients with STEMI who received primary PCI. This finding may hold considerable significance for clinical practice and could aid in the development of a personalized prevention strategy that incorporates the monitoring of CAR."
OpenAlex,aortic stenosis,Sports cardiology field as a key player in optimizing cardiovascular health during sports,Mohammed Mohyeldin; Muhammad Reihan; Mohamed R. Herzalla; H I Thalib; Ayesha Jamal; Fatma Ahmed; Eman Sobh,10.55860/g0e11983,2026-05-07,Journal of Human Sport and Exercise,"Background: Sudden cardiac death (SCD) in athletes, though rare, continues to make headlines, raising questions about its underlying causes. Athletes are generally healthy, yet life-threatening cardiac events can occur unexpectedly in those without prior symptoms. Early detection of high-risk cardiac conditions is critical for prevention. Main text: Sports cardiology is an emerging specialty focused on the cardiovascular health of competitive athletes and highly active individuals, including those with known or undiagnosed heart disease. It encompasses structural, functional, and electrical cardiac assessment, exercise physiology, and preventive strategies. Screening and preparticipation evaluation are vital to identify hidden cardiovascular risks and differentiate physiological adaptations from pathology. This review highlights the importance of sports cardiology in optimizing cardiovascular performance, preventing SCD, and managing cardiovascular conditions such as arrhythmias, cardiomyopathies, coronary artery disease, and hypertension in physically active populations. Conclusions: Sports cardiology is rapidly evolving and plays a crucial role in safeguarding the health of athletes and active individuals. Optimal care requires an integrated approach, specialized knowledge, and targeted research initiatives to ensure safe participation in competitive and recreational exercise while minimizing cardiovascular risks."
OpenAlex,aortic stenosis,Flow-gradient Phenotypes and Functional Recovery After Transcatheter Aortic Valve Implantation for Severe Aortic Stenosis: A COMPARE-TAVI 1 Sub-study,Emil Johannes Ravn; Henrik Vase; Henrik Nissen; Kristian Hejlesen; Karen Juel Andersen; Nils S.B. Mogensen; Rasmus Carter‐Storch; Anne M. Dybro; Troels Thim; Phillip Freeman; Frederik Uttenthal; Ulrik Christensen; Evald H. Christiansen; Christian Juhl Terkelsen; Jordi Sanchez Dahl,10.64898/2026.05.04.26352421,2026-05-06,medRxiv,"BACKGROUND Patients with severe aortic stenosis (AS) exhibit heterogeneous flow-gradient hemodynamics and ventricular remodeling, which may influence symptomatic, functional, and structural responses to transcatheter aortic valve implantation (TAVI). Thus, we evaluated differences in functional recovery and reverse remodeling after transfemoral TAVI across flow-gradient phenotypes. METHODS In this sub-study of the COMPARE-TAVI 1 trial, 975 patients undergoing transfemoral TAVI were classified as classical low-flow low-gradient (cLFLG, 9.1%), paradoxical low-flow low-gradient (pLFLG, 7.7%), low-flow high-gradient (24.7%), normal-flow low-gradient (NFLG, 13.0%), and normal-flow high-gradient (45.4%). The primary functional outcome was longitudinal change in six-minute walk test distance (6MWTD) from baseline to 1 year follow-up. Secondary endpoints included changes in NYHA functional class and reverse remodeling from baseline to 1 year follow-up along with the incidence and risk of all-cause death and a composite MACE-endpoint. RESULTS Mean 6MWTD increased by 59±4 meters at 1-month (p=0.000) with no additional improvement at 1-year, but with heterogeneity between groups (p=0.000). Improvements among NFLG, cLFLG and low-flow high-gradient AS were comparable with normal-flow high-gradient AS, while pLFLG AS exhibited significantly increments at 1-year (−28±15 meters, p=0.007). Patients with NFLG, cLFLG and pLFLG were more symptomatic at baseline (NYHA ≥III: 40.5%, 57.3% and 50.6%, respectively, p=0.000). NYHA improved in all groups at 1-year follow-up (p=0.000), although persistent symptoms at 1-year were most frequent in pLFLG (NYHA ≥II, 38.7%, p=0.012). Reverse remodeling was also comparable between normal-flow high-gradient AS and NFLG, cLFLG, and low-flow high-gradient AS, respectively, but attenuated in pLFLG AS in both unadjusted and adjusted analyses. No differences were observed in the incidence and risk of all-cause death or the composite MACE-endpoint. CONCLUSION TAVI associates with functional recovery across all flow-gradient phenotypes, although with heterogeneous responses. Patients with NFLG showed comparable functional recovery and reverse remodeling at 1-year follow-up compared with normal-flow high-gradient AS, whereas pLFLG demonstrated attenuated benefits across all parameters."
OpenAlex,aortic stenosis,Resilia Inspiris® Valve in Modern Times: A Useful Alternative in Younger Patients with Severe Aortic Valve Stenosis with Anticipation for Future Valve-in-Valve Transcatheter Aortic Valve Implantation?,Wp Mistiaen,10.29328/journal.jcmhs.1001071,2026-05-06,Journal of Community Medicine and Health Solutions,"Introduction: The outcome of the Inspiris Resilia valve implanted in aortic position is investigated with respect to its hemodynamic properties and durability. In case of structural valve degeneration, its design would allow valve-in-valve transcatheter aortic valve implantation. Methods: The PubMed database was consulted for last 5 years with the search term: “inspiris resilia aortic valve”. Exclusion criteria were not the IR valve under study, reviews, letters to the editor, use in pulmonary position and editorials. Case reports and in vitro studies were included as a separate category. Results: Fifty-six papers were identified, of which 28 were retained. These included eleven comparative studies, ten single arm studies, with a follow-up to 5 years with one extension to 7 years, three in vitro studies, and four case reports as proof-of-concept for the valve-in-valve transcatheter aortic valve implantation approach. Age and risk scores of the investigated population are low in most series. Thirty-day outcomes, including complication rates and hemodynamic profile, are satisfactory for the Inspiris Resilia as well as for the conventional valves. This applies also for the mid-and-long-term results.Conclusion: There is cautious optimism for the Inspiris Resilia valve for its durability and there is proof of concept for a possible valve-in-valve transcatheter aortic valve implantation in case of valve degeneration, but problems caused by calcification of a degenerated Inspiris Resilia valve should be considered."
OpenAlex,aortic stenosis,"Coronary Microvascular Dysfunction and Lipid Molecules: Pathophysiological Mechanisms, Clinical Assessment, and Therapeutic Implications",Abdelrahman Hafez; Juan M. Farina; Kamal Awad; Milagros Pereyra Pietri; Isabel G. Scalia; Hesham Sheashaa; Fatmaelzahraa Abdelfattah; Mahshad Razaghi; Sherif Ahmed; Ramzi Ibrahim; David Simper; Steven J. Lester; Balaji Tamarappoo; C A Ayoub; R A Arsanjani,10.3390/jpm16050254,2026-05-06,Journal of Personalized Medicine,"Coronary microvascular dysfunction (CMD) has emerged as a crucial contributor to cardiovascular morbidity and mortality, particularly in patients with ischemia and non-obstructive coronary arteries (INOCA). The condition arises from a complex interplay of structural and functional abnormalities within the small coronary vessels, driven by underlying molecular mechanisms including endothelial nitric oxide synthase (eNOS) uncoupling, oxidative stress, and chronic inflammation. Lipid metabolism plays a central role in this pathology, especially in the setting of elevated low-density lipoprotein cholesterol (LDL-C). Furthermore, the protective capacity of high-density lipoprotein (HDL) is increasingly understood to depend on its functionality rather than absolute levels, as it can become dysfunctional and pro-inflammatory in pathological states. Emerging evidence has identified lipoprotein(a) [Lp(a)] and triglyceride-rich lipoproteins as significant, independent contributors to microvascular injury. Comprehensive clinical assessment of microvascular dysfunction therefore requires integration of advanced lipid profiling, including apolipoprotein B (ApoB), [Lp(a)], and the triglyceride-glucose (TyG) index with invasive and non-invasive measures of coronary flow reserve to more precisely stratify risk. In this narrative review, we synthesize current observational, mechanistic, and early interventional data linking diverse lipid phenotypes to coronary microvascular dysfunction. We propose a concept of lipid-driven CMD endotypes, such as ApoB-/particle overload, dysfunctional HDL, Lp(a)-mediated risk, and metabolic/TyG-high states, and map these to a practical, mechanism-informed management framework. While intensive LDL-C lowering with high-intensity statins and combination therapy remains guideline-directed care for high-risk patients, evidence for dedicated microvascular benefit from newer lipid and cardiometabolic agents is still largely hypothesis-generating. A personalized approach that aligns lipid phenotyping, CMD endotyping, and existing guideline-based therapies may help refine risk assessment and inform future trials."
OpenAlex,aortic stenosis,"DUSP family phosphatases in cell signaling, inflammation, and chronic diseases",Chia‐Wen Wang; Huai-Chia Chuang; Tse‐Hua Tan,10.1186/s12929-026-01251-0,2026-05-06,Journal of Biomedical Science,"Multiple members (DUSP1-29) of dual-specificity phosphatase (DSP) family are key regulators of mitogen-activated protein kinases (MAPKs), which regulate numerous physiological responses. Eight DUSPs are also named MAPK phosphatases (MKPs). DUSP dysregulation contributes to the pathogenesis of various human inflammatory and chronic diseases. Downregulation of DUSP1, DUSP3, DUSP11, and DUSP22, as well as upregulation of DUSP4, DUSP6, and DUSP23 are involved in human autoimmune diseases. Besides autoimmune diseases, reduction of DUSP1, DUSP2, and DUSP14, as well as induction of DUSP8 contribute to the pathogenesis of allergic diseases. Additionally, decreased levels of DUSP2, DUSP11, DUSP22, and DUSP28 are associated with human inflammatory bowel diseases. Moreover, deficiency of 10 DUSPs, as well as induction of DUSP4 are associated with metabolic diseases. Downregulation of 5 DUSPs are involved in cardiovascular disease pathogenesis; in contrast, upregulation of other 5 DUSPs are correlated with cardiovascular diseases. Collectively, dysregulated DUSPs could be diagnostic biomarkers and therapeutic targets for inflammatory diseases. Due to complex expression patterns of DUSPs, it is crucial to study the regulatory mechanisms of individual DUSPs in various inflammatory and chronic diseases. In this review, we summarize the roles and regulatory mechanisms of DUSPs in human inflammatory and chronic diseases. We also discuss the potential therapeutic applications of DUSP agonists/inhibitors in human inflammatory and chronic diseases."
OpenAlex,aortic stenosis,Concomitant Dynamic Left Ventricular Outflow Tract Obstruction and Severe Aortic Stenosis a Case Report and a Literature Review,T Crovetto; Fabio Vagnarelli; Vito Maurizio Parato; Alessandro Barbarossa,10.4103/jcecho.jcecho_95_25,2026-05-06,Journal of Cardiovascular Echography,"Abstract We report the case of a 77-year-old woman presenting with a hypertrophic cardiomyopathy phenotype characterized by hemodynamically significant dynamic left ventricular outflow tract obstruction (LVOTO) due to mitral systolic anterior motion (SAM), in association with aortic stenosis (AS). The clinical presentation included an episode of syncope, followed by progressive exertional dyspnea. Initial transthoracic echocardiography revealed marked septal hypertrophy, a calcified aortic valve with elevated transvalvular gradients, and SAM-induced dynamic LVOTO. Sarcomeric hypertrophic cardiomyopathy (HCM) and its phenocopies were subsequently excluded from the study. Transesophageal echocardiography confirmed the coexistence of severe AS and SAM. Given the complexity of the patient’s cardiac condition and the presence of a “porcelain aorta,” both surgical and transcatheter aortic valve replacement were deemed high risk. We discuss the diagnostic and therapeutic challenges of this “double-threat” scenario – severe aortic stenosis combined with dynamic LVOTO – and review the relevant literature regarding its hemodynamic implications, imaging strategies, and management approaches, including the concept of the “suicide left ventricle.”"
OpenAlex,aortic stenosis,Photon counting detector CT contrast agent-reduced transcatheter aortic valve reconstruction planning: a comparative study,Yannik C. Layer; Alexander Isaak; Narine Mesropyan; Patrick A. Kupczyk; Dmitrij Kravchenko; Marilia Voigt; Tatjana Dell; Julian A. Luetkens; Daniel Kuetting,10.1007/s00330-026-12613-5,2026-05-06,European Radiology,"OBJECTIVES: Continuous efforts are made to reduce contrast media, improving patient safety, reducing environmental risks, and addressing recurring supply shortages. The aim of this study was to evaluate contrast agent-reduced CT protocols for transcatheter aortic valve reconstruction (TAVR) planning in photon counting detector CT (PCDCT). MATERIALS AND METHODS: 162 BMI-matched examinations with standard dose contrast media (SCD; 80 mL; Iohexol 300 mg/mL; 81 examinations) and reduced contrast media dose (RCD; 50 mL; 81 examinations) for TAVR planning on a PCDCT were included in this retrospective monocentric study. Virtual monoenergetic reconstructions (VMI) at 70 keV, 60 keV and 50 keV of contrast agent-reduced examinations were compared with polyenergetic images. Quantitatively, regions-of-interest (ROIs) were placed in the abdominal aorta, iliac bifurcation, femoral artery, left ventricle and trapezius muscles. Signal-to-noise-ratio (SNR) and contrast-to-noise-ratio (CNR) were calculated. Qualitatively, diagnostic quality and contrast were assessed on a visual grading scale of 1 (non-diagnostic) - 5 (excellent) and contrast agent dose was estimated. RESULTS: . CONCLUSION: The diagnostic efficacy of TAVR planning assessment using PCDCT with minimized contrast agent dosing is preserved, presenting a practical approach to conserve contrast media. KEY POINTS: Question The aim of the study was to implement a PCDCT-adapted contrast media dose protocol to reduce contrast agent volume at sufficient diagnostic quality. Findings PCDCT enables substantial contrast dose reduction for TAVR planning with maintained diagnostic image quality. Low-keV virtual monoenergetic image reconstructions compensate for the reduced iodine concentration. Clinical relevance The study demonstrates the potential of contrast media reduction of PCD-CT in clinical routine. This can benefit patients with renal impairment, for example, and reduce the negative effects of iodinated contrast media on the environment."
