source,keyword,title,authors,doi,publication_date,journal,abstract
OpenAlex,mitral regurgitation,"Supplementary Material for: Graded Severity of Aortic Valve Sclerosis as an Independent Clinical Marker of Systemic Disease, Diastolic Dysfunction, and Mortality Risk: A Large Echocardiographic Cohort Study",figshare admin karger; Gotsman I.; Verbner A.; Zwas D.R.; Ouzan E.; Amir O.; Leibowitz D.,10.6084/m9.figshare.32323332.v1,2026-05-19,Figshare,"Background: Aortic valve sclerosis (AVS) is highly prevalent in the elderly. However, the prognostic implications of different degrees of echocardiographic AVS severity, and its association with comorbidities, myocardial remodeling, and heart failure phenotypes remains incompletely defined. Methods: We studied 42,959 participants from a large institutional echocardiographic database. AVS severity was classified as Normal (69%), Thickened (16%), Calcified (13%), or Severely Calcified (2%). Subjects with aortic stenosis greater than mild were excluded. Results: Increasing AVS severity was consistently associated with a higher burden of systemic comorbidities: hypertension, diabetes mellitus, atherosclerotic cardiovascular disease, heart failure, atrial fibrillation and renal disease. It was also associated with concentric left ventricular (LV) geometry, reflected by increased relative wall thickness and LV mass index. Worsening diastolic dysfunction was evident with increasing degrees of AVS, including reduced mitral annular e′ velocity, an elevated E/e′ ratio, increased left atrial volume index, and higher tricuspid regurgitation gradient. A rising prevalence of clinical heart failure with preserved ejection fraction (HFpEF) was observed. After multivariable adjustment including diastolic parameters, AVS severity demonstrated a strong, dose-dependent, independent association with all-cause mortality. Patients with severe calcification demonstrated the highest risk, with a hazard increase exceeding 60%. AVS severity was also a predictor of the composite endpoint of death and cardiovascular hospitalization. Conclusions: AVS severity assessed on echocardiography demonstrates strong, dose‑dependent associations with systemic comorbidities, concentric LV geometry, and HFpEF, and carries substantial prognostic significance. These findings highlight the clinical relevance of AVS severity as an early stage of the aortic valve disease spectrum, underscoring the need for proactive management of the systemic disease continuum."
OpenAlex,mitral regurgitation,Kynurenic acid mediates epicardial fat-induced lymphatic metabolic dysfunction in atrial fibrillation,Masaki Takahashi; Ichitaro Abe; Naofumi Yoshida; Daisuke Katoh; Daishi Fujita; Shunsuke Goto; Hirochika Yamasaki; Toshiyuki Ko; Yue Jiang; Yu He; Shinji Ito; Taisuke Harada; Masayuki Takano; Hiroki Sato; Hidekazu Kondo; Akira Fukui; Yasushi Teshima; Hidenori Sako; Keisuke Ohta; Shinji Miyamoto; Toshimasa Yamauchi; Seitaro Nomura; Norihiko Takeda; Issei Komuro; Naohiko Takahashi,10.1038/s41467-026-72974-9,2026-05-19,Nature Communications,"Atrial fibrillation represents a prevalent cardiac arrhythmia whose pathogenic mechanisms remain incompletely understood. Here, we identify impaired atrial lymphangiogenesis as a critical determinant in atrial fibrillation pathogenesis. Analysis of human left atrial appendage specimens reveals decreased lymphatic vessel density in atrial fibrillation patients compared to those in sinus rhythm. Mechanistically, we demonstrate that epicardial adipose tissues from atrial fibrillation patients secrete kynurenic acid, which acts via GPR35 to disrupt lymphatic endothelial cell metabolism and mitochondrial homeostasis, ultimately promoting endothelial-to-mesenchymal transition. Using an organotypic culture system, we show that epicardial adipose tissue -derived factors directly impair lymphatic vessel formation. In vivo studies utilizing angiotensin II-induced and high-fat diet male mouse models confirm the critical role of lymphatic dysfunction in atrial fibrillation susceptibility. Therapeutic interventions promoting lymphangiogenesis, either through VEGFC administration or weight loss intervention by LY3437943 (the novel triple GIP, GLP-1, and glucagon receptor agonist), significantly attenuate atrial fibrillation inducibility. These findings establish lymphatic dysfunction as a novel pathogenic mechanism in atrial fibrillation and highlight lymphatic vessel formation as a promising therapeutic target."
OpenAlex,mitral regurgitation,"Supplementary Material for: Graded Severity of Aortic Valve Sclerosis as an Independent Clinical Marker of Systemic Disease, Diastolic Dysfunction, and Mortality Risk: A Large Echocardiographic Cohort Study",figshare admin karger; Gotsman I.; Verbner A.; Zwas D.R.; Ouzan E.; Amir O.; Leibowitz D.,10.6084/m9.figshare.32323332,2026-05-19,Figshare,"Background: Aortic valve sclerosis (AVS) is highly prevalent in the elderly. However, the prognostic implications of different degrees of echocardiographic AVS severity, and its association with comorbidities, myocardial remodeling, and heart failure phenotypes remains incompletely defined. Methods: We studied 42,959 participants from a large institutional echocardiographic database. AVS severity was classified as Normal (69%), Thickened (16%), Calcified (13%), or Severely Calcified (2%). Subjects with aortic stenosis greater than mild were excluded. Results: Increasing AVS severity was consistently associated with a higher burden of systemic comorbidities: hypertension, diabetes mellitus, atherosclerotic cardiovascular disease, heart failure, atrial fibrillation and renal disease. It was also associated with concentric left ventricular (LV) geometry, reflected by increased relative wall thickness and LV mass index. Worsening diastolic dysfunction was evident with increasing degrees of AVS, including reduced mitral annular e′ velocity, an elevated E/e′ ratio, increased left atrial volume index, and higher tricuspid regurgitation gradient. A rising prevalence of clinical heart failure with preserved ejection fraction (HFpEF) was observed. After multivariable adjustment including diastolic parameters, AVS severity demonstrated a strong, dose-dependent, independent association with all-cause mortality. Patients with severe calcification demonstrated the highest risk, with a hazard increase exceeding 60%. AVS severity was also a predictor of the composite endpoint of death and cardiovascular hospitalization. Conclusions: AVS severity assessed on echocardiography demonstrates strong, dose‑dependent associations with systemic comorbidities, concentric LV geometry, and HFpEF, and carries substantial prognostic significance. These findings highlight the clinical relevance of AVS severity as an early stage of the aortic valve disease spectrum, underscoring the need for proactive management of the systemic disease continuum."
OpenAlex,mitral regurgitation,Edoxaban for atrial fibrillation in patients with atherosclerotic disease in daily clinical practice,Tim A.C. de Vries; Joris R. de Groot; Ron Pisters; M E W Hemels; J. Komen; Rüdiger Smolnik; E M Fronk; Jan Steffel; Thomas Weiss; Carlo de Asmundis; Paulus Kirchhof; Raffaele De Caterina,10.1007/s11239-026-03269-5,2026-05-18,Journal of Thrombosis and Thrombolysis,"To estimate major clinical event rates for patients with atrial fibrillation (AF) and atherosclerotic disease treated with edoxaban in routine practice, and to evaluate how well such patients were represented in ENGAGE AF-TIMI 48, the seminal randomized trial comparing edoxaban against warfarin for AF. ETNA-AF-Europe is a prospective cohort of AF patients receiving edoxaban in routine care. We compared patients with coronary or peripheral artery disease (CAD/PAD) to: (1) those without CAD/PAD in ETNA-AF-Europe, and (2) CAD/PAD patients in ENGAGE AF-TIMI 48. Of 13,164 patients in ETNA-AF-Europe, 23.3% had CAD/PAD. Compared with those without, patients with CAD/PAD had higher rates of stroke/systemic embolism (0.87%/year vs. 0.59%/year; HR 1.5, 95%-CI 1.14-1.88), acute coronary syndrome (1.24%/year vs. 0.37%/year; HR 3.3, 95%-CI 2.60-4.27), major bleeding (1.06%/year vs. 0.81%/year; HR 1.3, 95%-CI 1.04-1.63), cardiovascular death (1.59%/year vs. 0.85%/year; HR 1.9, 95%-CI 1.54-2.26), and all-cause death (6.02%/year vs. 3.53%/year; HR 1.7, 95%-CI 1.55-1.89). Compared with CAD/PAD patients in ENGAGE-AF TIMI-48, those in ETNA-AF-Europe had fewer cardiovascular comorbidities, less prevalent aspirin use (20.2% vs. 50.3%), and lower rates of stroke/systemic embolism (0.87%/year vs. 1.5%/year), major bleeding (1.04%/year vs. 3.0%/year), and cardiovascular death (1.59%/year vs. 3.7%), but higher non-cardiovascular mortality (4.43%/year vs. 1.6%/year). In routine practice, deaths and bleeding were the most common events in edoxaban-treated patients with AF. This pattern was consistent between those with and without atherosclerosis. ENGAGE-AF TIMI-48 participants with CAD/PAD had substantially higher cardiovascular but lower non-cardiovascular risks than those treated in daily practice.Trial registration number: NCT02944019 (ClinicalTrials.gov Identifier)."
OpenAlex,mitral regurgitation,"Cardiovascular involvement in ankylosing spondylitis and axial spondyloarthritis: epidemiology, mechanisms, and clinical management",Xiaoxi Dai; Qi Zhao,10.3389/fmed.2026.1841913,2026-05-18,Frontiers in Medicine,"Ankylosing spondylitis (AS) and axial spondyloarthritis (axSpA) are chronic inflammatory diseases primarily affecting the axial skeleton. Increasing evidence indicates that their impact extends beyond the musculoskeletal system and includes clinically relevant cardiovascular involvement. Cardiovascular disease has become an important determinant of long-term outcomes in these patients, with growing evidence showing increased risks of myocardial infarction, stroke, atrial fibrillation, and other major adverse cardiovascular events. In addition to overt clinical events, subclinical vascular abnormalities, endothelial dysfunction, arterial stiffness, and structural cardiac changes are frequently observed. Cardiovascular injury in this setting arises from a complex interplay between traditional risk factors and persistent systemic inflammation. Inflammatory pathways involving tumor necrosis factor, interleukin-17, and interleukin-6 appear to promote endothelial activation, oxidative stress, lipid dysfunction, vascular remodeling, and atherosclerosis. Current evidence suggests that tumor necrosis factor inhibitors may provide cardiovascular benefit through improved control of inflammation, whereas the long-term cardiovascular effects of interleukin-17 inhibitors, non-steroidal anti-inflammatory drugs, and Janus kinase inhibitors remain incompletely defined. These findings support a more integrated clinical approach in AS/axSpA, combining disease control with cardiovascular risk assessment, modification of conventional risk factors, and ongoing cardiovascular surveillance."
OpenAlex,valvular heart disease,Factors associated with short-term adverse events in hypertensive acute heart failure,O Miro; John Parissis; Effie Polyzogopoulou; Carolina Sánchez; Rosa Escoda; Víctor Gil; Vasiliki Bistola; Pere Llorens; On Behalf of ICA-SEMES Research Group,10.1080/00015385.2026.2667549,2026-05-20,Acta cardiologica. Supplementum,"OBJECTIVE: To analyse the factors associated with adverse events in patients presenting with hypertensive acute heart failure (AHF), and to assess whether differences exist according to patient sex. METHODS: We included patients diagnosed with AHF Spanish emergency departments (EDs), with a decompensation episode and elevated systolic blood pressure (SBP) on arrival. We analysed the association between 22 independent variables and in-hospital mortality. One-year mortality and 30-day post-discharge composite adverse events (defined as ED revisit, hospitalisation, or death) were analysed. RESULTS: We included 2865 AHF episodes secondary to hypertensive crisis (median age: 83 years; 60.5% women). In-hospital mortality was 5.3% and was independently associated with nine variables. Intravenous nitroglycerine administration was associated with increased in-hospital mortality (adjusted OR 1.874; 95% CI: 1.322-2.658). One-year mortality was 23.8% and was associated with eight variables (the same as in-hospital mortality, excluding valvular disease). In both cases, the strongest predictor was age ≥80 years (adjusted OR 2.195 [1.768-2.724]; adjusted HR 1.896 [1.548-2.323], respectively). The 30-day composite adverse event rate was 25.5% and was directly associated with chronic obstructive pulmonary disease (COPD) (HR 1.332; 95% CI: 1.095-1.621) and ischaemic heart disease (HR 1.202; 95% CI: 1.006-1.436), and inversely associated with hospitalisation (HR 0.781; 95% CI: 0.645-0.945). No significant interactions with sex were found for any outcome. CONCLUSIONS: In hypertensive AHF, multiple factors are associated with mortality, and intravenous nitroglycerine use appears to increase risk. Post-discharge adverse events are more frequent in patients with chronic pulmonary and ischaemic heart disease. No sex-based differences were observed for any of the outcomes analysed."
OpenAlex,valvular heart disease,The Current State Of Knowledge On The Management Of Ischemic Heart Disease In Patients With Cancer,Anush Barkhudaryan; A. L. Chilingaryan; L G Tunyan,10.56936/18290825-2026.20v.1-20,2026-05-20,THE NEW ARMENIAN MEDICAL JOURNAL,"Cardiovascular disease and cancer are associated with high rates of morbidity and mortality worldwide. These pathological conditions often have common risk factors and may co-exist, with one evolving into another. Recent advancements in the management of patients with malignancy have improved their quality of life and survival. However, the risk of developing cardiovascular disease, in particular ischemic heart disease, remains high due to the cardiotoxic effects of chemotherapeutic agents and radiation therapy. Recent clinical trials have revealed new pharmacological and interventional strategies for the management of acute and chronic forms of ischemic heart disease in this patient population. In particular, shortened dual antithrombotic therapy following coronary angioplasty with third-generation drug-eluting stents may allow preventing bleeding complications and the earlier resumption of chemotherapy in patients presenting with acute coronary syndrome. In contrast, cancer therapy may be continued in patients with stable ischemic heart disease after administering anti-anginal medications for the treatment of myocardial ischemia induced by chemotherapy. Although surgical revascularization is associated with a high risk of mortality, it may be performed concomitantly with tumor resection to improve clinical outcomes. Prospective studies directed to the investigation of the safety and efficacy of these interventional approaches will allow determination of the optimal revascularization strategy. Implementation of individualized treatment will prevent the development of chronic heart failure and lead to reduction of cardiovascular mortality in patients with oncological diseases. This review addresses the common pathophysiological mechanisms, diagnostic methods, as well as novel preventive and therapeutic strategies in the management of ischemic heart disease in cancer survivors."
OpenAlex,valvular heart disease,"Severe Orthostatic Hypotension and Weight Loss After Bortezomib, Lenalidomide, and Dexamethasone Therapy",Büşra Tuğçe Tonyalı; Ebru Koca,10.4274/csmedj.galenos.2026.2026-3-3,2026-05-20,Cam and Sakura Medical Journal,
OpenAlex,valvular heart disease,Binaphthoquinone attenuates myofibroblast transition of human ventricular cardiac fibroblasts <i>in vitro via</i> mitochondrial modulation under diabetic conditions,Chang Shin Yoon; Jeong Rim Ko; Nammi Park; Se Hwan Park; Hyoung Kyu Kim; Jin Han,10.4196/kjpp.25.434,2026-05-20,Korean Journal of Physiology and Pharmacology,"O.F. Müller. In this study, we examined the anti-fibrotic effects of BiNQ in a diabetic context, focusing on its potential to enhance mitochondrial function. Human cardiac fibroblasts (NHCF-V) were cultured under control 5 mM glucose or exposed to 33 mM glucose plus palmitic acid (100 μM). Fibroblast-to-myofibroblast transition was evaluated by measuring the expression level of the myofibroblast marker α-smooth muscle actin (α-SMA), and functional changes were further assessed using a contraction assay. BiNQ was applied at two concentrations (10 nM and 1 μM) and was found to reduce α-SMA expression, indicating inhibition of myofibroblast differentiation. Concurrently, BiNQ enhanced the expression of mitochondrial respiratory chain complexes, resulting in increased ATP production. To elucidate the underlying molecular mechanisms, targeted proteomic analysis was performed using LC-MS/MS, enabling identification and quantification of proteins involved in mitochondrial bioenergetics and fibrotic regulation. Collectively, these findings suggest that BiNQ attenuates fibroblast activation in a diabetic context by improving mitochondrial function and modulating key pro-fibrotic pathways."
OpenAlex,valvular heart disease,The predictive value of combining CAAP-AF score and epicardial adipose tissue thickness for early recurrence after catheter ablation in atrial fibrillation patients,Liqing Lin; ShuXuan Huang; Linfang Ke; Jinxin Lan; M L Chen,10.3389/fcvm.2026.1839244,2026-05-20,Frontiers in Cardiovascular Medicine,"Background Atrial fibrillation (AF) is the most common arrhythmia globally, associated with a significant burden of stroke, heart failure, and reduced quality of life. Early recurrence after catheter ablation for AF remains a common and challenging issue. Objective Our aim was to investigate the correlation between epicardial adipose tissue (EAT) thickness and early recurrence after catheter ablation in patients with AF, and to evaluate the incremental predictive value of EAT thickness when combined with the CAAP-AF score. Methods A total of 56 AF patients who underwent catheter ablation between March 2023 and November 2023 at Zhangzhou Affiliated Hospital of Fujian Medical University were included in this study. The CAAP-AF score was calculated, and EAT thickness was measured for each patient. Patients were divided into two groups based on follow-up outcomes: early recurrence and no recurrence. Receiver operating characteristic (ROC) curve analysis was performed to evaluate the predictive value of the CAAP-AF score, EAT thickness, and their combination for early recurrence after catheter ablation. Results Early recurrence occurred in 13 patients, while 43 patients had no recurrence. Multivariate logistic regression analysis demonstrated that both the CAAP-AF score (OR = 2.10, 95% CI: 1.09–4.05, p = 0.027, β =0.74) and EAT thickness (OR = 3.71, 95% CI: 1.33–10.34, p = 0.012, β =1.31) were independent predictors of early recurrence. The AUC values for the CAAP-AF score, EAT thickness, and their combination in predicting early recurrence were 0.871, 0.800, and 0.914, respectively. Furthermore, intra-class correlation coefficients (ICC) and Bland-Altman analysis demonstrated excellent reproducibility of EAT thickness measurements via ultrasound. Conclusion Both the CAAP-AF score and EAT thickness are independent risk factors for early recurrence after catheter ablation in AF patients. Combining these two parameters enhances the predictive accuracy for early recurrence."
OpenAlex,valvular heart disease,Risk stratification for sudden cardiac death in nonischemic dilated cardiomyopathy: a moving target?,Laura Bradel; Katherine Kovrizhkin; Harout Yacoub; Gioia Turitto,10.3389/fcvm.2026.1766952,2026-05-20,Frontiers in Cardiovascular Medicine,"Risk stratification for sudden cardiac death (SCD) in non-ischemic dilated cardiomyopathy (NICM) and a left ventricular ejection fraction (LVEF) ≤35%. remains controversial. The value of a low LVEF alone is limited, as it cannot distinguish between arrhythmic and nonarrhythmic mortality. This led to further investigation into markers of electrical instability. Prior studies have evaluated noninvasive and invasive markers, including ambient arrhythmias, signal-averaged ECG, QT dispersion, T-wave alternans, heart rate variability, and programmed ventricular stimulation. None of these markers have consistently improved the predictive accuracy for SCD beyond LVEF. Cardiac magnetic resonance (CMR) imaging with late gadolinium enhancement (LGE) has emerged as a tool for substrate characterization, with myocardial fibrosis burden and LGE patterns associated with SCD, arrhythmic events, as well as appropriate therapies in patients with implantable cardioverter-defibrillators. Quantitative LGE thresholds and integrated CMR-based models may enhance SCD risk discrimination, although methodological heterogeneity, scanner-dependent quantification, and lack of randomized trials challenge the inclusion of CMR parameters in current guidelines. Emerging tiered approaches like the ReCONSIDER framework, combining noninvasive markers, CMR tissue characterization, and electrophysiologic testing to capture the heterogeneity of NICM, may also be of value. However, at the present time, no single imaging, clinical, or electrophysiologic marker has achieved guideline-level validation as an adjunct or a replacement for LVEF. Future studies may focus on standardizing CMR acquisition and quantification, prospective validation of multimodal risk models, and assessment of dynamic, serial biomarkers to establish a more accurate approach to SCD risk stratification in NICM."
OpenAlex,valvular heart disease,"Multifocal Osteoarticular Brucellosis: A Rare Case Of Spondylodiscitis, Vertebral Abscess, And Knee Arthritis",Hovhannisyan Alvard H; Svetlana G Manukyan; Susanna L Mkhitaryan; Naira M. Gyulazyan; Vigen A Asoyan,10.56936/18290825-2026.20v.1-74,2026-05-20,THE NEW ARMENIAN MEDICAL JOURNAL,"Brucellosis is a zoonotic disease transmitted from animals to humans, most commonly through direct contact with infected livestock or consumption of contaminated animal products such as unpasteurized dairy. It presents with a wide clinical spectrum, ranging from mild flu-like symptoms such as fever, fatigue, and muscle pain to more severe complications involving multiple organ systems if left untreated. Osteoarticular involvement is the most frequent complication, but the simultaneous occurrence of spinal brucellosis, vertebral abscess, and peripheral arthritis is rare and poses significant diagnostic challenges. Brucellosis is an endemic disease in Armenia. According to annual statistics from the National Institutes of Health, the number of brucellosis cases has increased during the last decade. The aim of the case report is to highlight the challenges in the management of a patient with multifocal osteoarticular brucellosis. A 51-year-old male agricultural worker was admitted to the hospital with fever, fatigue, lumbar pain, restricted mobility, and night sweats. Magnetic resonance imaging (MRI) revealed L4–L5 spondylodiscitis with an epidural abscess and epiduritis. Tuberculosis was excluded, while serological testing (Wright test 1:400, Huddleson test 3+) and enzyme-linked immunosorbent assay (ELISA) confirmed brucellosis (IgM and IgG strongly positive). During hospitalization, the patient developed swelling of the left knee; synovial fluid polymerase chain reaction (PCR) was positive for Brucella, confirming knee arthritis (gonitis). Laboratory evaluation demonstrated elevated erythrocyte sedimentation rate (ESR) (53 mm/h), C-reactive protein (CRP) (72.74 mg/L), and fibrinogen (724 mg/dL), indicating active infection. The final diagnosis was acute brucellosis, osteoarticular form with spondylitis, vertebral abscess, and left gonitis. He received combination antibiotic therapy with supportive care, resulting in clinical improvement and decreased inflammatory markers by discharge. This case highlights an unusual triad of brucellar spondylitis, epidural abscess, and knee arthritis (gonitis). Early recognition, supported by imaging and serology, and prompt initiation of appropriate therapy are essential to prevent long-term sequelae."
