source,keyword,title,authors,doi,publication_date,journal,abstract
PubMed,mitral regurgitation,Protected Mitral TEER With Temporary Ventricular Circulatory Support in Severe Left Ventricular Dysfunction for Heart Failure Management.,Lukas Weber; Julien Ternacle; Johann Cattan; Melchior Jonveaux; Antoine Beurton; François Picard; François-Xavier Hérion; Thomas Modine; Lionel Leroux; Guillaume Bonnet,10.1016/j.jaccas.2026.108783,2026-06-24,JACC. Case reports,"Mitral transcatheter edge-to-edge repair (M-TEER) is an established therapy for secondary mitral regurgitation in heart failure, but its safety in patients with severely impaired left ventricular function is limited by the risk of afterload mismatch.
We report a 46-year-old man with ischemic cardiomyopathy, left ventricular ejection fraction of 26%, and severe secondary mitral regurgitation who underwent planned M-TEER under elective Impella 5.0 (Abiomed) support via subclavian access. Two XTW clips were successfully implanted. The Impella was maintained postprocedure and weaned stepwise over several days, enabling gradual left ventricular adaptation, hemodynamic stability, and early rehabilitation.
Rapid reinitiation and uptitration of guideline-directed medical therapy led to sustained functional recovery and removal from the transplant list. At 3.5-year follow-up, the patient remains at NYHA functional class I-II status, with sustained clinical stability, improved exercise capacity, and no heart failure hospitalizations.
This case illustrates a strategy combining elective M-TEER with temporary ventricular support to prevent afterload mismatch and safely reintroduce guideline-directed medical therapy in advanced heart failure."
PubMed,valvular heart disease,Echocardiographic assessment in arterial hypertension: a contemporary narrative review.,Hafiz Naderi; Kelly Victor; Lynne Williams; Pauline A Swift; Ian Wilkinson; Sanjeev Bhattacharyya,10.1186/s44156-026-00125-3,2026-06-29,Echo research and practice,"Arterial hypertension remains the leading modifiable cause of cardiovascular morbidity and mortality resulting in characteristic changes in cardiac structure and function. Contemporary hypertension clinical guidelines increasingly emphasise prevention and early detection of hypertension-mediated organ damage, yet they differ in how blood pressure is categorised and when further investigation is recommended. Within this prevention-focused landscape and alongside a broader cardio-renal-metabolic framework, this review provides a practical overview on the role of echocardiography in arterial hypertension by integrating contemporary hypertension guidelines with imaging consensus documents. We outline when echocardiography is most likely to add value in hypertension and review echocardiographic assessment of left ventricular structure and geometry, systolic and diastolic function and filling pressures, atrial remodelling, right ventricular assessment, valvular heart disease and the aorta. Practical indications for scanning and transoesophageal echocardiography considerations are discussed. Finally, we highlight future directions including prevention-focused pathways, scalable echocardiography strategies, routine inclusion of contemporaneous blood pressure in reports, artificial intelligence-enabled quantification and selective multimodality imaging within specialist hypertension services."
PubMed,valvular heart disease,Management of pregnancy in women with rare multisystemic vascular diseases: a qualitative survey analysis.,Gloria Somalo-Barranco; Alexandra Benachi; Laurence M Boon; Petra Borgards; Janine Dickinson; Freya Droege; Olivier Dupuis; Michael Frank; Guillaume Jondeau; Robert M Kauling; Diana Marinello; Edit Nagy; Jolien W Roos-Hesselink; Meike Rybczynski; Pernille Mathiesen Torring; Carine van der Vleuten; Aline Verstraeten; Liesbeth Wildero Van Wouwe; Dina Zucchi; Julie De Backer,10.1186/s13023-026-04472-6,2026-06-27,Orphanet journal of rare diseases,"Pregnancy in women with rare vascular diseases is highly challenging, as it can be associated with significant maternal and foetal risks, requiring complex and multidisciplinary management. Care across countries remains insufficiently characterized, and both patients and healthcare providers across Europe highlight the need for better structures and organization to support this critical and potentially life-threatening phase.
To describe current practices, perspectives, and challenges faced by patients and healthcare professionals in the management of pregnancy in women with rare vascular diseases.
A survey developed by the European Reference Networks (ERN) pregnancy working group was extended with VASCERN-specific questions, resulting in a 13-item questionnaire. The survey was distributed to healthcare providers and patient representatives (ePAGs). Qualitative data from open-ended responses were analysed using an inductive thematic approach.
36 responses were collected from 145 invited VASCERN members, resulting in a 25% response rate and representing 10 European countries. Most respondents were healthcare providers (83%). 17% were patient representatives. Thematic analysis identified five recurring themes, including the need for coordinated and collaborative multidisciplinary approaches, variability in the practices regarding preconception and genetic counselling, limited access to specialised centres for pregnancy monitoring, and the importance of structured delivery planning and postnatal follow-up.
This survey clearly shows that there are common concerns about pregnancy in women with rare vascular diseases. Improvement actions mainly involve better education and drawing up multidisciplinary care pathways and guidelines that will lead to better access and organisation of care. Initiatives in this direction have already been taken within VASCERN."
PubMed,valvular heart disease,Leaflet resection improves valve expansion and hemodynamic performance in redo TAVI with balloon- and self-expanding transcatheter heart valve configurations.,Roberta Scuoppo; Stefano Cannata; Caterina Gandolfo; Stefano Pasquino; Salvatore Pasta; Mauro Ferraro,10.1016/j.cmpb.2026.109532,2026-06-24,Computer methods and programs in biomedicine,"Redo transcatheter aortic valve implantation (redo-TAVI) is increasingly carried out to treat degenerated transcatheter heart valves (THV). Residual calcified leaflet tissue from the first valve may impair second-valve expansion and thus prosthesis-patient mismatch and hemodynamic alterations. While leaflet laceration techniques mitigate coronary obstruction, the biomechanical impact of complete leaflet resection remains poorly understood. This study aims to evaluate the structural and hemodynamic effects of transcatheter leaflet resection in redo TAVI for different valve sizes and devices.
Finite element and smoothed-particle hydrodynamics (SPH) simulations were performed on a patient-specific TAVI model. Redo-TAVI was simulated with and without leaflet resection using both the balloon-expandable Sapien 3 and self-expanding Evolut PRO devices under different THV-in-THV configurations. Expansion and eccentricity indices, effective orifice area (EOA), and mean pressure gradient (PG) were quantified.
Leaflet resection consistently improved second-valve expansion and reduced eccentricity, particularly at the annular level. In size-matched balloon-expandable redo-TAVI, annular expansion increased by approximately 30% and eccentricity decreased by nearly 50%. In mismatched size configurations, eccentricity was reduced by >80%. Hemodynamic performance improved accordingly, with EOA increasing by 11-24% and PG decreasing by 21-38% across redo TAVI scenarios.
Findings demonstrated that leaflet resection improves redo-TAVI valve structural and flow performance by reducing asymmetric mechanical constraint from residual leaflet tissue of the degenerated device. The present computational framework provides a valuable tool to guide the optimization of transcatheter system designed to completely resect and remove degenerated valve leaflets prior to redo TAVI."
PubMed,valvular heart disease,Native Valve Infective Endocarditis Caused by Staphylococcus condimenti: First Case Reported.,Antonio Terrón; Eduardo Aparicio-Minguijón; Raúl Recio; José Enrique Ruiz-Cabello; Laura Domínguez-Pérez; Juan Meca-Aguirrezabalaga; Francisco López-Medrano,10.1016/j.jaccas.2026.109108,2026-06-27,JACC. Case reports,"Staphylococcus condimenti is a coagulase-negative staphylococcus previously considered nonpathogenic. We report to our knowledge the first documented case of native-valve infective endocarditis caused by this pathogen.
A 67-year-old man with rheumatic heart disease presented with fever and purpura. Initial IgA-dominant glomerulonephritis and leukocytoclastic vasculitis suggested systemic vasculitis. However, echocardiography revealed a large mitral vegetation. Scondimenti was identified by MALDI-TOF mass spectrometry and 16S rRNA sequencing from blood cultures and was subsequently confirmed by resected valve culture. After urgent mitral valve replacement and targeted cefazolin, the patient achieved full recovery and resolution of all immune-mediated complications.
This report identifies Scondimenti as an emerging pathogen capable of significant valvular destruction and immune-mediated phenomena mimicking systemic vasculitis.
Rare coagulase-negative staphylococci require integrating clinical context and species-level molecular identification to avoid dismissal as contaminants. Emerging pathogens can present with misleading systemic immunological manifestations, requiring high clinical suspicion for infective endocarditis."
PubMed,valvular heart disease,Pouch-like infective endocarditis of the mitral valve.,Yuanyuan Cui; Xuejie Li,10.11152/mu-4625,2026-06-26,Medical ultrasonography,
PubMed,valvular heart disease,Predictors of Heart Failure in Pediatric Patients with End-Stage Kidney Disease Secondary to Nephrotic Syndrome.,Meng Wei; Huiping Huang; Yajun Shen; Li Wei; Yifei Li; Hui Guo,10.3390/medicina62061131,2026-06-10,"Medicina (Kaunas, Lithuania)","Background and Objectives: To investigate prognostic risk factors and determine the incidence, clinical characteristics, and predictors of heart failure (HF) development in pediatric patients with end-stage kidney disease (ESKD) secondary to steroid-resistant nephrotic syndrome (SRNS). Materials and Methods: We conducted a retrospective cohort study of pediatric patients diagnosed with ESKD secondary to nephrotic syndrome (NS) between 2014 and 2020. Patients were stratified based on clinical outcomes and the occurrence of HF during follow-up. Comparative analyses of clinical characteristics, laboratory parameters, and cardiac assessments were performed across groups. Multivariate logistic regression was used to identify independent risk factors for HF development within the first year and for adverse prognosis at five years. Results: The cohort comprised 172 children with ESKD secondary to NS. Multivariate logistic regression identified HF as an independent risk factor for adverse long-term outcomes in pediatric patients with ESKD. During follow-up, HF developed in 27 patients (15.7%) within the first year after ESKD diagnosis, and in 45 patients (26.2%) by the end of five years. Early HF onset (within the first year) was associated with a significantly reduced five-year survival rate. Independent risk factors for HF development included elevated cardiac troponin I levels (OR = 6.786, 95% CI: 2.326-19.799), a history of cardiac arrhythmias (OR = 2.951, 95% CI: 1.260-6.912), and the presence of left heart enlargement (OR = 23.669, 95% CI: 2.876-194.827), and valvular regurgitation at the initial post-ESKD diagnosis evaluation. Conclusions: HF is associated with markedly reduced survival. Crucially, our findings demonstrate that pre-existing cardiovascular structural abnormalities-specifically left heart enlargement-and elevated cTnI are robust, early predictors of HF. These findings necessitate a paradigm shift in pediatric ESKD management, we advocate for the implementation of systematic baseline echocardiographic and biomarker screening at the immediate onset of ESKD. Identifying these subclinical, yet modifiable, structural changes provide a critical therapeutic window for targeted anti-remodeling interventions to significantly improve long-term prognosis."
PubMed,valvular heart disease,"Changing Epidemiology, Healthcare-Associated Infections, and Outcomes in Infective Endocarditis: A Five-Year Retrospective Study from a Tertiary Cardiovascular Center.",Adelina Matei; Grigore Tinică; Alberto Bacușcă; Mihail Enache; Andrei Țăruș; Mihaela Cătălina Luca; Gabriela Jugănariu; Doina Azoicăi,10.3390/medicina62061028,2026-05-26,"Medicina (Kaunas, Lithuania)","Background and Objectives: Infective endocarditis (IE) remains a major clinical challenge. It carries high morbidity and mortality, despite advances in diagnostic and therapeutic methods. This study aimed to evaluate the epidemiological profile, microbiological characteristics, complications, and predictors of adverse outcomes among patients with IE treated at a tertiary cardiovascular center in Romania over 5 years. Materials and Methods: We conducted a retrospective study including 156 patients diagnosed with IE between January 2020 and December 2024. We analyzed demographic data, comorbidities, microbiological findings, treatment strategies, complications, and in-hospital outcomes. Results: The cohort was predominantly male (76.3%), with a mean age of 58.5 years. Native valve endocarditis was the most frequent form (80.1%). Streptococci were the most commonly identified pathogens, followed by enterococci and staphylococci. Complications occurred in 74.4% of patients. Heart failure (70.5%), acute kidney injury (37.2%), and embolic events (32.7%) were most frequent. Healthcare-associated infective endocarditis (HAIE) was seen in 10.3% of patients. Additional healthcare-associated infections (HAIs) occurred in 26.9% of patients and were associated with longer hospital stays (21.7 vs. 13.5 days; p < 0.001). Use of a central venous catheter independently predicted HAI development (adjusted OR, 3.89; 95% CI, 1.08-14.06; p = 0.038). The in-hospital mortality rate was 16.7%. Acute kidney injury and sepsis were the strongest factors associated with in-hospital mortality. Conclusions: IE remains associated with a high burden of complications and in-hospital mortality. HAIs complicate the clinical course and are closely linked to invasive device use. Mortality is mainly driven by systemic disease severity, especially acute kidney injury and sepsis. These findings highlight the importance of infection prevention, prompt risk stratification, and coordinated multidisciplinary care to improve outcomes in patients with IE."
PubMed,valvular heart disease,Clinical Features of Adult Patients with Isolated Pulmonary Valve Endocarditis: A Systematic Review.,Guillermo Cuervo; Supavit Chesdachai; Joya-Rita Hindy; Danielle Gerberi; Christopher V DeSimone; Abhishek J Deshmukh; José M Miró; Abdallah El Sabbagh; Daniel C DeSimone; Larry M Baddour,10.3390/microorganisms14061208,2026-05-27,Microorganisms,"Isolated pulmonary valve endocarditis (PV-IE) is a rare condition. Its epidemiology, clinical profile, and management remain poorly characterized. A systematic review was conducted to provide a contemporary characterization (2020-2025) of adult cases with isolated PV-IE. Individuals with previous cardiac surgeries, cardiac implantable electronic devices (CIEDs), or long-term venous catheters were excluded. Of 1902 citations identified, 72 studies were selected with 79 eligible cases, mostly case reports. Patients were predominantly male (78.5%) with a median age of 43 years. Congenital heart disease (CHD) and injection drug use (IDU) were risk factors in 30.4% and 27.8% of cases, respectively, while 41.8% had neither (No-CHD/IDU group). Staphylococcus aureus was the leading pathogen (39%), followed by streptococci (16.5%) and Enterococcus faecalis (8.9%). Vegetations were large (median, 19.5 mm), and pulmonary septic emboli highly prevalent (~93% of cases). More than half (54.4%) of patients underwent surgery. Hospital mortality was low (7.6%). Differences across risk factor subgroups were observed, with higher median age in No-CHD/IDU patients and more staphylococcal etiology in patients with IDU, although treatment approaches and mortality did not differ. This review highlights distinct characteristics and the overall favorable short-term prognosis of isolated PV-IE, underscoring the need for larger, systematically collected datasets."
PubMed,valvular heart disease,Early Outcomes and Mid-Term Follow-Up of Melody TPV Implantation: A Ten-Year Single-Center Retrospective Observational Study.,Mario Giordano; Gianpiero Gaio; Raffaella Marzullo; Ippolita Altobelli; Raffaele Barbato; Raffaella Esposito; Giancarlo Scognamiglio; Gabriella Gaudieri; Michela Palma; Maurizio Cappelli Bigazzi; Giuseppe Limongelli; Berardo Sarubbi; Maria Giovanna Russo,10.3390/healthcare14121699,2026-06-15,"Healthcare (Basel, Switzerland)","Introduction: The Melody transcatheter pulmonary valve (TPV) was the first percutaneous bioprosthetic valve approved for transcatheter pulmonary valve implantation (TPVI). We report our single-centre experience with Melody TPV implantation in patients with congenital heart disease (CHD). Methods: This retrospective observational single-centre study included all patients evaluated in the catheterization laboratory for Melody TPV implantation. Early outcomes included procedural failure, life-threatening adverse events, and mortality. Long-term outcomes assessed during follow-up included infective endocarditis, transcatheter reintervention, and surgical reintervention. Results: Between 2015 and 2025, 50 consecutive patients were evaluated for TPVI with the Melody TPV at our institution. In four patients (8%), the procedure was aborted because of coronary artery compression detected during balloon interrogation of the right ventricular outflow tract (RVOT). One patient (2%) died of septic shock following acute pulmonary oedema in the immediate post-procedural period. The remaining 45 patients (90%) underwent successful Melody TPV implantation and were discharged from hospital. In six patients, the Melody TPV was implanted off-label: in the tricuspid position (n = 2) and in small conduits (<16 mm) (n = 4). Mean follow-up duration was 5.8 ± 3.6 years. One patient was lost to follow-up. Among the remaining 44 patients, seven (15.9%; 2.7% per patient-year) developed infective endocarditis, seven (15.9%; 2.7% per patient-year) underwent transcatheter reintervention (six balloon dilatations of the Melody valve and one valve-in-valve implantation), and four (9.1%; 1.5% per patient-year) required surgical replacement of the Melody TPV. Conclusions: Transcatheter implantation of the Melody TPV is an effective treatment for RVOT dysfunction. At mid-term follow-up, the majority of implanted Melody valves demonstrated satisfactory function, and only a minority of patients required surgical valve replacement."
PubMed,valvular heart disease,"Troponin T, Left Ventricular Ejection Fraction, and Tricuspid Regurgitation Velocity for Biomarker- and Echocardiography-Based Risk Stratification in Critically Ill Patients with Heart Failure.",Hasan Burak Isleyen; Sevil Tugrul Yavuz; Sercan Bulut; Fatih Kizkapan; Cevahir Alioglu; Ali Arda Sozen; Mahsa Khanmohammadi,10.3390/ijms27125339,2026-06-13,International journal of molecular sciences,"Troponin T is a molecular marker of cardiomyocyte injury, whereas left ventricular ejection fraction (LVEF) and tricuspid regurgitation velocity (TRV) reflect downstream ventricular and cardiopulmonary measures. This study evaluated whether synchronized troponin T and echocardiographic data can identify mortality risk in critically ill patients with heart failure, while separating statistical association from clinically meaningful incremental discrimination. Adult intensive care unit admissions with heart failure diagnoses were identified from MIMIC-IV and MIMIC-IV-ECHO. The primary endpoint was 28-day all-cause mortality; one-year mortality was secondary. Multivariable Cox models were adjusted for demographics, comorbidity, illness severity, organ support, and laboratory covariates. Restricted cubic splines, proportional hazards diagnostics, variance inflation factors, prespecified subgroup interaction tests, complete-case analyses, and multiple imputation sensitivity analyses were performed. The final cohort included 4362 patients, and 1072 patients (24.6%) died within 28 days. In the primary complete-case Cox model (n = 2087; 659 deaths), higher log-transformed troponin T was associated with higher 28-day mortality (hazard ratio [HR], 1.09; 95% confidence interval [CI], 1.03-1.15; p = 0.003), and higher LVEF was associated with lower mortality (HR per percentage point, 0.99; 95% CI, 0.99-1.00; p = 0.004). After severity and organ-support covariates were entered, troponin T and LVEF produced statistically detectable but very small C-statistic gains. Measurable TRV was available in 1546 patients and was associated with mortality in that subset (HR, 1.28; 95% CI, 1.08-1.52; p = 0.005). Troponin T, LVEF, and TRV were associated with mortality in ICU heart failure. Their contribution was best interpreted as risk enrichment within a clinical severity framework rather than a stand-alone decision rule."
PubMed,valvular heart disease,Remote ECG monitoring as a diagnostic tool for therapeutic strategies after transcatheter aortic valve replacement: rationale and design of the DRAGON-TAVI randomized trial.,Paulina Lis; Maciej Koźlik; Marta Chamera; Andrzej Kułach; Grzegorz Smolka; Malwina Smolarek; Michał Orszulak; Katarzyna Mizia-Stec; Krzysztof Szydło; Krzysztof Gołba; Sylwia Gładysz-Wańha; Łukasz Kuźma; Łukasz Morkisz; Radosław Gocoł; Damian Hudziak; Fabrizio D'Ascenzo; Gaetano Maria de Ferrari; Gregory Y H Lip; Wojciech Wojakowski; Krystian Wita; Wojciech Wańha,10.5603/cj.111069,2026,Cardiology journal,
PubMed,valvular heart disease,Prosthetic Valve Endocarditis by Acinetobacter baumannii: Case Report and Systematic Descriptive Review.,Annabella Salvati; Loredana Alessio; Gloria Trombaccia; Giovanni Cimmino; Marisa De Feo; Fausto Ferraro; Stefania De Pascalis; Nicola Coppola,10.3390/pathogens15060581,2026-05-28,"Pathogens (Basel, Switzerland)","A 61-year-old woman developed prosthetic valve infective endocarditis after osteomyelitis caused by extensively drug-resistant (XDR) Acinetobacter baumannii. Moreover, a systematic descriptive review of published case reports was performed to describe the main features, treatment, and outcomes of this condition.
Apart from the description of our case, a PubMed and Embase literature review was conducted up to January 2026 using the terms ""A. baumannii"" AND (""infective endocarditis"" OR ""endocarditis"" OR ""valvular infection""). We included clinical cases of IE caused by A. baumannii published as full-text articles in English.
After orthopedic osteosynthesis surgery following a femur fracture, our patient developed osteomyelitis by XDR A. baumannii and was treated for a short period of time. Later, prosthetic aortic valve endocarditis was diagnosed. Despite treatment with cefiderocol and eravacycline, she died. An additional 18 clinical cases of IE by A. baumannii were identified from the literature, bringing the total to 19 cases. IE affected prosthetic valves in nine cases, native valves in nine and involved a right atrial mass in one. Twelve cases were caused by MDR or XDR A. baumannii. Mortality occurred more frequently in cases not treated with surgery (9/13, 69%) compared to those treated with surgery (1/6, 16.7%). However, given the very small sample size, these data should be interpreted with caution.
This case, together with previously reported observations, highlights the severity of EI by A. baumannii and the need of multidisciplinary management."
