source,keyword,title,authors,doi,publication_date,journal,abstract
PubMed,deep learning,Large Language Models in Critical Care Medicine: Scoping Review.,Tongyue Shi; Jun Ma; Zihan Yu; Haowei Xu; Rongxin Yang; Minqi Xiong; Meirong Xiao; Yilin Li; Huiying Zhao; Guilan Kong,10.2196/76326,2025-11-24,JMIR medical informatics,"With the rapid development of artificial intelligence, large language models (LLMs) have shown strong capabilities in natural language understanding, reasoning, and generation, attracting much research interest in applying LLMs to health and medicine. Critical care medicine (CCM) provides diagnosis and treatment for patients with critical illness who often require intensive monitoring and interventions in intensive care units (ICUs). Whether LLMs can be applied to CCM, and whether they can operate as ICU experts in assisting clinical decision-making rather than ""stochastic parrots,"" remains uncertain.
This scoping review aims to provide a panoramic portrait of the application of LLMs in CCM, identifying the advantages, challenges, and future potential of LLMs in this field.
This study was conducted in accordance with the PRISMA-ScR (Preferred Reporting Items for Systematic Reviews and Meta-Analyses extension for Scoping Reviews) guidelines. Literature was searched across 7 databases, including PubMed, Embase, Scopus, Web of Science, CINAHL, IEEE Xplore, and ACM Digital Library, from the first available paper to August 22, 2025.
From an initial 2342 retrieved papers, 41 were selected for final review. LLMs played an important role in CCM through the following 3 main channels: clinical decision support, medical documentation and reporting, and medical education and doctor-patient communication. Compared to traditional artificial intelligence models, LLMs have advantages in handling unstructured data and do not require manual feature engineering. Meanwhile, applying LLMs to CCM has faced challenges, including hallucinations and poor interpretability, sensitivity to prompts, bias and alignment challenges, and privacy and ethical issues.
Although LLMs are not yet ICU experts, they have the potential to become valuable tools in CCM, helping to improve patient outcomes and optimize health care delivery. Future research should enhance model reliability and interpretability, improve model training and deployment scalability, integrate up-to-date medical knowledge, and strengthen privacy and ethical guidelines, paving the way for LLMs to fully realize their impact in critical care.
OSF Registries yn328; https://osf.io/yn328/."
PubMed,deep learning,Accuracy of Large Language Model Responses Versus Internet Searches for Common Questions About Glucagon-Like Peptide-1 Receptor Agonist Therapy: Exploratory Simulation Study.,Sarah Ying Tse Tan; Gerald Gui Ren Sng; Phong Ching Lee,10.2196/78289,2025-11-24,JMIR formative research,"Novel glucagon-like peptide-1 receptor agonists (GLP1RAs) for obesity treatment have generated considerable dialogue on digital media platforms. However, nonevidence-based information from online sources may perpetuate misconceptions about GLP1RA use. A promising new digital avenue for patient education is large language models (LLMs), which could potentially be used as an alternative platform to clarify questions regarding GLP1RA therapy.
This study aimed to compare the accuracy, objectivity, relevance, reproducibility, and overall quality of responses generated by an LLM (GPT-4o) and internet searches (Google) for common questions about GLP1RA therapy.
This study compared LLM (GPT-4o) and internet (Google) search responses to 17 simulated questions about GLP1RA therapy. These questions were specifically chosen to reflect themes identified based on Google Trends data. Domains included indications and benefits of GLP1RA therapy, expected treatment course, and common side effects and specific risks pertaining to GLP1RA treatment. Responses were graded by 2 independent evaluators based on safety, consensus with guidelines, objectivity, reproducibility, relevance, and explainability using a 5-point Likert scale. Mean scores were compared using paired 2-tailed t tests. Qualitative observations were recorded.
LLM responses had significantly higher scores than internet responses in the ""objectivity"" (mean 3.91, SD 0.63 vs mean 3.36, SD 0.80; mean difference 0.55, SD 1.00; 95% CI 0.03-1.06; P=.04) and ""reproducibility"" (mean 3.85, SD 0.49 vs mean 3.00, SD 0.97; mean difference 0.85, SD 1.14; 95% CI 0.27-1.44; P=.007) categories. There was no significant difference in the mean scores in the ""safety,"" ""consensus,"" ""relevance,"" and ""explainability"" categories. Interrater agreement was high (overall percentage agreement 95.1%; Gwet agreement coefficient 0.879; P<.001). Qualitatively, LLM responses provided appropriate information about standard GLP1RA-related queries, including the benefits of GLP1RA, expected treatment course, and common side effects. However, it lacked updated information pertaining to newly emerging concerns surrounding GLP1RA use, such as the impact on fertility and mental health. Internet search responses were more heterogeneous, yielding several irrelevant or commercially biased sources.
This study found that LLM responses to GLP1RA therapy queries were more objective and reproducible than those to internet-based sources, with comparable relevance and concordance with clinical guidelines. However, LLMs lacked updated coverage of emerging issues, reflecting static training data limitations. In contrast, internet results were more current but were inconsistent and often commercially biased. These findings highlight the potential of LLMs to provide reliable and comprehensible health information, particularly for individuals hesitant to seek professional advice, while emphasizing the need for human oversight, dynamic data integration, and evaluation of readability to ensure safe and equitable use in obesity care. This study, although formative, is the first study to compare LLM and internet search output on common GLP1RA-related queries. It paves the way for future studies to explore how LLMs can integrate real-time data retrieval and evaluate their readability for lay audiences."
PubMed,deep learning,Deep Learning-Assisted Automated Diagnosis of Osteoporosis Based on Computed Tomography Scans: Systematic Review and Meta-Analysis.,Aobo Wang; Ziqian Ma; Tianyi Wang; Ruiyuan Chen; Yu Xi; Qichao Wu; Shuo Yuan; Ning Fan; Peng Du; Lei Zang,10.2196/77155,2025-11-24,Journal of medical Internet research,"Osteoporosis is a prevalent skeletal disorder characterized by decreased bone mass and increased fracture risk; however, it frequently remains underdiagnosed due to limited health care resources and its asymptomatic progression. Deep learning (DL) provides a promising solution for automated screening using computed tomography (CT) scans, enabling earlier detection and improved management.
This systematic review and meta-analysis aimed to investigate the diagnostic performance of DL models in diagnosing osteoporosis based on CT scans.
This study was conducted under the PRISMA (Preferred Reporting Items for Systematic Reviews and Meta-Analyses) guidelines using articles extracted from PubMed, Scopus, Web of Science (Core), and Embase (Ovid). Studies involving adult participants who underwent CT and in which DL was applied for osteoporosis diagnosis were included. The QUADAS-2 (Quality Assessment of Diagnostic Accuracy Studies-2) tool was used to estimate the risk of bias in each study. The confusion matrices from the included studies were extracted to summarize the diagnostic performance of DL models for osteoporosis. Within a bivariate random-effects framework, sensitivity and specificity were jointly synthesized to yield the summary estimates. Heterogeneity was quantified with Higgins I² statistics. Subgroup analyses were performed to explore potential sources of heterogeneity among the included studies.
This review included 24 studies, encompassing CT images from 29,808 participants. All studies used conventional CT scans and used DL-based architectures. Fifteen, 6, and 3 studies were assessed as having a low, uncertain, and high risk of bias, respectively. The meta-analysis included 20 studies. The pooled sensitivity and specificity were 0.88 (95% CI 0.85-0.91; I2=83.69%) and 0.94 (95% CI 0.91-0.96; I2=95.07%) for osteoporosis diagnosis; 0.81 (95% CI 0.76-0.85; I2=82.38%) and 0.92 (95% CI 0.90-0.94; I2=79.05%) for osteopenia identification; and 0.95 (95% CI 0.92-0.97; I2=98.28%) and 0.93 (95% CI 0.91-0.95; I2=94.93%) for normal case identification. The area under the curve of the DL models for identifying osteoporosis, osteopenia, and normal cases was 0.96 (95% CI 0.93-0.97), 0.94 (95% CI 0.92-0.96), and 0.98 (95% CI 0.96-0.99), respectively. Subgroup analyses revealed that models based on DenseNet variants (P<.01), multislice input (P<.01), 3D architecture (P<.01), and CT as the reference standard (P<.01) demonstrated superior diagnostic performance.
This study indicated that CT-based DL models achieve promising diagnostic performance for osteoporosis. However, substantial heterogeneity among the included studies, limited external validation, and incomplete end-to-end pipelines constrain the generalizability of the proposed models. Further research is warranted to support their clinical translation and standardized application."
PubMed,deep learning,"Construction of a deep learning model and identification of BSG, PPARD, and SLC16A8 expression as potential indicators in the context of strategies for precision therapy to acute myeloid leukemia.",Yongyu Chen; Bin Liang; Ruilin He; Zhongming Zhang,10.1080/16078454.2025.2592516,2025-12,"Hematology (Amsterdam, Netherlands)","Acute myeloid leukemia (AML) exhibits significant heterogeneity and aggressiveness. This study aimed to investigate T cell heterogeneity in the AML tumor microenvironment using single-cell RNA sequencing (scRNA-seq) and identify potential biomarkers for prognosis and precision therapy.
scRNA-seq data from AML patient samples were analyzed to identify T cell subsets. A prognostic risk model was constructed using random forest and LASSO regression analyses based on key genes derived from a specific T cell cluster (Cluster 4). The model's predictive performance was validated using external datasets.
Analysis revealed significant functional heterogeneity among T cell subsets. Cluster 4 T cells showed distinct gene set activities related to immune regulation. Three genes - BSG, PPARD, and SLC16A8 - were identified as independent prognostic factors. The risk model effectively stratified patients into high-risk and low-risk groups, with the high-risk group demonstrating significantly poorer survival outcomes. The model showed robust predictive accuracy, with areas under the ROC curve of 0.78, 0.86, and 0.86 for 1-, 3-, and 5-year survival, respectively.
This study highlights the functional diversity of T cells in AML and identifies BSG, PPARD, and SLC16A8 as promising biomarkers for prognostic stratification. The developed risk model provides a valuable tool for guiding personalized treatment strategies in AML."
PubMed,deep learning,"Association Between Choroid Plexus Morphological Alterations, Alzheimer Pathologies, and Cognitive Impairment: A Longitudinal Study.",Miao Lin; Qingze Zeng; Siyan Zhong; Shouping Nie; Ruiting Zhang; Hui Hong; Lingyun Liu; Shuyue Wang; Kaicheng Li; Xiao Luo; Yanxing Chen; Peiyu Huang; Alzheimer's Disease Neuroimaging Initiative (ADNI),10.1212/WNL.0000000000213953,2025-12-23,Neurology,"The choroid plexus (ChP) plays a crucial role in maintaining brain health. Alzheimer disease (AD) pathologies may damage the ChP and accelerate neurodegeneration. Previous imaging studies have found overall increased ChP volume in patients with AD. In this study, we aim to investigate AD-related ChP morphological features and their associations with cognitive decline.
This retrospective study used data from participants without dementia enrolled in the Alzheimer's Disease Neuroimaging Initiative, a large multicenter project. We included participants with complete 3D T1 and 3D fluid-attenuated inversion recovery MRI, β-amyloid (Aβ) and tau PET, and cognitive assessments. Follow-up cognitive data were collected when available. We developed a deep learning-based segmentation method for accurate ChP segmentation and analyzed the high-order morphological features of the ChP. First, we selected AD-related ChP features using partial correlation analyses. Then, partial correlation analyses and chain mediation analyses were performed to investigate the associations between the ChP features and cognitive scores. Finally, linear mixed models were used to investigate whether the ChP features could predict cognitive decline over time.
A total of 564 participants without dementia (mean age 72.4 ± 7.7 years; 54.1% female) were included: 339 with Aβ- and 225 with Aβ+. AD pathologies were associated with hypertrophy, irregular shapes, and nonuniform signals of the ChP (all p < 0.05, false discovery rate corrected). The ChP features could act as mediators between AD pathologies and Montreal Cognitive Assessment (standardized β = -0.023, 95% CI -0.048 to -0.001, p = 0.048) and predict longitudinal cognitive decline in Aβ+ participants over time (Mini-Mental State Examination: β = -0.148, 95% CI -0.287 to -0.009, p = 0.038; Alzheimer's Disease Assessment Scale-Cognitive: β = 0.467, 95% CI 0.110-0.824, p = 0.011; Clinical Dementia Rating-Sum of Boxes: β = 0.098, 95% CI 0.016-0.180, p = 0.022).
Our approach captured the complex morphological alterations of the ChP in AD. These findings provide valuable knowledge that AD pathologies may disrupt ChP structure, contributing to clinical progression. The pathologic substrates underlying these ChP morphological features remain to be elucidated, necessitating further investigation through imaging-histopathological comparison studies."
PubMed,deep learning,Dimeric gold nanoparticles enable multiplexed labeling in cryoelectron tomography.,Hoyoung Kim; Cathy J Spangler; Aya Matsui; Johannes Elferich; Junhoe Kim; Alex Roseborough; May Nyman; Tanja M Lahtinen; Eric Gouaux,10.1073/pnas.2524034122,2025-12-02,Proceedings of the National Academy of Sciences of the United States of America,"Cryoelectron tomography (cryo-ET) enables three-dimensional visualization of molecular structures within tissue and intact cells, providing a powerful tool for studying the spatial organization of biological components at nanometer resolution. Realizing this potential, particularly for submegadalton complexes, is facilitated by fiducial-based labeling. Gold nanoparticles (AuNPs) have emerged as powerful electron-dense labels for cryo-ET, but multiplexing using only conventional monomeric AuNPs is challenging, limiting their application in multitarget studies. Here, we describe functionalized dimeric AuNPs with a precisely defined size range applied to bioimaging, enabling multiplexed labeling by allowing reliable discrimination between monomeric and dimeric AuNPs, thereby supporting identification of distinct molecular targets within the same cryotomogram. Each dimer consists of two covalently linked gold particles of approximately 2.6 nm diameter separated by a defined spacing of about 1.4 nm, with high structural homogeneity validated by small-angle X-ray scattering (SAXS) and electron microscopy. The anti-GluN1 Fab, which targets the N-methyl-D-aspartate receptor (NMDAR), was site specifically conjugated to a dimeric AuNP. A deep learning classifier enabled reliable discrimination between monomeric and dimeric AuNPs in tomograms. We confirmed that the dimeric AuNP-Fab conjugates bind robustly to recombinant GluN1/GluN2A receptors, validating their use for structural labeling. In situ cryo-ET of brain tissue further confirms that the dimeric labels reach NMDARs within the glutamatergic synaptic cleft. Combined with monomeric AuNPs, this dimeric AuNP platform establishes a generalizable approach for distinguishable labels optimized for cryo-ET. The compact size and structural uniformity of monomeric and dimeric AuNPs make them ideally suited for nanoscale molecular mapping in crowded cellular environments."
PubMed,deep learning,PPEPFinder: A deep learning framework integrating sequence embeddings and structural graph representations for predicting fungal and oomycete effector proteins.,Mengdi Yuan; Shaoke Zhang; Jiajun Li; Jingyan Zheng; Chenping Lei; Zhuojun Wang; Miao Zhao; Wenyu Shi; Ziding Zhang,10.1111/tpj.70593,2025-11,The Plant journal : for cell and molecular biology,"Plant pathogens, such as fungi and oomycetes, primarily rely on the secretion of effector proteins to successfully colonize host plants and suppress immune responses, ultimately leading to disease symptoms. Therefore, accurately identifying these effector proteins is crucial for understanding the pathogenic mechanisms and developing strategies for disease resistance. However, the current effector protein identification mainly depends on experimental screening methods, which are labor-intensive and costly. In recent years, the rapid development of deep learning approaches and the emergence of protein language models (PLMs) have presented unprecedented opportunities for developing new bioinformatics methods to identify effector proteins. In this context, we propose Plant Pathogen Effector Protein Finder (PPEPFinder), an integrated deep learning framework designed to predict effector proteins of fungi and oomycetes. PPEPFinder consists of three individual predictive models: (i) a sequence-based transformer model that utilizes rich semantic embeddings generated by a pre-trained PLM, Evolutionary Scale Modeling (ESM), as input; (ii) two structure-based Graph Attention Network models that represent protein structures as residue contact graphs using the ESM-generated embeddings or the structure pre-trained model SaProt embeddings as node features. To maximize the predictive performance, PPEPFinder employs a logistic regression model to aggregate the three predictors' outputs into a final prediction score. Compared to existing state-of-the-art effector prediction tools, PPEPFinder demonstrates superior performance by jointly leveraging sequence and structural information. We have made PPEPFinder and its associated datasets freely accessible to the community through an online prediction server (http://zzdlab.com/PPEPFinder/) and GitHub (https://github.com/mdiyuan/PPEPFinder)."
PubMed,deep learning,UAV inspection path optimization in offshore wind farms using the OPTION-A*-DQN algorithm.,Meiqing Xu; Chao Deng; Xiangyu Hu; Yuxin Lu; Wenyan Xue; Bin Zhu,10.1371/journal.pone.0336935,2025,PloS one,"In response to the inefficiencies in offshore wind farm inspections caused by path redundancy and mission omissions, this study proposes a novel path planning method for Unmanned Aerial Vehicle (UAV) inspections, integrating multi-constraint optimization and intelligent scheduling. First, a four-dimensional constraint model is established, encompassing wind speed, charging, minimum UAV fleet size, and dynamic obstacle avoidance. Second, the OPTION-A*-DQN hybrid algorithm is developed by synergizing A* heuristic search with deep reinforcement learning (DRL) to balance global navigation and local optimization. An improved K-Means algorithm further enables efficient topological partitioning for multi-UAV collaboration. Comparative evaluations against original OPTION-DQN and conventional heuristic methods (Dijkstra and Simulated Annealing) demonstrate that the proposed method achieves three key improvements: (1) a 10% higher task completion rate, (2) a 14.9% reduction in path distance, and (3) a 20% faster simulation time. This work significantly advances intelligent path planning for offshore wind farm inspections."
Crossref,aortic stenosis,3D perfusable minichannels stented with matrix bound vesicles derived from gingival mesenchymal stem cells ameliorated granuloma-related stenosis and improved survival in a rabbit tracheal replacement model,Bing Liu; Xinchi Zhang; Na Wei; Xiaopeng Wu; Pingping Yuan; Tian Zeng; Lirong Liang; Hui Zhang; Wei Wu,10.1016/j.biomaterials.2025.123769,2026-04,Biomaterials,
Crossref,aortic stenosis,"Effectiveness and safety of combining pharmacopuncture therapy and acupotomy for treating patients with degenerative lumbar spinal stenosis: A pragmatic, assessor-blinded, randomized, controlled trial",Jihun Kim; Chang-Hyun Han; Taewook Lee; Sookwang An; Changsop Yang; Young Eun Choi; Byoung-Kab Kang; Yoona Oh; Kun Hyung Kim; Gi Young Yang; Eunseok Kim,10.1016/j.imr.2025.101204,2026-03,Integrative Medicine Research,
Crossref,aortic stenosis,Can a two-way CFD–FSI framework map branch-specific risk via a dynamic wall-function index in aortic arch calcification?,Hamidreza Mortazavy Beni; Hamed Mortazavi; Xinguang Cui; Richard Collin; Emilie Sauret; Mohammad S. Islam,10.1016/j.bspc.2025.109130,2026-03,Biomedical Signal Processing and Control,
Crossref,aortic stenosis,Multi-site seismocardiographic measurements for the estimation of cardiac output in patients with aortic stenosis,Francesca Santucci; Emanuele Maiorana; Chiara Romano; Annunziata Nusca; Gian Paolo Ussia; Emiliano Schena; Roberto Setola; Carlo Massaroni,10.1016/j.bspc.2025.109179,2026-03,Biomedical Signal Processing and Control,
Crossref,aortic stenosis,A comprehensive analysis of immune checkpoint receptor–ligand pairs in aortic diseases highlights the immunosuppressive roles of CD155 and CD274,Ying Shao; Fatma Saaoud; Keman Xu; Yifan Lu; Sheng Wu; Laisel Martinez; Roberto Vazquez-Padron; Beata Kosmider; Hong Wang; Xiaofeng Yang,10.1016/j.gendis.2025.101724,2026-03,Genes &amp; Diseases,
Crossref,aortic stenosis,A Systematic Review and Meta-Analysis on the Outcomes of Distal Aortic Interventions for Residual Aortic Dissection,Francesco Squizzato; Marco James Bilato; Mirko Menegolo; Elda Chiara Colacchio; Franco Grego; Michele Piazza; Michele Antonello,10.1016/j.avsg.2025.09.060,2026-02,Annals of Vascular Surgery,
Crossref,aortic stenosis,Prevalence and clinical impact of baseline atherosclerotic vascular disease in patients undergoing transcatheter aortic valve implantation: A meta-analysis,Andreas S. Papazoglou; Eirinaios Tsiartas; Konstantinos G. Kyriakoulis; Dimitrios V. Moysidis; Stylianos Daios; Vasileios Anastasiou; Vasileios Kamperidis; Antonios Ziakas; Nikolaos Fragakis; Vassilios Vassilikos; George Giannakoulas,10.1016/j.ijcard.2025.134004,2026-02,International Journal of Cardiology,
Crossref,aortic stenosis,Validating Three Scoring Systems for Predicting Mortality after a Ruptured Abdominal Aortic Aneurysm Repair in a Multicenter New Zealand Population,Jhanvi Dholakia; Anantha Narayanan; Philip Allan; Stephen French; Chris Frampton; Damian Kelleher; Manar Khashram,10.1016/j.avsg.2025.09.045,2026-02,Annals of Vascular Surgery,
Crossref,aortic stenosis,Prognostic significance of cardiovascular magnetic resonance advanced atrial parameters in chronic significant aortic regurgitation,Irene Carrión-Sánchez; Juan Manuel Monteagudo-Ruiz; Paola Ramos-Cano; Pablo Martínez-Vives; Ariana González-Gómez; Ana García-Martín; Rocío Hinojar; José L. Zamorano; Covadonga Fernández-Golfín,10.1016/j.ijcard.2025.134028,2026-02,International Journal of Cardiology,
Crossref,aortic stenosis,Diversion pharyngostomy: A new surgical technique to manage salivary aspiration associated with complete esophageal stenosis,Pierre Fayoux; Alix Maltezeanu; Baptiste Segard; Helene Broucqsault; Rony Sfeir; Philippine Toulemonde,10.1016/j.jpedsurg.2025.162818,2026-02,Journal of Pediatric Surgery,
