source,keyword,title,authors,doi,publication_date,journal,abstract
Crossref,valvular heart disease,Fitness and exercise effects on brain age: A randomized clinical trial,Lu Wan; Cristina Molina-Hidalgo; Mary E. Crisafio; George Grove; Regina L. Leckie; Thomas W. Kamarck; Chaeryon Kang; Mia DeCataldo; Anna L. Marsland; Matthew F. Muldoon; Mark R. Scudder; Javier Rasero; Peter J. Gianaros; Kirk I. Erickson,10.1016/j.jshs.2025.101079,2026-12,Journal of Sport and Health Science,
Crossref,valvular heart disease,Disease-related communication difficulties and dyadic coping among patients with breast cancer and their spouses: An actor–partner interdependence model,Lingling Yang; Xi Zhang; Meina Yang; Liping Zhang; Rong Wang; Ting Wang,10.1016/j.apjon.2025.100829,2026-12,Asia-Pacific Journal of Oncology Nursing,
Crossref,valvular heart disease,Global hotspots and development trends in the new generation of artificial heart valves based on bibliometric analysis from 1991 to 2024,Shiping Chen; Jiamin Peng; Zhiyi Ye; Xingshuang Ma; Ming Sun; Nasser Fatouraee; Jifu Mao; Guixue Wang; Lu Wang,10.1016/j.advim.2025.100005,2026-12,Advanced Interventional Materials,
Crossref,valvular heart disease,"Methanol extract of Smritisagara Rasa attenuates neurobehavior, neurochemical and stress indicators in rotenone-induced Drosophila model of Parkinson's disease",G Gopinath; Ramesha Hanumanthappa; Raifa Abdul Aziz; P.C. Kiran; Hemalatha Nanjaiah; Iranna B. Kotturshetty; Shamprasad Varija Raghu; Manjunath Ajanal; Devaraju Kuramkote Shivanna,10.1016/j.abst.2025.11.003,2026-11,Advances in Biomarker Sciences and Technology,
Crossref,valvular heart disease,Multi-omics integration and machine learning reveal biomarker networks and therapeutic targets in Alzheimer's disease,Shreya Satyanarayan Bhat; Vidya Niranjan; Trilok Chandran; Spoorthi R. Kulkarni; Samridhi Makkar; Vishwam Dixit; Cherishma K. Subhasa; Adarsh Vishal,10.1016/j.abst.2025.12.004,2026-11,Advances in Biomarker Sciences and Technology,
Crossref,valvular heart disease,"Investigating the Relationship Between Postpartum Depression, Antenatal Depression, Corona Disease Anxiety, and Personality Traits During the COVID-19 Pandemic",Hanieh Soltani Nejad; Fatemeh Mohtasham; Mahjoubeh Ramezanzadeh; Azam Zare Arashlouei; Atefeh Ahmadi; Adele Dadvar; Saleheh Iranmanesh; Motahare Mirmahmoodi,10.2174/0126667975320431240915165722,2026-10,Coronaviruses,"Introduction and Aim:                     Postpartum depression has a profound impact, both physically and psychologically, on both the mother and her newborn. With a focus on the prevalent psychological complications following the onset of this condition, this study aimed to explore the correlation between antenatal depression and Corona disease anxiety, personality traits, and postpartum depression during the COVID-19 pandemic.                                                           Materials and Methods:                     This cross-sectional descriptive-analytical study investigated women receiving care at health centers affiliated with Kerman University of Medical Sciences during the last month of their pregnancy and the postpartum period in 2022. Following the acquisition of informed consent, participants were assessed using various measures, including demographic and obstetric information, the Edinburgh Postnatal Depression Scale, the Corona Disease Anxiety Scale (CDAS), and the NEO Personality Inventory-Revised during their third trimester of pregnancy. The same group of participants completed the Edinburgh Depression Scale and the Corona Disease Anxiety Scale (CDAS) 4-6 weeks after childbirth.                                                           Results and Discussion:                     There was a significant correlation between family income, unwanted pregnancy as perceived by both the mother and father, and antenatal depression. Additionally, marital satisfaction played a significant role in postpartum depression. Furthermore, antenatal depression was significantly associated with neuroticism, agreeableness, and physical symptoms related to Corona disease anxiety. Personality traits, with the exception of extroversion and conscientiousness, and various domains of Corona disease anxiety, excluding psychological symptoms, were also significantly associated with postpartum depression.                                                           Conclusion:                     During pandemics or epidemics, such as the COVID-19 outbreak, experiencing mental distress during pregnancy can contribute to mental health issues during the postpartum period. This risk is particularly true in individuals with unique personality traits, emphasizing the need for increased focus on mental health within prenatal care during these crises."
Crossref,valvular heart disease,Association between Helicobacter pylori Infection and Celiac Disease,Raghad R.M. Salih; Rana S. Aboud,10.21608/ejmm.2026.462213.2128,2026-10-01,Egyptian Journal of Medical Microbiology,
Crossref,valvular heart disease,The Severity of Disease and Hospital Length of Stay for the First and Second Admission of COVID-19 Patients: An Observational Study from Southeastern Iran,Milad Ahmadi Gohari; Mohammad Hossein Mehrolhassani; Shoboo Rahmati; Elham Sharifpoor; Hossein Mirzaei; Yunes Jahani,10.2174/0126667975341163241129050027,2026-10,Coronaviruses,"Background:                     This study aimed to investigate the severity of disease and length of hospital stay for COVID-19 patients admitted to a hospital in southeastern Iran.                                                           Method:                     This cross-sectional study was conducted in Kerman, Iran. Data were collected from patients who visited Afzalipour Hospital in Kerman more than twice during the COVID-19 epidemic from the end of February 2020 to March 21, 2021. We conducted two key analyses: 1. Mixed effect logistic regression was used to check the relationship between the variables and COVID-19 severity. 2. Mixed effect linear regression was used to check the relationship between the variables and the length of stay in the hospital.                                                           Results:                     The findings indicated that the most important risk factors for the severity of COVID-19 were heart diseases (OR=1.67,95%CI:1.20-2.30), increasing age (OR=2.23 for age&gt;54, 95%CI:1.70- 2.90), male gender (OR=1.47,95%CI:1.10-1.96), respiratory diseases other than asthma, and frequency of admission (OR=1.60,95%CI:1.20-2.15). All patients who underwent readmission experienced a shorter duration of hospitalization during their subsequent admission (OR=0.94,95%CI:0.91,0.96) and had a higher mortality rate (30% within 14 days, 26.6% between 14-90 days). Patients readmitted at intervals of 14-90 days and greater than 90 days exhibited lower disease severity compared to those readmitted within the 0-14 day period.                                                           Conclusion:                     Examining readmissions, the severity of COVID-19, and the length of hospital stay in affected patients are important factors for planning and allocating resources for COVID-19 management and treatment. These factors can help policymakers develop effective clinical guidelines for hospitalization or outpatient treatment of COVID-19 patients and contribute to reducing the burden of disease in the community."
Crossref,deep learning,Learner profiles and the process of Learning in the Higher Educational Context,Christos Skourlas; Petros Belsis,10.15556/ijiim.02.01.003,2115-03-05,International Journal on Integrated Information Management,
Crossref,deep learning,WEB-BASED COLLABORATIVE LEARNING AND KNOWLEDGE SHARING IN INFORMAL BUSINESS NETWORKS,George Stalidis; Costis Papadimitrakopoulos; Theocharis Tsakiris,10.15556/ijiim.01.02.002,2114-12-10,International Journal on Integrated Information Management,
Crossref,deep learning,Availability and Utilization of Tools and Equipment for Teaching and Learning Garment Making Trade in the Senior Secondary Schools in Edo State,,10.20431/2349-0381.0303002,2106,"International Journal of Humanities, Social Sciences and Education",
Crossref,deep learning,Title Pending 7452,,10.3998/mjcsl.7452,2036-01-19,Michigan Journal of Community Service Learning,
Crossref,deep learning,Title Pending 6294,,10.3998/mjcsl.6294,2034-12-20,Michigan Journal of Community Service Learning,
Crossref,deep learning,Title Pending 5730,,10.3998/mjcsl.5730,2034-11-18,Michigan Journal of Community Service Learning,
Crossref,deep learning,Title Pending 3643,,10.3998/mjcsl.3643,2033-09-06,Michigan Journal of Community Service Learning,
Crossref,deep learning,Title Pending 4120,,10.3998/mjcsl.4120,2033-03-28,Michigan Journal of Community Service Learning,
Crossref,deep learning,Title Pending 2741,,10.3998/mjcsl.2741,2032-09-28,Michigan Journal of Community Service Learning,
Crossref,deep learning,Machine Learning Application for SAIs,Tiare Rivera,10.56251/watu4873,2030-10-20,International Journal of Government Auditing,
Crossref,deep learning,Integration of Biomechanics and Digital Technology: Using Kinovea for Motion Analysis and Learning for Beginner Athletes,Muhammad Nur Hudha; Riezky Maya Probosari; Annisa Nur Khasanah; Supurwoko; Salsabila Kholifahtun Nisa’; Gifran Rihla Gifarka Latief,10.58524/jcss.v4i2.890,2029-11-29,Journal of Coaching and Sports Science,"Background: The integration of biomechanics with digital motion-analysis technologies has introduced new approaches for examining movement efficiency, kinematic characteristics, and technical patterns in walking and running activities. Kinovea, as an accessible motion-analysis software, provides both visual and quantitative feedback. However, its application in supporting technique development among beginner athletes remains insufficiently explored. Aim: This study aims to describe the use of Kinovea in biomechanics training and examine its contribution to the awareness of kinematic characteristics and movement techniques among beginner athletes. Methods: A descriptive qualitative design involved 72 beginner athletes aged 18–25 years selected through purposive sampling. Data were collected over 16 weeks through interviews, field observations, and motion video recordings analyzed using Kinovea. Kinematic data focused on joint angles, stride behavior, and movement phases during walking, running, and the flight phase. Qualitative data were analyzed using content analysis with NVivo 12, while kinematic results were interpreted descriptively to identify performance patterns and areas for technical refinement. Result: Kinematic analysis showed coordinated joint-angle patterns across all phases. Walking analysis identified arm swing angles of 50.9°–58.8° and leg separation angles of 64.3°–67.2°, indicating a stable gait rhythm. The running analysis revealed knee angles of 68.8°–69.8° and elbow angles of 87.6°–89.1°, indicating efficient propulsive mechanics. The flight phase demonstrated knee angles of 81.2°–87.8° and elbow angles of 80.4°–88.3°, suggesting effective momentum use and postural stability. These measurements supported stride-efficiency assessment and technique evaluation. Qualitative findings revealed that Kinovea enabled athletes to interpret movement phases and identify technical inefficiencies through slow-motion and frame-by-frame visualization. Conclusion: Kinovea supports basic motion analysis by providing clear kinematic information and helping beginner athletes observe and refine their movement techniques. The findings also offer practical value for coaches by enabling more precise identification of inefficient patterns and guiding targeted corrections during early-stage training."
Crossref,deep learning,Distributed Algorithms for High-Dimensional Statistical Inference and Structure Learning with Heterogeneous Data,Hongru Zhao; Xiaotong Shen,10.5705/ss.202025.0087,2028,Statistica Sinica,
Crossref,deep learning,Botnet Detection in Network Security by means of Deep Neural Network - DBoTPM,Sankarsan Panda; Julia Faith S; C. Manonmani; Sheshang Degadwala,10.1504/ijcis.2028.10073178,2028,International Journal of Critical Infrastructures,
Crossref,deep learning,Zero-Day Intrusion Detection System: Training on Small Datasets with Advanced Data Augmentation and Ensemble Learning,Mehaboob Mujawar; Aasheesh Raizada; Abdullah Gubbi,10.1504/ijims.2028.10075219,2028,International Journal of Internet Manufacturing and Services,
Crossref,deep learning,Doubly Robust Transfer Learning Under Sub-group Shift for Cohort-level Missing Indicator Covariates,Huali Zhao; Tianying Wang,10.5705/ss.202025.0245,2028,Statistica Sinica,
Crossref,deep learning,Simultaneous Estimation and Dataset Selection for Transfer Learning in High Dimensions by a Non-convex Penalty,Zeyu Li; Dong Liu; Yong He; Xinsheng Zhang,10.5705/ss.202024.0423,2028,Statistica Sinica,
Crossref,deep learning,Enhancing Real Time Decision Intelligence through Federated Learning Integration in Edge Computing Networks,M.S. Bennet Praba; M.Vinay Kumar; K.B. Anusha; Nitin Tiwari; Nidal Al Said; K. Kandan,10.1504/ijcis.2028.10073919,2028,International Journal of Critical Infrastructures,
Crossref,deep learning,Uncertainty Quantification for Large-Scale Deep Neural Networks via Post-StoNet Modeling,Yan Sun; Faming Liang,10.5705/ss.202024.0294,2028,Statistica Sinica,
Crossref,deep learning,Dancing in the Rain: The Effectiveness of Mobile Platform for Learning Ten Qira’at,Muhammad Shahrizan Shahrudin; Mu’azah Md. Aziz; Ainul Maulid Ahmad; Abdul Hakim Mahadzir; Muhd Thoriq Asshiddiq Che Ahmad,10.6007/ijarbss/v14-i5/21493,2027-05-02,International Journal of Academic Research in Business and Social Sciences,
Crossref,deep learning,Harnessing IoT anu Machine Learning for Predictive Smart Irrigation Systems: Optimising Water Use and Crop Yield,D. Prathyusha; Pranusha Dogga; Dogga Aswani; Selvani Deepthi,10.1504/ijsse.2027.10068719,2027,International Journal of System of Systems Engineering,
OpenAlex,deep learning,Combating Data and Target Shifts in Visual Tasks,Zhaorui Tan,10.17638/03194353,2031-01-01,University of Liverpool,"The rapid advancement of deep learning models for visual tasks has led to significant progress in many domains. However, a key challenge remains: ensuring that models can generalize effectively to unseen samples or novel classes, especially in real-world scenarios where training data-target pairs are often limited or unavailable, and test data may exhibit shifts in both data and targets. This thesis addresses the problem of shifts across data and targets, proposing novel methods to improve model generalization and transferability in complex settings. The thesis identifies the different shift scenarios for visual tasks and presents their problem forms. The research first relaxes the static target distribution assumption in Multi-Domain Generalization (mDG) tasks, introducing the General Multi-Domain Generalization (GMDG) objective to improve generalization under varying data shifts. Specifically, Extensive experiments validate that GMDG is feasible for classification, segmentation, and regression tasks. Further considering extreme target distribution shifts where even unknown novel classes emerge, the study also explores logical regularization techniques for tasks such as Generalized Category Discovery (GCD), mDG+GCD, and Class Incremental Learning (CIL), proposing a sample-based logical regularization term (L-Reg) to enhance data-, target-, and all-shift generalization. Additionally, a partial logic framework is introduced to address challenges in CIL, enabling models to retain room for unknown classes during training. This is further extended by the Partial-Logic Regularization (PL-Reg), which improves generalization across GCD, mDG+GCD, and transferability for CIL tasks. Furthermore, the thesis proposes a novel Semantic-aware Data Augmentation (SADA) framework for cross-modality generalization in text-to-image synthesis (T2Isyn), text-image retrieval (TIR), and image-text retrieval (ITR) tasks. This framework ensures semantic preservation across text and image modalities, improving both semantic consistency and image quality in cross-modality tasks. The methods proposed in this thesis offer significant advancements in visual generalization and transfer scenarios, providing theoretical insights and practical solutions for handling data shifts, target shifts, and multi-modalities in complex scenarios. Extensive experiments validate the effectiveness of the proposed methods, demonstrating their superior performance across a range of tasks."
OpenAlex,deep learning,Antecedents and consequences of Green-tech FDI in emerging markets,Zhuoran Liu,10.17638/03195308,2031-01-01,University of Liverpool,"As environmental pressures intensify, attracting sustainable foreign direct investment (FDI), particularly green-tech FDI, has become a critical pathway for emerging markets to achieve environmental sustainability. However, existing research remains fragmented, offering limited insights into why green-tech FDI enters emerging markets and how it affects regional green innovation. This thesis addresses these gaps by systematically examining both the antecedents and consequences of green-tech FDI through three empirical studies using regional data from China. Study 1 and Study 2 focus on the antecedents of green-tech FDI. Study 1 examines how host-country conditions can attract green-tech FDI, highlighting the role of environmental management information disclosure (EMID) by domestic firms in reducing information gaps and strengthening green market–seeking motives. Study 2 shifts attention to the active decision-making of green-tech FDI, showing that under uncertainty, green-tech foreign investors engage in identity-based bandwagon learning by imitating peers with similar green identities, thereby mitigating investment risks. Study 3 turns to the consequences of green-tech FDI. It demonstrates that, due to the technological complexity of green innovation and limited absorptive capacity in emerging markets, green-tech FDI may generate crowding-out effects rather than purely positive spillovers. Adopting a network perspective, the study further finds that universities play a key moderating role: through broad linkages and deep collaborations, they help mitigate negative spillovers and facilitate the diffusion of green technologies. Together, the three studies advance the literature on sustainable FDI by differentiating green-tech FDI from general FDI and identifying the specific mechanisms that shape its entry decisions and local innovation outcomes. Practically, the findings provide guidance for emerging-market governments and firms on how to attract and manage sustainable investment, balance growth with environmental objectives, and strengthen local innovation ecosystems."
OpenAlex,deep learning,A UAV-Based Framework for Community-Scale Residential Building Energy Modelling in China,Mengfan Jin,10.17638/03195460,2029-01-01,University of Liverpool,"With increasing emphasis on energy efficiency and carbon emission reduction in the building sector, rapid and scalable energy modelling of existing buildings is critical for retrofit projects and policy development. Conventional surveys, data collection and energy modelling processes remain labour-intensive and impractical for large-scale applications, and energy modelling often dominates project time and cost. Unmanned Aerial Vehicles (UAVs) equipped with high-resolution and infrared cameras now offer fast and safe exterior surveys, showing great potential in building energy assessments. Yet, a systematic framework for UAV integration, from image capture through processing to inputs for building energy simulation, has not been established. This research addresses these challenges by developing a structured framework for community-scale building energy modelling, which integrates UAV photogrammetry to accelerate data acquisition, reduce labour, and shorten energy modelling time for retrofit projects. The framework is designed to minimise prior data requirements while maximising automation and retaining sufficient accuracy and reliability. It also addressed systemic issues, such as the lack of data necessary to fully exploit the potential of available technologies in the context of this study. To achieve this research objective, a mixed-methodology approach, combining desk studies and fieldwork, was adopted. First, a comprehensive review of UAV-based building energy studies mapped the current applications and available tools, proposing a preliminary framework. Fieldwork then encompassed a pilot study and a detailed case study. In the pilot test, a single building was surveyed to identify an optimal toolchain for flight planning, image capture, photogrammetric reconstruction, model generation, and selection of a simulation platform. The resulting refined framework was applied to a case study of a 39-building community, and it was demonstrated that further automation was necessary. The potential for automation was then further explored. Geomatic algorithms, machine learning, and deep learning techniques were compared, and the combination that best balanced accuracy and processing time was selected for 3D model generation and window-to-wall ratio (WWR) extraction. In parallel, an archetype library of residential buildings in the Hot Summer Cold Winter (HSCW) zone in China was compiled to facilitate the assignment of thermal parameters. Finally, a reusable community-scale building energy modelling (CBEM) workflow was assembled in Grasshopper using Ladybug Tools components to process the aforementioned inputs. In conclusion, this study integrates UAV photogrammetry, GIS-based geomatic algorithms, machine learning, and graphical programming to develop an UAV-CBEM framework. The outcomes establish a foundation for scalable UAV-based building energy assessments, enhancing applicability in data-limited and large-scale settings worldwide."
OpenAlex,deep learning,Data Augmentation Application in Deep Learning Drug Discovery by Utilizing Relationships Between Biological and Medical Entities,Tianjun Wang,10.17638/03195452,2029-01-01,University of Liverpool,
OpenAlex,deep learning,Tree ring segmentation performance in highly disturbed trees using deep learning,"Muñoz-Torrero Manchado, Alberto; Zambrano Suárez, Joe David; Pérez-Martín, Jorge",10.5281/zenodo.17974158,2028-12-18,Zenodo (CERN European Organization for Nuclear Research),"All data and materials are related to ""Tree ring segmentation performance in highly disturbed trees using deep learning"". It includes the source code, the primary datasets, the original-resolution figures from the main manuscript, and all supplementary materials cited in the text."
OpenAlex,deep learning,Tree ring segmentation performance in highly disturbed trees using deep learning,"Muñoz-Torrero Manchado, Alberto; Zambrano Suárez, Joe David; Pérez-Martín, Jorge",10.5281/zenodo.17981686,2028-12-18,Zenodo (CERN European Organization for Nuclear Research),"All data and materials are related to ""Tree ring segmentation performance in highly disturbed trees using deep learning"". It includes the source code, the primary datasets, the original-resolution figures from the main manuscript, and all supplementary materials cited in the text."
OpenAlex,deep learning,Deep q-learning aided k-means clustering protocol for optimizing network lifetime in wireless sensor networks,Flynn Dowey,10.14288/1.0451106,2028-01-01,Open Collections,"The full abstract for this thesis is available in the body of the thesis, and will be available when the embargo expires."
