source,keyword,title,authors,doi,publication_date,journal,abstract
Crossref,mitral regurgitation,Letter to the editor: Outcomes of mitral valve reoperation and first-time surgery for mitral regurgitation: A nationwide study,Muhammad Huzaifa Zahid; Maria Saleem; Amir Murtaza,10.1016/j.ijcard.2025.133859,2026-01,International Journal of Cardiology,
Crossref,mitral regurgitation,Natural history outcome of moderate tricuspid regurgitation with preserved left-ventricular ejection fraction,Davide Margonato; Michele Morosato; Giacomo Ingallina; Cheng Wang; Francesco Ancona; Giorgio Fiore; Vincenzo Rizza; Alberto Preda; Michele De Bonis; Francesco Maisano; Giovanni Benfari; Maurice Enriquez-Sarano; Yan Topilsky; Eustachio Agricola,10.1016/j.ijcard.2025.133826,2026-01,International Journal of Cardiology,
Crossref,mitral regurgitation,"Comparison of Functional Tricuspid Regurgitation Following Transcatheter Atrial Septal Defect Closure in Adult Patients With Sinus Rhythm, Post-ablation Sinus Rhythm, and Permanent Atrial Fibrillation",Satoshi Noda; Tsutomu Murakami; Hitomi Horinouchi; Kaho Hashimoto; Junichi Miyamoto; Katsuaki Sakai; Norihiko Kamioka; Yohei Ohno; Atsuhiko Yagishita; Gaku Nakazawa; Yuji Ikari,10.1016/j.amjcard.2025.09.052,2026-01,The American Journal of Cardiology,
Crossref,mitral regurgitation,Aortic regurgitation as a cause of sudden cardiac death with aortic and left ventricular remodelling - the role of the bicuspid valve,Lauren Moran; Joseph Westaby; Mary N. Sheppard,10.1016/j.carpath.2025.107781,2026-01,Cardiovascular Pathology,
Crossref,mitral regurgitation,Guiding Early Management in Severe Mitral Stenosis with Extensive Mitral Annular Calcification: A Transseptal ViMAC Case,Tommaso Fabris; Michele Strosio; Francesco Putortì; Consolato Mesiani; Antonio Amadio; Simone Tripi; Andrea Panza; Giuseppe Tarantini,10.1016/j.amjcard.2025.08.033,2026-01,The American Journal of Cardiology,
Crossref,mitral regurgitation,A doppler-exclusive computational diagnostic framework to enhance conventional 2-D clinical ultrasound with 3-D mitral valve dynamics and cardiac hemodynamics,Nikrouz Bahadormanesh; Mohamed Abdelkhalek; Zahra Keshavarz-Motamed,10.1016/j.media.2025.103772,2026-01,Medical Image Analysis,
Crossref,mitral regurgitation,Cardiac Damage Staging in Moderate or Greater Aortic Regurgitation: A New Framework for Risk Stratification,Francisco B. Alexandrino; Ian Persits; Joseph Hajj; Ziad Zalaquett; V. Karthik; Travis Howard; Vincent Chen; Samir R. Kapadia; Serge C. Harb; Rishi Puri,10.1016/j.shj.2025.100748,2026-01,Structural Heart,
Crossref,mitral regurgitation,Outcome of Functional Mitral Regurgitation Associated With Heart Failure with Mildly Reduced or Preserved Ejection Fraction,Ga Yun Kim; So-Min Lim; Sahmin Lee; Byung Joo Sun; Jong-Min Song; Duk-Hyun Kang,10.1016/j.amjcard.2025.08.067,2026-01,The American Journal of Cardiology,
Crossref,valvular heart disease,Giant Cells in Health and Disease-A Review,Sonal Gupta,10.21276/ijchmr.2016.2.2.10,2106-06-20,International Journal Of Community Health And Medical Research,
Crossref,valvular heart disease,Contemporary Disease Management in Quebec,Amédé Gogovor; Michelle Savoie; Yola Moride; Marilyn Krelenbaum; Terrence Montague,10.12927/hcq.2013.19495,2088-01-15,Healthcare Quarterly,
Crossref,valvular heart disease,Chronic Disease Prevention and Management: Implications for Health Human Resources in 2020,Margo Orchard; Esther Green; Terrence Sullivan; Anna Greenberg; Verna Mai,10.12927/hcq.2013.19496,2088-01-15,Healthcare Quarterly,
Crossref,valvular heart disease,What a Study on Ultraprocessed Fake Meat and Heart Disease Really Found,Lori Y,10.1038/scientificamerican072077-2xmzfca9smsvxelw1jobgf,2077-07,Scientific American,
Crossref,valvular heart disease,Woman Receives Genetically Modified Pig Kidney Transplant after Heart Pump Surgery,Tanya L,10.1038/scientificamerican072077-4hozib8kpx2m6wjvhqi1zz,2077-07,Scientific American,
Crossref,valvular heart disease,Water Lily or Camelotte Sign in Pulmonary Hydatid Cyst – An Orphan Disease,Sudheer Tale; Soibampahel M; Mrudula K; Ritisha B; Subodh K; Girish S,10.23880/cclsj-16000132,2028-11-11,Cell &amp; Cellular Life Sciences Journal,"A 20 – year – old male without any previous comorbidity presented to pulmonary medicine outpatient department with complaints of dull aching chest pain on right side, dry cough and shortness of breath for the pastone year. He was non vegetarian and had no addictions. On general physical examination his vitals were stableand respiratory system examination revealed decreased breath sounds in the right hemithorax. All his routineblood investigations were normal. Chest radiograph revealed homogenous opacity in the right middle andlower zones. Contrast enhanced computed tomography of thorax and abdomen showed a well defined encapsulatedcystic lesion of size 12x10x14cm with internal floating membranes (water lily sign or Camelotte sign) with masseffect on adjacent lung parenchyma causing atelectasis and compression of adjacent vessels (Figure 1). Hydatid serology (IgG) was positive. Patient was treated symptomatically and referred for surgical intervention."
Crossref,valvular heart disease,RELATION OF HEART WEIGHT WITH AGE AND WEIGHT OF CADAVER,Jolly Agarwal; Virendra Kumar,10.21761/jms.v2i01.10838,2027-07-25,SRMS JOURNAL OF MEDICAL SCIENCE,"Introduction: Height, weight, and age of person has significant impact on the normal size of&#x0D; heart. These parameters need to be considered when cut-off values indicating the need for&#x0D; treatment or even surgery are established. The aim of present work is to study the relation of&#x0D; weight of the heart with age and weight of cadaver.&#x0D; Material and Methods: The study was performed in the Department of Anatomy, Shri Ram&#x0D; Murti Smarak Institute of Medical Sciences, Bareilly on 30 hearts from embalmed cadavers.&#x0D; The hearts were procured from the cadavers available in our department. The heart was&#x0D; thoroughly cleaned and measurements were taken.&#x0D; Results: The mean heart weight was 223.37 ± 57.78 g. Significant relationship between age of&#x0D; the cadaver and weight of the heart (p=0.0004), weight of cadaver and weight of heart&#x0D; (p=0.0001) was observed.&#x0D; Conclusion: The above study provides valuable data of the heart in our geographical location,&#x0D; which may be useful for cardiac surgeons and physicians."
Crossref,valvular heart disease,Improving Citrus Leaf Disease Segmentation and Classification with a Game Theoretical U-Net Convolutional LightGBM model,K. Rama Gangi Reddy; K.S. Thirunavukkarasu,10.1504/ijiei.2027.10072915,2027,International Journal of Intelligent Engineering Informatics,
Crossref,valvular heart disease,An Intelligent Approach with Integrated Feature Selection for Accurate Parkinson's Disease Diagnosis,Pravin Madhukar Dhanrao; B.K. Madhavi; Haard Patel; Debabrata Swain; Sashikala Mishra; Het Prajapati; Shrey Joshi,10.1504/ijims.2027.10072985,2027,International Journal of Internet Manufacturing and Services,
Crossref,valvular heart disease,An evolutionarily conserved module links TIR signaling to disease resistance,XiaoFei Du; Yu Zhang; Hailong Guo,10.1016/j.ncrops.2025.100083,2026-10,New Crops,
Crossref,valvular heart disease,SIRT1(rs7069102) Gene Polymorphism in Chronic Obstructive Pulmonary Disease in Egyptian Patients,Zeinab M. Kadry; Ebtisam M. Gad; Noha S. Shafik; Asmaa T. Mostafa; Sara M. Sleim; Alshimaa H. Abdelall,10.21608/ejmm.2025.431059.1922,2026-07-01,Egyptian Journal of Medical Microbiology,
Crossref,valvular heart disease,A Timid Hello to Professional Nursing: Letters from Newly Graduating Nurses During Coronavirus Disease 2019 Pandemic,"Cankiri Karatekin University, Faculty of Health Science, Cankiri, Turkey; Funda ASLAN; Nilay ERCAN SAHIN; Hacettepe University, Faculty of Nursing, Ankara, Turkey",10.5152/janhs.2023.22255,2026-06-26,Journal of Nursology,
Crossref,valvular heart disease,A Qualitative Analysis Using Social Listening Method: Turkish Nurses’ Experiences in Coronavirus Disease 2019 Pandemic,"Koc University School of Nursing, Istanbul, Turkey; Ozlem CICEK DOGAN; Seda GUNEY; Koc University School of Nursing, Istanbul, Turkey; Ayse BESER; Koc University School of Nursing, Istanbul, Turkey",10.5152/janhs.2023.22262,2026-06-26,Journal of Nursology,
Crossref,valvular heart disease,Handgrip strength as an independent predictor of mortality in chronic kidney disease patients undergoing hemodialysis: A prospective cohort,Vanessa Gomes Brandão Rodrigues; Joyce Noelly Vitor Santos; Vanessa Kelly da Silva Lage; Inara Caroline Marcelino Martins; Elisângela Andrade Assis Madeira; Gabriel Viana Figueiredo; Larissa Paes Toledo; Tamara Cunha; Jéssica Stéfany Rocha; Vitória Emanuelli Rodrigues Silva; Frederico Lopes Alves; Maria Cecília Sales Mendes Prates; Emílio Henrique Barroso Maciel; Redha Taiar; Henrique Silveira Costa; Ana Cristina Rodrigues Lacerda; Pedro Henrique Scheidt Figueiredo; Vanessa Amaral Mendonça,10.1016/j.jbmt.2025.10.036,2026-06,Journal of Bodywork and Movement Therapies,
Crossref,valvular heart disease,Intensive versus usual rehabilitation programs in stable chronic obstructive pulmonary disease (COPD) patients,Hala M. Abd Elsabour Sabah; Rehab M. Mohammed; Samia Mohamed Rashad,10.1016/j.jbmt.2025.10.055,2026-06,Journal of Bodywork and Movement Therapies,
Crossref,valvular heart disease,Postbiotics: A promising frontier in improving periodontal disease,Congxin Dong; Tian Liu; Chun Li; Guofang Zhang; Libo Liu; Peng Du; Aili Li,10.1016/j.fnutr.2025.100041,2026-06,Food Nutrition,
Crossref,valvular heart disease,A Combination of Whey Protein and Vitamin D Reduces Sarcopenia in Patients with Chronic Obstructive Pulmonary Disease. A Randomized Controlled Trial,Rizwan Qaisar; Imran Ullah Khan; Firdos Ahmad; Asima Karim,10.1016/j.arcmed.2025.103330,2026-06,Archives of Medical Research,
Crossref,valvular heart disease,Early acupuncture exposure and mortality in older adults with ischemic heart disease: A nationwide cohort study in Korea,Hyungsun Jun; Dasol Park; Haerim Kim; Ye-Seul Lee; Jungtae Leem,10.1016/j.imr.2025.101252,2026-06,Integrative Medicine Research,
Crossref,valvular heart disease,"A hybrid approach using logistic sigmoid, radial basis, and hyperbolic tangent neural networks to model M-pox disease dynamics",Nassira Madani; Zakia Hammouch,10.1016/j.cam.2025.117146,2026-05,Journal of Computational and Applied Mathematics,
Crossref,valvular heart disease,Optimal control strategies for sustainable management of Bayoud disease in date palm trees: The role of resistant varieties and treatment,Azhar Iqbal Kashif Butt,10.1016/j.cam.2025.117209,2026-05,Journal of Computational and Applied Mathematics,
Crossref,deep learning,Learner profiles and the process of Learning in the Higher Educational Context,Christos Skourlas; Petros Belsis,10.15556/ijiim.02.01.003,2115-03-05,International Journal on Integrated Information Management,
Crossref,deep learning,WEB-BASED COLLABORATIVE LEARNING AND KNOWLEDGE SHARING IN INFORMAL BUSINESS NETWORKS,George Stalidis; Costis Papadimitrakopoulos; Theocharis Tsakiris,10.15556/ijiim.01.02.002,2114-12-10,International Journal on Integrated Information Management,
Crossref,deep learning,Availability and Utilization of Tools and Equipment for Teaching and Learning Garment Making Trade in the Senior Secondary Schools in Edo State,,10.20431/2349-0381.0303002,2106,"International Journal of Humanities, Social Sciences and Education",
Crossref,deep learning,Title Pending 7512,,10.2458/itlt.7512,2035-07-24,Issues and Trends in Learning Technologies,
Crossref,deep learning,Title Pending 6368,,10.2458/itlt.6368,2034-12-21,Issues and Trends in Learning Technologies,
Crossref,deep learning,Title Pending 6294,,10.3998/mjcsl.6294,2034-12-20,Michigan Journal of Community Service Learning,
Crossref,deep learning,Title Pending 5730,,10.3998/mjcsl.5730,2034-11-18,Michigan Journal of Community Service Learning,
Crossref,deep learning,Title Pending 6052,,10.2458/itlt.6052,2034-11-12,Issues and Trends in Learning Technologies,
Crossref,deep learning,Title Pending 3643,,10.3998/mjcsl.3643,2033-09-06,Michigan Journal of Community Service Learning,
Crossref,deep learning,Title Pending 4120,,10.3998/mjcsl.4120,2033-03-28,Michigan Journal of Community Service Learning,
Crossref,deep learning,Title Pending 2741,,10.3998/mjcsl.2741,2032-09-28,Michigan Journal of Community Service Learning,
Crossref,deep learning,Distributed Algorithms for High-Dimensional Statistical Inference and Structure Learning with Heterogeneous Data,Hongru Zhao; Xiaotong Shen,10.5705/ss.202025.0087,2028,Statistica Sinica,
Crossref,deep learning,Botnet Detection in Network Security by means of Deep Neural Network - DBoTPM,Sankarsan Panda; Julia Faith S; C. Manonmani; Sheshang Degadwala,10.1504/ijcis.2028.10073178,2028,International Journal of Critical Infrastructures,
Crossref,deep learning,Enhancing Real Time Decision Intelligence through Federated Learning Integration in Edge Computing Networks,M.S. Bennet Praba; M.Vinay Kumar; K.B. Anusha; Nitin Tiwari; Nidal Al Said; K. Kandan,10.1504/ijcis.2028.10073919,2028,International Journal of Critical Infrastructures,
Crossref,deep learning,Uncertainty Quantification for Large-Scale Deep Neural Networks via Post-StoNet Modeling,Yan Sun; Faming Liang,10.5705/ss.202024.0294,2028,Statistica Sinica,
Crossref,deep learning,Dancing in the Rain: The Effectiveness of Mobile Platform for Learning Ten Qira’at,Muhammad Shahrizan Shahrudin; Mu’azah Md. Aziz; Ainul Maulid Ahmad; Abdul Hakim Mahadzir; Muhd Thoriq Asshiddiq Che Ahmad,10.6007/ijarbss/v14-i5/21493,2027-05-02,International Journal of Academic Research in Business and Social Sciences,
Crossref,deep learning,Harnessing IoT anu Machine Learning for Predictive Smart Irrigation Systems: Optimising Water Use and Crop Yield,D. Prathyusha; Pranusha Dogga; Dogga Aswani; Selvani Deepthi,10.1504/ijsse.2027.10068719,2027,International Journal of System of Systems Engineering,
Crossref,deep learning,Efficient Learning of DAG Structures in Heavy-tailed Data,Wei Zhou; Xueqian Kang; Wei Zhong; Junhui Wang,10.5705/ss.202024.0199,2027,Statistica Sinica,
Crossref,deep learning,Prediction of The Recycled Aggregate Concrete Compressive Strength Using Novel Machine Learning Model and Metaheuristic Algorithms,Xiuyuan Li; Zhiyong Wang,10.1504/ijcis.2027.10069677,2027,International Journal of Critical Infrastructures,
Crossref,deep learning,Efficient digital forensic in IoT environment: a hybrid framework using deep-federated learning,Waad Almadud; Asma Abdulghani Al Shargabi,10.1504/ijesdf.2027.10073649,2027,International Journal of Electronic Security and Digital Forensics,
