source,keyword,title,authors,doi,publication_date,journal,abstract
PubMed,deep learning,PIPN: Physics-inspired phase retrieval network for propagation-based X-ray phase-contrast imaging.,Ziyao Wang; Xianqin Du; Yimin Li; Fangzhi Li; Chenyang Ma; Dongjiang Ji; Xinyan Zhao; Yingran Tang; Chunhong Hu; Yuqing Zhao,10.1364/OL.581596,2026-01-15,Optics letters,"Propagation-based X-ray phase-contrast imaging (PB-XPCI) can produce high-resolution images of soft tissue. However, this usually requires extracting the phase shift from intensity measurement at a single propagation distance through phase retrieval-an underdetermined nonlinear inverse problem. Conventional single-distance phase retrieval methods usually rely on multiple approximation conditions. Deep learning (DL)-based phase retrieval methods often rely on high-quality data for training or lengthy physics model iterative computations to optimize network parameters. In order to surmount the aforementioned limitations, this study proposes a physics-inspired phase retrieval network for propagation-based X-ray phase-contrast imaging (PIPN) and an acceleration strategy for the PIPN. It can achieve phase retrieval based solely on a single approximation condition and a physics imaging model, without the need for any training data. Experiments demonstrate that the PIPN can quickly reconstruct high-quality retrieved phase projections by using the acceleration strategy, and remain stable under different propagation distances."
PubMed,deep learning,Experimental demonstration of coherent beam combination by a simulation-trained deep neural network.,Nathanaël Hulard; Bastien Rouzé; Laurent Lombard; Stéphane Barland; Pierre Bourdon,10.1364/OL.578133,2026-01-15,Optics letters,"For phase retrieval in a coherent beam combining of 7 fiber amplifiers arranged in a tiled aperture experiment, we demonstrate the feasibility of direct implementation of a light-weight deep-learning model trained on simulated data only. Deep-learning-assisted phase control performs efficiently with lower than λ/30 residual phase error. The use of simulation-trained neural networks allows for fast training (<10 min), a priori optimization, without the need for experimental data acquisition, and easier experimental portability."
PubMed,deep learning,Deep learning-assisted metalens imaging over a wide depth of field.,Ruixiang Song; Xiyao Song; Xutong Lu; Shuaihong Qi; Feng Wang; Jiaqi Cui; Zhangyuan Chen; Yanping Li,10.1364/OL.580297,2026-01-15,Optics letters,"Miniaturized lenses with a large depth of field and high imaging quality are desirable for compact optical systems, as they eliminate the need for lens switching and repeated refocusing. Metalenses, composed of flat, subwavelength nanostructures, are well suited to this demand due to their ultra-thin profile and design flexibility. However, miniaturized metalenses typically require larger numerical apertures (NA), which lead to strong chromatic dispersion and resolution degradation. To address this limitation, we propose a Metalens Depth-of-Field Generative Adversarial Network tailored for restoring full-color images captured by a high-NA (0.447) millimeter-scale metalens. It achieves a 35% increase in peak signal-to-noise ratio and a 57.7% reduction in perceptual loss, while maintaining reconstruction quality across over 17.5 cm depth of field without additional training. This network provides a practical and scalable solution for enhancing image quality in miniaturized imaging systems."
PubMed,deep learning,Application of deep learning to single-shot gas-phase laser-induced breakdown spectroscopy.,Nathan P Brown; Elijah R Jans; Garrett W Idler,10.1364/OL.583775,2026-01-15,Optics letters,"Single-shot fs laser-induced breakdown spectroscopy (LIBS) has the potential to capture ns-scale electrode desorption phenomena in pulsed power fusion drivers. However, the successful implementation of the diagnostic for this purpose is challenging, as it requires interpreting single-shot measurements collected from low-density gas mixtures. In this work, we demonstrate the efficacy of a Bayesian-optimized convolutional neural network (CNN) to interpret these measurements. We generated 256 distinct measurement conditions at relevant gas pressures ranging from 80-530 mTorr by mixing 100-250 sccm H2 and 50-200 sccm CH4 in increments of 10 sccm. Despite the considerable overlap between signals separated by 20 sccm, the CNN is able to predict the H2 flow rate with a root-mean-square error (RMSE) of 15.9 sccm and the CH4 flow rate with an RMSE of 12.0 sccm. The average relative prediction error is <9% for each gas and largely remains below or near 10%."
PubMed,deep learning,Mild Cognitive Impairment Detection System Based on Unstructured Spontaneous Speech: Longitudinal Dual-Modal Framework.,Yu-Shan Liao; Thiri Wai; Ting-Yun Liao; Ho-Ling Chang; Yu-Ling Chang; Li-Chen Fu,10.2196/80883,2026-01-15,JMIR medical informatics,"In recent years, the incidence of cognitive diseases has also risen with the significant increase in population aging. Among these diseases, Alzheimer disease constitutes a substantial proportion, placing a high-cost burden on health care systems. To give early treatment and slow the progression of patient deterioration, it is crucial to diagnose mild cognitive impairment (MCI), a transitional stage.
In this study, we use autobiographical memory (AM) test speech data to establish a dual-modal longitudinal cognitive detection system for MCI. The AM test is a psychological assessment method that evaluates the cognitive status of subjects as they freely narrate important life experiences.
Identifying hidden disease-related information in unstructured, spontaneous speech is more difficult than in structured speech. To improve this process, we use both speech and text data, which provide more clues about a person's cognitive state. In addition, to track how cognition changes over time in spontaneous speech, we introduce an aging trajectory module. This module uses local and global alignment loss functions to better learn time-related features by aligning cognitive changes across different time points.
In our experiments on the Chinese dataset, the longitudinal model incorporating the aging trajectory module achieved area under the receiver operating characteristic curve of 0.85 and 0.89 on 2 datasets, respectively, showing significant improvement over cross-sectional, single time point models. We also conducted ablation studies to verify the necessity of the proposed aging trajectory module. To confirm that the model not only applies to AM test data, we used part of the model to evaluate the performance on the ADReSSo dataset, a single time point semistructured data for validation, with results showing an accuracy exceeding 0.88.
This study presents a noninvasive and scalable approach for early MCI detection by leveraging AM speech data across multiple time points. Through dual-modal analysis and the introduction of an aging trajectory module, our system effectively captures cognitive decline trends over time. Experimental results demonstrate the method's robustness and generalizability, highlighting its potential for real-world, long-term cognitive monitoring."
PubMed,deep learning,DPM: A Deep Learning and Optimal Transport Framework for Cost-Effective Spatial Metabolomics.,Bo Yao; Longfeng Yang; Chi Zhang; Yuanyuan Lv; Chenkun Yang; Li-Jun Di; Jie Luo; Shu-Hai Lin,10.1021/acs.analchem.5c06903,2026-01-15,Analytical chemistry,"Mass spectrometry imaging (MSI) is a powerful technology in spatial metabolomics that enables the in situ detection and distribution analysis of metabolites in tissue sections. However, the high cost associated with high-resolution and multislice MSI acquisition remains a major limitation. Here, we introduce DeepPathMetabol (DPM), a deep learning-enhanced framework based on optimal transport theory, which accurately predicts spatial metabolite distributions in an MSI section using data from an adjacent section through an optimized mapping strategy. DPM achieves superior alignment and prediction accuracy, outperforming conventional feature similarity-based methods such as those using Euclidean or kernel-based metrics both with and without spatial distance weighting. We further demonstrated that the DPM framework can effectively enhance MSI resolution, providing a powerful tool for cost-effective and high-precision spatial metabolomics research. This approach also shows promising potential for extension to spatial transcriptomics. Collectively, our work establishes histology-facilitated MSI-to-MSI prediction as a versatile strategy for spatial biology research. DPM is open-source and available at https://github.com/LinShuhaiLAB/DeepPathMetabol."
PubMed,deep learning,Can Large Language Models Detect Periapical Lesions in Anterior Teeth? A Comparative Study.,Diulia Pereira Bubna; Natanael Henrique Ribeiro Mattos; Luana Beatriz das Portas Luiz; Flares Baratto-Filho; May Tostes de Mattos-Calil; Yara Teresinha Corrêa Silva-Sousa; Erika Calvano Küchler; Ângela Graciela Deliga Schroder; Cristiano Miranda de Araujo; Bianca Marques de Mattos de Araujo,10.1590/0103-644020256861,2026,Brazilian dental journal,"This study evaluated the diagnostic performance of large language models (LLMs)-ChatGPT 5.0 (OpenAI) and Gemini Flash 2.0 (Google Inc.)-in detecting periapical lesions on periapical radiographs using a standardized multimodal prompt. Seventy-five anonymized periapical radiographs of anterior teeth from the maxilla and mandible were analyzed, evenly distributed between cases with and without lesions. A calibrated endodontic specialist provided the reference diagnosis. Each image was independently assessed five times by both LLMs using the prompt: ""Does this image show a periapical lesion? Answer 'Yes' or 'No'. If 'Yes', which tooth?"". Balanced accuracy, sensitivity, specificity, and F1-score were calculated with 95% confidence intervals (CIs) obtained via bootstrap resampling. Performance was also stratified by diagnostic difficulty, and the models were compared using the exact McNemar test (α = 0.05). ChatGPT 5.0 showed higher overall performance than Gemini Flash 2.0, with sensitivity of 0.97 (95% CI: 0.95-0.99), specificity of 0.11 (95% CI: 0.07-0.16), and balanced accuracy of 0.54 (95% CI: 0.52-0.57). Gemini Flash 2.0 achieved sensitivity of 0.84 (95% CI: 0.79-0.89), specificity of 0.11 (95% CI: 0.07-0.16), and balanced accuracy of 0.48 (95% CI: 0.44-0.51). Both models showed high false-positive rates and frequent errors in tooth localization. The McNemar test confirmed a significant difference between models (p < 0.05), favoring ChatGPT 5.0. Both LLMs demonstrated high sensitivity but poor specificity, resulting in intermediate diagnostic performance and a bias toward positive classifications. General-purpose LLMs are therefore not yet suitable for radiographic diagnostic use."
PubMed,deep learning,Clinical decisions in Orthodontics using x-ray-based images and artificial intelligence approaches: a scoping review.,Pedro Henrique José de Oliveira; João Roberto Gonçalves; Luiz Gonzaga Gandini Júnior; Julianna de Oliveira Lima Parizotto; Michelle Sousa Oliveira; Renata Mayumi Kato; Karine Evangelista; Lucia Helena Soares Cevidanes; Jonas Bianchi,10.1590/2177-6709.30.4.e2524219.oar,2026,Dental press journal of orthodontics,"Artificial intelligence (AI) in health has increased its applications over the last years. The large amount of data available due to the improvement of data storage and digital exams provided better knowledge in treatment planning and opened new possibilities of applications of AI in Orthodontics' diagnosis and treatment planning.
The aim of this scoping review was to examine when AI models enhance the clinical decision-making process in orthodontic diagnosis and treatment planning, with a focus on the utilization of X-ray-based imaging.
Individual eletronic search strategies were developed and conducted on PubMed/Medline, Scopus, Web fo Science, Embase, Lilacs, and Cochrane Library (only English language articles published from January 2000 to October 20, 2021), aiming for relevant studies that met the eligibility criteria.
12 studies were included, categorized in 5 different groups: Orthognathic surgery, Temporomandibular Joint (TMJ) osteoarthritis, skeletal pattern, obstructive sleep apnea (OSA), and skeletal maturation/development. Most of the AI models used were Deep Learning (DL) based and the X-ray image that was most used was lateral radiographs.
Integrating AI into clinical practice will likely continue to evolve, enhancing treatment planning in selective cases. The best applications were over TMJ osteoarthritis, skeletal maturation, and classification, OSA, and the need for orthognathic surgery."
PubMed,deep learning,Laparoscopic Anatomical S7 Segmentectomy: A Standardized Combined Dorsal and Ventral Method.,Wuqiang Chen; Yingjian Hou; Yuan Jiang; Youzhao He; Wen Xiang; Youyi Liu; Cheng Jin,10.1159/000550334,2026-01-15,Digestive surgery,"Anatomical resection of tumor in liver segment S7 is the most technically challenging procedure in laparoscopic liver hepatectomy due to its deep location and complex vascular structures, which results in a steep learning curve for beginners. We explored a simple and feasible approach: a dorsal approach combined with a dorsoventral method for liver segment S7 resection.
The key innovations we propose through the dorsal approach combined with a dorsoventral method include: 1) systematic dissection of the S7 hepatic pedicle through Rouviere sulcus; 2) parenchymal transection guided by the dorsal ischemic demarcation line of segment S7; 3) advance along the right hepatic vein toward the ventral aspect of segment S7. By decomposing complex maneuvers into three standardized steps (Step 1-3), this protocol significantly reduces technical barriers. The procedural details are meticulously demonstrated in this report to enhance reproducibility.
All patients underwent surgery smoothly, with no conversion to open surgery and no deaths, and all patients achieved R0 resection. The operation time was 190.0 (178.0 - 210.0) min, and intraoperative blood loss was 200.0 (150.0 - 280.0) mL.
This method standardizes the laparoscopic S7 segment resection, which, while ensuring precise removal, is expected to reduce the learning curve for surgeons."
PubMed,deep learning,Towards Enhanced Representation Learning for Single-Source Domain Generalization in LiDAR Semantic Segmentation.,Hyeonseong Kim; Yoonsu Kang; Changgyoon Oh; Kuk-Jin Yoon,10.1109/TPAMI.2026.3654352,2026-01-15,IEEE transactions on pattern analysis and machine intelligence,"With the success of the 3D deep learning models, various perception technologies for autonomous driving have been developed in the LiDAR domain. While these models perform well in the trained source domain, they struggle in unseen domains with a domain gap. In this paper, we propose a representation learning approach for domain generalization in LiDAR semantic segmentation, termed DGLSS++, which is designed to ensure robust performance in both the source domain and unseen domains despite training exclusively on the source domain. Our approach focuses on generalizing from a single source domain, addressing the domain shift caused by variations in LiDAR sensor configurations and scene distributions. To tackle both sparse-to-dense and dense-to-sparse generalization scenarios, we simulate unseen domains by generating sparsely and densely augmented domains. With the augmented domain, we introduce two constraints for generalizable representation learning: generalized masked sparsity invariant feature consistency (GMSIFC) and localized semantic correlation consistency (LSCC). GMSIFC aligns the internal sparse features of the source domain with those of the augmented domain at different sparsity, introducing a novel masking strategy to exclude voxel features associated with multiple inconsistent classes. For LSCC, class prototypes from spatially local regions are constrained to maintain similar correlations across all local regions, regardless of the scene or domain. In addition, we establish standardized training and evaluation protocols utilizing four real-world datasets and implement several baseline methods. Extensive experiments demonstrate our approach outperforms both UDA and DG baselines. The code is available at https://github.com/gzgzys9887/DGLSS."
PubMed,deep learning,Single-Photon Imaging in Complex Scenarios via Physics-Informed Deep Neural Networks.,Siao Cai; Zhicheng Yu; Shaobing Gao; Zeyu Chen; Yiguang Liu,10.1109/TPAMI.2026.3654264,2026-01-15,IEEE transactions on pattern analysis and machine intelligence,"Single-photon imaging uses single-photon-sensitive picosecond-resolution sensors to capture 3D structure and supports diverse applications, but success remains mostly limited to simple scenes. In complex scenarios, traditional methods degrade and deep learning methods lack flexibility and generalization. Here, we propose a physics-informed deep neural network (PIDNN) framework that effectively addresses both aspects, adapting to complex and variable sensing environments by embedding imaging physics into the deep neural network for unsupervised learning. Within this framework, by tailoring the number of U-Net skip connections, we impose multi-scale spatiotemporal priors that improve photon-utilization efficiency, laying the foundation for addressing the inherent low-signal-to-background ratio (SBR) problem in subsequent complex scenarios. Additionally, we introduce volume rendering into the PIDNN framework and design a dual-branch structure, further extending its applicability to multiple-depth and fog occlusion. We validated the performance of this method in various complex environments through numerical simulations and real-world experiments. The results of photon-efficient imaging with multiple returns show robust performance under low SBR and large fields of view. The method attains lower root mean-squared error than traditional methods and exhibits stronger generalization than supervised approaches. Further multiple depths and fog interference experiments confirm that its reconstruction quality surpasses existing techniques, demonstrating its flexibility and scalability. Both simulation and experimental results validate its exceptional reconstruction performance and flexibility."
PubMed,deep learning,Deep learning reveals hidden diversity of Synechococcus in the coastal water of China: novel clades and their ecological insights.,Yanhui Wang; Jinxin Xu; Feng Chen; Yanni Sun; Lu Liu; Jiaxin Chen; Xiaomeng Wang; Yuxing Hu; Bowen He; Yunxuan Li; Qiang Zheng,10.1098/rspb.2025.1936,2025-12-17,Proceedings. Biological sciences,"Synechococcus is ubiquitous and diverse in marine environments and contributes significantly to primary productivity in the ocean. The genetic diversity of the genus Synechococcus has been extensively explored based on the 16S-23S rRNA internal transcribed spacer (ITS) region. However, accurate identification of Synechococcus ITS from large sequencing datasets is challenging owing to the absence of a standardized taxonomy and to ambiguous clade boundaries. To address these limitations, we developed Syn_Tool, a deep-learning-based framework integrating a curated Synechococcus ITS database for sequence identification, classification and novel clade discovery. Analysing 1 087 323 ITS sequences from the coastal water of China-the largest Synechococcus dataset to date-Syn_Tool classified them into 42 clades, including 28 known and 14 newly defined clades. Biogeographical analyses revealed a latitudinal diversity gradient driven by temperature, with 12 newly defined clades (clades CSII-IV, CSVI-XIV) primarily found in estuarine regions where rapid diversification may promote the emergence of novel genotypes. This study demonstrates the application of deep learning in classifying Synechococcus and understanding their ecological roles in dynamic marine ecosystems."
PubMed,deep learning,Expanding the clinical utility of deep learning-based radiomics and machine learning for prognostic assessment in IDH-wildtype glioblastoma following maximal safe surgical resection.,Lirui Dai; Wenyi Zhan; Shu Jiang; Peizhi Zhou,10.1097/JS9.0000000000004661,2026-01-13,"International journal of surgery (London, England)",
PubMed,deep learning,A comprehensive survey of genome language models in bioinformatics.,Liyuan Shu; Jiao Tang; Xiaoyu Guan; Daoqiang Zhang,10.1093/bib/bbaf724,2026-01-07,Briefings in bioinformatics,"Large language models have revolutionized natural language processing by effectively modeling complex semantics and capturing long-range contextual relationships. Inspired by these advancements, genome language models (gLMs) have recently emerged, conceptualizing DNA and RNA sequences as biological texts and enabling the identification of intricate genomic grammar and distant regulatory interactions. This review examines the need for gLMs, emphasizing their capacity to overcome the limitations of traditional deep learning approaches in genomic sequence characterization. We comprehensively survey contemporary gLM architectures, including Transformer models, Hyena convolutions, and state space models, as well as various sequence tokenization strategies, assessing their applicability, and effectiveness across diverse genomic applications. Additionally, we discuss foundational pretraining strategies and provide an overview of genomic pretraining datasets spanning multiple species and functional domains. We critically analyze evaluation methodologies, including supervised, zero-shot, and few-shot learning paradigms, as well as fine-tuning approaches. An extensive taxonomy of downstream tasks is presented, alongside a summary of existing benchmarks and emerging trends. Finally, we contemplate key challenges such as data scarcity, interpretability, and the computational demands of genomic modeling, and propose a roadmap to guide future advances in genome language modeling."
PubMed,deep learning,CNAttention: an attention-based deep multiple-instance method for uncovering copy number aberration signatures across cancers.,Ziying Yang; Michael Baudis,10.1093/bib/bbaf696,2026-01-07,Briefings in bioinformatics,"Somatic copy number aberrations (CNAs) represent a distinct class of genomic mutations associated with oncogenetic effects. Over the past three decades, significant volumes of CNA data have been generated through molecular-cytogenetic and genome sequencing-based techniques. These data have been pivotal in identifying cancer-related genes and advancing research on the relationship between CNAs and histopathologically defined cancer types. However, comprehensive studies of CNA landscapes and disease parameters are challenging due to the vast diagnostic and genomic heterogeneity encountered in ""pan-cancer"" approaches. In this study, we introduce CNAttention, an attention-based deep multiple instance learning method designed to comprehensively analyze CNAs across different cancers and uncover specific CNA patterns within integrated gene-level CNA profiles of 30 cancer types. CNAttention effectively learns CNA features unique to each cancer type and generates CNA signatures for 30 cancer types using attention mechanisms, highlighting the distinctiveness of their CNA landscapes. CNAttention demonstrates high accuracy and exhibits stable performance even with the incorporation of external datasets or parameter adjustments, underscoring its effectiveness in tumor identification. Expanding these signatures to cancer classification trees reveals common patterns not only among physiologically related cancer types but also among clinico-pathologically distant types, such as different cancers originating from neural crest derived cells. Additionally, detected signatures also uncover genomic heterogeneity in individual cancer types, for instance in brain lower grade glioma. Additional experiments with classification models underscore the efficacy of these signatures in representing various cancer types and their potential utility in clinical diagnosis."
PubMed,deep learning,Artificial intelligence in mitotic checkpoint modeling: transforming our understanding of cellular division through machine learning and predictive biology.,Bashar Ibrahim,10.1093/bib/bbaf729,2026-01-07,Briefings in bioinformatics,"Mitotic checkpoints safeguard genomic integrity by orchestrating the precise segregation of chromosomes during cell division. Yet their complex, nonlinear dynamics have long defied full understanding through traditional experimental and computational approaches. In recent years, artificial intelligence (AI) has begun to transform this landscape. Machine learning and deep learning methods now achieve substantial accuracies in predicting cellular behaviors and uncovering novel regulatory mechanisms within checkpoint networks. Advances include transformer architectures capable of predicting spindle assembly checkpoint engagement with >95% accuracy, graph neural networks that decode kinetochore-microtubule dynamics at subpixel resolution, and hybrid AI-mechanistic models that reveal previously hidden feedback circuits. By integrating multi-omics data and bridging molecular mechanisms with clinical applications, AI-driven approaches are opening significant opportunities for precision medicine in cancer and other proliferative diseases. This review synthesizes emerging computational frameworks, highlights transformative AI-driven discoveries, and proposes a roadmap for developing predictive, personalized models of mitotic checkpoint control-charting a path from computational insight to clinical impact."
