source,keyword,title,authors,doi,publication_date,journal,abstract
OpenAlex,mitral regurgitation,Tpeak-Tend interval predicts VT inducibility in arrhythmogenic mitral valve prolapse syndrome,Benjamin Rath; Julian Wolfes; Christian Ellermann; Fatih Güner; Felix Wegner; Julia Köbe; Florian Reinke; Gerrit Frommeyer; Lars Eckardt,10.1007/s00392-026-02918-2,2026-04-15,Clinical Research in Cardiology,"Prolonged T<sub>peak</sub>-T<sub>end</sub> was associated with VT inducibility in patients with AMVP syndrome, suggesting its potential value as simple ECG-based marker for risk stratification. If T<sub>peak</sub>-T<sub>end</sub> also correlates with clinical outcome should be investigated in prospective studies."
OpenAlex,mitral regurgitation,Waldenström macroglobulinemia complicated with AL λ − type amyloid nephropathy: a case report and literature review,Yuan Ma; Taotao Li; Xiaoli Li,10.3389/fmed.2026.1806896,2026-04-15,Frontiers in Medicine,"Waldenström macroglobulinemia (WM) is a rare CD20-positive B-cell non-Hodgkin lymphoma. It is characterized by lymphoplasmacytic infiltration in the bone marrow and abnormal monoclonal IgM secretion. WM complicated by renal amyloidosis is uncommon but associated with rapid progression of organ damage. Accurate identification of pathogenic factors and individualized treatments are essential to improve prognosis. This paper reports the case of a 75-year-old female who initially presented with facial edema and bilateral lower-extremity edema lasting 2 days. Additional symptoms included foamy urine, frequent urination, and urgency. Laboratory tests revealed significant proteinuria (24-h urinary protein, 6.11 g), hypoalbuminemia (serum albumin, 20.07 g/L), and impaired renal function (serum creatinine, 129.90 μmol/L; eGFR, 45.2 mL/min/1.73 m 2 ). Immunofixation electrophoresis detected monoclonal IgM- λ immunoglobulin in both serum and urine. Bone marrow biopsy demonstrated clonal lymphoplasmacytic infiltration (32%), and genetic testing revealed a positive MYD88-L265P mutation (mutation frequency, 28.5%). Renal biopsy indicated diffuse deposition of λ light chains predominantly in the glomerular mesangium. Ultrastructural examination revealed amyloid fibrils, confirming the diagnosis of AL λ − type amyloid nephropathy. Chemotherapy with rituximab, cyclophosphamide, and dexamethasone (RCD regimen), combined with symptomatic supportive therapy, resulted in temporary improvement of clinical symptoms and laboratory parameters. However, the disease progressed rapidly. The patient died on Jan 28, 2024, approximately 3 months after discharge, due to multiple organ failure involving cardiac, renal, and respiratory dysfunction. Based on relevant literature and the Chinese Expert Consensus on Diagnosis and Treatment of Lymphoplasmacytic Lymphoma (LPL)/WM (2022 Edition) [Abstract 3], this paper discusses diagnostic criteria, differentiation of pathogenic components, treatment strategies, and prognostic factors. These findings may provide clinical guidance for similar rare cases."
OpenAlex,mitral regurgitation,Rule-based clinical decision support system for automated assessment of left ventricular diastolic function during stress echocardiography,Gulnora Rozikhodjaeva; Omonulla Juraev; H.-Christian Brauweiler; Tom Schaal,10.3389/frhs.2026.1690832,2026-04-15,Frontiers in Health Services,"Background Heart failure with preserved ejection fraction (HFpEF) remains challenging to diagnose due to the complexity of diastolic function assessment during stress echocardiography, where multiple hemodynamic parameters must be evaluated under time pressure. Explainable artificial intelligence, specifically rule-based Clinical Decision Support Systems (CDSS), offers promising improvements in reproducibility and interpretability. Methods A rule-based CDSS was developed and clinically validated to automate left ventricular diastolic function assessment during semi-supine bicycle stress echocardiography. A prospective cohort of 134 patients (mean age 61.3 ± 8.7 years) with exertional dyspnea and preserved left ventricular ejection fraction (LVEF &amp;gt;50%) was enrolled, excluding individuals with significant valvular pathologies, arrhythmias, or unstable ischemia. Echocardiographic and Doppler data were collected using Toshiba Aplio500 and Esaote MyLabSIGMA systems. The algorithm incorporated manual input of measurements, computed derived indices (e.g., diastolic reserve index, myocardial stiffness, vascular resistance), and applied rule-based logic in accordance with ASE/EACVI (2016/2022) guidelines and the ESC HFpEF consensus. Results The CDSS generated diagnostic conclusions within 3 min per case, matching expert assessments in 93% of cases and correctly identifying stress-induced diastolic dysfunction in 85%. It demonstrated high diagnostic agreement (ICC &amp;gt; 0.94) and discrimination (AUC = 0.92). Rule-based outputs, such as “Impaired diastolic reserve” or “Right ventricular dysfunction under load,” were based on combinations of parameters (e.g., E/e′ &amp;gt; 15, Δe′ ≤ 0, TAPSE &amp;lt; 17 mm, PCWR &amp;gt; 12 mmHg). Conclusion The explainable, guideline-compliant CDSS enables real-time, transparent analysis of diastolic function, supporting improved diagnostic consistency and augmented physician decision-making in cardiovascular care."
OpenAlex,mitral regurgitation,Association between T cell exhaustion and the recurrence of atrial fibrillation after cryoballoon ablation,Rong Suo; Shiyu Qi; Wenhua Song; Bingshuo Shi; H F Zhang; Daiqi Liu; Tong Liu; X Liu,10.3389/fimmu.2026.1767253,2026-04-14,Frontiers in Immunology,"Background Atrial fibrillation (AF) recurrence remains a challenge after Cryoballoon ablation (CBA). To date, few studies have investigated the impact of immunosenescence, particularly exhausted T cells, on AF recurrence after CBA. This study aims to investigate the association between exhausted T cells and AF recurrence after CBA, and to develop a novel model for the prediction of AF recurrence. Methods Clinical data of patients undergoing CBA treatment for AF at Tianjin Medical University Second Hospital from March to November 2022 were collected, and AF recurrence was followed up. Flow cytometry was employed to evaluate the levels of inhibitory receptors (IR) on exhausted T cells, including killer cell lectin-like receptor G1 (KLRG1), programmed death-1 (PD-1), T cell immunoglobulin and mucin domain-containing molecule 3 (Tim-3), lymphocyte activation gene 3 (LAG-3), CD27, and CD57. Variables selected through Lasso regression analyses were incorporated into a multivariable Cox proportional hazards model to validate and identify independent risk factors for AF recurrence, building two predictive models. The efficacy of the two models was assessed using Receiver Operating Characteristic (ROC) curves, calibration curves, and Decision Curve Analysis (DCA). Results Cox multivariate regression analysis revealed that KLRG1 of CD8 + T central memory cell (Tcm), PD-1 of CD8 + naive T cell (Tnaive), mean corpuscular volume (MCV), γ-Glutamyl Transferase (γ-GGT), glucose, and mitral valve maximum blood flow velocity (MV Vmax) were significant predictors. Two models were developed based on Cox multivariate regression analysis. Model 1 includes MCV, γ-GGT, glucose, and MV Vmax, while Model 2 includes all risk factors: MCV, γ-GGT, glucose, MV Vmax, KLRG1 of CD8 + Tcm, and PD-1 of CD8 + Tnaive. Validation of both models revealed that Model 2 showed better predictive performance, and a nomogram was created to present the results visually. Conclusion The KLRG1 of CD8 + Tcm and PD-1 of CD8 + Tnaive are novel independent risk factors for AF recurrence after CBA and play a significant role in the early recurrence of AF. We constructed a new predictive nomogram incorporating KLRG1 of CD8 + Tcm and PD-1 of CD8 + Tnaive as key variables, which can enhance the predictive value for AF recurrence in patients after CBA surgery."
OpenAlex,mitral regurgitation,Peripartum Cardiomyopathy: Current Insights into Pathogenesis and Clinical Management: A Narrative Review,Marzena Laskowska,10.3390/jcm15082974,2026-04-14,Journal of Clinical Medicine,"Peripartum cardiomyopathy (PPCM) is a distinct condition that presents as heart failure (HF) in a woman who was previously healthy and has no prior cardiovascular issues. It results from idiopathic left ventricular (LV) dysfunction, characterized by a reduced LV ejection fraction below 45%. PPCM is a life-threatening condition with a high mortality rate (MR) that demands urgent treatment. Methods: This narrative review aims to define PPCM and its pathophysiology and conduct a scoping review of the latest data on the management of patients with peripartum cardiomyopathy during pregnancy and the postpartum period. Results: Currently, treatment follows standard HF protocols for reduced ejection fraction, with the possible addition of bromocriptine, and during pregnancy, medications that do not harm the fetus. Conclusions: Early, aggressive therapy is essential for a better prognosis, but managing PPCM can be challenging. Treatment of PPCM patients should be led by a team of highly qualified specialists, known as the Obstetric and Cardiac Care Team, comprising an obstetrician-perinatologist, an anesthesiologist, a cardiologist, and a cardiac intensive care specialist. Baseline left ventricular end-diastolic diameter (LVEDD) and left ventricular ejection fraction (LVEF) are the main prognostic factors. LVEF less than 30%, significant LV dilatation, LVEDD ≥ 6.0 cm, and right ventricular involvement are factors indicative of a poor prognosis. While pregnancy after PPCM is possible, it should be discouraged due to the significant risk of complications and even death. The most common causes of death in patients with PPCM are thromboembolic complications, severe HF, serious ventricular arrhythmias, cardiogenic shock, and sudden cardiac arrest."
OpenAlex,mitral regurgitation,Perioperative clinical profiles and longitudinal outcomes in patients supported by continuous-flow left ventricular assist devices: a comprehensive analysis of early and late follow-up data,Qiuju Ding; Qingqing Zhu; Zeyi Zhou; Cheng Chen; Z M Xu; Jun Pan; Min Ge,10.3389/fcvm.2026.1784700,2026-04-14,Frontiers in Cardiovascular Medicine,"Introduction Mechanical circulatory support technology, particularly continuous-flow left ventricular assist devices (CF-LVADs), has emerged as a vital therapeutic option for end-stage heart failure (ESHF). However, domestic data on the long-term efficacy and safety of CF-LVADs in real-world settings remain limited, necessitating further investigation to guide clinical practice. Methods This single-center, retrospective study analyzed 28 patients who underwent CF-LVAD implantation as destination therapy for ESHF between October 2022 and July 2025. One patient died intraoperatively due to severe cardiogenic shock and was excluded from subsequent analyses. The remaining 27 patients (median age: 61 years; 88.9% male) were followed for a median duration of 5.4 months (range: 1.1–35.4 months). Perioperative clinical characteristics, early- and late-term outcomes, including survival, readmission rates, and changes in cardiac and renal/hepatic function, were evaluated. Results During the follow-up period, significant improvements of liver and renal function were observed, as well as a reduced left ventricular end-diastolic diameter, and an increased left ventricular ejection fraction. Despite these improvements, two deaths occurred during CF-LVAD support, and the hospital readmission rate reached 40.74%. Discussion CF-LVADs demonstrated promising efficacy in improving hemodynamic and organ function in patients with ESHF. However, the notable readmission rate and mortality highlight the need for optimized patient selection, postoperative management, and long-term monitoring. This study provides critical insights into the real-world challenges and benefits of CF-LVAD therapy, underscoring its value as destination therapy while calling for larger, multicenter studies to validate these findings and further refine clinical protocols."
OpenAlex,mitral regurgitation,"Case Report: Delivery or not, generalized arterial calcification of infancy in China",Yanxiu Guo; Yì Wáng; Ying Gu; Qiang Ma; Lin Li,10.3389/fmed.2026.1761482,2026-04-14,Frontiers in Medicine,"Generalized arterial calcification of infancy (GACI) is an extremely rare, often fatal condition characterized by widespread calcification and stenosis of both large and medium-sized arteries. The majority of cases are caused by biallelic variants in the ENPP1 gene, leading to deficiency of an enzyme critical for preventing pathological calcium deposition in arterial walls. The prognosis of GACI is severe, with fetal and infant mortality rates reaching up to 55%. This study reports a GACI case diagnosed at 24 weeks in a 32-year-old woman with a history of miscarriages, whose fetal ultrasound at 24 weeks revealed striking echogenic foci and thickening in the heart and major blood vessels. This prompted a multidisciplinary team to suspect GACI. Following confirmation through amniocentesis and given the poor prognosis, the parents opted to terminate the pregnancy at 26 weeks. This case underscores the critical role of advanced prenatal imaging and genetic analysis in diagnosing GACI. Ultimately, management decisions extend beyond medical science, involving profound ethical and personal considerations for families facing this devastating diagnosis."
OpenAlex,mitral regurgitation,A Novel Minimally Invasive Porcine Model of Functional Tricuspid Regurgitation,Claudia González-Cucharero; Ignacio Hernández; Javier Díez-Mata; Rafael Ramírez-Carracedo; Marta Saura; Claudia Báez-Díaz; Fátima Vázquez-López; Francisco M. Sánchez‐Margallo; Jose L. Zamorano; Verónica Crisóstomo; Carlos Zaragoza,10.3390/jcdd13040166,2026-04-14,Journal of Cardiovascular Development and Disease,"Tricuspid regurgitation (TR) is a prevalent cardiovascular disorder with significant clinical impact. TR is frequently silent and underdiagnosed and is estimated to impact over 70 million people globally. Characterized by retrograde blood flow from the right ventricle into the right atrium due to incomplete valve closure, TR leads to right heart dilation, systemic congestion, and eventually right-sided heart failure. Importantly, TR may contribute to the onset of atrial fibrillation (AF), the most common sustained arrhythmia, affecting approximately 59 million individuals worldwide. Despite its growing clinical importance, the pathophysiology of TR remains incompletely understood, and current animal models of TR, based on direct valve manipulation, limit translational applicability. We present a novel, minimally invasive porcine model of TR established via femoral/jugular vein catheterization with deployment of an inferior vena cava (IVC) filter. The filter partially impedes tricuspid valve closure, inducing TR without valvular injury. Validation was achieved through multimodal imaging, including fluoroscopy, echocardiography, and electrocardiography, confirming hallmark features of TR, including right atrial and ventricular enlargement and arrhythmic activity. This model provides a reproducible, minimally invasive platform for studying selected features of TR progression. Its minimally invasive nature and preservation of native valvular structure make it a useful preclinical platform for mechanistic and translational research."
OpenAlex,mitral regurgitation,Left Ventricular Assist Device Implantation in Pediatric Duchenne Muscular Dystrophy with Advanced Heart Failure: A Single-Center Study,Mingwei Sun; Lili Yang; Wenting Zhao; Qianru Xie; Yiqi Mo; Jinpeng Zheng; Xiangming Fan; L Y Ying; Chunhong Xie; Yiying Zhang; Shanshan Shi; Jingjing Ye; Yi Jin; Ziying Jin; Qiang Shu; Ru Lin,10.21203/rs.3.rs-8643616/v1,2026-04-14,Research Square,
OpenAlex,mitral regurgitation,Case Report: Transcatheter closure of paravalvular leak following left ventricular assist device and aortic valve replacement,Pingan Lian; Shuai Cheng; Shan-fu Liang; Fei Xie; Zhou Zhu; Yunfei Zhao; Lei Yin; Shen-wei Zhang,10.3389/fcvm.2026.1742624,2026-04-13,Frontiers in Cardiovascular Medicine,"Background End-stage dilated cardiomyopathy (DCM) is a common cause of end-stage heart failure, and some patients may eventually require heart transplantation. Such patients often need a left ventricular assist device (LVAD) as a bridge to heart transplantation, and those with severe aortic regurgitation may undergo concurrent aortic valve replacement. Paravalvular leak (PVL) is a complication following valve surgery that can lead to worsening heart failure; however, reports on transcatheter closure of PVL after LVAD implantation are rare. Case summary This article reports the case of a 39-year-old male patient with DCM who underwent CorHeart 6 LVAD implantation, aortic bioprosthetic valve replacement, and tricuspid valvuloplasty due to end-stage heart failure. A follow-up echocardiogram 2 months post-surgery revealed a progressively worsening paravalvular leak around the aortic bioprosthetic valve (maximum regurgitant jet width 3.4 mm, regurgitant jet area 20.5 cm 2 ), accompanied by worsening symptoms of heart failure. Due to the extremely high risk of redo surgery (STS score 16.2%), a multidisciplinary team consisting of cardiac surgeons, interventional cardiologists, intensive care physicians, and echocardiographers decided to perform transcatheter closure. The procedure was successfully performed via a retrograde approach through the right femoral artery, guided by fluoroscopy combined with transthoracic echocardiography. A 10 × 8 mm ventricular septal defect occluder was used to successfully seal the leak. Intraoperative angiography and echocardiography confirmed the satisfactory position of the occluder with no residual shunt. At the 2-month and 6-month follow-up visits post-procedure, the patient's cardiac function had improved to NYHA class II, echocardiography showed no residual PVL, and the left ventricular dimensions were slightly reduced compared to previous measurements. Conclusion This case suggests that transcatheter closure may be a safe and effective treatment option for high-risk patients who develop PVL following LVAD implantation combined with aortic valve replacement, providing a reference for the individualized management of similar complex cases."
OpenAlex,mitral regurgitation,Clinical Characteristics and Management Outcomes of Severe Multi-Valvular Rheumatic Heart Disease: A Hospital-Based Analysis,Shraiya Stan; Ananjan Bhattacharya,10.7759/cureus.106946,2026-04-13,Cureus,"Background: Multi-valvular involvement represents the most severe form of rheumatic heart disease (RHD), presenting complex clinical challenges requiring a comprehensive understanding for optimal patient management. In resource-limited settings, late presentation and inadequate secondary prophylaxis result in advanced disease with high complication burdens. Objective: To analyze the clinical presentation, diagnostic findings, treatment strategies, and outcomes, specifically in-hospital complication rates, mortality, functional improvement, and six-month follow-up outcomes in patients with severe multi-valvular RHD presenting to secondary and tertiary academic centers in Delhi, India. Methods: A retrospective observational analysis was conducted of 385 consecutive patients with severe multi-valvular RHD admitted to Lal Bahadur Shastri Hospital and Dr. Ram Manohar Lohia Hospital, New Delhi, between September 2023 and September 2025. Clinical data, echocardiographic parameters, laboratory findings, treatment protocols, and outcomes were systematically reviewed and analyzed. Results: Mean age was 31.2 ± 7.4 years; 68% were female. The majority (57%) presented with New York Heart Association Functional Classification (NYHA) Class III-IV symptoms. Atrial fibrillation was documented in 58%, severe pulmonary hypertension (&gt;60 mmHg) in 82%, and right ventricular dysfunction in 69%. Healthcare-associated infections occurred in 23%, including MRSA bacteremia in 12%. In-hospital mortality was 3.4%; 6-month mortality was 7.2%. Admissions peaked during monsoon months (18% higher case volume). Conclusion: Severe multi-valvular rheumatic heart disease (RHD) presents complex management challenges requiring comprehensive evaluation and multidisciplinary care. Early recognition of complications and timely intervention are crucial for improving outcomes in this high-risk population."
OpenAlex,mitral regurgitation,Real-world incidence and predictors of left atrial thrombus detected in transesophageal echocardiography before atrial fibrillation ablation procedures,Elżbieta Ostrowska-Kaim; Karolina Golińska‐Grzybała; Jolanta Rzucidło-Resil; P M Molek-Dziadosz; Maciej Stąpór; Barbara Szlósarczyk; Magdalena Mostowik; A G Andrzej Gackowski,10.33963/v.phj.112130,2026-04-13,Kardiologia Polska,"Among the patients referred to AF ablation, easily accessible clinical data may improve selection of patients who truly require TEE to exclude LAAT prior to the procedure. Further studies are needed to independently validate the proposed risk assessment model."
OpenAlex,mitral regurgitation,Transcatheter Therapy in Secondary Mitral Regurgitation: Recent Clinical Evidence and Emerging Frontiers,Álvaro Torres; Renato Jochava; Francisca Quintanilla; Catalina Córdova; Günther Krögh; Santiago Besa,10.7759/cureus.106989,2026-04-13,Cureus,
OpenAlex,mitral regurgitation,Quantifying Regional and Age-Dependent Microstructural Changes in Porcine Ventricles from Neonatal to Adulthood Using DT-MRI and TPEF-SHG Microscopy,Faizan Ahmad; James P. Barnett; Ali Bienemann; Carol-Ann Janes; Peter Theobald,10.1007/s10439-026-04143-4,2026-04-13,Annals of Biomedical Engineering,"The heart undergoes substantial structural changes in response to new physiological demands, which occur with the rapid opening of pulmonary circulation immediately after birth. The dependence on pulmonary circulation causes an immediate increase in ventricular workload, resulting in microstructural changes that serve to maintain overall physiological homeostasis. Ageing continues to evolve the heart's structure due to increased myocardial tissue stress and strain, initiating the formation of a new extracellular matrix to facilitate the physiology of an adult. Quantifying the region-specific and age-dependent microstructural changes in tissue due to ageing is pivotal for the development of constitutive models for computational simulations. This study aimed to determine the microstructure of porcine ventricles at four time points from neonatal to adulthood. The three-dimensional microstructure was investigated using diffusion-tensor magnetic resonance imaging, two-photon excited fluorescence and second-harmonic generation microscopy to quantify fibre tractography, fractional anisotropy (FA), spherical measure, rotation and dispersion of cardiomyocytes and collagen fibrils. The results revealed that the left ventricle possessed greater FA than the right. Adult hearts demonstrated smaller FA than the young. The anterior left and right ventricles exhibited greater cardiomyocyte and collagen fibril rotation and dispersion than the posterior. The adult hearts possessed greater cardiomyocyte and collagen fibril rotation and dispersion than young hearts. The right ventricle demonstrated greater cardiomyocyte rotation in the younger hearts, and the Left in the adult. This study provides baseline data that should prove useful to bioengineers, researchers, and mathematicians in developing region-specific and age-dependent constitutive models to enhance the accuracy and bio-fidelity of computational simulations."
