source,keyword,title,authors,doi,publication_date,journal,abstract
PubMed,valvular heart disease,Primary Tricuspid Regurgitation: From Neglect to Clinical Relevance.,Mariagrazia Piscione; Jad Mroue; Dario Gaudio; Vivek Mehta; Fadi Matar,10.3390/jpm15110535,2025-11-03,Journal of personalized medicine,"Primary tricuspid regurgitation (TR) is an underrecognized valve disease characterized by structural abnormalities of the tricuspid valve (TV) apparatus, including leaflet prolapse, flail, rheumatic degeneration, carcinoid involvement and congenital malformations such as Ebstein's anomaly. Historically neglected and often misclassified as functional, primary TR has recently gained attention due to advances in multimodality imaging and increased awareness of its pathophysiological complexity and adverse outcomes. A major challenge that remains is the accurate diagnosis of primary TR, as well as the optimal timing for intervention, particularly in asymptomatic patients. While surgical repair or replacement has been the traditional approach, recent developments in transcatheter therapies, such as tricuspid edge-to-edge repair, have broadened the therapeutic landscape for patients considered at high surgical risk. In this context, personalized medicine has emerged as a central paradigm in the management of this valvular disease. Tailored therapeutic decisions should include anatomical, functional, and clinical parameters, as well as patient-specific risk factors such as age and comorbidities. Advanced imaging modalities, including 3D echocardiography and cardiac magnetic resonance, are essential for guiding this individualized approach. This review summarizes the current understanding of the etiology, pathophysiology, diagnostic tools, and treatment strategies for primary TR, highlighting the critical role of personalized treatment pathways in optimizing clinical outcomes."
PubMed,valvular heart disease,Immunohistochemical Characterization and CT-Derived Volume of Epicardial Adipose Tissue in Patients with Coronary Artery Disease.,Matija Furtula; Igor Zivkovic; Slobodan Micovic; Zoran Tabakovic; Gorica Vidovic; Zelimir Antonic; Jelica Vukmirovic; David Savic; Milovan Bojic; Branko Beleslin; Milan Dobric; Jelena Rakocevic,10.3390/cells14221760,2025-11-11,Cells,"Epicardial adipose tissue (EAT) is a visceral fat depot surrounding the myocardium. It contributes to coronary artery disease (CAD) through local inflammation, while its metabolic activity, including the expression of uncoupling protein-1 (UCP-1) and incretin receptors (GLP-1R, GIPR), may exert protective effects. The relationship between EAT immunohistochemical features and imaging-derived volume remains unclear.
We prospectively studied 50 patients undergoing cardiac surgery: 25 with CAD undergoing coronary artery bypass grafting and 25 without CAD undergoing valve replacement. EAT samples were immunohistochemically stained for CD3, CD68, MPO, UCP-1, GLP-1R, and GIPR. Preoperative CT was used to quantify EAT volume.
Patients with CAD more frequently had higher CD3 immunopositivity compared to the control group (84.0 vs. 58.3%, p = 0.047), with no difference in MPO and CD68 immunoexpression. UCP-1 expression was elevated in CAD patients (p = 0.004), whereas GLP-1R and GIPR immunopositivity were similar. EAT volume did not differ between CAD and non-CAD patients (102.87 cm3 vs. 99.38 cm3, p = 0.964) but correlated modestly with BMI (rs = 0.325, p = 0.021). UCP-1 and GLP-1R immunopositivity, as well as larger LVEDD (left ventricular end-diastolic diameter), were positively associated with greater EAT volume.
EAT in CAD exhibits increased T-cell infiltration and elevated UCP-1 expression, indicating an inflammatory yet metabolically active profile. Larger EAT volume was associated with UCP-1 and GLP-1R expression, underscoring the immunometabolic role of EAT in CAD."
PubMed,valvular heart disease,Histological Analysis of Lung Tissue and Pulmonary Vessels in Cardiac Surgery Patients with Mitral Valve Disease and Pulmonary Hypertension.,I N Lyapina; T V Martynyuk; L A Bogdanov; A N Stasev; Yu E Kuz'mina; E V Dren'; E E Gorbatovskaya; Yu O Markova; M V Khutornaya; A G Kutikhin; O L Barbarash,10.18087/cardio.2025.10.n2941,2025-11-25,Kardiologiia,"Aim        To study morphological features of lung tissue and pulmonary vessels in patients with pulmonary hypertension (PH) associated with acquired mitral valve (MV) defects, with indications for surgical treatment.Material and methods          This cross-sectional study included 105 patients with acquired MV defect of non-infectious origin (median age 60.0 [51.0; 66.0] years, 55.24% men) who underwent corrective surgery under cardiopulmonary bypass between 2024 through March 2025. PH was verified by right heart catheterization before defect correction. In 26 patients with MV defect and PH and 12 patients without PH, intraoperative lung tissue puncture biopsy samples were collected to assess changes in the lung parenchyma and microvasculature.Results    In patients with MV defect and PH, the condition of arterioles was characterized by a larger area of intimal hyperplasia and predominantly the presence of thrombosis (34.6%). In patients with MV defect without PH, partial thrombosis of arterioles was more often found (41.66%), and plethoric arterioles were observed in 41.66%. During morphometry of pulmonary vessels, it was noted that the a calculated systolic pressure in the pulmonary artery of &gt;38 mm Hg according to preoperative echocardiography (EchoCG) had a moderate inverse correlation with the area of the vascular wall (Kendall's rank correlation coefficient tau (τ) = -0.34; p=0.01) and a moderate direct association with the greatest thickness at the site of arteriolar intimal hyperplasia (τ = 0.39; p = 0.04). A moderate inverse correlation was found between the systolic excursion of the tricuspid valve annulus (1.7 cm or more) and the greatest thickness at the site of arteriolar intimal hyperplasia (τ= -0.47; p=0.04). MV stenosis was associated with the presence of thrombosed capillaries (odds ratio (OR) 8.75; 95% confidence interval (CI) 1.1-69.5; p=0.029) and focal interstitial fibrosis (OR 10.66; 95% CI 0.89-126.78; p=0.046). The presence of mitral stenosis had a moderate correlation with perivascular fibrosis (τ=0.41; p=0.005). A body mass index of &gt;25 kg/m2 was associated with reduced odds of arteriolar media thickening (OR 0.15; 95% CI 0.02-1.01; p=0.03).Conclusion            The severity of PH and right ventricular dysfunction, as determined by EchoCG before MV defect correction, may reflect morphometric changes in the pulmonary vessels. The nature of MV lesion, based on its stenosis type, is associated with a more than 8-fold increase in the odds of thrombosed capillaries and a 10-fold increase in the odds of focal interstitial fibrosis. Being overweight or obese was associated with an 85% reduction in the odds of arteriolar media thickening, as determined by pulmonary vascular morphometry."
PubMed,valvular heart disease,Interventional Treatment of Mitral Insufficiency With Edge-to-Edge Valvuloplasty in Terms of Etiologic Factor: Immediate Results.,E Z Golukhova; I V Slivneva; K V Petrosyan; G M Dadabaev; B Sh Berdibekov; A M Antonova; B A Sagymbaev; Yu D Pirushkina; K A Ter-Akopyan,10.18087/cardio.2025.10.n3002,2025-11-25,Kardiologiia,"Aim        To study the immediate outcome of an interventional method for the treatment of mitral regurgitation (MR) using the MitraClip system (Abbott Vascular) in the context of the etiological factor.Material and methods         This was a prospective, single-center study. A total of 89 patients treated in 2023-2024 were included in the analysis. Most patients belonged to an older age group (67.6 ± 9.3 years) where males predominated (57.3%). Echocardiography (EchoCG) was performed on a Philips EPIQ CVx ultrasound system using X5-1 and X8 t transducers. The severity of MR was assessed by multiparametric EchoCG. Quantitative measurements were performed in accordance with current Guidelines of the American Society of Echocardiography and the European Association of Cardiovascular Imaging (ASE and EACVI, 2015).Results    In 19.1% of cases, the cause of MR was mitral valve leaflet chordae prolapse or rupture (primary mitral regurgitation (PMR) group, group 1). In 80.9% of cases, MR was secondary: in 29.2%, MR was atrial functional mitral regurgitation (a-FMR, group 2) and in 51.7%, MR was ventricular FMR (v-FMR, group 3). Comparative analysis of EchoCG data showed that with a comparable MR degree, the left ventricular systolic function was significantly lower in the v-FMR group than in the PMR group, and was also inferior to that in the a-FMR group (42.7±10.2% vs. 53.5±8.5 and 49.2±10.7%, respectively; p1-3&lt;0.001, p2-3=0.029). The effectiveness of the procedure evident in a reduction of the MR degree was achieved in 93.2% of patients (grade &lt;1 in 64% of them). The maximum reduction in MR to grade I and less was noted in the v-FMR group (71.7%); this proportion was higher compared to other groups (a-FMR, 57.7%; PMR, 52.9%). All groups had improvements in symptoms and in the NYHA chronic heart failure (CHF) functional class (FC). The v-FMR group achieved a more pronounced symptomatic improvement and a reduction in FC (95.7% of patients with FC II).Conclusion            Transcatheter edge-to-edge mitral valve reconstructive procedures using the MitraClip system achieved significant immediate reductions in MR, regardless of its etiology. Long-term follow-up is essential to assess the result sustainability."
PubMed,valvular heart disease,Clinical and Echocardiographic Profile of Patients With Heart Failure With Reduced Ejection Fraction: A Retrospective Outcome Analysis.,Shahul Irfan; Vikhnesh Padmakaran; Ram Prasanth; Sharefa Nazar; Sachith Srinivas; Akshay K Tv; Vaibhav S Bhandary; Parth Vinod Patel; Rutuja Baldota; Archana Puthenveedu Soman; Bhagyalakshmi A Vattapothy,10.7759/cureus.95354,2025-10,Cureus,"Heart failure with reduced ejection fraction (HFrEF) is a major contributor to cardiovascular morbidity and mortality worldwide. This condition is associated with delayed diagnosis and high comorbidity burden since patients often present at a younger age with advanced disease. Echocardiography plays a central role in identifying structural abnormalities and prognostic markers. This study aimed to evaluate the clinical and echocardiographic profile of patients with HFrEF and assess outcome predictors in a tertiary care center.
A retrospective observational study was conducted at Madras Medical College from May 2024 to May 2025, including 75 patients diagnosed with HFrEF (left ventricular ejection fraction (LVEF) ≤40%). Clinical data on demographics, comorbidities, and New York Heart Association (NYHA) functional class were collected along with echocardiographic parameters such as left ventricular dimensions, diastolic dysfunction, valvular lesions, right ventricular function, and pulmonary artery systolic pressure (PASP). Outcomes assessed included mortality, hospital stay, and readmission.
The mean age was 58.4 ± 11.2 years, with males comprising 45 patients (60%). Hypertension (42 patients, 56%), diabetes (36 patients, 48%), and ischemic cardiomyopathy (39 patients, 52%) were predominant. Most patients presented in NYHA class III or IV (55 patients, 73%). Echocardiography revealed a mean LVEF of 31.6 ± 5.8, LV dilatation in 48 patients (64%), diastolic dysfunction in 60 patients (80%), and moderate-to-severe mitral regurgitation in 25 patients (33%). Patients with EF <25% had significantly higher mortality (five patients, 15%) and readmission (10 patients, 29%) rates. PASP >40 mmHg independently predicted readmissions, while right ventricular dysfunction and mitral regurgitation were associated with adverse outcomes on univariate analysis.
This study highlights that severe left ventricular dysfunction and elevated PASP are strong prognostic markers in HFrEF. Comprehensive echocardiographic evaluation is essential for risk stratification, and early intervention is crucial to improve outcomes in Indian patients with HFrEF."
Crossref,aortic stenosis,3D perfusable minichannels stented with matrix bound vesicles derived from gingival mesenchymal stem cells ameliorated granuloma-related stenosis and improved survival in a rabbit tracheal replacement model,Bing Liu; Xinchi Zhang; Na Wei; Xiaopeng Wu; Pingping Yuan; Tian Zeng; Lirong Liang; Hui Zhang; Wei Wu,10.1016/j.biomaterials.2025.123769,2026-04,Biomaterials,
Crossref,aortic stenosis,"Effectiveness and safety of combining pharmacopuncture therapy and acupotomy for treating patients with degenerative lumbar spinal stenosis: A pragmatic, assessor-blinded, randomized, controlled trial",Jihun Kim; Chang-Hyun Han; Taewook Lee; Sookwang An; Changsop Yang; Young Eun Choi; Byoung-Kab Kang; Yoona Oh; Kun Hyung Kim; Gi Young Yang; Eunseok Kim,10.1016/j.imr.2025.101204,2026-03,Integrative Medicine Research,
Crossref,aortic stenosis,Can a two-way CFD–FSI framework map branch-specific risk via a dynamic wall-function index in aortic arch calcification?,Hamidreza Mortazavy Beni; Hamed Mortazavi; Xinguang Cui; Richard Collin; Emilie Sauret; Mohammad S. Islam,10.1016/j.bspc.2025.109130,2026-03,Biomedical Signal Processing and Control,
Crossref,aortic stenosis,Multi-site seismocardiographic measurements for the estimation of cardiac output in patients with aortic stenosis,Francesca Santucci; Emanuele Maiorana; Chiara Romano; Annunziata Nusca; Gian Paolo Ussia; Emiliano Schena; Roberto Setola; Carlo Massaroni,10.1016/j.bspc.2025.109179,2026-03,Biomedical Signal Processing and Control,
Crossref,aortic stenosis,A comprehensive analysis of immune checkpoint receptor–ligand pairs in aortic diseases highlights the immunosuppressive roles of CD155 and CD274,Ying Shao; Fatma Saaoud; Keman Xu; Yifan Lu; Sheng Wu; Laisel Martinez; Roberto Vazquez-Padron; Beata Kosmider; Hong Wang; Xiaofeng Yang,10.1016/j.gendis.2025.101724,2026-03,Genes &amp; Diseases,
Crossref,aortic stenosis,"Activation of aortic baroreceptors depresses the somato–lumbar sympathetic reflex, reducing hindlimb muscle contractile force",Nobuhiro Watanabe; Kotaro Takeno; Naoko H. Tomioka; Masamichi Moriya; Hiroshi Nishimune; Harumi Hotta,10.1016/j.jphyss.2025.100051,2026-03,The Journal of Physiological Sciences,
Crossref,aortic stenosis,A Systematic Review and Meta-Analysis on the Outcomes of Distal Aortic Interventions for Residual Aortic Dissection,Francesco Squizzato; Marco James Bilato; Mirko Menegolo; Elda Chiara Colacchio; Franco Grego; Michele Piazza; Michele Antonello,10.1016/j.avsg.2025.09.060,2026-02,Annals of Vascular Surgery,
Crossref,aortic stenosis,Prevalence and clinical impact of baseline atherosclerotic vascular disease in patients undergoing transcatheter aortic valve implantation: A meta-analysis,Andreas S. Papazoglou; Eirinaios Tsiartas; Konstantinos G. Kyriakoulis; Dimitrios V. Moysidis; Stylianos Daios; Vasileios Anastasiou; Vasileios Kamperidis; Antonios Ziakas; Nikolaos Fragakis; Vassilios Vassilikos; George Giannakoulas,10.1016/j.ijcard.2025.134004,2026-02,International Journal of Cardiology,
Crossref,aortic stenosis,Validating Three Scoring Systems for Predicting Mortality after a Ruptured Abdominal Aortic Aneurysm Repair in a Multicenter New Zealand Population,Jhanvi Dholakia; Anantha Narayanan; Philip Allan; Stephen French; Chris Frampton; Damian Kelleher; Manar Khashram,10.1016/j.avsg.2025.09.045,2026-02,Annals of Vascular Surgery,
Crossref,aortic stenosis,Prognostic significance of cardiovascular magnetic resonance advanced atrial parameters in chronic significant aortic regurgitation,Irene Carrión-Sánchez; Juan Manuel Monteagudo-Ruiz; Paola Ramos-Cano; Pablo Martínez-Vives; Ariana González-Gómez; Ana García-Martín; Rocío Hinojar; José L. Zamorano; Covadonga Fernández-Golfín,10.1016/j.ijcard.2025.134028,2026-02,International Journal of Cardiology,
Crossref,aortic stenosis,Diversion pharyngostomy: A new surgical technique to manage salivary aspiration associated with complete esophageal stenosis,Pierre Fayoux; Alix Maltezeanu; Baptiste Segard; Helene Broucqsault; Rony Sfeir; Philippine Toulemonde,10.1016/j.jpedsurg.2025.162818,2026-02,Journal of Pediatric Surgery,
Crossref,aortic stenosis,Thoracic Endovascular Aortic Repair for Native or Prosthetic Aortic Infection: Solution or a Bridge to Nowhere? With Focus on Fistulae,Carlos A. Mestres; Eduard Quintana; Francis E. Smit,10.1016/j.avsg.2025.09.035,2026-02,Annals of Vascular Surgery,
Crossref,aortic stenosis,The Role of Gender in Blunt Thoracic Aortic Injuries,Ilenia D'Alessio; Nicola Monzio-Compagnoni; Greta Salinetti; Joseph DuBose; Benjamin W. Starnes; Elina Quiroga; Davide Benasconi; Mario D'Oria; Sandro Lepidi; Pierantonio Rimoldi; Valerio Stefano Tolva; Naveed Saqib; Anthony Estrera; Gustavo Oderich; Rana Afifi; Ezra Koh; Michelle McNutt; Dave Meyer; Binod Shrestha; Edmundo Dipasupil; Elina Quiroga; Nicolas Stafforini; Charles Fox; Rishi Kundi; Rami Gilani; David Turay; Xian Luo-Owen; Muhammad Aftab; Mohammed Al-Musawi; T. Brett Reece; Donald Jacobs; Rafael D. Malgor; Jeniann Yi; Erica Leith Mitchell; Martin Croce; Suzanne Moyer; Lalithapriya (Priya Jayakumar; Matthew J. Sideman; Christopher Mitromaras; Dimitrios Miserlis; Reshma Brahmbhatt; Lisa Bennett; Ernest Moore; Alexis Cralley; William Shutze; William Dockery; Laura Petrey; Timothy N. Phelps; Nicole Fox; Lisa Shea; Ivan Puente; Mario F. Gomez; Dalier R. Mederos; Pedro Teixeira; Emily Leede; Frank Buchanan; Emilio Ramos; Marielle Ngoue; Sadia Ali; Davide Pacini; Luca Botta; Ciro Amodio; Tal Horer; David McGreevy; Ravi Rajani; Jaime Benarroch-Gampel; Christopher R. Ramos; Manuel Garcia-Toca; Kenji Inaba; Desmond Khor; Matt Smeds; Emad Zakhary; Michael Williams; Catherine Wittgen; Pierantonio Rimoldi; Ilenia D'Alessio; Nicola Monzio Compagnoni; Valerio Tolva; Neil Parry; Luc Dubois; John Bini; Karen Herzing; Marc Passman; Adam W. Beck; Mark Patterson; Ben Pearce; Emily Spangler; Jarrad Rowse; Danielle Sutzko; Andres Schanzer; Francesco Aiello; Edward Arous; Elias Arous; Douglas Jones; Dejah Judelson; Louis Messina; Tammy Nguyen; Jessica Simons; Robert Steppacher; James Haan; Kelly Lightwine; Vincent Riambau; Gaspar Mestres; Xavier Yugueros; Daniel Gil; Eduard Casajuana; Malachi Sheahan; Marie Unruh; Claudie Sheahan; Tapash Palit; Amit Chawla; Amadis Brooke; Melissa Donovan; Joe Giaimo; Bruce Torrance; Joao Rezende-Neto; Mario D'Oria; Sandro Lepidi; Peter Rossi; Momdou Jammeh; Nathan Kugler; Mitchell Dyer; Viktor Reva; Trissa Babrowski; Ross Milner; Luka Pocivavsek; Christopher Skelly; Julie Dunn; Brittany Smoot; Sam Godin; Kevin Martin; Todd Vogel; Santi Trimarchi; Maurizio Domanin; Viviana Grassi; Matt Eagleton; Ali Azizzadeh; Bruce Gewertz; Galinos Barmparas; Donald Baril; Elizabeth Chou; Cassra Arbabi; NavYash Gupta; Sally Schonefeld; Theodore Teruya; Marc Schermerhorn; Mark Wyers; Allen Hamdan; Lars Stangenberg; Andy Lee; Patric Liang; Christina Marcaccio; Junaid Malek; Giovanni Ferrante; Emmanuel Nwachuku; Ralph Darling; Xzabia Caliste; Benjamin B. Chang; Jeffrey C. Hnath; Paul B. Kreienberg; Alexander Kryszuk; Adriana Laser; Sean P. Roddy; Stephanie Saltzberg; Melissa Shah; Courtney Warner; Chin-Chin Yeh; Allison Berndtson; Asad Choudhry; Joseph Galante; Lee Seong; Seong K. Lee; Andrew Rosenthal; Rachele Solomon; Sergi Bellmunt; Robert Rhee; Susan Beale; Lewis E. Jacobson; Jamie Williams; Christopher Firek; Xiaofei Zhang; Alex Coronel; Megan Brenner; Zachary Wanken; Jahanzeb Kaikaus; Daniel Kindell; Richie Li; Erin McIntosh; Fatima Mustansir; Julia Suggs; Shirli Tay; Varun Dalmia; Ryan Wahidi; Muhammad Zeeshan; Henry Jefferson; Heather Grossman Verner; Cynthia Villalta; Rene Chidozie; R. Pulli; Rossella Di Domenico; Sara Speziali; Giorgio Turicchia; Mara Fanelli,10.1016/j.avsg.2025.09.023,2026-02,Annals of Vascular Surgery,
Crossref,aortic stenosis,The impact of arterial cannula direction in central venoarterial extracorporeal membrane oxygenation on aortic hemodynamic characteristics under various perfusion conditions,Yifeng Xi; Yuan Li; Hongyu Wang; Xiaofei Wang; Bingyang Ji; Zengsheng Chen,10.1016/j.cmpb.2025.109164,2026-02,Computer Methods and Programs in Biomedicine,
Crossref,aortic stenosis,The double trouble: A case report on central vein dual stenosis,Yana Supriatna; Trianingsih; Rifki Bachtiar; Rozan Muhammad Irfan,10.1016/j.radcr.2025.10.032,2026-02,Radiology Case Reports,
Crossref,aortic stenosis,Peripheral Artery Disease Diagnosis is an Independent Predictor Factor for Reduced Long-Term Survival after Fenestrated/Branched Endovascular Aortic Repair,Mohammad Alsarayreh; Mark A. Farber; Vivian Carla Gomes; Luigi Pascarella; Jacob Wood; Ehsan Benrashid; Federico Ezequiel Parodi,10.1016/j.avsg.2025.09.017,2026-02,Annals of Vascular Surgery,
Crossref,aortic stenosis,Safety and Efficacy of a New Microporous Stent-Graft for Reconstructing Porcine Supra-Aortic Arch Branches and Excluding Thoracic Aortic Aneurysm,Qiaohao Wan; Xiaoming Zhang,10.1016/j.avsg.2025.09.041,2026-02,Annals of Vascular Surgery,
Crossref,aortic stenosis,Mixed reality-assisted physician-modified endograft fenestration for urgent repair of a complex infrarenal abdominal aortic aneurysm: First-in-the-world case,Diego Ardiles; Jeison Peñuela; Carlos Timaran; Marcelo Lagos; Sebastián Alba; Manuel Espíndola,10.1016/j.jvscit.2025.102001,2026-02,"Journal of Vascular Surgery Cases, Innovations and Techniques",
Crossref,aortic stenosis,Blood flow numerical modeling in catheterized arteries with mild stenosis,Yevgeniya Daineko; Sultan Alpar; Bakhyt Alipova; Fatima Tokmukhamedova; Zhiger Bolatov,10.1016/j.matcom.2025.07.051,2026-02,Mathematics and Computers in Simulation,
Crossref,aortic stenosis,Benchmarking a DNN for aortic valve calcium lesions segmentation on FPGA-based DPU using the vitis AI toolchain,Valentina Sisini; Andrea Miola; Giada Minghini; Enrico Calore; Armando Ugo Cavallo; Sebastiano Fabio Schifano; Cristian Zambelli,10.1016/j.future.2025.108115,2026-02,Future Generation Computer Systems,
Crossref,mitral regurgitation,Magnetic resonance-based computational modelling of healthy and prolapsing mitral valves to quantify the load transfer between the mitral apparatus and the ventricular myocardium,Davide Tondi; Francesco Sturla; Mateo Marin-Cuartas; Maja-Theresa Dieterlen; Cosima Jahnke; Ingo Paetsch; Ricardo A Spampinato; Michael A. Borger; Emiliano Votta,10.1016/j.cmpb.2025.109151,2026-02,Computer Methods and Programs in Biomedicine,
Crossref,mitral regurgitation,“Echo-derived estimate of peak left atrial pressure in patients with iatrogenic atrial septal defects following transcatheter mitral edge-to-edge repair”,Sakul Sakul; Sara DiazSaravia; Brandon Berman; Abel Casso Dominguez; Stamatios Lerakis; Edgar Argulian,10.1016/j.ijcard.2025.133975,2026-02,International Journal of Cardiology,
Crossref,mitral regurgitation,Corrigendum to “Longitudinal profile of N-terminal pro-atrial natriuretic peptide and N-terminal pro B-type natriuretic peptide in dogs undergoing mitral valve repair” [J Vet Cardiol 63 (2026) 1–15],S. Furusato; H. Arai; S. Shinoda; K. Harada; M. Mizuno; M. Uechi,10.1016/j.jvc.2025.11.003,2026-02,Journal of Veterinary Cardiology,
Crossref,mitral regurgitation,Multimodal Imaging Assessment of Tricuspid Regurgitation and the Right Ventricle,Malgorzata Maciorowska; Lily Zhang; Omar K. Khalique,10.1016/j.ccl.2025.07.003,2026-02,Cardiology Clinics,
Crossref,mitral regurgitation,The 4A  classification for prognostic stratification of patients with tricuspid regurgitation. A multicenter study,Ariana González-Gómez; Juan Manuel Monteagudo Ruiz; Ander Arteagoitia Bolumburu; Patricia Mahia; Esther Pérez David; Laura Gutierrez García-Moreno; Marta Sitges; Chi-Hion Li; David Alonso; Fernando Carrasco Chinchilla; Jesús María de la Hera; Ana García Martín; Roció Hinojar; Covadonga Fernández-Golfín; José Luis Zamorano,10.1016/j.ijcard.2025.133977,2026-02,International Journal of Cardiology,
Crossref,mitral regurgitation,Treatment of supravalvular mitral stenosis in a kitten with hybrid balloon angioplasty,R.L. Winter; D.M. Tillson; K.L. Maneval; M. Rajeev; D. Castro,10.1016/j.jvc.2025.10.006,2026-02,Journal of Veterinary Cardiology,
Crossref,mitral regurgitation,Longitudinal profile of N-terminal pro-atrial natriuretic peptide and N-terminal pro B-type natriuretic peptide in dogs undergoing mitral valve repair,S. Furusato; H. Arai; S. Shinoda; K. Harada; M. Mizuno; M. Uechi,10.1016/j.jvc.2025.10.003,2026-02,Journal of Veterinary Cardiology,
Crossref,mitral regurgitation,Left ventricular diastolic function modifies clinical outcomes of mild mitral regurgitation,Peihan Xie; Huimin Zhou; Yiquan Huang; Zhuoshan Huang; Menghui Liu; Ziwen Hui; Yue Guo; Shujuan Li; Rui Fan; Zhenyu Xiong; Xiaodong Zhuang; Xinxue Liao,10.1016/j.ijcard.2025.133998,2026-02,International Journal of Cardiology,
Crossref,mitral regurgitation,Multimodality Imaging of Mitral Regurgitation,Christopher B. Scoma; Nidhi Patel,10.1016/j.ccl.2025.07.002,2026-02,Cardiology Clinics,
Crossref,mitral regurgitation,Ideal Candidates for Mitral Transcatheter Edge-to-Edge Repair: Anatomic and Clinical Indications,Jong-Il Park; Ung Kim,10.54912/jci.2025.0023,2026,Journal of Cardiovascular Intervention,
Crossref,mitral regurgitation,Worsening tricuspid regurgitation after mitral valve surgery: a meta-analysis and meta-regression,Gal Aviel; Bruria Hirsh-Raccah; Islam Idais; Rafat Abu Ghannam; Maxim Komodei; Alexander Lipey-Dyamant; Ori Wald; Amit Korach,10.1016/j.ijcard.2025.133931,2026-01,International Journal of Cardiology,
