source,keyword,title,authors,doi,publication_date,journal,abstract
Crossref,deep learning,Integration of Biomechanics and Digital Technology: Using Kinovea for Motion Analysis and Learning for Beginner Athletes,Muhammad Nur Hudha; Riezky Maya Probosari; Annisa Nur Khasanah; Supurwoko; Salsabila Kholifahtun Nisa’; Gifran Rihla Gifarka Latief,10.58524/jcss.v4i2.890,2029-11-29,Journal of Coaching and Sports Science,"Background: The integration of biomechanics with digital motion-analysis technologies has introduced new approaches for examining movement efficiency, kinematic characteristics, and technical patterns in walking and running activities. Kinovea, as an accessible motion-analysis software, provides both visual and quantitative feedback. However, its application in supporting technique development among beginner athletes remains insufficiently explored. Aim: This study aims to describe the use of Kinovea in biomechanics training and examine its contribution to the awareness of kinematic characteristics and movement techniques among beginner athletes. Methods: A descriptive qualitative design involved 72 beginner athletes aged 18–25 years selected through purposive sampling. Data were collected over 16 weeks through interviews, field observations, and motion video recordings analyzed using Kinovea. Kinematic data focused on joint angles, stride behavior, and movement phases during walking, running, and the flight phase. Qualitative data were analyzed using content analysis with NVivo 12, while kinematic results were interpreted descriptively to identify performance patterns and areas for technical refinement. Result: Kinematic analysis showed coordinated joint-angle patterns across all phases. Walking analysis identified arm swing angles of 50.9°–58.8° and leg separation angles of 64.3°–67.2°, indicating a stable gait rhythm. The running analysis revealed knee angles of 68.8°–69.8° and elbow angles of 87.6°–89.1°, indicating efficient propulsive mechanics. The flight phase demonstrated knee angles of 81.2°–87.8° and elbow angles of 80.4°–88.3°, suggesting effective momentum use and postural stability. These measurements supported stride-efficiency assessment and technique evaluation. Qualitative findings revealed that Kinovea enabled athletes to interpret movement phases and identify technical inefficiencies through slow-motion and frame-by-frame visualization. Conclusion: Kinovea supports basic motion analysis by providing clear kinematic information and helping beginner athletes observe and refine their movement techniques. The findings also offer practical value for coaches by enabling more precise identification of inefficient patterns and guiding targeted corrections during early-stage training."
Crossref,deep learning,Distributed Algorithms for High-Dimensional Statistical Inference and Structure Learning with Heterogeneous Data,Hongru Zhao; Xiaotong Shen,10.5705/ss.202025.0087,2028,Statistica Sinica,
Crossref,deep learning,Botnet Detection in Network Security by means of Deep Neural Network - DBoTPM,Sankarsan Panda; Julia Faith S; C. Manonmani; Sheshang Degadwala,10.1504/ijcis.2028.10073178,2028,International Journal of Critical Infrastructures,
Crossref,deep learning,Zero-Day Intrusion Detection System: Training on Small Datasets with Advanced Data Augmentation and Ensemble Learning,Mehaboob Mujawar; Aasheesh Raizada; Abdullah Gubbi,10.1504/ijims.2028.10075219,2028,International Journal of Internet Manufacturing and Services,
Crossref,deep learning,Enhancing Real Time Decision Intelligence through Federated Learning Integration in Edge Computing Networks,M.S. Bennet Praba; M.Vinay Kumar; K.B. Anusha; Nitin Tiwari; Nidal Al Said; K. Kandan,10.1504/ijcis.2028.10073919,2028,International Journal of Critical Infrastructures,
Crossref,deep learning,Uncertainty Quantification for Large-Scale Deep Neural Networks via Post-StoNet Modeling,Yan Sun; Faming Liang,10.5705/ss.202024.0294,2028,Statistica Sinica,
Crossref,deep learning,Dancing in the Rain: The Effectiveness of Mobile Platform for Learning Ten Qira’at,Muhammad Shahrizan Shahrudin; Mu’azah Md. Aziz; Ainul Maulid Ahmad; Abdul Hakim Mahadzir; Muhd Thoriq Asshiddiq Che Ahmad,10.6007/ijarbss/v14-i5/21493,2027-05-02,International Journal of Academic Research in Business and Social Sciences,
Crossref,deep learning,Harnessing IoT anu Machine Learning for Predictive Smart Irrigation Systems: Optimising Water Use and Crop Yield,D. Prathyusha; Pranusha Dogga; Dogga Aswani; Selvani Deepthi,10.1504/ijsse.2027.10068719,2027,International Journal of System of Systems Engineering,
Crossref,deep learning,Efficient Learning of DAG Structures in Heavy-tailed Data,Wei Zhou; Xueqian Kang; Wei Zhong; Junhui Wang,10.5705/ss.202024.0199,2027,Statistica Sinica,
Crossref,deep learning,Prediction of The Recycled Aggregate Concrete Compressive Strength Using Novel Machine Learning Model and Metaheuristic Algorithms,Xiuyuan Li; Zhiyong Wang,10.1504/ijcis.2027.10069677,2027,International Journal of Critical Infrastructures,
Crossref,deep learning,Efficient digital forensic in IoT environment: a hybrid framework using deep-federated learning,Waad Almadud; Asma Abdulghani Al Shargabi,10.1504/ijesdf.2027.10073649,2027,International Journal of Electronic Security and Digital Forensics,
Crossref,deep learning,Methods to Enhance Student Classroom Participation through Big Data and Deep Learning,Mingfang Zhou; Guofang Li; Yameng Bai,10.1504/ijcsyse.2027.10072910,2027,International Journal of Computational Systems Engineering,
OpenAlex,mitral regurgitation,"Evaluation of ePLAR, the echocardiographic pulmonary to left atrial ratio, in a large cohort with pulmonary hypertension",Juan M Farina; Isabel G Scalia; Milagros Pereyra Pietri; Mohammed Tiseer Abbas; Nima Baba Ali; Kamal Awad; Niloofar Javadi; Nadera N Bismee; Ahmed K Mahmoud; Sogol Attaripour Esfahani; Hesham Sheashaa; Oman H Ibrahim; Fatmaelzahraa E Abdelfattah; Timothy Barry; Balaji K Tamarappoo; Said Alsidawi; Robert L Scott; Julie L Rosenthal; Steven J Lester; Chadi Ayoub; Reza Arsanjani,10.1093/ehjopen/oeaf174,2025-12-18,European Heart Journal Open,"Abstract Background and Aims Pre-capillary pulmonary hypertension (PHTN), typically due to intrinsic pulmonary pathology, requires right heart catheterization (RHC) for diagnosis. ePLAR, the echocardiographic pulmonary to left atrial ratio (calculated: tricuspid regurgitation maximum velocity [TRVmax] divided by mitral valve E to e’ wave ratio [E/e’]), has been demonstrated as a promising non-invasive surrogate for characterization of pre-capillary PHTN. As such, this study aimed to further evaluate the diagnostic utility of ePLAR in a large cohort of patients with PHTN. Methods and Results All RHCs between 2018-2023 across three tertiary centers were retrospectively reviewed. Patients with PHTN were characterized as pre-capillary or post-capillary (isolated or combined). Concurrent ePLAR was calculated. ROC analysis evaluated the accuracy of ePLAR in detecting pre-capillary PHTN. Overall, 2235 patients had PHTN by RHC, mean age 63.5 ± 14.7 years, 53.5% male. Of these, 43.3% had pre-capillary PHTN. ROC analysis demonstrated ePLAR to have good accuracy in detection of pre-capillary PHTN (AUC 0.760), with a cutoff of 0.20m/s demonstrating a sensitivity and specificity of 77% and 60% respectively. This persisted on sensitivity analysis for contemporaneous investigations and for right ventricular function. Conclusions In this large cohort, ePLAR was validated as an accurate tool for identifying patients with pre-capillary PHTN. This widely available, non-invasive, and reproducible parameter can have an important role in the work up of PHTN and may guide the need for invasive testing."
OpenAlex,mitral regurgitation,Long-Term Outcomes of Drug-Refractory Atrial Fibrillation After Atrioventricular Node Ablation Combined with Implantation of a Cardiac Resynchronization Therapy Defibrillator (CRT-D),Б А Ахыт; Salim Berkinbaev; Н. Г. Ложкина; С. Н. Артеменко; Nikolay Zyatkov; Olga Krivorotko; K Koshum-Bayeva; M. Pashimov; R Tuleutayev; Elmira Kultanova,10.3390/jcm14248938,2025-12-18,Journal of Clinical Medicine,"Objective: In this study, we aimed to determine the most significant risk factors for 5-year mortality in patients with paroxysmal and persistent drug-refractory tachysystolic atrial fibrillation after undergoing atrioventricular node ablation (AVNA) in combination with the implantation of a permanent three-chamber pacemaker with an implantable cardioverter–defibrillator function (CRT-D). Methods: This prospective single-center cohort study included 101 patients with chronic heart failure (mean age 62 ± 15.5 years; 70.3% male) with paroxysmal or persistent drug-refractory atrial fibrillation who underwent atrioventricular node ablation and CRT-D implantation. All patients received optimal medical therapy before and after undergoing the procedure. Predictors of 5-year mortality were assessed using exploratory machine-learning methods, including random forest and Shapley additive explanations. Results: During 5-year follow-up, 13 cardiovascular deaths were recorded. Five key predictors of mortality were identified: left ventricular ejection fraction, 6 min walk distance, mean pulmonary artery pressure, systolic relaxation coefficient, and degree of mitral regurgitation. The exploratory predictive model showed high accuracy (92%) in terms of classifying the outcomes. Conclusions: Atrioventricular node ablation (AVNA) combined with CRT-D was associated with the observed long-term clinical outcomes observed in patients with drug-refractory tachysystolic atrial fibrillation. The exploratory machine learning analysis identified key mortality-associated factors, which may support future efforts in personalized risk stratification and hypothesis generation. The combination of AVNA and CRT-D was associated with the observed long-term outcomes in this real-world cohort."
OpenAlex,mitral regurgitation,Advancing Minimally Invasive Mitral Valve Surgery: Early Outcomes of a Total Endoscopic 2D and 3D Approach,Carlo Savini; Mariafrancesca Fiorentino; Diego Sangiorgi; Simone Calvi; Antonino Costantino; Elena Tenti; Elisa Mikus,10.3390/jcdd12120501,2025-12-18,Journal of Cardiovascular Development and Disease,"Background: The minimally invasive approach is increasingly recognized as the standard for surgical management of mitral valve disease. Advances in endoscopic visualization and surgical instrumentation have enhanced precision while minimizing trauma, improving both functional and esthetic outcomes. This study presents a single-center experience with total endoscopic mitral valve repair (MVR) performed using two- or three-dimensional video-assisted technology. Methods: Between October 2022 and September 2025, 239 patients underwent total endoscopic MVR at our institution. Demographic, operative, and postoperative data were collected and analyzed. Results: Median age was 63 years, with 64.4% male. Median logistic EuroSCORE and EuroSCORE II were 2.53 and 0.83, respectively. Most patients were NYHA class II (54.4%), and 47.7% had pulmonary hypertension. Mitral annuloplasty was performed in 99.2% of cases; 78.6% received Gore-Tex chordae, 6.3% underwent posterior leaflet resection, and 11.7% edge-to-edge repair. Conversion to sternotomy occurred in 0.4%. In-hospital mortality was 1.3%; stroke occurred in 0.4%. Postoperative atrial fibrillation developed in 26.8%, while major complications such as sepsis (2.1%) and renal failure requiring dialysis (1.3%) were infrequent. Median ventilation time was 5 h, ICU stay was 2 days, and hospital stay was 7 days. Pre-discharge echocardiography showed ≤mild regurgitation in 99.2%. Conclusions: Total endoscopic MVR using two- or three-dimensional video assistance is safe, feasible, and yields excellent clinical, functional, and cosmetic results, with low morbidity and rapid recovery."
OpenAlex,mitral regurgitation,Paradoxical Normal‐Flow Aortic Stenosis Despite Reduced Left Ventricular Ejection Fraction: Insights From the Randomized COMPARE‐TAVI 1 Trial,Emil Johannes Ravn; Ulrik Christiansen; Henrik Nissen; Jonas Agerlund Povlsen; Christian Alcaraz Frederiksen; Steen Hvitfeldt Poulsen; Marie‐Annick Clavel; Rasmus Carter‐Storch; C. B. Nielsen; Troels Thim; Phillip Freeman; Frederik Uttenthal; Evald Høj Christiansen; Christian Juhl Terkelsen; Jordi Sanchez Dahl,10.1161/jaha.125.045521,2025-12-17,Journal of the American Heart Association,"Background The hemodynamic profile and remodeling patterns of paradoxical low‐flow, low‐gradient aortic stenosis are well understood. However, some patients with severe aortic stenosis exhibit eccentric remodeling with enlarged left ventricular cavities, enabling a normal flow, low ejection fraction ( NF ‐ LEF ) phenotype. We assessed the prevalence, hemodynamic characteristics, and post‐transcatheter aortic valve implantation outcomes of NF ‐ LEF . Methods In this substudy of the COMPARE‐TAVI 1 trial, 979 patients undergoing transfemoral transcatheter aortic valve implantation were stratified by left ventricular ejection fraction (LVEF) (&lt; or ≥50%) and stroke volume index (&lt; or ≥35 mL/m 2 ) into 4 groups: normal flow, normal LVEF, NF‐LEF, low flow, normal ejection fraction, and low flow, low ejection fraction. Results NF‐LEF was observed in 10.7% of patients. Reduced LVEF was associated with previous myocardial infarction, pacemakers, New York Heart Association class &gt;2, atrial fibrillation, moderate or worse mitral regurgitation, and larger left ventricular cavities ( P &lt;0.001) with eccentric hypertrophy ( P =0.004). Compared with low‐flow, low‐ejection fraction, patients with NF‐LEF more frequently had moderate or worse aortic regurgitation ( P =0.007), whereas low flow, low ejection fraction showed poorer diastolic indices, suggesting diastolic dysfunction with high left ventricular filling pressures. Patients with low flow, normal ejection fraction were the most symptomatic and showed less improvement in 6‐minute walk distance at 1 year compared with normal flow, normal ejection fraction. During follow‐up, both low‐flow groups demonstrated significant increases in stroke volume index ( P &lt;0.001), whereas LVEF also improved among patients with reduced LVEF ( P &lt;0.001). Conclusions NF‐LEF is a prevalent aortic stenosis phenotype characterized by preserved flow despite reduced LVEF, likely driven by eccentric remodeling with moderate or worse aortic regurgitation and more favorable diastolic properties, with similar survival and time‐to‐event outcomes across phenotypes after transcatheter aortic valve implantation at long‐term follow‐up. Despite higher comorbidity burdens, patients with NF‐LEF showed functional and clinical improvements comparable with normal flow, normal ejection fraction, indicating a severe aortic stenosis phenotype."
OpenAlex,mitral regurgitation,Echocardiographic Assessment of Patients Undergoing Mitral Valve Repair,Marco Rolando; Nadeem Elmasry; Federico Gobbi; Antonella Moreo; Nina Ajmone Marsan; Erberto Carluccio; Federico Fortuni,10.3390/jcdd12120498,2025-12-17,Journal of Cardiovascular Development and Disease,"Mitral regurgitation (MR) is one of the most prevalent valvular disorders worldwide, with a growing burden driven by population aging and improved diagnostic capabilities. Understanding the mechanism of MR, whether primary, due to intrinsic valve abnormalities, or secondary, resulting from atrial or ventricular remodeling, is essential for optimal management. Echocardiography, particularly advanced modalities such as three-dimensional imaging and strain analysis, plays a central role in this process. It allows accurate quantification of MR severity, detailed characterization of valve and ventricular anatomy, and assessment of remodeling, all of which are critical for determining the optimal timing for intervention. Beyond diagnosis, echocardiography is indispensable in guiding therapy selection: it informs surgical planning by defining leaflet pathology for repair versus replacement strategies, and directs transcatheter interventions by guiding interatrial septal puncture, catheter orientation, and device deployment in real time. While surgery remains the gold standard for primary MR, transcatheter approaches including edge-to-edge repair and emerging mitral valve replacement are increasingly relevant, particularly in patients at high surgical risk or with complex anatomy. This review emphasizes the pivotal role of echocardiography in the pre-procedural assessment of MR, highlighting its ability to integrate anatomical, functional, and hemodynamic information to guide patient-tailored therapeutic strategies and optimize outcomes within a Heart Team framework."
OpenAlex,mitral regurgitation,TERMINALIA ARJUNA: POSSIBLE TREATMENT FOR SICKLE CELL ANAEMIA & POTENT BIOFUEL,Shyam J. Patel*,10.5281/zenodo.17951343,2025-12-16,Zenodo (CERN European Organization for Nuclear Research),"The review “Terminalia arjuna: The possible treatment for sickle cell anaemia & potent biofuel” focuses on the different studies and research done on different parts of the Terminalia arjuna plant. It examines the potential treatment for sickle cell anaemia and other chronic or acute diseases like myocardial infarction, angina, CHF, hypertension, rheumatic heart disease, ischemic mitral regurgitation, cardiomyopathy, platelet aggregation, oxidative stress, endothelial dysfunction, and thrombotic conditions. The review examines the potential of Terminalia arjuna leaf gall in SCD treatment, identifying its main bioactive compound, 5-Hydroxymethylfurfural, known for its anti-sickling properties. Galls form when plants react to insect attacks, notably from Trioza fletcheri in T. arjuna. Studies indicate that extracts from Terminalia arjuna exhibit significant anti-sickling effects. While the pharmacological potential of these extracts is promising, further clinical studies and safety assessments are necessary to validate efficacy and standardisation for therapeutic use. The review examines how Arjuna bark decoction has been used in the Indian subcontinent for centuries to manage anginal pain, hypertension, congestive heart failure, and dyslipidemia. While its potential in cardiovascular diseases warrants further study, recent literature highlights its anti-ischemic, antioxidant, hypolipidemic, and antiatherogenic effects, primarily due to its beneficial phytoconstituents like triterpenoids and flavonoids. Arjuna has shown promise in treating ischemic cardiomyopathy, with no serious side effects reported; however, long-term safety remains unclear. Its role in coronary prevention still needs exploration."
OpenAlex,mitral regurgitation,TERMINALIA ARJUNA: POSSIBLE TREATMENT FOR SICKLE CELL ANAEMIA & POTENT BIOFUEL,Shyam J. Patel*,10.5281/zenodo.17951342,2025-12-16,Zenodo (CERN European Organization for Nuclear Research),"The review “Terminalia arjuna: The possible treatment for sickle cell anaemia & potent biofuel” focuses on the different studies and research done on different parts of the Terminalia arjuna plant. It examines the potential treatment for sickle cell anaemia and other chronic or acute diseases like myocardial infarction, angina, CHF, hypertension, rheumatic heart disease, ischemic mitral regurgitation, cardiomyopathy, platelet aggregation, oxidative stress, endothelial dysfunction, and thrombotic conditions. The review examines the potential of Terminalia arjuna leaf gall in SCD treatment, identifying its main bioactive compound, 5-Hydroxymethylfurfural, known for its anti-sickling properties. Galls form when plants react to insect attacks, notably from Trioza fletcheri in T. arjuna. Studies indicate that extracts from Terminalia arjuna exhibit significant anti-sickling effects. While the pharmacological potential of these extracts is promising, further clinical studies and safety assessments are necessary to validate efficacy and standardisation for therapeutic use. The review examines how Arjuna bark decoction has been used in the Indian subcontinent for centuries to manage anginal pain, hypertension, congestive heart failure, and dyslipidemia. While its potential in cardiovascular diseases warrants further study, recent literature highlights its anti-ischemic, antioxidant, hypolipidemic, and antiatherogenic effects, primarily due to its beneficial phytoconstituents like triterpenoids and flavonoids. Arjuna has shown promise in treating ischemic cardiomyopathy, with no serious side effects reported; however, long-term safety remains unclear. Its role in coronary prevention still needs exploration."
OpenAlex,mitral regurgitation,Three-Dimensional Echocardiographic Approach to Mitral Valve After Transcatheter Edge-to-Edge Repair,Rishi Kumar; Serena S. Dasani; Kara G. Fields; Guillem Roca; Lauren Cornella; Douglas C. Shook; Charles Nyman; Sula Nasra; Chinyere Archie; Pinak Shah; Stanton K. Shernan; Sergey Karamnov,10.1213/ane.0000000000007756,2025-12-15,Anesthesia & Analgesia,"BACKGROUND: Evaluation of the mitral valve during transcatheter edge-to-edge repair (TEER) for management of mitral regurgitation is commonly guided by intraprocedural interventional transesophageal echocardiography (TEE). The risk of iatrogenic mitral stenosis (MS) remains a concern, particularly in patients requiring multiple clips, since the mitral valve orifice area (MVA) is reduced. The value of conventional flow-based echocardiographic methods to rule out MS is limited by intraprocedural and general anesthesia (GA)-induced hemodynamic variability. This retrospective study introduces the novel adaptation of a 3-dimensional (3D) Orifice Area (3DOA) technique to evaluate post-TEER MVA. We evaluated the degree of agreement between MVAs derived via TEE 3DOA, TEE pressure half-time (PHT), and postprocedure transthoracic echocardiography (TTE) PHT with patients awake. METHODS: TEE and TTE images from 20 adult patients with severe mitral regurgitation undergoing a TEER (MitraClip, Abbott) procedure were retrospectively reviewed. MVAs obtained by MTEE 3DOA and TEE PHT under GA were compared to those acquired with TTE PHT with patients awake. Agreement was assessed via calculation of Bland–Altman 95% limits of agreement and Lin’s concordance correlation coefficients, both with 95% confidence intervals (CIs). RESULTS: There was good agreement between TEE 3DOA-derived MVA measurements under GA and TTE PHT-derived MVA measurements in awake patients, as reflected by Bland–Altman (lower limit of agreement: −.0.45 [95% CI, −.58 to −.31] and upper limit of agreement: 0.26 [95% CI, 0.12–0.4]), and an excellent concordance correlation coefficient value (0.95 [95% CI, 0.86–0.98]). In contrast, agreement between TEE PHT-derived MVA and TTE PHT-derived MVA was weak, with much broader limits of agreement (lower limit of agreement: −1.6 [95% CI, −2.19 to −1.02] and upper limit of agreement: 1.43 [95% CI, 0.84–2.01]) and a weak concordance correlation coefficient value (0.46 [95% CI, 0.02–0.75]). CONCLUSIONS: In this retrospective cohort study, we demonstrated excellent agreement between TEE-3DOA-derived MVA under GA and TTE PHT-derived MVA in awake patients, but not between TEE versus TTE PHT. These findings warrant further validation in larger patient datasets to assess the utility of 3D echocardiographic approaches in evaluating MVA after TEER."
OpenAlex,mitral regurgitation,Transcatheter mitral edge-to-edge repair vs optimal medical therapy in secondary mitral regurgitation: a meta-analysis,Daniel Paulino-González; Miguel Angel Pardiño-Vega; Arantza Lizbeth García-Loera; and Karoly P. Zúñiga-Montaño; Daniel Alejandro Navarro-Martínez,10.24875/recice.m25000558,2025-12-14,REC interventional cardiology (English Edition),
OpenAlex,mitral regurgitation,Mitral regurgitation and in-hospital outcomes of percutaneous left atrial appendage closure,Gilad Margolis; Liron Naftali Ben Haim; Adam Folman; Mark Kazatsker; Ariel Roguin; Eran Leshem‐Rubinow,10.1007/s10840-025-02200-x,2025-12-13,Journal of Interventional Cardiac Electrophysiology,
OpenAlex,mitral regurgitation,Prevalence and prognostic implications of different aetiologies of low flow aortic stenosis,Giorgio Fiore; Federico Biondi; Margherita Fabris; Paola Cunsolo; Michele Morosato; Marco Gamardella; Giacomo Ingallina; Stefano Stella; Francesco Ancona; Annamaria Tavernese; Davide Margonato; Martina Belli; Alessandro Castiglioni; Matteo Montorfano; Francesco Maisano; Eustachio Agricola,10.1186/s12947-025-00363-1,2025-12-13,Cardiovascular Ultrasound,"The main cause of LFAS is reduced LVEF, while in preserved LVEF mixed causes and small LV volume prevailed, without association with the outcome. Severe mitral and tricuspid regurgitation were strongly associated with worse outcomes, while valve replacement and mean transvalvular gradient ≥ 40 mmHg emerged as protective factors."
