source,keyword,title,authors,doi,publication_date,journal,abstract
OpenAlex,valvular heart disease,Heart Disease in Survivors of Childhood Cancer: Data From the German Cancer Registry and Statutory Health Insurance Carriers (the VersKiK Study).,Hiltrud Merzenich; Pietro Trocchi; Claudia Bremensdorfer; Ekaterina Aleshchenko; Enno Swart; Christian Apfelbacher; Christian Lüpkes; Peter Ihle; J Küpper-Nybelen; Katja Baust; Gabriele Calaminus; Thorsten Langer; Dirk Horenkamp-Sonntag; Patrik Dröge; Thomas Ruhnke; Ursula Marshall; Melanie Klein; Claudia Spix; Cécile Ronckers,10.3238/arztebl.m2026.0038,2026-05-29,PubMed,"BACKGROUND: Cardiac and cardiovascular diseases are major causes of morbidity in the growing population of childhood cancer survivors, particularly as a result of treatment with anthracyclines and radiotherapy to the chest. METHODS: The VersKiK study is based on record linkage between the German Childhood Cancer Registry and 13 statutory health insurance carriers (69% coverage of the German statutorily insured population). Registry data with information on primary cancers in childhood or adolescence were linked to data from the participating health insurance carriers. Cardiac diseases were analyzed in 11 863 patients with cancer diagnosed between 1991 and 2011 who survived at least 5 years after their diagnosis (up to January 2017). The health insurance data covered the years 2017-2021. The childhood cancer survivors were matched to a comparison group of 35 589 insurees without childhood cancer by age, sex, region of residence within Germany, and duration of insurance. RESULTS: Cardiac diseases were identified in 6.4% of the 5-year survivors of childhood cancer and in 2.5% of the matched comparison group. Cardiomyopathy, valvular disease, and arrhythmia were the most common heart diseases in the survivors (1.9%, 2.7%, 1.5%). The largest difference from the comparison group was observed for cardiomyopathy (prevalence ratio = 14.0; 95% confidence interval: [10.9; 20.5]). CONCLUSION: Long-term survivors of childhood cancer in Germany are more likely to be diagnosed with cardiac disease than the general population of the same age. Systematic medical monitoring and individualized preventive measures for survivors are indicated. In the interpretation of these findings, it should be noted that the childhood cancer survivors underwent more intensive long-term medical follow-up than their counterparts in the comparison group."
OpenAlex,valvular heart disease,Development and validation of interpretable machine learning models for predicting stroke in NVAF patients with CHA2DS2-VA scores ≤1,Tanggang Gao; Xi Zhang; Tianyi Ma; Meijuan Li; Bingbo Hou; Ze Lin; Jiayi Cai; Sen Huang; Xiping Liu; Yanan Zhao; Siyang Ji; Weibing Guo; Wenxin Xue; Feng Gao,10.3389/fcvm.2026.1725168,2026-04-28,Frontiers in Cardiovascular Medicine,"Background Non-valvular atrial fibrillation (NVAF) patients with CHA₂DS₂-VA ≤1 face uncertainty in stroke risk assessment, particularly in Asian populations. Machine-learning (ML) models offer improved accuracy for individualized risk prediction. Methods This single-center, retrospective study at Zhongshan Hospital, Xiamen University (January 2022–January 2025) included 82 NVAF-related stroke cases and 164 matched non-stroke controls with CHA₂DS₂-VA ≤1. Data encompassed demographics, comorbidities, laboratory markers, and echocardiographic parameters. Following stratified train-test split (80%:20%), feature selection used univariable logistic regression and least absolute shrinkage and selection operator (LASSO) regression, retaining the intersection of variables selected by both methods. Three nested predictor sets were defined: Model A (clinical and routine laboratory variables), Model B (Model A plus Cardiac biomarkers), and Model C (Model B plus echocardiographic parameters). ML algorithms [logistic regression (LR), random forest (RF), XGBoost (XGB)] underwent nested cross-validation for hyperparameter tuning. Performance was evaluated by area under the receiver operating characteristic curve (AUC), sensitivity, specificity, precision, and F1 score. Shapley additive explanations (SHAP) were applied to the best-performing ML algorithm in the test set to evaluate the contributions of individual features. Results Stroke cases were older, with higher E/e′ ratio, and elevated N-terminal pro-B-type natriuretic peptide (NT-proBNP), C-reactive protein (CRP), and white blood cell count (all P ≤ 0.01). Comorbidities such as heart failure, hypertension, and age 65–74 years were more prevalent in stroke cases (all P ≤ 0.05). Feature selection yielded seven predictors: age, CRP, E/e′ ratio, left ventricular ejection fraction (LVEF), NT-proBNP, triglycerides, and white blood cell count. In the training set, XGB employing Model C achieved an AUC of 0.905 (95% CI: 0.877–0.933). In the test set, XGB employing Model C yielded the AUC (0.906; 95% CI: 0.826–0.985). SHAP analysis identified NT-proBNP as the most influential feature, with elevated NT-proBNP and E/e′ levels associated with increased predicted risk and higher LVEF linked to decreased risk. Conclusions ML models incorporating cardiac biomarkers and echocardiographic parameters improve stroke risk stratification in low- to moderate-risk NVAF patients, supporting personalized anticoagulation strategies."
OpenAlex,valvular heart disease,Reconsidering the Prognostic Role of the HALP Score in Rheumatic Mitral Stenosis,Muhammad Talha; Sawera Gul; Muhammad Faizan Khan,10.1002/clc.70334,2026-04-28,Clinical Cardiology,"We read with considerable interest the recently published study by Kaya et al. [1] evaluating the prognostic value of the hemoglobin–albumin–lymphocyte–platelet (HALP) score in patients with rheumatic mitral stenosis. The authors address an important clinical need, particularly in resource-constrained settings where simple and cost-effective biomarkers are desirable. However, the modest discriminatory performance and the absence of independent significance in multivariable analysis suggest that interpreting HALP as a true prognostic marker do not support its interpretation as an independent prognostic marker. First, there appears to be a conceptual overlap between a prognostic biomarker and what may instead represent a state marker. A robust prognostic biomarker is expected to provide independent and incremental predictive value beyond established clinical variables. In this study, the HALP score did not retain statistical significance after adjustment, which raises the possibility that it reflects the patient's current physiological or inflammatory condition rather than reliably predicting future risk. This distinction has been emphasized in established biomarker frameworks, where simple association is not sufficient to define prognostic utility [2]. The lack of statistical significance in multivariable analysis further undermines its role as an independent prognostic biomarker. Moreover, the modest discriminatory performance (AUC ≈ 0.64) indicates limited clinical utility. Second, reliance on a single baseline measurement introduces a temporal limitation. The components of the HALP score are inherently dynamic and can fluctuate with changes in clinical status, treatment, and nutritional state. Models intended for long-term risk prediction generally benefit from temporal consistency or repeated assessments. Previous work has shown that incorporating longitudinal biomarker trends can enhance predictive accuracy compared to single time-point measurements [3, 4]. Additionally, the inclusion of intervention-based endpoints may introduce clinician-dependent bias, potentially confounding the assessment of true prognostic value. Third, the biological non-specificity of the HALP score deserves consideration. Composite indices reflecting inflammation and nutritional status are not disease-specific and have demonstrated prognostic associations across a wide spectrum of cardiovascular conditions [5-7]. For instance, HALP has been linked with mortality in coronary heart disease, outcomes following percutaneous coronary intervention, and atrial fibrillation cohorts. Similar associations have also been reported in valvular and surgical populations. These findings suggest that HALP may primarily capture a generalized systemic vulnerability rather than mechanisms unique to rheumatic mitral stenosis, which may limit its disease-specific predictive value. Taken together, these observations suggest that while the HALP score is accessible and inexpensive, it more likely reflects systemic health status rather than disease-specific risk and should not be considered a standalone prognostic tool. Future prospective studies incorporating serial measurements and evaluating incremental predictive value over established clinical and echocardiographic models would help clarify its clinical relevance. Until such evidence is available, caution may be warranted in considering HALP as a disease-specific prognostic marker in rheumatic mitral stenosis. All authors contributed equally to the conception and writing of this manuscript. The authors have nothing to report. The authors have nothing to report. The authors declare no conflicts of interest. Data sharing not applicable to this article as no datasets were generated or analysed during the current study."
OpenAlex,valvular heart disease,Spinal infection caused by Coxiella burnetii and surgical treatments: a case report,Xu Zhai; Hong Pan; Jie Zheng,10.3389/fmed.2026.1785109,2026-04-28,Frontiers in Medicine,"Q fever is a rare global zoonosis caused by Coxiella burnetii , with bone and joint involvement being an uncommon manifestation that poses significant diagnostic challenges. This article reports a case of persistent focal spinal infection caused by C. burnetii in an elderly female without a clear epidemiological exposure history, who was initially misdiagnosed with vertebral compression fractures. The diagnosis was confirmed by third-generation nanopore-based metagenomic next-generation sequencing (mNGS), which detected 12,170 reads of C. burnetii with a relative abundance of 98.27%. The patient was initially treated with oral doxycycline (0.1 g q12h) and rifampin capsules (0.45 g daily) for 4 weeks, resulting in decreased inflammatory markers and reduced paravertebral abscess size. After clinical stabilization, surgical intervention (posterior approach T12–L1 vertebral lesion resection, intervertebral bone graft fusion, and pedicle screw rod fixation) was performed under general anaesthesia. Postoperative follow-up for 3 months showed a significant improvement in the patient’s low back pain [visual analogue scale (VAS) score from 6 preoperatively to 1 at 3 months] and functional status [Oswestry Disability Index (ODI) from 65% preoperatively to 10% at 3 months], with normalized inflammatory markers and a reduced C. burnetii IgG antibody titre (from 1:256 to 1:128). Serological follow-up revealed persistent negative IgM antibodies throughout the treatment course. This case highlights the diagnostic value of third-generation mNGS for rare spinal infections caused by C. burnetii and the efficacy of a multimodal treatment approach combining targeted antimicrobial therapy and surgical intervention. The rationale for antibiotic selection and surgical management is discussed, along with the limitations of the present case and clinical insights for managing similar cases."
OpenAlex,valvular heart disease,Case Report: A case analysis of antitumor therapy and cardiovascular safety management in a breast cancer patient with multiple cardiovascular diseases,Minghui Long; Boni Ding,10.3389/fcvm.2026.1690244,2026-04-28,Frontiers in Cardiovascular Medicine,"Background As breast cancer treatment advances, therapeutic efficacy has improved significantly, but cardiovascular toxicity from anticancer agents has become a critical concern. Elderly patients often have pre-existing cardiovascular comorbidities like coronary heart disease (CHD) and high venous thromboembolism (VTE) risk, requiring long-term antithrombotic therapy. Perioperative management demands individualized assessment of thrombotic and bleeding risks, with bridging anticoagulation when necessary. Close surveillance for cardiovascular complications (myocardial injury, heart failure, hypertension [HTN]) and control of modifiable risk factors (HTN, diabetes mellitus [DM]) are essential during treatment. Case report This study presents a breast cancer patient with multiple cardiovascular comorbidities (HTN, DM, CHD). Following multidisciplinary team (MDT) consultation, the low-cardiotoxicity PTD regimen (pertuzumab, trastuzumab, docetaxel) was selected. Perioperatively, aspirin was withheld, and low-molecular-weight heparin (LMWH) bridging was used 24 h before and after radical mastectomy. Postoperative radiotherapy was administered, with regular cardiac function monitoring throughout treatment. No cardiovascular complications occurred. Conclusion For cancer patients with cardiovascular comorbidities, balancing tumor treatment and cardiovascular safety is achievable through comprehensive baseline risk assessment, the selection of low-cardiotoxicity regimens, rational perioperative antithrombotic adjustments, and continuous cardiac monitoring, thereby ensuring optimal oncological outcomes with minimized cardiovascular risks."
OpenAlex,valvular heart disease,Onco-hypertension: hypertension induced by VEGF pathway inhibition,Nicolas L. Palaskas; J Kim; Silvia Fernanda López Moreno; Bernardo Casso-Chapa; Noah Beinart; Nnenne Nnanna; Keila Carolina Ostos Mendoza; Anita Deswal; Syed Wamique Yusuf; Efstratios Koutroumpakis; Jun-ichi Abe; Michael S. Ewer,10.3389/fcvm.2026.1748445,2026-04-28,Frontiers in Cardiovascular Medicine,"Cancer therapies are increasingly linked to a wide spectrum of cardiovascular toxicities, presenting significant challenges in the long-term care of oncology patients. Among these, therapy-induced hypertension stands out as one of the most consistent and clinically relevant adverse effects, especially with agents targeting the VEGF pathway. Understanding the mechanisms behind this form of hypertension is critical, as it not only represents a modifiable cardiovascular risk factor but may also serve as a biomarker of therapeutic efficacy in certain cancer treatments. Clinical evidence underscores the importance of early detection and aggressive blood pressure control to improve both cardiovascular and oncologic outcomes. The most well-characterized and clinically significant subtype of therapy-related hypertension is that induced by VEGF pathway inhibitors, owing to its high incidence, rapid onset, and well-defined mechanistic basis. In this review, we specifically examine VEGFi-associated hypertension as a prototypical model of onco-hypertension. Evidence-based strategies for managing therapy-induced hypertension emphasize early detection and individualized treatment plans. Renin-angiotensin system inhibitors (RAAS inhibitors) are frequently recommended as first-line agents due to their favorable cardiovascular profile and potential synergistic effects with some cancer therapies. Calcium-channel blockers (CCBs) also demonstrate strong efficacy and are often used in combination regimens to achieve optimal blood pressure control. Successful management requires a multidisciplinary approach, integrating expertise from oncology, cardiology, and primary care. Proactive surveillance, patient education, and risk stratification are essential components of care. As the field of cardio-oncology continues to evolve, structured blood pressure management remains a cornerstone of safe and effective cancer care, ensuring that patients receive optimal therapeutic benefit while minimizing cardiovascular risk."
OpenAlex,valvular heart disease,A nomogram as a screening tool for mild cognitive impairment in middle-aged and elderly patients with atrial fibrillation,Yanmei Gan; Yao Du; Maoyuan Tang; Gaoye Li; Tingting Liao,10.1038/s41598-026-50844-0,2026-04-28,Scientific Reports,"Middle-aged and elderly patients with atrial fibrillation (AF) face a 1.4-fold higher risk of cognitive impairment (CI) and a 1.3-fold higher risk of dementia compared to those without AF. This study aimed to identify independent factors for mild cognitive impairment (MCI) among hospitalized AF patients and to develop a screening nomogram to facilitate the identification of high-risk individuals for early assessment and targeted non-pharmacological interventions. A cross-sectional study was conducted involving 475 patients with atrial fibrillation admitted to a tertiary care hospital in Nanning, China, between September 2024 and September 2025. Cognitive function was evaluated using the Beijing version of the Montreal Cognitive Assessment Scale. Multivariable logistic regression analysis was used to identify independent factors for MCI in these patients. Based on the results of the regression analysis, a screening nomogram was developed. The accuracy of the model was assessed using calibration curves and receiver operating characteristic analysis, and its clinical utility was evaluated through decision curve analysis. Internal validation was performed using the bootstrap method with 500 resamples. Among the 475 patients included in the study, 237 (49.89%) were diagnosed with MCI. Multivariate analysis identified nine independent factors: age, educational level, alcohol, hypertension, stroke, comorbidity count, duration of AF, malnutrition status and frailty status. The nomogram showed good discriminative ability, with an area under the curve of 0.913. Internal validation using bootstrap resampling (500 repetitions) yielded an optimism‑corrected C‑index of 0.901. The model exhibited a sensitivity of 0.806, a specificity of 0.887, and an overall accuracy of 0.846. Furthermore, the calibration curve showed acceptable agreement between predicted probabilities and observed outcomes. We developed and internally validated a nomogram incorporating nine routinely available clinical variables. This model shows potential as a screening and risk stratification tool for MCI in middle-aged and elderly AF patients, which may aid in early identification and guide targeted management pending external validation in independent study."
OpenAlex,valvular heart disease,Contribution of immune cells and cytokines to radiation-induced injury: the key roles and potential targets,Yanan Wu; Yuanjing Tian; YingYing Zhang; Pingping Hu; Lili Qiao; Guodong Deng; Ning Liang; Yan Zhang; Jiandong Zhang,10.3389/fimmu.2026.1785418,2026-04-28,Frontiers in Immunology,"Despite the useful applications of ionizing radiation in daily life, the heightened risks of radiation-induced injury have emerged as a significant challenge. Immune cells and the associated cytokines play crucial roles in orchestrating the inflammatory and repair processes that follow radiation exposure. These immune responses contribute to both the beneficial and detrimental outcomes of radiotherapy. Cytokines, in particular, regulate the recruitment and activation of immune cells, thereby influencing the extent and nature of tissue damage. By understanding the mechanisms underlying the interactions between immune cells and cytokines in radiation-induced injury, we can identify potential targets for therapeutic interventions. This article provides insights into the mechanisms underlying radiation-induced injury and highlights opportunities for enhancing the efficacy and safety of radiotherapy through immune-based interventions."
OpenAlex,valvular heart disease,"End-stage valvular heart disease requiring heart transplantation: risk profile, surgical modifiers, and myocardial pathology",Yifan Wang; Yiqi Zhao; Weiteng Wang; Hao Jia; Xiao Chen; Han Mo; Zhe Sun; Xiaohu Wang; Songren Shu; Hongjie Shi; Zhiling Luo; Xiumeng Hua; Hao Cui; Jiangping Song,10.1186/s12872-026-05814-9,2026-04-28,BMC Cardiovascular Disorders,
OpenAlex,valvular heart disease,When day seven strikes: a cautionary tale of direct oral anticoagulation resumption following thyroidectomy,Swe Phyoe; Jason Diab; Natalie Garibotto,10.18203/2349-2902.isj20261179,2026-04-27,International Surgery Journal,"Delayed neck haematoma following thyroidectomy is an uncommon but potentially life-threatening complication due to the risk of rapid airway compromise. We report a 62-year-old man with non-valvular atrial fibrillation on rivaroxaban who developed a large anterior neck haematoma on postoperative day (POD) 7, three days after resumption of anticoagulation following an initially uncomplicated total thyroidectomy with lateral neck dissection. Emergency re-exploration revealed active bleeding from a small superficial vessel between the sternocleidomastoid and platysma. The patient recovered without further complications after evacuation, haemostatic adjuncts and delayed reintroduction of anticoagulation. This case highlights the potential for clinically significant delayed haemorrhage after thyroidectomy in the context of direct oral anticoagulation (DOAC) therapy. It also emphasises the importance of vigilant post-discharge counselling regarding late warning signs and supports individualised perioperative anticoagulation strategies in head and neck surgery."
OpenAlex,valvular heart disease,Comorbidity Clusters in Acute Heart Failure: Insights From the AMERICCAASS Registry,Juan Pablo Arango-Ibañez; Sebastián Seni-Molina; Juan Andrés Muñoz-Ordoñez; Valeria Azcárate-Rodríguez; Andrea Valencia; Mario Miguel Barbosa Rengifo; Luis Eduardo Echeverría; Adrián Lescano; Juan Pablo Allende; Tessa Negrín Valdés; Maikel Santos Medina; Miguel Quintana; José Jesús Marval; Paola Oliver Rengifo; Harold Segundo Cedeño Macias; Luis Pérez-Plata; Alexander Romero; Eduardo R. Perna; Víctor Rossel; Daniel Quesada; Mario Speranza; Mark H. Drazner; Walter Alarco; C S P Lam; Juan Esteban Gómez‐Mesa; Juan Esteban Gómez Mesa; Eduardo R. Perna; Víctor Alejandro Rossel Mariángel; Daniel Quesada Chaves; Mario Osvaldo Speranza; Mark H. Drazner; Walter Alarco; Alexander Romero Guerra; Sebastian Seni Molina,10.1161/jaha.125.046820,2026-04-27,Journal of the American Heart Association,"BACKGROUND: Acute heart failure (HF) frequently coexists with multimorbidity. Comorbidity clusters have been associated with distinct clinical outcomes, but data from the Americas remain limited. We aimed to identify comorbidity clusters in patients with acute HF and assess their association with in-hospital outcomes. METHODS: This cohort study applied latent class analysis to patients from the AMERICCAASS Registry (Registro Americano de Insuficiencia Cardiaca Ambulatoria o Agudamente descompensada). Adjusted Poisson regression assessed in-hospital mortality and intensive care unit (ICU) admission, and multivariable analysis identified independent predictors of ICU admission. RESULTS: <0.001), compared with Cluster 1. Severe valvular insufficiency, peripheral artery disease, dyslipidemia, cancer, acute coronary syndrome, anemia, and cardiogenic shock were associated with higher ICU admission risk. CONCLUSIONS: Patients with acute HF in the Americas exhibit distinct comorbidity patterns associated with different clinical profiles and ICU admission rates, which may inform risk stratification and management strategies. REGISTRATION: URL: https://www.clinicaltrials.gov; Unique Identifier: NCT05295641."
OpenAlex,valvular heart disease,Splenic Infarction as a Complication of Acute Epstein-Barr Virus Infection in an 18-Year-Old Woman,Prabesh Angbuhang; Ahmed Amer; Anna Vaulks; Sajjad Pathan; A Laban,10.7759/cureus.107816,2026-04-27,Cureus,"Infectious mononucleosis, caused by Epstein-Barr virus (EBV), is a common illness in adolescents and young adults that usually follows a benign, self-limiting course. We report the case of an otherwise healthy 18-year-old woman who developed a radiologically confirmed splenic infarct presenting with left upper quadrant abdominal pain as a rare complication of infectious mononucleosis. Imaging demonstrated splenomegaly with a subcapsular wedge-shaped splenic infarct. She was managed conservatively with analgesia, observation, activity restriction, and interval imaging, with complete radiological and clinical resolution. This case highlights splenic infarction as a rare but likely under-recognised complication of EBV infection that can mimic more common abdominal pathology. Clinicians should maintain a high index of suspicion for splenic complications in patients with infectious mononucleosis who develop new or focal left upper quadrant abdominal pain, as prompt diagnosis facilitates appropriate management."
