source,keyword,title,authors,doi,publication_date,journal,abstract
OpenAlex,mitral regurgitation,Impact of Previous Cardiac Surgery on Outcomes After Tricuspid Valve Transcatheter Edge-to-Edge Repair: Insights from EuroTR,Dario Grassini; Karl‐Patrik Kresoja; Jennifer von Stein; Vera Fortmeier; Christoph Pauschinger; Wolfgang Rottbauer; Mohammad Kassar; Bjoern Goebel; Paolo Denti; Paul Achouh; Tienush Rassaf; Manuel Barreiro-Perez; Peter Boekstegers; Andreas Rück; Monika Zdanyte; M Adamo; Flavien Vincent; Philipp Schlegel; Sebastian Rosch; Mirjam G. Wild; Christian Besler; Stefan Toggweiler; Stephanie Brunner; Julia Grapsa; Tiffany Patterson; H Thiele; Tobias Kister; Giuseppe Tarantini; Giulia Masiero; Marco De Carlo; Cristina Giannini; Fabian Voss; Amin Polzin; Antonio Popolo Rubbio; Francesco Bedogni; Thorald Stolte; Thomas Nestelberger; Tomás Benito-González; Enrique Sánchez-Muñóz; Martijn Vrijkorte; Martin Swaans; M H Konstandin; Eric Van Belle; Marco Metra; Tobias Geisler; Rodrigo Estévez-Loureiro; Amir Abbas Mahabadi; Nicole Karam; Francesco Maisano; Philipp Lauten; Mirjam Kessler; Daniel Kalbacher; Volker Rudolph; Christos Iliadis; P Lurz; F Praz; Lukas Stolz; Jörg Hausleiter; on behalf of the EuroTR Investigators; Philipp Doldi; Ludwig T. Weckbach; Thomas J. Stocker; Julia Novotny; Kaspar Volz; Katalin Berschiminski; Hannah Kempton; Karl-Philip Rommel; Ralph Stephan von Bardeleben; Roman Pfister; Stephan Baldus; Philipp von Stein; Muhammed Gerçek; Felix Rudolph; Hazem Omran; Sebastian Ludwig; Benedikt Koell; Leonhard‐Moritz Schneider; Dominik Felbel; Carsten Salomon; Harald Lapp; Quentin de Baynast; Alain Berrebi; Florian Schindhelm; Berenice Caneiro-Queija; Julio Echarte-Morales; Andreas Goldschmied; Edoardo Pancaldi; Elisa Pezzola; Mauro Massussi; Laura Lupi; Natacha Rousse; Samy Aghezzaf; Norbert Frey; Martin Kraus; Dirk Westermann; Federico Arturi; Alessandro Sticchi; Matteo Mazzola; Anke von Peter,10.1007/s00392-026-02914-6,2026-05-18,Clinical Research in Cardiology,"Abstract Background Data on the association of previous cardiac surgery (PCS) with outcomes following tricuspid valve transcatheter edge-to-edge repair (T-TEER) are limited. Objectives This study aimed to evaluate the impact of PCS on outcomes after T-TEER. Methods This analysis included patients from the EuroTR registry (European Registry of Transcatheter Repair for Tricuspid Regurgitation; NCT0630726) who underwent T-TEER for clinically relevant tricuspid regurgitation (TR) between 2016 and 2024 and had available information on cardiac surgical history. Study endpoints were procedural TR reduction, improvement in NYHA functional class, all-cause mortality, and the composite of death or heart failure hospitalization (HFH) at 2 years. Results Among 2929 patients, 27.2% had a history of PCS. These patients exhibited a higher comorbidity burden and more advanced right heart remodeling. TR severity at baseline was comparable between groups ( P = 0.095), whereas residual TR at discharge and follow-up was higher in patients with PCS (both P &lt; 0.001). PCS independently predicted residual TR ≥ 3 + at discharge (OR: 1.41; 95% CI: 1.11–1.79; P = 0.01). T-TEER was associated with an improvement in NYHA class in patients with and without PCS (≥ 1-class reduction: 66.2% in PCS vs. 59.6% in non-PCS patients; P = 0.15). At 2 years, PCS patients had higher all-cause mortality (HR: 1.25; 95% CI: 1.04–1.50; P = 0.02) and a higher incidence of the composite endpoint of death or HFH (HR: 1.24; 95% CI: 1.05–1.46; P = 0.01). Conclusions PCS is an independent predictor of outcomes in patients undergoing T-TEER, identifying a subgroup with less pronounced TR reduction and lower long-term survival despite significant functional improvement. Graphical Abstract"
OpenAlex,mitral regurgitation,Cardiac Dysphagia: When the Heart Disrupts Swallowing,Caitlyn Margol; Sajid Ali; Navkiran Randhawa; Subbaramiah Sridhar; Humberto Sifuentes,10.7759/cureus.109146,2026-05-18,Cureus,"Cardiac dysphagia is a rare cause of dysphagia due to an enlarged left atrium compressing the esophagus. We describe three patients (ages 70, 71, and 31) with past medical histories of advanced heart disease who presented with diverse clinical manifestations of dysphagia. Recognition of cardiac dysphagia is important to prevent unnecessary esophageal interventions. Multimodal evaluation with barium swallow, esophageal manometry, endoscopy, and cardiac imaging facilitates diagnosis and management. These cases highlight the importance of considering cardiac causes of dysphagia in patients with severe underlying heart disease."
OpenAlex,mitral regurgitation,Association between Left Ventricular Late Gadolinium Enhancement and Left Atrial Function in Hypertrophic Cardiomyopathy: A Cardiac MR-Feature Tracking Study,Wenqi Liu; Gao Y; Q Li; Zhan Feng; Youfan Zhao; Jingjing Shi; Wanzhen Li; Jie Lin; Zewen Qiao; Lin Lu; Houzhang Sun; Wenbo Xiao; Xu M,10.21203/rs.3.rs-9364182/v1,2026-05-18,Research Square,
OpenAlex,mitral regurgitation,Incremental Prognostic Value of Regurgitant Fraction in Patients with Ventricular Secondary Mitral Regurgitation,Jana Ambrožič; Dušica Prodanova; Ana Starc; Mojca Škafar; Ljupka Dimitrovska; Janez Toplišek; M Bervar; M Bunc; Marta Cvijić,10.3390/jcm15103854,2026-05-17,Journal of Clinical Medicine,"Objectives: Quantifying ventricular secondary mitral regurgitation (MR) remains challenging, and the prognostic value of echocardiographic parameters is uncertain. This study aimed to assess the concordance of parameters of MR severity and determine the added value of regurgitant fraction (RF) in predicting outcomes. Methods and results: We retrospectively analysed 186 patients with ventricular secondary MR who underwent echocardiography with MR assessment, evaluating effective regurgitant orifice area (EROA), regurgitant volume (RegVol) and RF. The primary endpoint was a composite of all-cause death or heart failure hospitalisation. Quantitative parameters of MR severity were frequently discordant. Using the guideline-recommended cut-offs for EROA (≥40 mm2), RegVol (≥60 mL) and RF (≥50%), severe MR was present in 5.4%, 3.3%, and 29.5% of patients, respectively. Both RF ≥ 50% and EROA ≥ 40 mm2 were independently associated with clinical outcomes in multivariable Cox models. Combining RF and EROA provided incremental prognostic value over either parameter alone (p &lt; 0.05). Kaplan–Meier curves showed that patients with EROA &lt; 40 mm2 and RF ≥ 50% had similar outcomes to those with EROA ≥ 40 mm2 (p = 0.055), whereas patients with both EROA &lt; 40 mm2 and RF &lt; 50% had significantly better outcomes (p = 0.002). Conclusions: Substantial discordance between quantitative parameters of severe MR was observed in ventricular secondary MR. RF is a strong, underutilised marker of MR severity, reflecting haemodynamic burden beyond EROA and RegVol. Patients with EROA &lt; 40 mm2 and RF &gt; 50% had outcomes comparable to those who met the guideline-based threshold for severe MR, defined as EROA ≥ 40 mm2. Our results demonstrate that routine RF assessment may enhance risk stratification and enable identification of a high-risk subgroup of patients with EROA &lt; 40 mm2."
OpenAlex,mitral regurgitation,Development and validation of a predictive model to predict the risk of acute heart failure during hospitalization in patients with STEMI following PCI,Mengyu Cao; Baowei Zhu; Fan Wu; Meilin Zhu; Lei Chen; Jingpeng Jin; Shanshan Zhou,10.21203/rs.3.rs-9339290/v1,2026-05-15,Research Square,
OpenAlex,mitral regurgitation,Improvement in left atrial strain after percutaneous mitral valvuloplasty is an independent prognostic marker in patients with rheumatic mitral stenosis,Alexandre Negrão Pantaleão; Fernanda Azevedo Figueiredo; Antonio Mutarelli; Bruna Vieira Guarçoni; Hortência Carvalho; Isabella Fonseca; Shani Dahan; Jagdip Kang; Rasmus Sindre; Juliana Rodrigues Soares Oliveira; Elena Aikawa; R LEVINE; M C P N Nunes; on behalf of the PRIMA Network,10.3389/fcvm.2026.1719283,2026-05-15,Frontiers in Cardiovascular Medicine,"Background Rheumatic mitral stenosis (MS) leads to left atrial (LA) pressure overload, resulting in progressive atrial remodeling and dysfunction. Percutaneous mitral valvuloplasty (PMV) relieves LA pressure overload and is the primary treatment for severe MS. LA reservoir strain (LASr), assessed by speckle-tracking echocardiography, allows early detection of LA dysfunction, which may improve immediately after the procedure, with potential prognostic implications. In this study, we analyzed the prognostic value of post-procedural improvement in LASr beyond well-established predictors. Methods Patients with rheumatic MS undergoing PMV were prospectively recruited. All patients underwent a transthoracic echocardiogram before and within 48 h after the procedure. The primary outcome was a composite of cardiac death or need for mitral valve replacement (MVR). The prognostic value of the change in LASr post and pre PMV (ΔLASr) was assessed using a Cox proportional hazards model adjusted for known prognostic factors. Results In total, 163 patients were included. Overall, patients were aged 46 (IQR 37–54) years, 82.8% were female, median mitral valve area pre PMV was 0.97 (IQR 0.82–1.13) cm 2 and median ΔLASr was +3.2 (IQR −0.4 to +6.2). Over a median follow-up of 55 months (IQR 27–83), 46 patients had the composite outcome (28%), being 9 cardiac deaths and 37 MVR. In the final Cox model, ΔLASr was an independent predictor of the composite outcome [HR: 0.93 (0.87–0.99), p = 0.021]. Conclusion Improvement in LASr independently predicted clinical outcomes in patients with rheumatic MS undergoing PMV, with each unit increase in ΔLASr associated with a 7% risk reduction of death or MVR. Assessment of LASr may be a valuable tool for post-procedural risk stratification in this population."
OpenAlex,mitral regurgitation,Cardiac Computed Tomography and Echocardiography Integration for Chronic Secondary Mitral Regurgitation Quantification,Abdulameer Jasim Jawad Al-Gburi,10.18295/2075-0528.2990,2026-05-15,Sultan Qaboos University medical journal,"Objectives: This study aimed to determine whether it would be possible to reclassify the severity of secondary mitral regurgitation (MR) using an integrated mitral regurgitant volume (RVol) derived from computed tomography (CT) and echocardiography data. Methods: This cross-sectional study was conducted at Ibn al-Bitar Specialized Center for Cardiac Surgery, Baghdad, Iraq. Systolic CT data of patients with isolated secondary MR were evaluated from June 2023 to December 2025. The image with the highest regurgitant orifice area (ROA) and the smallest left ventricular volume was chosen from the CT systolic phase. To calculate the integrated RVol (iRVol), the velocity time integral obtained by echocardiography was multiplied by the mitral anatomic ROA (AROA) that was obtained using planimetry. Results: A total of 113 patients were included in this study. While the mean AROA and iRVol measured by CT were 0.143 ± 0.090 cm2 and 26.47 ± 10.61 mL, respectively, the mean effective ROA and RVol of MR measured by echocardiography were 0.175 ± 0.095 cm2 and 27.57 ± 8.82 mL, respectively. A total of 62% of patients were reclassified from severe to non-severe MR and 21% from non-severe to severe MR when iRVol grading was used instead of only echocardiography. Conclusion: By integrating the real cross-sectional mitral ROA measured by CT with Doppler mitral haemodynamics, a quantitative metric for MR severity (called mitral iRVol) was developed, leading to a clinically important reclassification of secondary MR grade."
OpenAlex,mitral regurgitation,Prevalence and Recovery of Arrhythmia‐Induced Cardiomyopathy in Patients With Newly Diagnosed Heart Failure Using a Wearable Defibrillator: A Real‐World Cohort Study,Joerg Yogarajah; Jana Dannebaum; Ahmed Halim; Jamschid Sedighi; M. Mensch; Malte Kuniss; Thomas Neumann; Andreas Rieth; Julia Treiber; S Sossalla; Andreas Hain,10.1111/jce.70366,2026-05-15,Journal of Cardiovascular Electrophysiology,"ABSTRACT Background Arrhythmia‐induced cardiomyopathy (AIC) is a potentially reversible cause of heart failure triggered by different sustained arrhythmias, but data on its real‐world prevalence, recognition, and outcomes are limited. Objective To assess frequency, predictors, and outcomes of AIC in patients with newly diagnosed left ventricular systolic dysfunction (LVSD) and concurrent arrhythmia undergoing early rhythm control with a wearable cardioverter‐defibrillator (WCD). Methods Among 780 WCD‐treated patients (2017–2023), those with newly diagnosed idiopathic LVSD (LVEF &lt; 35%) and persistent arrhythmia (atrial fibrillation/flutter or &gt; 20% ventricular ectopy) were included. Diagnostic workup comprised echocardiography, coronary angiography, and cardiac MRI. Effective rhythm control was achieved via cardioversion, antiarrhythmic drugs, and/or ablation. Follow‐up was up to 6 months. AIC was defined as LVEF improvement &gt; 15% with restored sinus rhythm or suppressed ventricular ectopy. Results Of 780 WCD patients, 142 (18.2%) had LVSD with arrhythmia; 74 idiopathic cases were analyzed. At a mean follow‐up of 138 days (4.5 months), 54 patients (73%) maintained sinus rhythm or suppressed ventricular ectopy after rhythm control, of whom 32 (59.3%) fulfilled AIC criteria. LVEF improved from 28% to 43% in AIC; 56.3% of AIC patients fully recovered (&gt; 50%). Non‐AIC patients had larger LV dimensions, lower heart rates, more mitral regurgitation, and a non‐significant trend toward more frequent late gadolinium enhancement ( p = 0.073). No parameter reliably predicted AIC; LVEF &lt; 25% predicted lack of full recovery ( p = 0.040). No appropriate WCD shocks occurred. ICD indication decreased from 100% to 17% post‐therapy in AIC and Non‐AIC patients (3.1% vs . 36.4%, p = 0.001). Conclusions AIC related to atrial fibrillation, flutter, or frequent ventricular ectopy is more prevalent and reversible than often recognized. Early rhythm control under WCD protection, supported by comprehensive diagnostics, allows identification of reversible LVSD and may help prevent unnecessary ICD implantation."
OpenAlex,mitral regurgitation,Predicting the <i>When</i> : Multimodal AI for Time-to-Recurrence Analysis After Atrial Fibrillation Ablation,Minglang Yin; Changxin Lai; Ritu Yadav; Jenna Milstein; Linh Thi My Tran; Calvin O'Donnell; Sarah Schumacher; Craig Cronin; Robert Weinstein; Carolyna Yamamoto; Zan Ahmad; Shiyi Chen; Arthur Lefebvre; Jooyoung Ryu; Audrey Lacy; Alana Thi Yee; Jiwoo Noh; Eugene Kholmovski; Mauro Maggioni; Hugh Calkins; David Spragg; Natalia Trayanova,10.64898/2026.05.12.26353055,2026-05-15,medRxiv,"Abstract Background Catheter ablation is the most effective rhythm control strategy for atrial fibrillation (AF); however, recurrence remains common. Current post-ablation management follows largely population-level protocols, constrained by the absence of tools that can anticipate not merely whether , but when , an individual patient will experience recurrence. The emergence of multimodal artificial intelligence (AI) presents a new opportunity to address this unmet clinical need. Objective To develop a predictive model for time-to-AF-recurrence post-ablation using pre-procedural bi-atrial imaging, clinical covariates, and procedural characteristics, within a novel multimodal AI and survival analysis framework. Methods We analyzed a retrospective cohort of 437 AF patients who underwent catheter ablation with follow-up censored at 36 months. MARTA-AF (Multimodal AI Recurrence and Time-to-event Analysis post-Ablation in AF) was trained on pre-procedural bi-atrial images, and covariates/procedural characteristics, and integrated into a survival model to generate time-varying recurrence probability estimates. Model interpretability was achieved by quantifying contribution of covariates/procedural characteristics to predicted survival probabilities. Results MARTA-AF successfully predicted time-varying recurrence risk up to three years post-ablation. Patients were effectively stratified into low– and high-risk groups, with statistically significant discrimination sustained over the follow-up period. The model demonstrated consistent performance across clinically relevant subgroups, including sex, age, and AF type. Incorporation of right atrial shape features improved time-to-AF-recurrence prediction. Interpretability analyses identified key recurrence predictors. Conclusions MARTA-AF delivers individualized, time-varying AF recurrence risk forecasts and enables stratification into clinically meaningful risk groups. This framework has the potential to transform post-ablation management into a proactive paradigm and to support informed clinical decision-making prior to ablation."
OpenAlex,valvular heart disease,A young woman with dramatic pulmonary hypertension and respiratory failure: a case report,Min Li; Yaru Zhang; Mingjie Liu; Chunyi Lv; Dezhi Li; Yunyan Wan; Yuanyuan Sun; Ling Zhu,10.3389/fmed.2026.1788480,2026-05-19,Frontiers in Medicine,"Acid α -glucosidase (GAA) is the sole lysosomal enzyme responsible for degrading glycogen into glucose monomers. Deficiency of GAA leads to progressive lysosomal glycogen accumulation and cellular dysfunction, resulting in Pompe disease (PD), an autosomal recessive disorder. This case report described a 41-year-old woman who presented with progressive dyspnea and decreased exercise tolerance. The preliminary examination in the outpatient clinic showed that the patient suffered from pulmonary hypertension (PH). After the patient was admitted to the hospital and further relevant auxiliary examinations were completed, and finally a diagnosis of late-onset Pompe disease (LOPD) was confirmed. Protein structure prediction suggested that the double mutation might disrupt the hydrogen bond network, hydrophobic core, and aromatic interactions of the GAA enzyme, potentially reducing the stability of the protein (ΔΔG = −2.55 kcal/mol). Although these computational insights provide a theoretical basis for the clinical phenotype, they require further validation. This is a rare case of PD complicated with PH in the absence of childhood symptoms, suggesting that specific missense mutations may contribute to late-onset and milder phenotypes. This case underscores that clinicians should strengthen clinical discrimination when diagnosing respiratory failure and PH. Understanding the characteristics of infantile-onset Pompe disease (IOPD)—relatively mild enzymatic activity impairment and late onset—helps in the clinical management of genetic metabolic."
OpenAlex,valvular heart disease,Consensus Recommendations from a Modified Delphi Study on Specific Point of Care Ultrasound Examinations’ Utility and Feasibility for North American Primary Care Physicians,Aditya Mohanty; Irene Ma; Brandon Fainstad; Rachel Johnson; Sudipta Mohanty,10.21203/rs.3.rs-9337621/v1,2026-05-19,Research Square,
OpenAlex,valvular heart disease,"Clinical value of the water injection, dilution, and drainage method for blind nasoenteric tube placement in patients receiving sequential enteral nutrition support after major thoracic surgery",Kunkun Cheng; Le Zhang,10.3389/fonc.2026.1838370,2026-05-19,Frontiers in Oncology,"Aim This study aimed to evaluate the clinical effectiveness of a blind nasoenteric tube placement technique based on water injection, dilution, and drainage in patients receiving sequential enteral nutrition support after major thoracic surgery. Methods Eighty patients who underwent major thoracic surgery were enrolled and equally assigned to an observation group and a control group. The control group received conventional blind nasoenteric tube placement using gas injection, whereas the observation group received the water injection, dilution, and drainage method. The evaluated outcomes included catheterization success rate, catheterization time, length of hospital stay, nutritional indicators, serum nutritional markers, inflammatory response markers, immune function markers, quality of life, and incidence of adverse events. Results Compared with the control group, the observation group showed significantly shorter catheterization time and hospital stay, as well as a significantly higher catheterization success rate (P &amp;lt; 0.05). After the intervention, both groups demonstrated improvements in body mass index (BMI), triceps skinfold thickness (TSF), mid-arm muscle circumference (MAMC), hemoglobin, serum albumin, transferrin levels, and quality of life scores. These improvements were more pronounced in the observation group than in the control group (P &amp;lt; 0.05). In addition, after the intervention, the observation group had significantly lower levels of inflammatory markers, including C-reactive protein (CRP), procalcitonin (PCT), and interleukin-6 (IL-6), and significantly higher levels of immune function markers, including CD3 + , CD4 + , and the CD4 + /CD8 + ratio, compared with the control group (P &amp;lt; 0.05). Moreover, the incidence of adverse reactions was significantly lower in the observation group (P &amp;lt; 0.05). Conclusion The blind nasoenteric tube placement protocol based on water injection, dilution, and drainage is associated with improved catheterization success and procedural efficiency in patients receiving sequential enteral nutrition support after major thoracic surgery. The observed improvements in nutritional status, inflammatory markers, immune function, and quality of life are likely indirect and should not be attributed to the catheterization technique itself. Given the presence of multiple co-interventions and the lack of intervention isolation, these findings should be interpreted as associative and hypothesis-generating rather than causal."
OpenAlex,valvular heart disease,Heart disease in survivors of childhood cancer: Data from the German Childhood Cancer Registry and statutory health insurance carriers (the VersKiK study),Hiltrud Merzenich; Pietro Trocchi; Claudia Bremensdorfer; Ekaterina Aleshchenko; Enno Swart; Christian Apfelbacher; Christian Lüpkes; Peter Ihle; J Küpper-Nybelen; Katja Baust; Gabriele Calaminus; Thorsten Langer; Dirk Horenkamp-Sonntag; Patrik Dröge; Thomas Ruhnke; Ursula Marshall; Melanie Klein; Claudia Spix; Cécile Ronckers,10.3238/arztebl.m2026.0038,2026-05-19,Deutsches Ärzteblatt international,"BACKGROUND: Cardiac and cardiovascular diseases are major causes of morbidity in the growing population of childhood cancer survivors, particularly as a result of treatment with anthracyclines and radiotherapy to the chest. METHODS: The VersKiK study is based on record linkage between the German Childhood Cancer Registry and 13 statutory health insurance carriers (69% coverage of the German statutorily insured population). Registry data with information on primary cancers in childhood or adolescence were linked to data from the participating health insurance carriers. Cardiac diseases were analyzed in 11 863 patients with cancer diagnosed between 1991 and 2011 who survived at least 5 years after their diagnosis (up to January 2017). The health insurance data covered the years 2017-2021. The childhood cancer survivors were matched to a comparison group of 35 589 insurees without childhood cancer by age, sex, region of residence within Germany, and duration of insurance. RESULTS: Cardiac diseases were identified in 6.4% of the 5-year survivors of childhood cancer and in 2.5% of the matched comparison group. Cardiomyopathy, valvular disease, and arrhythmia were the most common heart diseases in the survivors (1.9%, 2.7%, 1.5%). The largest difference from the comparison group was observed for cardiomyopathy (prevalence ratio = 14.0; 95% confidence interval: [10.9; 20.5]). CONCLUSION: Long-term survivors of childhood cancer in Germany are more likely to be diagnosed with cardiac disease than the general population of the same age. Systematic medical monitoring and individualized preventive measures for survivors are indicated. In the interpretation of these findings, it should be noted that the childhood cancer survivors underwent more intensive long-term medical follow-up than their counterparts in the comparison group."
