source,keyword,title,authors,doi,publication_date,journal,abstract
PubMed,valvular heart disease,Adaptive Autocorrelation Based Heart Rate Estimation from Single-Axis Seismocardiogram: A Comprehensive Benchmark Across Six Diverse Datasets.,Ajdar Ullah; Ismail Elnaggar; Sepehr Seifizarei; Olli Lahdenoja; Usman Azmat; Jussi Jaakkola; Samuli Jaakkola; Tuija Vasankari; Juhani Airaksinen; Tuomas Kiviniemi; Tero Koivisto; Pasi Liljeberg,10.1109/JBHI.2026.3665979,2026-02-18,IEEE journal of biomedical and health informatics,"We introduce AACFD (Adaptive Autocorrelation Function Detector), a lightweight, fully automatic pipeline for estimating window-averaged heart rate (HR) from a single-axis seismocardiogram (SCG) without ECG calibration or machine learning. AACFD combines two periodicity detectors-(i) a YIN-style difference-function analysis of an adaptive SCG envelope and (ii) a short-window autocorrelation branch-operating on 3 s segments. The two branches are fused by feature-aware weighting based on signal-quality indices and multi-scale features; and a Hampel filter plus temporal consistency checks remove outlier windows. The algorithm is efficient enough for real time implementation on commodity hardware. AACFD was validated on 535 subjects spanning six heterogeneous datasets (sampling rates 200 Hz-5 kHz): lab oratory mechanocardiograms (MCG), controlled-breathing SCG (CEBS), motion-rich multichannel SCG (MC-SCG), valvular heart-disease clinics (VHD), invasive right-heart catheterization (RHC), and smartphone recordingsfrom300 atrial-fibrillation/sinus-rhythm subjects. For each recording we analyzed non-overlapping windows of 10, 20, 30, and 60 s and compared the SCG-derived mean HR with ECG derived (or telemetry) reference values. After ECG- and SCG-based quality control and temporal refinement, the mean per-subject mean absolute error (MAE) on 30-s windows was 0.99 bpm in MCG, 0.72 bpm in CEBS, 4.38 bpm in VHD, 1.34 bpm in MC-SCG after removal of recordings with corrupted ECG, 3.58 bpm in RHC, and 7.67 bpm in the smartphone cohort. Across all datasets, more than 90% of non-overlapping 10-60 s windows passed ECG- and SCG based quality control, so the reported errors reflect nearly the full usable recording duration rather than a few selected clean segments. This cross-dataset benchmark indicates that a short window hybrid YIN and autocorrelation routine, guarded by simple robustness checks, attains sub-bpm accuracy on resting datasets and clinically acceptable accuracy on several pathological cohorts using only a single accelerom eter axis. Importantly, AACFD is deliberately designed and evaluated for reliable window-averaged HR estimation on 10-60 s time scales rather than instantaneous beat-to-beat HR; deriving robust heart-rate-variability indices from SCG remains an important direction for future work."
PubMed,valvular heart disease,AI-ECG for predicting regurgitant valve disease-addressing implementation challenges.,Arunashis Sau; Yixiu Liang; Fu Siong Ng,10.1093/eurheartj/ehaf854,2026-02-18,European heart journal,
PubMed,valvular heart disease,"A retrospective cohort and machine learning study on the efficacy, safety, and recurrence prediction of combined EI-VOM and linear ablation in persistent Non-valvular atrial fibrillation.",Ting Zhang; Yuling Dai; Wenzhai Cao,10.3389/fcvm.2026.1689942,2026,Frontiers in cardiovascular medicine,"Although circumferential pulmonary vein isolation (CPVI) is the standard treatment for persistent nonvalvular atrial fibrillation (PeNVAF), its efficacy remains limited. Combining CPVI with linear ablation and ethanol infusion into the vein of Marshall (EI-VOM) (CPVI + PLUS) may improve patient outcomes.
This single-center retrospective study included hospitalized patients with PeNVAF who underwent their first radiofrequency ablation at Zigong First People's Hospital from August 2022 to August 2024. After propensity score matching (PSM), 132 patients were assigned to each group: the CPVI + PLUS group (combined EI-VOM and linear ablation) and the CPVI-only group. Outcomes were assessed at 3 and 6 months, including AF recurrence, complications, and cardiac function. Quality of life was evaluated at 6 months using the Atrial Fibrillation Effect on Quality-of-Life Questionnaire (AFEQT). The primary endpoints were AF recurrence rate and arrhythmia-free survival at 6 months after ablation; secondary endpoints included changes in cardiac function parameters, quality-of-life scores, and complication rates. Kaplan-Meier analysis was used to compare arrhythmia-free survival between the two groups, and univariate and multivariate logistic regression analyses were performed to identify risk factors for AF recurrence. In addition, a stacking ensemble model was developed to enhance prediction of AF recurrence after ablation.
There were no significant differences in baseline demographics, comorbidities, laboratory, or echocardiographic parameters between the two groups. The CPVI + PLUS group had a longer procedure time than the CPVI group, but intraoperative complication rates were similar. At 6-month follow-up, the CPVI + PLUS group showed significantly better AFEQT, left ventricular ejection fraction (LVEF), left atrial diameter(LAD), and left ventricular end-diastolic diameter (LVEDD) compared to the CPVI group. Recurrence rates of AF were lower in the CPVI + PLUS group, and arrhythmia-free survival time was longer. Multivariate analysis identified coronary artery disease, heart failure, severe preoperative valvular regurgitation, intraoperative myocardial injury, longer AF course, and larger LAD as independent risk factors for recurrence. Additional ablation strategies and left atrial appendage occlusion were protective factors. The stacking ensemble model achieved high accuracy, precision, recall, F1 score, and ROC-AUC in both training and validation cohorts. Feature importance analysis consistently identified AF course, age, body mass index, B-type natriuretic peptide, LVEF, platelet count, and uric acid as core predictors of recurrence risk.
CPVI + PLUS significantly improved arrhythmia-free survival, cardiac function, and quality of life in patients with PeNVAF without increasing procedural risk. Multivariate and machine learning analyses confirmed that additional ablation and left atrial appendage occlusion were protective against recurrence, while heart failure, valvular regurgitation, and longer AF course increased risk. The stacking model showed excellent predictive performance, and key features identified may support precise risk stratification and individualized therapy."
PubMed,deep learning,Deep Learning-Based Structural Brain Age Estimation in Bipolar Disorder and Schizophrenia: A Single-Site Pilot Study.,Akila Weerasekera; Shuqin Zhou; Chao Wang; Zhilang Qiu; Abigail Stein; Margaux Ameer; Virginie-Anne Chouinard; Ann Shinn; Kathryn E Lewandowski; Michael Murphy; Mark Halko; Halide Bilge Türközer; Dost Öngür; Fei Du,10.1002/hbm.70479,2026-02-15,Human brain mapping,"Accelerated brain aging has been implicated in severe mental illnesses, particularly schizophrenia (SZ) and bipolar disorder (BD). Brain-PAD, derived from structural MRI, offers a promising biomarker of neurobiological aging, but its developmental course, within-group variability, and regional drivers remain incompletely understood. A three-dimensional convolutional neural network (3D-CNN) was trained exclusively on healthy controls (HC; n = 155) and then applied to independent BD (n = 122) and SZ (n = 161) groups. Brain-PAD was computed as predicted brain age minus chronological age. Age-by-group interactions, within-group dispersion, and sensitivity analyses (e.g., piecewise regression, inverse probability weighting) were conducted. Gradient-weighted Class Activation Mapping (Grad-CAM) was used to identify regional contributions to brain age predictions. The 3D-CNN achieved high accuracy in HC (MAE = 3.05 years, r = 0.96), with reduced accuracy in BD (MAE = 8.86, r = 0.51) and SZ (MAE = 9.01, r = 0.48). Mean Brain-PAD was significantly elevated in BD (+4.2 ± 10.2 years) and SZ (+6.7 ± 8.7 years) relative to HC (+0.7 ± 3.5 years). Age-by-group analyses revealed that BD and SZ exhibited elevated Brain-PAD at younger ages, converging toward HC trajectories by midlife, followed by renewed divergence beyond age 40. This pattern was supported by piecewise and spline models showing steeper negative slopes in BD and SZ compared with HC. Variance and quantile regression indicated greater heterogeneity in BD and SZ across the Brain-PAD distribution. Grad-CAM highlighted temporal and frontal regions as central contributors across all groups; in SZ, Brain-PAD correlated positively with whole-brain (r = 0.23, p = 0.004), frontal (r = 0.21, p = 0.009), and temporal (r = 0.20, p = 0.012) activations, whereas BD showed weaker and more diffuse associations. SZ and BD exhibit elevated Brain-PAD early in adulthood with greater heterogeneity than healthy controls. Frontotemporal regions contribute prominently to brain-age predictions, reflecting model sensitivity to age-informative structure. These findings support Brain-PAD as a group-level marker of apparent brain aging and motivate longitudinal study of midlife divergence."
PubMed,deep learning,Hierarchical deep learning pipeline for robust cervical parameter measurement in radiographs with C7 obscuration.,Dong-Ho Kang; Se-Jun Park; Jin-Sung Park; Hyeonsu Park; Chong-Suh Lee,10.1038/s41746-026-02455-2,2026-02-19,NPJ digital medicine,"We developed and externally validated a hierarchical deep learning pipeline that automates cervical sagittal measurements, explicitly addressing C7 obscuration on lateral radiographs. The model combines a global keypoint detector with C2/C7 specialists localized via a multilayer perceptron to refine landmarks on high‑resolution patches. Trained on 5604 images and tested internally and on a challenging external cohort enriched for C7 obscuration (82%), it achieved excellent agreement with ground truth. Externally, intraclass correlation coefficients (ICCs) were 0.97 for lordosis (mean absolute error [MAE] 2.6°), >0.99 for C2 slope (MAE 0.8°), and 0.93 for C7 slope (MAE 2.3°), with minimal bias and narrower limits of agreement than a single‑stage baseline. The model showed near-perfect repeatability (ICC > 0.99) and higher artificial intelligence-expert agreement (ICC 0.81-0.84) for C7 slope than inter-expert reliability (ICC 0.67). In failure cases, the pipeline corrected large global model errors (e.g., 10.22°- 0.22°). This robust, coarse‑to‑fine approach advances reliable, generalizable cervical alignment assessment in real‑world conditions."
PubMed,deep learning,AI prediction models based on time-lapse imaging for good embryos with implantation potential and euploidy.,Ryo Maekawa; Taro Kiritani; Takeshi Abe; Masahiko Nakatsui; Yoshiyuki Asai; Norihiro Sugino,10.1038/s41598-026-40917-5,2026-02-19,Scientific reports,
PubMed,deep learning,WISeRKNet: wide slice residual Kronecker network for lung cancer detection based on CT images.,Amgothu Shanthi; S Satheesh Kumar; Srinivas Koppu,10.1038/s41598-026-39793-w,2026-02-19,Scientific reports,
PubMed,deep learning,Research on enhancing short-term wind power forecasting through feature fusion in a hybrid deep learning framework.,Xianlong Su; Jinming Gao; Kai Han; Hankil Kim; Hoekyung Jung,10.1038/s41598-026-40689-y,2026-02-20,Scientific reports,"Wind power generation is a vital component of renewable energy, and achieving high-accuracy power forecasting is crucial for grid stability and sustainable operation. To address the highly nonlinear and complex temporal characteristics of wind power, this paper investigates a hybrid deep learning model, TCN-SENet-BiGRU-Global Attention. The model integrates a Temporal Convolutional Network (TCN), Squeeze-and-Excitation Network (SENet), Bidirectional Gated Recurrent Unit (BiGRU), and a Global Attention mechanism to construct a multi-level feature extraction architecture. Specifically, TCN efficiently captures both long-term and short-term temporal dependencies, SENet enhances the impact of key variables by adaptively adjusting channel-wise feature weights, BiGRU models bidirectional temporal context, and the Global Attention mechanism focuses on informative time steps to better track dynamic changes in wind power. Experiments on multiple real-world datasets from a wind farm demonstrate that the proposed TCN-SENet-BiGRU-Global Attention model achieves consistently lower prediction errors and more stable performance than several representative baseline models, indicating its good robustness and promising application potential for complex short-term wind power forecasting tasks."
PubMed,deep learning,An open-source deep learning-based toolbox for automated auditory brainstem response analyses (ABRA).,Abhijeeth Erra; Cayla M Miller; Jeffrey Chen; Elena Chrysostomou; Shannon Barret; Yasmin M Kassim; Rick A Friedman; Amanda Lauer; Federico Ceriani; Walter Marcotti; Cody Carroll; Uri Manor,10.1038/s41598-026-38045-1,2026-02-19,Scientific reports,
PubMed,deep learning,Robust and interpretable unit level causal inference in neural networks for pediatric myopia.,Zihui Jin; Mengtian Kang; Wuyan Zhao; Wenjin Gui; He Li; Yongfang Tu; Yongjun Huo; Canqing Yu; Weihua Song; Ningli Wang; Xu Yang; Shi-Ming Li,10.1038/s41746-026-02442-7,2026-02-19,NPJ digital medicine,"Understanding causal mechanisms in deep learning is essential for clinical adoption, where interpretability and reliability are critical. Most existing AI systems act as black boxes, limiting transparency in medicine. We propose a causal inference framework integrated into neural networks to assess the influence of individual features on predictions. Using a prospective pediatric ophthalmology cohort of over 3000 children with longitudinal follow-up, our method estimates direct and indirect causal effects through intervention. Applied to myopia progression in children, our approach not only achieved good performance but also identified clinically plausible causal pathways. Refutation experiments with multiple falsification strategies confirm the robustness and reliability of causal effects. The approach is model-agnostic and suitable for digital health interventions requiring explainability. By incorporating unit-level causal reasoning into deep learning, this work advances transparent and reliable AI systems aligned with the goals of precision medicine and equitable healthcare."
PubMed,deep learning,TrustNet: a lightweight network with integrated uncertainty quantification and quantitative explainable AI for ischemic stroke detection in CT images.,Mahesh Anil Inamdar; Anjan Gudigar; U Raghavendra; Aryaman Kaprekar; Massimo Salvi; Silvia Seoni; Girish R Menon; Filippo Molinari; U R Acharya,10.1038/s41598-026-37169-8,2026-02-19,Scientific reports,
PubMed,deep learning,Deep learning models identify brain changes during the progression of Alzheimer's disease.,Jinhui Sun; Jing-Dong J Han; Weiyang Chen,10.1038/s41540-026-00666-7,2026-02-19,NPJ systems biology and applications,"Alzheimer's disease (AD) is an irreversible neurodegenerative disorder whose progression is closely associated with time. However, most diagnostic models are based on single time-point data, overlooking longitudinal disease characteristics. Structural magnetic resonance imaging (sMRI) has been widely utilized in the study of AD. To address the need for multi-time series analysis in longitudinal AD research and the integration of features from different brain tissues, we propose a Multi-Branch Fusion Channel Attention Network (MBFCA-Net) for disease diagnosis. This network leverages the temporal correlations across longitudinal scans for effective AD detection. We further conduct retrospective interpretability analysis to quantify the contributions of brain regions across disease stages. This enables a detailed investigation of dynamic changes in brain regions associated with AD and normal aging. The results indicate that the importance of regions such as the amygdala, parahippocampal gyrus, and temporal lobe undergoes dynamic changes throughout the progression of AD. Furthermore, AD-related voxel clusters exhibit a developmental trend, shifting from the hippocampus to the temporal lobe and transitioning from a dispersed to a more aggregated distribution. Our study provides novel insights into the longitudinal patterns of AD-related changes, offering valuable contributions to early diagnosis and pathological understanding of the disease."
PubMed,deep learning,FATE-MAP predicts teratogenicity and human gastrulation failure modes by integrating deep learning and mechanistic modeling.,Joseph Rufo; Chongxu Qiu; Dasol Han; Naomi Baxter; Gabrielle Daley; Jasmine Dhillon; Felix Wong; James J Collins; Maxwell Z Wilson,10.1038/s41467-026-69596-6,2026-02-19,Nature communications,"Gastrulation, a critical developmental stage involving germ layer specification and axes formation, is a major point of failure in human development, contributing to pregnancy loss and congenital malformations. However, due to ethical constraints and anatomical differences in animal models, the failure modes underlying human gastrulation remain poorly understood. To elucidate these failure modes, we introduce FATE-MAP (Failure Analysis and Trajectory Evaluation via Mechanistic-AI Prediction), an integrated platform that combines high-throughput perturbations of human 2D gastruloids with quantitative phenotypic mapping, predictive deep learning, and mechanistic morphogen modeling. Analyzing over 2000 drug-treated human 2D gastruloids, we mapped a phenotypic morphospace that separates canonical patterning, in which primitive-streak fates are correctly specified and radially organized, from failure modes, defined as departures from this organization and marked by a loss of a required fate and/or radial symmetry. To predict and interpret patterning outcomes, FATE-MAP combines a transformer linking chemical structure to phenotype with PDE simulations of morphogen transport and cell fate specification, and projects both outputs onto the experimentally defined morphospace. Applying this framework, we flagged two clinical molecules as potential teratogens and identified two parameters, cell density and SOX2 stability, that form orthogonal morphospace axes along which canonically patterned gastruloids systematically vary. FATE-MAP thus provides a roadmap for decoding human developmental trajectories and accelerating safe therapeutic discovery."
PubMed,deep learning,The consensus molecular subtypes of esophageal squamous cell carcinoma.,Heyang Cui; Zhongxu Zhu; Enwei Xu; Lin Qi; Yikun Cheng; Yinghan Zhang; Ling Zhang; Matthew Yibo Cheng; Bin Yang; Ruifang Sun; Xiaofei Zhuang; Yanfeng Xi; Ting Yan; Caixia Cheng; Ning Ding; Huijuan Liu; Lu Wang; Min Guo; Dinghe Guo; Haoyu Zhang; Meilan Peng; Zhekun An; Yongjia Weng; Fang Wang; Meng Liu; Ruixin Xiong; Weihua Yin; Bin Song; Weimin Zhang; Xiaolong Cheng; Zhihua Liu; Qimin Zhan; Xin Wang; Yongping Cui,10.1038/s41392-026-02577-9,2026-02-19,Signal transduction and targeted therapy,"Esophageal squamous cell carcinoma (ESCC) lacks a standardized classification system, resulting in inconsistent clinical management and a suboptimal prognosis. This study addresses the urgent need for a robust consensus taxonomy to facilitate precision treatment for ESCC. We employed a network-based approach to elucidate the interconnections among eight existing classification systems, leading to the identification of four distinct consensus molecular subtypes (ECMSs): ECMS1-MET (metabolic), characterized by dysregulated metabolic pathways and NFE2L2 activation; ECMS2-CLS (classical), featuring upregulated cell cycle and canonical signaling pathways; ECMS3-IM (immunomodulatory), marked by robust immune activation and elevated PD-1 expression; and ECMS4-MES (mesenchymal), associated with mesenchymal transition, stromal activation, and VEGF signaling. To improve clinical applicability, we developed an image-based framework (imECMS) that utilizes spatial organization features (SOFs) quantified from autodelineated hematoxylin‒eosin (H&E)-stained whole-slide images through deep learning algorithms. The imECMS classifier assigns patients to one of the four ECMS subtypes, which correlate with distinct molecular characteristics, prognoses, and responses to neoadjuvant chemotherapy and immunotherapy. Validation across multiple independent cohorts confirmed that the imECMS accurately classifies ESCC subtypes from histopathological images, offering a robust and effective tool for precision medicine. In summary, the ECMS/imECMS subtyping systems we developed are the most robust frameworks for ESCC to date, providing clear biological insights and a foundation for clinical stratification and targeted therapies."
PubMed,deep learning,Artificial Intelligence Could Predict Chest Tube Drainage Necessity for Spontaneous Pneumothorax.,Dongsub Noh; Chanwoo Kim; Gucheol Jung; Hongjun Yoon; Jin-Young Yoo; Jae-Hyeok Lee; Dohun Kim,10.1007/s10278-025-01834-7,2026-02-19,Journal of imaging informatics in medicine,"Artificial intelligence (AI) is increasingly utilized in the medical field, primarily for diagnostic purposes. Although AI has demonstrated efficacy in pneumothorax detection using chest X-rays (CXR), it has yet to be applied for decision-making regarding subsequent treatment. This study aims to develop and evaluate an AI-based system capable of predicting the necessity of chest tube drainage (CTD) in spontaneous pneumothorax patients based on CXR and clinical data. A two-stage AI model was developed: (1) segmentation and quantification of pneumothorax size from CXR using deep learning and (2) prediction of CTD necessity using machine learning models integrating pneumothorax size and patient clinical parameters. The AI model was trained using CXR images and clinical information from 163 pneumothorax patients. Model performance was assessed using area under the receiver operating characteristic curve (AUROC), sensitivity, specificity, and inference time. The AI model demonstrated high segmentation accuracy for pneumothorax (DSC, 76.95%; MAE, 5.06%). In predicting CTD necessity, the AUROC for the AI model incorporating pneumothorax ratio and clinical data was 89.68 (95% CI, 78.57-98.02), outperforming models without pneumothorax ratio (AUROC, 84.13) or with pneumothorax ratio alone (AUROC, 71.03). The sensitivity and specificity of the optimized AI model were 80.95% and 100%, respectively. The mean inference time was 0.75 ± 0.06 s, demonstrating potential for real-time clinical application. This study presents an AI-based clinical decision support system capable of accurately predicting the need for CTD in spontaneous pneumothorax patients. By integrating AI-driven pneumothorax quantification and clinical parameters, the model improves decision-making efficiency and accuracy. Future studies with larger datasets and prospective validation are warranted to further refine and validate this approach."
PubMed,deep learning,BreasTransNeXt: An Enhanced Multi-Module Vision Transformer For Early Breast Cancer Diagnosis.,Hakan Acikgoz; Alper Aytekin; Sevgi Gezici,10.1007/s10278-026-01863-w,2026-02-19,Journal of imaging informatics in medicine,"Breast cancer (BC) represents the most common and one of the most lethal malignancies among women globally, ranking second only to lung cancer in terms of mortality. Early diagnosis is critically important, as treatment outcomes are significantly improved when BC is identified at an initial stage. Although considerable research has been conducted on BC classification utilizing deep learning techniques, there remains a deficiency of comprehensive models that effectively integrate robust feature extraction with balanced learning methodologies. To address this limitation, we introduce BreasTransNeXt, a new hybrid deep learning framework that synergizes the convolutional inductive bias inherent in ConvFormer with the efficient global attention mechanisms of a hybrid transformer architecture, thereby facilitating robust multi-scale feature representation. Furthermore, to mitigate class imbalance and enhance model generalization, the BC dataset is augmented through the application of a Wasserstein Generative Adversarial Network with gradient penalty, which generates high-fidelity synthetic images for both malignant and healthy classes. Additionally, BreasTransNeXt incorporates a hybrid attention mechanism comprising of local, channel, and global branches, which are integrated via adaptive gating; this design enhances feature representation by capturing fine-grained lesion characteristics, inter-feature correlations, and long-range contextual dependencies. The proposed model is rigorously evaluated against traditional convolutional neural network approaches and state-of-the-art vision transformer architectures. Experimental findings demonstrate that BreasTransNeXt consistently outperforms these methods, achieving an accuracy of 0.9710, recall of 0.9808, precision of 0.9808, and F1-score of 0.9808, thereby underscoring its potential as a reliable tool for early BC detection."
