source,keyword,title,authors,doi,publication_date,journal,abstract
OpenAlex,mitral regurgitation,Contemporary approach to valve-sparing surgery of the aortic root: the David procedure,K. Mavrodieva; A. Keltchev,10.3897/bgcardio.32.e189359,2026-05-05,Bulgarian Cardiology,"Aneurysmal dilatation of the aortic root and ascending aorta is frequently associated with functional aortic regurgitation due to distortion of aortic root geometry, including dilatation of the annulus and the sinotubular junction, in the presence of morphologically preserved valve cusps. The classic surgical approach &amp;ndash; composite aortic root replacement (Bentall-De Bono) &amp;ndash; provides radical correction but is limited by the drawbacks of valve substitution, namely lifelong anticoagulation with mechanical prostheses or limited structural durability with the potential need for reintervention in bioprosthetic valves. Over recent decades, valve-sparing operations have become a preferred approach in appropriately selected patients. The David reimplantation technique provides annular stabilisation and control of dilatation of both the aortic root and the sinotubular junction while preserving the native aortic valve. Use of a Valsalva graft facilitates a more physiological root geometry, potentially optimising valvulo-aortic hemodynamics and cusp kinematics. The procedure also allows concomitant&amp;nbsp;cusp repair when necessary to achieve optimal coaptation. The available literature consistently demonstrates low early operative mortality and excellent long-term durability of valve preservation in experienced centers, with high freedom from reoperation and a low incidence of clinically signi&amp;#64257; cant aortic regurgitation at follow-up. European recommendations support valve-sparing strategies in younger patients with a dilated aortic root and preserved cusps when performed in specialized centers. Our experience at Acibadem City Clinic Hospital Vitosha since implementation of the technique in 2018 is consistent with published data, with good early hemodynamic results and favourable clinical evolution during follow-up. David valve-sparing aortic root replacement using a Valsalva graft according to the De Paulis method represents an anatomically grounded and highly effective strategy that combines radical correction of root pathology with preservation of the native valve and avoidance of prosthesis-related complications."
OpenAlex,mitral regurgitation,Transcatheter mitral valve replacement,Tobias Friedrich Ruf; Theresa Ann-Marie Gößler; Philipp Lurz,10.1007/s00059-026-05377-7,2026-05-05,Herz,
OpenAlex,mitral regurgitation,"Aortic disease. Aortic arch debranching, wrapping aorta ascendens and endovascular implantation of stent-graft",I. Todorov; A. Doichev; D. Mihaylov; D. Nikolov,10.3897/bgcardio.32.e187136,2026-05-05,Bulgarian Cardiology,"We present a clinical case of a 77-year-old male with an aortic aneurysm extending from aorta ascendens to the beginning of the descending aorta. Signi&amp;#64257; cant patient comorbidities included prostate carcinoma, ischemic heart disease with single-vessel coronary artery disease (status post PCI with DES &amp;times;1 of the LCX in 2019), chronic heart failure NYHA class III, peripheral arterial disease stage IIA, anemic syndrome, left-sided nephrolithiasis, hemorrhoidal disease, colonic diverticulosis, and oesophageal haemangiomas. After multidisciplinary discussion, the patient underwent minimally invasive aortic arch debranching and wrapping of the ascending aorta without the need for extracorporeal circulation (ECC), followed by endovascular implantation of an aortic arch stent-graft and PTA of the right common and external iliac arteries with implantation of a 7/150 mm balloon. The postoperative period was uneventful. The patient was discharged in good general condition with recommendations for medical therapy and cardiology follow-up."
OpenAlex,mitral regurgitation,Paediatric Cardiac Disease Patterns at University of Medical Sciences Teaching Hospital Ondo: A Four-Year Retrospective Review,Akinkunmi B.F; Odunlade C.O; Kumolalo F.O; Afe D; Osundare Y.J; Adegbola J.O; Akinduro-Ajiga E; Akinkunmi O.E,10.12691/ajcmr-14-1-4,2026-05-05,American journal of clinical medicine research,"Introduction Recent studies suggest that cardiovascular diseases contribute substantially to childhood morbidity in Sub-Saharan Africa where paediatric cardiac services are scarce. We aim to provide empirical data on disease types, frequencies, demographic distribution, to influence health policy formulation, better resource allocation and targeted interventions. Materials and Methods A four-year retrospective review of records of patients aged 0 -15years from August 2020 to July 2024, with cardiac diseases at the University of Medical Sciences Teaching Hospital (UNIMEDTH), Ondo, Nigeria. Age at presentation, sex, presenting complaints, anthropometric measurements, echocardiographic findings, treatment received, and the outcome of care were extracted and analyzed using the Statistical Package for the Social Sciences (SPSS) version 21.0 Results A total of 45 patients aged 0 to 15 years were included in this study. Their mean age was 65.4 months (SD ± 49.1) with a M: F of 1.2:1. (25: 20). Congenital heart diseases (CHDs) accounted for 88.9% (n = 40) of all cases while acquired heart diseases constituted 11.1% (n = 5). Within the congenital group, acyanotic and cyanotic lesions were 75.0% (n = 30) and 25.0% (n = 10) respectively. The most frequently echocardiographic diagnosed lesions were ventricular septal defect (VSD), 28.9% (n=13), Patent ductus arteriosus (PDA), 20.0% (n=9), and atrioventricular canal defect (AVCD) 7 (15.6%), Three patients (6.7%) had open heart surgery. Twenty-seven of the patients (60.0%) were alive and followed-up till the end of the study period, 13 patients (28.9%) were lost to follow-up and mortality was recorded in 11.1% (n=5). Conclusion This study demonstrates a high burden of paediatric cardiac disease in a semi-urban Nigerian tertiary hospital, with CHDs being the most prevalent and largely untreated surgically. The findings call for urgent improvements in screening, diagnostics, referral pathways, and surgical access."
OpenAlex,mitral regurgitation,Myectomy with secondary chordal resection in hypertrophic obstructive cardiomyopathy: the mid-term outcomes,Zhuheng Wu; Zedong He; Lin Xie; Songbo Zhang; Hong Qian; Yajiao Li; Yanlin Yang; Changping Gan; Ke Lin,10.1186/s13019-026-04205-7,2026-05-05,Journal of Cardiothoracic Surgery,"BACKGROUND: It is not clear whether septal myectomy with secondary chordal resection (SM-SCR) can achieve similar postoperative outcomes among hypertrophic obstructive cardiomyopathy (HOCM) patients exhibiting different severity of septal hypertrophy. METHODS: This was a single-center retrospective cohort study with a nested case-control study. HOCM patients received SM-SCR between 2014 and 2023 were retrospectively included and were grouped based on their septal thickness. The main outcome was the relief of the left ventricular outflow tract (LVOT) obstruction. Besides, predictors for recurrent mitral regurgitation (MR) were also explored. RESULTS: A total of 88 patients were included, with 63 in the significant hypertrophy group (SH group) and 25 in the mild hypertrophy group (MH group). The overall median follow-up time was 54.0 (33.0-79.0) months. Before adjusting the covariates, The LVOT gradients at the last follow-up were similar between groups [SH group vs. MH group: 10.0 (6.0-14.0) mmHg vs. 8.0 (6.0-11.5) mmHg, P = 0.556], while the interventricular septum (IVS) was thicker for the SH group [15.0 (12.0-17.0) mm vs. 13.0 (11.0-14.0) mm, P = 0.016]. In the fully adjusted model, both the LVOT gradients and the IVS thickness were comparable (P = 0.606 and 0.520 respectively). The risk of recurrent MR was similar between groups (7.9% vs. 8.0%, log-rank P = 0.879), while no predictors for recurrent MR were identified. CONCLUSION: According to our single-center data, the mid-term outcomes after SM-SCR were comparable for HOCM patients with different severity of septal hypertrophy. However, further investigations with larger sample sizes and longer follow-up durations are needed. TRIAL REGISTRATION: The study was approved by the Institutional Review Board [2023(2408)], and patients' consents were waived due to the retrospective nature of the study."
OpenAlex,valvular heart disease,Heart Disease in Survivors of Childhood Cancer: Data From the German Childhood Cancer Registry and Statutory Health Insurance Carriers (the VersKiK Study).,Hiltrud Merzenich; Pietro Trocchi; Claudia Bremensdorfer; Ekaterina Aleshchenko; Enno Swart; Christian Apfelbacher; Christian Lüpkes; Peter Ihle; J Küpper-Nybelen; Katja Baust; Gabriele Calaminus; Thorsten Langer; Dirk Horenkamp-Sonntag; Patrik Dröge; Thomas Ruhnke; Ursula Marshall; Melanie Klein; Claudia Spix; Cécile Ronckers,10.3238/arztebl.m2026.0038,2026-05-29,PubMed,"BACKGROUND: Cardiac and cardiovascular diseases are major causes of morbidity in the growing population of childhood cancer survivors, particularly as a result of treatment with anthracyclines and radiotherapy to the chest. METHODS: The VersKiK study is based on record linkage between the German Childhood Cancer Registry and 13 statutory health insurance carriers (69% coverage of the German statutorily insured population). Registry data with information on primary cancers in childhood or adolescence were linked to data from the participating health insurance carriers. Cardiac diseases were analyzed in 11 863 patients with cancer diagnosed between 1991 and 2011 who survived at least 5 years after their diagnosis (up to January 2017). The health insurance data covered the years 2017-2021. The childhood cancer survivors were matched to a comparison group of 35 589 insurees without childhood cancer by age, sex, region of residence within Germany, and duration of insurance. RESULTS: Cardiac diseases were identified in 6.4% of the 5-year survivors of childhood cancer and in 2.5% of the matched comparison group. Cardiomyopathy, valvular disease, and arrhythmia were the most common heart diseases in the survivors (1.9%, 2.7%, 1.5%). The largest difference from the comparison group was observed for cardiomyopathy (prevalence ratio = 14.0; 95% confidence interval: [10.9; 20.5]). CONCLUSION: Long-term survivors of childhood cancer in Germany are more likely to be diagnosed with cardiac disease than the general population of the same age. Systematic medical monitoring and individualized preventive measures for survivors are indicated. In the interpretation of these findings, it should be noted that the childhood cancer survivors underwent more intensive long-term medical follow-up than their counterparts in the comparison group."
OpenAlex,valvular heart disease,Implementing a national acute rheumatic fever case-finding program and registry in Nepal: protocol for a multi-site implementation study,Sheila Klassen; Sandeepa Karki; Alma Adler; Prakash Raj Regmi; Kunjang Sherpa; Ganesh Shetty; Prashant Khadka; Urmila Shakya; Samir Shakya; Neil Gupta; Shela Sridhar; Gene Bukhman; R LEVINE; Bhagawan Koirala,10.3389/fcvm.2026.1823957,2026-05-07,Frontiers in Cardiovascular Medicine,"Background Rheumatic heart disease (RHD) is a leading cause of preventable cardiovascular morbidity and mortality among children and young adults in low- and lower-middle-income countries. Acute rheumatic fever (ARF), the immunologic precursor to RHD, is frequently missed in endemic settings, resulting in delayed treatment and progressive valvular disease. Nepal bears a high burden of RHD but lacks a coordinated system for early ARF identification, standardized echocardiographic evaluation, and longitudinal follow-up. Methods This protocol describes implementation of a standardized ARF case-finding program and integrated clinical and echocardiographic registry across 11 district and referral hospitals in Nepal. The program is delivered through the PRIMA Network in partnership with the Kathmandu Institute of Child Health (KIOCH), embedded within existing PEN-Plus chronic disease infrastructure at district-level facilities. Case-finding is integrated into routine care using the 2015 modified Jones criteria, standardized echocardiography protocols, centralized training, and REDCap registry-based follow-up. Implementation outcomes are evaluated using Proctor's taxonomy, focusing on acceptability, feasibility, and adoption of the program within routine care, rather than on clinical detection rates or RHD outcomes. Contextual determinants are examined using the Consolidated Framework for Implementation Research (CFIR). Care-process indicators including diagnostic patterns and follow-up completion are summarized descriptively over the first 12 months of program delivery. Discussion This protocol describes a pragmatic approach to embedding ARF case-finding within routine district-level care in Nepal. Findings will inform future evaluations of program performance, scale-up, and sustainability, and may serve as a replicable model for strengthening ARF detection in other RHD-endemic low-resource settings."
OpenAlex,valvular heart disease,Epidural anesthesia in patients with chronic coronary syndrome undergoing non-cardiac surgery,Miranti I. Kumesan; Diana Ch. Lalenoh; Wahyuddin Suleman,10.54957/ijhs.v6i2.2135,2026-05-07,Indonesian Journal of Health Science,"Patients with cardiovascular disease, particularly Chronic Coronary Syndrome (CCS), face high perioperative risks, including myocardial ischemia, arrhythmias, and hemodynamic instability. Appropriate anesthetic management aims to maintain the balance between oxygen supply and demand as well as hemodynamic stability, including through the use of regional anesthesia techniques as a safer alternative. We report the case of a 71-year-old male patient, ASA III, with CCS accompanied by valvular heart disease in the form of mild aortic regurgitation and moderate pulmonary regurgitation, who underwent Percutaneous Nephrolithotomy (PCNL). Anesthesia management utilized a lumbar epidural technique with catheter placement at the L1–L2 level, 6 cm intradural, and administration of 12 ml of 0.75% ropivacaine. The intended block coverage included the T10–L2 viscerotome and the T8–S2 dermatome. Hemodynamic and pain assessments were performed periodically during the intraoperative period and in the post-anesthesia care unit (PACU). The block depth reached the target within 20 minutes, allowing the surgery to begin immediately. During the 2-hour and 25-minute procedure, the patient’s hemodynamics remained stable without complaints of chest pain or shortness of breath, and no additional anesthetic agents were required. In the PACU, the patient’s sensory and motor functions returned to normal with a NRS pain score of 1. The epidural regional anesthesia technique in a patient with CCS undergoing non-cardiac surgery was shown to facilitate hemodynamic stability intra- and postoperative pain control, thereby potentially significantly minimizing the risk of perioperative ischemia."
OpenAlex,valvular heart disease,Development of a core outcome set for traditional Chinese medicine for atrial fibrillation,Chenyao Zhang; Zhogping Hao; Danni Li; Jie Wan; H W Wang; Chunxiang Liu; Lujia Cao; Menglong Shi; 庞稳泰; Xinyao Jin; Bairu Cheng; Qi Jia; Junhua Zhang; Bo Pang,10.3389/fphar.2026.1731405,2026-05-07,Frontiers in Pharmacology,"Objectives The inconsistent reporting of clinical trial results in patients with atrial fibrillation (AF) hinders the comparison of findings. Developing a core outcome set (COS) in studies evaluating traditional Chinese medicine (TCM) for AF and recommending measurement instruments and time points may help standardize the selection, reporting, and measurement of outcomes in clinical trials. Methods Literature and registered trials were retrieved to systematically collect outcomes. Physician questionnaire surveys and semi-structured patient interviews were conducted to collect outcomes of clinical interest. These outcomes were standardized and compiled into a preliminary outcome pool. Consensus criteria were established in advance. Through two rounds of Delphi surveys and consensus meetings, perspectives from multiple stakeholder groups were gathered to establish a COS for TCM for AF (COS-TCM-AF). Results A total of 87 individuals participated in the Delphi survey, with 70 completing both rounds. During the consensus meeting, 19 stakeholders determined that seven core outcomes should be involved in the COS-TCM-AF, including AF episode frequency, AF episode duration, AF burden, TCM symptom-palpitation, thromboembolic (TE) event rate, AF recurrence rate, and incidence of acute heart failure (HF)/acute exacerbation of chronic HF. Among these, AF episode frequency and AF episode duration applied only to patients with paroxysmal AF. Conclusion This COS comprehensively addresses multiple aspects including AF episodes, patient symptoms, complication risks and long-term prognosis. It also recommends measurement instruments and time points. Its implementation will contribute to facilitating the comparison of similar studies and provide a reference for selecting and measuring outcomes."
OpenAlex,valvular heart disease,Characterisation and Enhanced Residual Risk Stratification of Long-Term Post-Discharge Ischaemic Events After Atrial Fibrillation Catheter Ablation,Hironori Ishiguchi; Shintaro Hashimoto; Yasuhiro Yoshiga; Masakazu Fukuda; Goki Nakashima; Takuya Omuro; Noriko Fukue; Shigeki Kobayashi; Motoaki Sano,10.1055/a-2862-0521,2026-05-06,TH Open,"Abstract Although the incidence of thromboembolic events after catheter ablation for atrial fibrillation (AF) is low, the residual risk persists. The nature of these long-term events remains poorly characterized, and optimal risk stratification is challenging. We therefore aimed to characterize the postablation ischemic events and develop an enhanced risk stratification model. This single-center historical cohort study enrolled 1,163 patients who underwent initial AF ablation. The primary endpoint was a composite of postdischarge ischemic events (ischemic stroke, transient ischemic attack, and systemic arterial thromboembolism [SE]). The predictability of clinically available risk scores and individual parameters, including left atrial volume index (LAVI), was assessed. The new model combining the strongest predictors was benchmarked against the risk score alone. Over a median follow-up of 5.1 (interquartile range: 3.1–7.1) years, 24 patients (2.1%) experienced an ischemic event (incidence: 0.38 per 100 person-years [95% confidence interval, 0.24–0.57]). AF-related etiologies (cardioembolic stroke/SE) accounted for 42% of events. More than half of the events (54%) occurred when the patients were in sinus rhythm. CHA2DS2-VASc score and LAVI were the strongest predictors. A combined model incorporating both parameters showed numerically higher discrimination and modest improvement in reclassification (net reclassification improvement: 0.698 [0.300–1.095], p &lt; 0.001) and discrimination (integrated discrimination improvement: 0.009 [0.002–0.017], p = 0.014) compared with the CHA2DS2-VASc score alone. In this long-term analysis, postablation ischemic events were infrequent and of mixed etiology, with noncardioembolic causes being common. A combined model integrating CHA2DS2-VASc and LAVI showed modest incremental value for residual risk stratification."
OpenAlex,valvular heart disease,Arrhythmic Syncope and Brugada Syndrome: Critical Identification of High-Risk Patterns at the ED Frontline,Kristine Rubi; Brittany Fera; Kelsey Murray; J. Luís Yagüe y Espinosa; Alan Lucerna,,2026-05-06,Rowan Digitals Works (Rowan University),"Brugada Syndrome (BrS) is a premier cause of sudden cardiac death (SCD) in structurally normal hearts, particularly in Southeast Asia (SEA) where it is historically recognized as Sudden Unexplained Nocturnal Death Syndrome (SUNDS). We report the case of a 55-year-old male of Vietnamese descent who presented to the emergency department (ED) after a sudden, non-prodromal syncopal episode at rest. The event was significant for urinary incontinence and diaphoresis, classic red flags for arrhythmic syncope. Bedside electrocardiogram (EKG) demonstrated the pathognomonic Type 1 coved ST-segment elevation in leads V1 and V2. This symptomatic presentation following a six-year ""follow-up gap"" since a previous diagnostic EKG and a similar unmanaged episode three years prior, underscores the syndrome’s dynamic and frequently overlooked nature in at-risk populations. Following admission for specialized electrophysiology (EP) evaluation, the patient was discharged with a LifeVest (wearable cardioverter-defibrillator) and a scheduled plan for subcutaneous implantable cardioverter-defibrillator (ICD) placement. This case emphasizes the high prognostic importance of recognizing the pathognomonic coved morphology to prevent fatal arrhythmic outcomes in the ED setting."
OpenAlex,valvular heart disease,Comparative Analysis of Extraction Complications in Transvenous Versus Leadless Pacemakers,Abdullah Sahyouni; Antonella Jimenez; Johny Alrahal; Andrew Knight; Roy Chen; Tanmayee Maddineni; Luis Antonio Lugo; Asmitha Koneru; Kurt Ramey; Robert J Subbiondo,10.7759/cureus.108392,2026-05-06,Cureus,"Pacemakers are cardiac implantable electronic devices (CIEDs) that deliver electrical impulses to regulate heart rhythm and manage conditions such as cardiac arrhythmias. While transvenous pacemakers (TP) have a generator with pacing leads, leadless pacemakers (LPs) are anchored within the right ventricular endocardium via tined or helical fixation. Device extractions may occur due to infection, dysfunction, or device upgrade. This study aims to analyze the incidence and severity of extraction complications between TPs and LPs. A comprehensive narrative review was performed through the PubMed database. The following key search terms and synonyms were incorporated into the search algorithm: “transvenous pacemaker,” “leadless pacemaker,” “pacemaker extraction,” “device infection,” and “bacterial complications”. This yielded 788 entries. After uploading the search results, articles that focused on pacemaker extractions were included, while animal studies, pediatric studies, and studies that were not peer-reviewed were excluded. After excluding 691 studies, 97 original articles on pacemaker extractions underwent full-text analysis. Both TP and LP extractions had high procedural success and low mortality rates. TPs were found to have procedural risks absent from leadless, namely, the development of arteriovenous fistula through subclavian access, tricuspid dysfunction, and atrial tearing. Examples of some differences between these studies include one LP study, which reported no change in mortality at a follow-up period of 18 months, and one TP study showed little change in mortality up to 24 months. Patients with TP and bacteremia have an increased risk of infection in the pocket and along the pacing leads. Infection of pacing leads has been shown to increase mortality and long-term complications. LPs are favored in many cases, for they minimize the incidence of these complications, have shorter extraction times, and have better recovery post-op in comparison to TPs. LPs are associated with fewer extraction complications due to their smaller size and minimally invasive procedural approach, eliminating the use of a generator pocket and transvenous leads. Due to the incorporation of case studies, this review’s limited sample size may decrease external validity. Future studies should collect large-scale data to further analyze the extraction complications between TP and LP patients."
