source,keyword,title,authors,doi,publication_date,journal,abstract
OpenAlex,mitral regurgitation,Libman-Sacks Endocarditis in Systemic Lupus Erythematosus: A Systematic Review,Mahmoud F. Okour; Mohammad T. Abuawwad; Rania S. Aldeek; Tariq Sabobeh; Ahmad Okour; Mohammad Jallad; Mohamed Omar Mohamed,10.21203/rs.3.rs-9501370/v1,2026-04-27,Research Square,
OpenAlex,mitral regurgitation,Assessing quality and reliability of online videos on peritoneal dialysis: a Douyin video-based study,Xiao Yue; Yu Luo; Jing Li; Xiaoyu Liu,10.1038/s41598-026-50551-w,2026-04-27,Scientific Reports,"Peritoneal dialysis (PD) is an established home-based kidney replacement therapy but remains underutilized, partly due to limited patient knowledge. Meanwhile, TikTok is increasingly used for health information, but the quality of PD-related content on this platform remains uncertain. We conducted a cross-sectional evaluation of PD-related Douyin (the Chinese domestic counterpart of TikTok) videos retrieved on November 13, 2025. Video characteristics were recorded and videos were categorized by uploader type and content category. Two independent raters assessed each video using the Journal of the American Medical Association (JAMA) benchmark criteria, the modified DISCERN (mDISCERN), the Global Quality Score (GQS), the Patient Education Materials Assessment Tool for Audiovisual Materials (PEMAT-A/V), and Peritoneal Dialysis-Specific Scale (PDSS), including a Core PDSS subset. Among 145 included videos, most (143/145) received a JAMA score of 2. Median scores were 2.0 (1.0–3.0) for mDISCERN, 2.0 (2.0–3.0) for GQS, 80.0% (70.0%–95.4%) for PEMAT understandability, 66.7% (66.7%-100%) for PEMAT actionability, 5.0 (3.0–7.0) for PDSS and 2.0 (1.0–3.0) for Core PDSS. Scores differed significantly by uploader type and content category. Videos posted by patients and non-professional individuals had lower GQS, PDSS, and Core PDSS scores than those from professional individuals or hospital-affiliated organizations. Spearman correlation analysis revealed that likes were not significantly correlated with any quality score. Favorites and shares correlated positively with quality and reliability, whereas comments correlated negatively. Multiple linear regression analysis suggested that longer video duration was independently associated with higher quality and reliability as well as higher engagement (likes, favorites, and shares). Overall, PD-related content on Douyin is frequently insufficient in reliability and patient education value. Strengthening nephrologist-led production, platform governance, and actionable patient-centered education is warranted."
OpenAlex,mitral regurgitation,Statin therapy improves long-term survival in patients with myocardial infarction and non-obstructive coronary arteries (MINOCA),Konrad Stępień; Grzegorz Horosin; Natalia Kachnic; Alicia Del Carmen Yika; Aleksandra Karcińska; Piotr Walczak; Karol Nowak; Mateusz Podolec; Jadwiga Nessler; J Zalewski,10.17219/acem/211628,2026-04-27,Advances in Clinical and Experimental Medicine,"BACKGROUND: Current guidelines suggest that statins may be beneficial in patients with myocardial infarction (MI) with non-obstructive coronary arteries (MINOCA). However, the available data are ambiguous. OBJECTIVES: We sought to investigate the effect of statin therapy on long-term mortality among MINOCA patients. MATERIAL AND METHODS: Between 2012 and 2019, coronary angiography was performed in 1,011 patients hospitalized with a diagnosis of MI. Patients with lesions narrowing coronary arteries by less than 50% were classified as MINOCA. Baseline clinical characteristics, laboratory and echocardiographic parameters, statin type prescribed at discharge, as well as long-term all-cause mortality were collected in the MINOCA group. RESULTS: MINOCA was diagnosed in 77 (7.6%) patients, while statins were prescribed in 57 (74%) of them at discharge. Subjects treated with statins had a higher prevalence of hypertension (94.7 vs 70%, p = 0.008) and dyslipidemia (77.2 vs 45%, p = 0.008), had a higher body mass index (BMI; p = 0.028), and were less likely to suffer from active cancer (17.5 vs 55.0%, p = 0.001). In multivariable logistic regression, active cancer independently reduced (odds ratio (OR) = 0.143, 95% confidence interval (95% CI): 0.027-0.748), whereas higher baseline low-density lipoorotein cholesterol (LDL-C) (OR = 3.216, 95% CI: 1.192-8.686) independently increased the likelihood of statin prescription at discharge. In the median follow-up of 69.2 [interquartile range (IQR): 37.8-79.9] months, all-cause mortality was significantly higher in MINOCA patients not treated with statins (p = 0.025). CONCLUSIONS: Roughly 75% of MINOCA patients were treated with statins at discharge. This decision was independently influenced by clinical characteristics and lipid profile. Statin prescription was associated with lower long-term all-cause mortality."
OpenAlex,mitral regurgitation,Mitral annular disjunction and mitral valve prolapse: echocardiographic-MRI insights into cardiac function,Max D. King; Andrew C. Peters; Stuart Karimi; Alyson N. Owen; Baskaran Sundaram; Behzad B. Pavri,10.1007/s10554-026-03709-6,2026-04-27,The International Journal of Cardiovascular Imaging,"BACKGROUND: Mitral annular disjunction (MAD) may accompany mitral valve prolapse (MVP) and is linked to ventricular arrhythmias. Its impact on global cardiac performance (specifically cardiac index (CI) and output (CO)), remains incompletely defined. Cardiac MRI (CMR) allows precise measurement of MAD, assessment of mitral annular dynamics, and detection of myocardial fibrosis via late gadolinium enhancement (LGE). We investigated both CMR and TTE metrics in patients with varying degrees of MAD compared to MVP-only. METHODS AND RESULTS: Fifty-six patients who underwent CMR and TTE (mean age 61, 33 female) were divided into MAD ≥2 mm and MVP (the ""MAD + MVP"" group, n = 41) or MVP-only (n = 15). MAD was classified as <5 mm, ≥5 mm, and ≥ 10 mm in peak systole after excluding pseudo-MAD. LV volume, stroke volume, ejection fraction, cardiac output (CO), cardiac index (CI), mitral regurgitation (MR), and LGE were assessed. Any MAD was associated with lower CI versus MVP-only (p = 0.03). MAD ≥5 mm and MAD ≥ 10 mm showed reduced CO (p = 0.04 and 0.04, respectively) and CI (p = 0.04 and 0.03, respectively) versus MVP-only. LGE was more frequent in MAD ≥ 10 mm than in MAD < 10 mm (p = 0.028). MR incidence, volume, or fraction did not differ across groups. TTE showed agreement with CMR in MAD detection and quantification (p = 0.269), with minimal inter-observer variability (p < 0.001). CONCLUSION: MAD is associated with impaired cardiac performance independent of MR and with increased myocardial fibrosis in severe cases. These findings suggest heightened electromechanical stress in MAD compared to MVP-only, which needs to be clinically correlated. TTE reliably detects and quantifies MAD, supporting its use alongside CMR for assessment of MAD."
OpenAlex,mitral regurgitation,"Response by Kang to Letter Regarding Article, “Long-Term Outcomes of Early Surgery versus Conventional Treatment for Asymptomatic Severe Mitral Regurgitation: A Propensity Analysis”",Duk‐Hyun Kang,10.1161/circulationaha.126.079910,2026-04-27,Circulation,
OpenAlex,mitral regurgitation,Improved Detection of Valvular Cardiac Abnormalities Using Phonocardiogram Signals by Explainable AI,P. Maragathavalli; Dinesh V.; Yuvraj R.; Swaminathan S.,10.38124/ijisrt/26apr1344,2026-04-27,International Journal of Innovative Science and Research Technology (IJISRT),"Valvular heart diseases are among the leading causes of cardiovascular complications worldwide, and early automated detection plays a critical role in improving patient outcomes. Traditional auscultation methods depend heavily on physician expertise and often fail to detect subtle cardiac abnormalities. Automated analysis of Phonocardiogram (PCG) signals provides a scalable and objective approach for cardiac screening. This project, CardioXAI — Improved Detection of Valvular Cardiac Abnormalities using Phonocardiogram Signals by Explainable AI, develops a hybrid deep learning framework that analyzes PCG recordings and provides interpretable diagnostic insights. The system classifies recordings into five conditions — Normal, Aortic Stenosis (AS), Mitral Regurgitation (MR), Mitral Stenosis (MS), and Mitral Valve Prolapse (MVP) — using a Dual-Branch EfficientNetB0 architecture that fuses 3-channel RGB spectrogram features with 19 handcrafted acoustic features. The system integrates two Explainable AI methods: Grad-CAM for spatial time-frequency localization on spectrograms, and SHAP for feature-level attribution. Beyond detection, the system provides cardiac phase localization (S1, Systole, S2, Diastole), an anatomical heart valve diagram highlighting the affected valve, severity grading, and automated clinical report generation. A novel cross-dataset validation experiment on the PhysioNet 2016 Heart Sound Challenge dataset quantifies domain shift using Jaccard similarity and KS statistics, providing evidence of model generalization across different recording devices."
OpenAlex,mitral regurgitation,The roles of quantitative doppler echocardiography in optimizing guideline-directed medical therapy in Post-STEMI patients,Juan Lei; Tou Kun Chong; Jingwei Gao; Jian Chen; Kan Liu,10.1007/s10554-026-03722-9,2026-04-27,The International Journal of Cardiovascular Imaging,"Patients with ST-segment elevation myocardial infarction (STEMI), who are at the highest risk, benefit the most from early guideline-directed medical therapy (GDMT). In real-world practice, timely application and titration of these medications are often compromised during the immediate post-STEMI period due to the perception of hemodynamic instability. An extended medication gap may last from the early post-STEMI period until outpatient follow-up weeks later, depriving prognostic benefit from key pharmacotherapy in the critical window of early post-infarct course. We discuss the practical hurdles in the post-STEMI period to commence GDMT, and the tactics to optimize risk management in high-risk patients to realize the benefits of GDMT. We highlight the challenges of real-time cardiac preload evaluation after coronary revascularization, and the emerging roles of quantitative Doppler echocardiography a point-of-care non-invasive imaging approaches in guiding preload titration to support early pharmacotherapy. We propose stepwise algorithms to integrate instantaneous quantitative Doppler assessment into routine post-STEMI management workflow, and outline our perspective for future trial design and clinical practice."
OpenAlex,mitral regurgitation,Nickel allergy in cardiothoracic surgery: a case report,Jason Sanchez; Andrew Brazier; Adeyemi Olayiwola; Uday Dandekar,10.1055/a-2862-1054,2026-04-27,The Thoracic and Cardiovascular Surgeon Reports,"Background: Metal hypersensitivity represents a rare but important challenge in cardiothoracic surgery, particularly during prosthesis selection for aortic valve replacement. Case Description: A 63-year-old woman with critical bicuspid aortic stenosis and moderate left ventricular dysfunction was found to have severe hypersensitivity to multiple metal alloys, including nickel, palladium, and iridium. Following multidisciplinary evaluation, standard surgical aortic valve replacement was considered unsafe. A transfemoral transcatheter aortic valve implantation using a cobalt–chromium transcatheter valve was successfully performed without complications. Conclusion: This case highlights the importance of individualized, multidisciplinary decision-making when managing patients with significant metal hypersensitivity."
OpenAlex,mitral regurgitation,"Letter by Rose Regarding Article, “Long-Term Outcomes of Early Surgery Versus Conventional Treatment for Asymptomatic Severe Mitral Regurgitation: A Propensity Analysis”",David Rose,10.1161/circulationaha.125.078363,2026-04-27,Circulation,
OpenAlex,mitral regurgitation,Transesophageal echocardiography of mechanical leaflet detachment and distal migration,Haikun Zhang; Haiyun Gu; J L Zhang; Chengcheng Chen; Jinxiang Yu; Xueying Song; Yongbin Han; Tao Zhao,10.21203/rs.3.rs-9374225/v1,2026-04-27,Research Square,
OpenAlex,mitral regurgitation,Fluorodeoxyglucose (FDG)-Avid Pericardial Effusion With Reactive Mesothelial Proliferation Mimicking Malignancy,Mohammadreza Akbarian Khorasgani; Pouriya Katouzi; Melika Khalifeh Hadi; Danial Alekhamis; Emmanuel Agyei; Jingjing Ma; Chuanbao Li; Xiangjuan Liu,10.7759/cureus.107842,2026-04-27,Cureus,"Fluorodeoxyglucose (FDG)-avid pericardial effusion is frequently associated with malignancy, but inflammation and reactive mesothelial proliferation may produce similar imaging and histologic findings, creating diagnostic uncertainty. This overlap may lead to unnecessary invasive procedures if metabolic imaging is overemphasized. A 76-year-old man presented with progressive bilateral lower extremity edema and was found to have a large pericardial effusion. Imaging demonstrated FDG-avid pericardial and pleural thickening with hypermetabolic lymphadenopathy on PET-CT. Serial cytology, bronchoscopic biopsies, and immunohistochemistry did not demonstrate malignancy. Cardiac MRI showed pericardial inflammation without myocardial involvement. The patient was treated with pericardial drainage and corticosteroids, resulting in clinical improvement and resolution of the effusion. This case is unique because FDG-avid pleuropericardial abnormalities, hypermetabolic lymphadenopathy, and reactive mesothelial proliferation closely simulated malignant disease but ultimately represented a non-malignant inflammatory process. FDG uptake in pericardial effusion is not synonymous with malignancy, and PET-CT findings alone are insufficient for diagnosis. Integrating metabolic imaging with pathology and dedicated cardiac imaging can prevent misdiagnosis and avoid unnecessary invasive interventions, particularly in older or frail patients."
OpenAlex,mitral regurgitation,From Isolated Dyspnea to Catastrophic Mechanical Complication: Posteromedial Papillary Muscle Rupture Following Subtle Inferior STEMI,Chadbellah Imane; Ouaziz Mariam; El Fathi Asmaa; Ait Yahya Abdelkarim; E Abdel-Hamid Mohamed; El Karimi Saloua; El Hattaoui Mustapha,10.9734/ca/2026/v15i2540,2026-04-27,Cardiology and Angiology An International Journal,"Background: Papillary muscle rupture (PMR) is a rare but rapidly fatal mechanical complication of acute myocardial infarction (MI) that may occur even after apparently limited ischemia. In the contemporary reperfusion era, its incidence is estimated between 0.05% and 0.26% of MIs, yet mortality remains extremely high. Case Summary: A 67-year-old woman with diabetes presented with isolated acute dyspnea and subtle ST-segment elevation in inferior and posterior leads. Transthoracic echocardiography (TTE) revealed inferior wall akinesia and acute severe mitral regurgitation (MR) caused by flail mitral leaflet motion secondary to subtotal rupture of the posteromedial papillary muscle (PMPM). Within hours of admission, she developed sudden neurological deficits consistent with hyperacute ischemic stroke, followed by massive pulmonary edema and refractory cardiogenic shock (CS). Despite intensive supportive management and planned urgent surgical intervention, the patient died before surgery could be performed. Discussion: PMR remains one of the most devastating mechanical complications of MI, with mortality reaching up to 80% without surgical treatment. This case highlights the importance of recognizing atypical presentations of myocardial infarction, particularly in diabetic patients presenting without chest pain. The case is valuable for the scientific and clinical community as it emphasizes the need for early echocardiographic evaluation and rapid multidisciplinary management. Furthermore, the combination of PMR and acute ischemic stroke represents an uncommon and educational clinical scenario."
OpenAlex,mitral regurgitation,Cardioplegia Strategies in ALCAPA Surgery: A Narrative review on Practical Comparison of Techniques,Youssef El Dsouki; Gopikrishnan Thalapathy; Ignazio Condello,10.1051/ject/2026013/pdf,2026-04-26,Springer Link (Chiba Institute of Technology),"Anomalous Left Coronary Artery from the Pulmonary Artery (ALCAPA) is a rare yet life-threatening congenital cardiac anomaly in which the left coronary artery originates from the pulmonary trunk, leading to severe myocardial ischemia, infarction, and progressive heart failure if untreated. Definitive management requires surgical reimplantation of the anomalous artery into the aorta, supported by meticulously tailored cardioplegia to protect the vulnerable pediatric myocardium, whose perfusion is further complicated by right-to-left coronary collaterals. This manuscript reports the findings of a targeted narrative review of operative videos, technical tutorials, and institutional protocols, synthesising practical knowledge on myocardial protection strategies for ALCAPA repair. Three techniques emerged as the most widely adopted and technically distinct: (1) simultaneous aortic and pulmonary-root administration of cold Custodiol®, providing prolonged single-dose crystalloid protection; (2) antegrade cold-blood cardioplegia supplemented by direct left-coronary ostial perfusion after main pulmonary artery transection, allowing staged protection during extended cross-clamp times; and (3) a classical normothermic blood protocol with repeated root doses and routine half-dose ostial delivery, offering dynamic electrolyte control and familiarity to most congenital teams. For each strategy we summarise precise indications, operative setup, perfusion pressures, dosing schedules, and practical tips for managing collateral-driven early electrical activity. By distilling evidence and expert practice into a concise technical comparison, this narrative review provides congenital cardiac surgeons with an up-to-date, step-by-step reference for safe, effective myocardial protection in ALCAPA repair."
OpenAlex,mitral regurgitation,Acute cardiac care in rheumatic mitral stenosis,Nisa Amnifolia Niazta; Indra Prasetya,10.21776/ub.hsj.2026.007.02.4,2026-04-26,Heart Science Journal,"Rheumatic heart disease (RHD) is prevented, although productive-age people may develop consequences. Indonesia, as an endemic country of RHD, predominantly reported isolated mitral stenosis among RHD patients. Acute worsening of mitral stenosis can lead to acute heart failure and cardiogenic shock, arrhythmias, stroke, pulmonary hypertension, systemic embolic events, infective endocarditis, and pregnancy-related issues. The diagnosis of critical valvular emergency, especially rheumatic mitral stenosis in acute cardiac care, is often overlooked due to the clinical history potentially resembling other disease entities. This review highlights clinical emergency manifestation and comprehensive management of rheumatic mitral stenosis in acute cardiac care. Keyword : Acute Cardiac Care; Acute Heart Failure; Cardiogenic Shock; Rheumatic Heart Disease; Rheumatic Mitral Stenosis."
OpenAlex,mitral regurgitation,Early cardiotoxicity of radiotherapy in breast cancer patients after chemotherapy: the early warning sign,Zakka Zayd Zhullatullah Jayadisastra; Muhammad Ivan Aulia Sani; Lucia Kris Dinarti; Hasanah Mumpuni; Susanna Hilda Hutajulu; Wigati Dhamiyati,10.1186/s43046-026-00341-2,2026-04-26,Journal of the Egyptian National Cancer Institute,"Radiotherapy, like chemotherapy, in breast cancer can cause cardiotoxicity. Research about the combined effect of radiotherapy and chemotherapy on left ventricular diastolic function (LVDD) is limited. Therefore, this study was conducted to see the early effect of radiotherapy in patients after completing chemotherapy. This research was a prospective analytical observational study with a pre-post design that was conducted from August 2023 to August 2024 in breast cancer patients who had completed their chemotherapy in Sardjito Hospital. The primary endpoint was cardiotoxicity in any level according to European Society of Cardiology (ESC) 2022 cardio-oncology guideline. Cardiotoxicity was diagnosed by considering patients’ history, physical examination, and echocardiography results. Twenty-nine female subjects were enrolled. Seven subjects (24.14%) had cardiotoxicity with one of them was symptomatic. McNemar test showed significant effect of radiotherapy (p = 0.016). Types of chemotherapy were not a confounding factor in this study. Radiotherapy may cause mild cardiotoxicity in short term. A routine screening protocol is needed to prevent further complication."
OpenAlex,mitral regurgitation,Prognostic implications of pulmonary hypertension in heart failure preserved and reduced ejection fraction,Muhammad Azhar Rosyidi; Valerinna Yogibuana,10.21776/ub.hsj.2026.007.02.3,2026-04-26,Heart Science Journal,"Pulmonary hypertension (PH) attributable to left heart disease (PH associated with left heart disease, PH-LHD) is the most common type of PH. PH-LHD is an important indicator of elevated morbidity and mortality in individuals with heart failure, both heart failure with preserved and reduced ejection fraction despite receive adequate therapy. Literature was sourced from major scientific databases and studies relevant to symptoms, examinations, management, and prognostic implications of PH-LHD. Pathophysiologically, PH-LHD is a gradual process that begins with increased left-heart pressure (postcapillary component), which triggers a series of biological changes in the pulmonary vasculature (precapillary component). This process ultimately places an excessive burden on the right ventricle, resulting in right ventricular dysfunction and failure, which are the main determinants of prognosis. Symptoms of PH-LHD are usually characterized by disproportionate dyspnea that is not consistent with left ventricular ejection fraction and other comorbidities. Echocardiography can noninvasively assess the probability of pulmonary hypertension in heart failure patients. A definitive diagnosis of PH-LHD requires confirmation through right heart catheterization. The most important prognostic factors are not only determined by the degree of hemodynamic severity, but also depend heavily on the degree of right ventricular dysfunction and the status of right ventricle–pulmonary artery coupling. Management of PH-LHD is through optimization of basic Guideline-Directed Medical Therapy (GDMT) to reduce mortality and morbidity. Keyword : Heart Failure; Left Heart Disease; Pulmonary Hypertension."
OpenAlex,mitral regurgitation,Complete Atrioventricular Block Induced by Donepezil: A Rare Case Report,Halil Koç; Cemal Köseoğlu; Can Ramazan Öncel,10.30565/medalanya.1825751,2026-04-25,Acta Medica Alanya,"Donepezil, a reversible acetylcholinesterase inhibitor that increases parasympathetic activity by enhancing cholinergic tone, is used to preserve cognitive function in patients with Alzheimer’s disease. However, donepezil may slow conduction, particularly at the sinoatrial and atrioventricular nodes, which increases the risk of bradycardia, sinus arrest, or high-grade AV block, particularly in elderly or comorbid patients. Complete AV block is rarely seen with donepezil use. Herein, we present a case of complete AV block in an 87-year-old woman receiving donepezil therapy, which resolved spontaneously following theophylline treatment."
