source,keyword,title,authors,doi,publication_date,journal,abstract
PubMed,deep learning,Towards digital twin-enabled perioperative care: extending the potential of multimodal deep learning for cardiovascular risk stratification.,Haiyue Wang,10.1097/JS9.0000000000004617,2026-01-13,"International journal of surgery (London, England)",
PubMed,deep learning,Factor analysis and risk prediction of postpartum hemorrhage in pregnant women.,Xiaodi Kang; Yawei Zhang; Li Li,10.29063/ajrh2026/v30i1.4,2026-01-14,African journal of reproductive health,"Postpartum hemorrhage (PPH) remains the leading cause of maternal mortality and a common obstetric complication. Rapid onset and severity can lead to hemorrhagic shock and fatal outcomes if not promptly managed. Major causes include uterine atony, placental abnormalities, birth canal trauma, and coagulation disorders. This study proposes a risk prediction model for PPH based on a Deep Belief Network (DBN), using relevant risk factors as input features. To address limitations from random initialization in the DBN, an improved Particle Swarm Optimization (IPSO) algorithm-featuring adaptive inertia weight and learning factors-was introduced to optimize network parameters. The optimized model, referred to as IDBN, was applied to predict PPH risk levels more accurately and efficiently. The results demonstrate the superior performance of the IDBN method, which achieved the highest accuracy and F1 score among all models evaluated. This approach offers a novel, data-driven method for early PPH risk identification and clinical intervention. L'hémorragie du post-partum (HPP) demeure la principale cause de mortalité maternelle ainsi qu'une complication obstétricale fréquente. Son apparition rapide et sa gravité peuvent entraîner un choc hémorragique et des issues fatales si elle n’est pas prise en charge rapidement. Les causes majeures incluent l’atonie utérine, les anomalies placentaires, les traumatismes du canal génital et les troubles de la coagulation. Cette étude propose un modèle de prédiction du risque de HPP basé sur un Réseau de Croyance Profond (Deep Belief Network, DBN), utilisant des facteurs de risque pertinents comme variables d'entrée. Afin de pallier les limitations dues à l'initialisation aléatoire dans le DBN, un algorithme amélioré d’optimisation par essaim particulaire (IPSO) – intégrant un poids d'inertie adaptatif et des facteurs d’apprentissage modulables – a été introduit pour optimiser les paramètres du réseau. Le modèle optimisé, nommé IDBN, a été appliqué pour prédire les niveaux de risque de HPP de manière plus précise et efficace. Les résultats démontrent les performances supérieures de la méthode IDBN, qui a obtenu les meilleurs scores en termes de précision et de F1 parmi tous les modèles évalués. Cette approche offre une méthode innovante et fondée sur les données pour l'identification précoce du risque de HPP et pour guider les interventions cliniques."
Crossref,aortic stenosis,Dual-parameter risk stratification based on device landing zone calcification and aortic annular perimeter for paravalvular regurgitation after self-expanding TAVR,Jun Shu; Didi Wen; Jingji Xu; Yu Mao; Hui Ma; Jing Zhang; Yao Zhao; Jian Yang; Minwen Zheng,10.1016/j.ejro.2025.100719,2026-06,European Journal of Radiology Open,
Crossref,aortic stenosis,Non-rheumatic calcific aortic valve disease as a global driver of heart failure: Burden and three-decade trends,Lin Zhu; Yanqing Gong; Zijie An; Liumei Mo; Jian Rong; Zhenhao Liu,10.1016/j.hrtlng.2025.102690,2026-05,Heart &amp; Lung,
Crossref,aortic stenosis,A large puncture closer of aortic wall by multi-memory actions with thrombo-hemodynamic control,Sungwoo Cho; Hyun-Su Ha; Sangmin Lee; Hyunjae Kim; Seok Joon Lee; Jueun Kim; Yerin Lee; Kang Suk Lee; Hyun-Chel Joo; Hak-Joon Sung,10.1016/j.bioactmat.2025.12.042,2026-05,Bioactive Materials,
Crossref,aortic stenosis,Is there a relationship between extracardiac pulmonary findings and coronary artery stenosis severity and plaque types?,Burak Günay; Ömer Kostak; Atakan Küskün; Halis Harun Öztürk; Fatma Öztora; Muzaffer Savaş Tepe,10.1016/j.hrtlng.2025.102708,2026-05,Heart &amp; Lung,
Crossref,aortic stenosis,3D perfusable minichannels stented with matrix bound vesicles derived from gingival mesenchymal stem cells ameliorated granuloma-related stenosis and improved survival in a rabbit tracheal replacement model,Bing Liu; Xinchi Zhang; Na Wei; Xiaopeng Wu; Pingping Yuan; Tian Zeng; Lirong Liang; Hui Zhang; Wei Wu,10.1016/j.biomaterials.2025.123769,2026-04,Biomaterials,
Crossref,aortic stenosis,Long-Term Outcomes of Type B Aortic Dissections in Younger (&lt;55 years) Patients,Bliss Jaggers; Charles Shirley; Oleksiy Gudz; Mohammed Moursi,10.1016/j.avsg.2025.11.144,2026-04,Annals of Vascular Surgery,
Crossref,aortic stenosis,Report of a human avian-type aortic arch variant with a descending thoracic aortic aneurysm,Tuna Aras; Julia Khabyuk; Adel Aswad; Martin Scaal; Payman Majd,10.1016/j.jvscit.2025.102099,2026-04,"Journal of Vascular Surgery Cases, Innovations and Techniques",
Crossref,aortic stenosis,Physician-modified vascular plug for entry closure of a chronic aneurysmal aortic dissection,Ryo Nishide; Takao Ohki; Kota Shukuzawa; Soichiro Fukushima; Hirotsugu Ozawa; Kentaro Kasa,10.1016/j.jvscit.2025.102100,2026-04,"Journal of Vascular Surgery Cases, Innovations and Techniques",
Crossref,aortic stenosis,Two-Stage Open Ascending Aorta Replacement Followed by Total Aortic Arch Repair Using a Double-Fenestrated Physician-Modified Endograft for Patients with an Aortic Arch Aneurysm and an Aneurysmal Ascending Aorta,Christoph Bacri; Baptiste Durant; Kheira Hireche; Pierre Alric; Thomas Gandet; Ludovic Canaud,10.1016/j.avsg.2025.11.143,2026-04,Annals of Vascular Surgery,
Crossref,aortic stenosis,Primary aortic angiosarcoma following endovascular aneurysm repair: Case report and review of the literature,Samer Koussayer; Faisal A. Almudaiheem; Talia Koussayer; Hussein Alkohlani; Nizar Zein,10.1016/j.jvscit.2025.102095,2026-04,"Journal of Vascular Surgery Cases, Innovations and Techniques",
Crossref,aortic stenosis,Explant of an infected aortic arch fenestrated stent graft with extra-anatomic reconstruction,Ezra Y. Koh; Akiko Tanaka; Naveed U. Saqib; Anthony L. Estrera,10.1016/j.jvscit.2025.102085,2026-04,"Journal of Vascular Surgery Cases, Innovations and Techniques",
Crossref,aortic stenosis,Food-derived chlorogenic acid prevents aortic aneurysm and dissection by nutritional restore branched-chain amino acid dyshomeostasis,Zhen-xiao Ma; Ze-qun Yin; Zi-an Feng; Xiang-peng Xie; Ao Li; Shi-hao Fu; Qi Yue; Sheng Wang; Li-kun Ma; Ya-jun Duan; Dan-qing He; Jun-fang Wu; Shuang Zhang; Zhi-wei Zhao,10.1016/j.jnutbio.2025.110211,2026-04,The Journal of Nutritional Biochemistry,
Crossref,aortic stenosis,Predictive value of machine learning for mortality risk in aortic dissection: a systematic review and meta-analysis,Zhihong Han; Baixin Li; Jie Liu,10.1016/j.ijmedinf.2026.106271,2026-04,International Journal of Medical Informatics,
Crossref,aortic stenosis,Retroperitoneal undifferentiated pleomorphic sarcoma with aortic and inferior vena cava involvement presenting as right common iliac artery rupture,Daichi Ito; Koichi Morisaki; Kentaro Inoue; Chiemi Oishi; Yoshinao Oda; Tomoharu Yoshizumi,10.1016/j.jvscit.2025.102053,2026-04,"Journal of Vascular Surgery Cases, Innovations and Techniques",
Crossref,aortic stenosis,Dynamic CTA image guidance for targeted robotic ligation of type II aortic endoleak,Dora Z. Zatyko; Ponraj Chinnadurai; Adam Bardoczi; Alan B. Lumsden; Charudatta S. Bavare,10.1016/j.jvscit.2025.102113,2026-04,"Journal of Vascular Surgery Cases, Innovations and Techniques",
Crossref,aortic stenosis,PRKG1 pathogenic variants cause thoracic aortic dissection with minimal aortic dilation: Insights from the UTHealth Houston multidisciplinary aortic and vascular disease conference,Ali Askari; Jennifer R. Landes; Alana Cecchi; Cihan Duran; Bihong Zhao; Gustavo S. Oderich; L. Maximilian Buja; Dianna M. Milewicz; Anthony L. Estrera; Rana O. Afifi; Siddharth K. Prakash,10.1016/j.jvscit.2025.102088,2026-04,"Journal of Vascular Surgery Cases, Innovations and Techniques",
Crossref,aortic stenosis,Thoracoabdominal multibranch endograft repair of type Ia endoleak after laser in situ fenestration and chimney endovascular repair for pararenal aortic aneurysm,Samuel Nofsinger; Anne Marker; Uttara Nag; Steven Cheung; Todd R. Vogel; Jonathan Bath,10.1016/j.jvscit.2025.102087,2026-04,"Journal of Vascular Surgery Cases, Innovations and Techniques",
Crossref,aortic stenosis,Association of pulmonary arterial end-diastolic forward flow and right heart remodeling in dogs with congenital pulmonic stenosis and precapillary pulmonary hypertension,E.H. Duble; C.M. Springer; L.S. Köster,10.1016/j.jvc.2025.11.007,2026-04,Journal of Veterinary Cardiology,
Crossref,aortic stenosis,Abdominal Aortic Aneurysm in Women and Men: A Systematic Review of Sex-Specific Outcomes in the United Kingdom,Gemma Pace; Martin Hossack; Francesco Torella; Jillian Madine; Riaz Akhtar,10.1016/j.avsg.2025.12.011,2026-04,Annals of Vascular Surgery,
Crossref,aortic stenosis,"Effectiveness and safety of combining pharmacopuncture therapy and acupotomy for treating patients with degenerative lumbar spinal stenosis: A pragmatic, assessor-blinded, randomized, controlled trial",Jihun Kim; Chang-Hyun Han; Taewook Lee; Sookwang An; Changsop Yang; Young Eun Choi; Byoung-Kab Kang; Yoona Oh; Kun Hyung Kim; Gi Young Yang; Eunseok Kim,10.1016/j.imr.2025.101204,2026-03,Integrative Medicine Research,
Crossref,mitral regurgitation,Atrial fibrillation and clinical outcomes after mitral transcatheter edge-to-edge repair: A mechanism-stratified cohort study,Hadar Horowitz; Itshak Amsalem; Shemy Carasso; Yael Yan Postell; Mohammad Karmi; Elad Asher; Moshe Rav Acha; Michael Glikson; Sharon Bruoha; Mony Shuvy,10.1016/j.ijcard.2025.134095,2026-03,International Journal of Cardiology,
Crossref,mitral regurgitation,Deep learning model for identifying significant tricuspid regurgitation using standard 12-lead electrocardiogram,Chun-Chin Chang; Ming-Tsung Hsieh; Yin-Hao Lee; Chih-Hsueh Tseng; Wei-Ming Huang; Ruey-Hsing Chou; Chin-Sheng Lin; Po-Hsun Huang,10.1016/j.ijcrp.2025.200557,2026-03,International Journal of Cardiology Cardiovascular Risk and Prevention,
Crossref,mitral regurgitation,"Long-term outcomes of tricuspid valve plasty vs. replacement after cardiac surgery: Mortality, reoperation, and anticoagulation complications in patients with postoperative tricuspid regurgitation",Linbin Hua; Shanwen Pang; Zhaolong Zhang; Jing Chen; Junqiang Qiu; Qiuji Wang; Zhenzhong Wang; Lishan Zhong; Yingjie Ke; Huanlei Huang,10.1016/j.ijcard.2025.134080,2026-02,International Journal of Cardiology,
Crossref,mitral regurgitation,Prognostic significance of cardiovascular magnetic resonance advanced atrial parameters in chronic significant aortic regurgitation,Irene Carrión-Sánchez; Juan Manuel Monteagudo-Ruiz; Paola Ramos-Cano; Pablo Martínez-Vives; Ariana González-Gómez; Ana García-Martín; Rocío Hinojar; José L. Zamorano; Covadonga Fernández-Golfín,10.1016/j.ijcard.2025.134028,2026-02,International Journal of Cardiology,
Crossref,mitral regurgitation,Long-Term Survival After Mitral Valve Replacement by Preoperative Risk: Implications for Patient Selection,Matthew Kazaleh; Catherine Wagner; J’undra Pegues; Jessica K. Millar; Carol Ling; Jeremy Wolverton; Rhea Gupta; Robert Hawkins; Steven F. Bolling; Gorav Ailawadi,10.1016/j.athoracsur.2025.07.031,2026-02,The Annals of Thoracic Surgery,
Crossref,mitral regurgitation,Magnetic resonance-based computational modelling of healthy and prolapsing mitral valves to quantify the load transfer between the mitral apparatus and the ventricular myocardium,Davide Tondi; Francesco Sturla; Mateo Marin-Cuartas; Maja-Theresa Dieterlen; Cosima Jahnke; Ingo Paetsch; Ricardo A Spampinato; Michael A. Borger; Emiliano Votta,10.1016/j.cmpb.2025.109151,2026-02,Computer Methods and Programs in Biomedicine,
Crossref,mitral regurgitation,Surgical Ablation of Atrial Fibrillation During Mitral Valve Surgery: Understanding the Signal,John Eisenga; Alessandro Gasparini; John Squiers; J. Mchael DiMaio; Justin Schaffer,10.1016/j.athoracsur.2025.05.029,2026-02,The Annals of Thoracic Surgery,
Crossref,mitral regurgitation,Beyond the PROM Score: Navigating Risk and Rethinking Endpoints in Surgical Mitral Valve Therapy,Sooyun Caroline Tavolacci; Anelechi C. Anyanwu,10.1016/j.athoracsur.2025.08.041,2026-02,The Annals of Thoracic Surgery,
Crossref,mitral regurgitation,“Echo-derived estimate of peak left atrial pressure in patients with iatrogenic atrial septal defects following transcatheter mitral edge-to-edge repair”,Sakul Sakul; Sara DiazSaravia; Brandon Berman; Abel Casso Dominguez; Stamatios Lerakis; Edgar Argulian,10.1016/j.ijcard.2025.133975,2026-02,International Journal of Cardiology,
Crossref,mitral regurgitation,Innovative Y-shaped hydrogel mitral clip with magnetic actuation and hydrophilic janus surface for enhanced valve leaflet repair,Yue Wang; Ximing Liao; Lei Zhou; Songchao Fu; Qing He; Xinqi Chen; Linxi Xia; Cihui Liu; Feng Liu; Lei Yang,10.1016/j.mtbio.2025.102750,2026-02,Materials Today Bio,
Crossref,mitral regurgitation,Corrigendum to “Longitudinal profile of N-terminal pro-atrial natriuretic peptide and N-terminal pro B-type natriuretic peptide in dogs undergoing mitral valve repair” [J Vet Cardiol 63 (2026) 1–15],S. Furusato; H. Arai; S. Shinoda; K. Harada; M. Mizuno; M. Uechi,10.1016/j.jvc.2025.11.003,2026-02,Journal of Veterinary Cardiology,
Crossref,mitral regurgitation,Multimodal Imaging Assessment of Tricuspid Regurgitation and the Right Ventricle,Malgorzata Maciorowska; Lily Zhang; Omar K. Khalique,10.1016/j.ccl.2025.07.003,2026-02,Cardiology Clinics,
Crossref,mitral regurgitation,The 4A  classification for prognostic stratification of patients with tricuspid regurgitation. A multicenter study,Ariana González-Gómez; Juan Manuel Monteagudo Ruiz; Ander Arteagoitia Bolumburu; Patricia Mahia; Esther Pérez David; Laura Gutierrez García-Moreno; Marta Sitges; Chi-Hion Li; David Alonso; Fernando Carrasco Chinchilla; Jesús María de la Hera; Ana García Martín; Roció Hinojar; Covadonga Fernández-Golfín; José Luis Zamorano,10.1016/j.ijcard.2025.133977,2026-02,International Journal of Cardiology,
Crossref,mitral regurgitation,Treatment of supravalvular mitral stenosis in a kitten with hybrid balloon angioplasty,R.L. Winter; D.M. Tillson; K.L. Maneval; M. Rajeev; D. Castro,10.1016/j.jvc.2025.10.006,2026-02,Journal of Veterinary Cardiology,
Crossref,mitral regurgitation,Outcomes of Mitral Transcatheter Edge-to-Edge Repair in Patients With Small Mitral Valve Area,Chloe Kharsa; Yasser M. Sammour; Rasha Bazari; Alba Muñoz Estrella; Gal Sella; Sahar Samimi; Samarthkumar Thakkar; Mangesh Kritya; Taha Hatab; Rody G. Bou Chaaya; Syed Zaid; Joe Aoun; Sherif F. Nagueh; William A. Zoghbi; Marvin D. Atkins; Michael Reardon; Nadeen N. Faza; Stephen H. Little; Gerald Lawrie; Neal S. Kleiman; Sachin S. Goel,10.1016/j.shj.2025.100772,2026-02,Structural Heart,
Crossref,mitral regurgitation,Integration of mitral regurgitant fraction with routine echocardiographic variables in assessment of myxomatous mitral valve disease,G. McAulay; M. Rishniw,10.1016/j.jvc.2025.11.004,2026-02,Journal of Veterinary Cardiology,
Crossref,mitral regurgitation,Longitudinal profile of N-terminal pro-atrial natriuretic peptide and N-terminal pro B-type natriuretic peptide in dogs undergoing mitral valve repair,S. Furusato; H. Arai; S. Shinoda; K. Harada; M. Mizuno; M. Uechi,10.1016/j.jvc.2025.10.003,2026-02,Journal of Veterinary Cardiology,
Crossref,mitral regurgitation,Management challenges of tongue piercing–associated mitral valve endocarditis with systemic embolization in a 16-year-old patient,Alexandru Oprea; Alexandra Dădârlat-Pop; Alexandru Manea; Cristina Gavanescu; Georgiana Toma; Stefan Mot; Simona Manole; Sergiu Cristian Turturica; Simona Oprita; Adrian Stef,10.1016/j.ijid.2025.108234,2026-02,International Journal of Infectious Diseases,
Crossref,mitral regurgitation,Left ventricular diastolic function modifies clinical outcomes of mild mitral regurgitation,Peihan Xie; Huimin Zhou; Yiquan Huang; Zhuoshan Huang; Menghui Liu; Ziwen Hui; Yue Guo; Shujuan Li; Rui Fan; Zhenyu Xiong; Xiaodong Zhuang; Xinxue Liao,10.1016/j.ijcard.2025.133998,2026-02,International Journal of Cardiology,
Crossref,valvular heart disease,Giant Cells in Health and Disease-A Review,Sonal Gupta,10.21276/ijchmr.2016.2.2.10,2106-06-20,International Journal Of Community Health And Medical Research,
Crossref,valvular heart disease,Contemporary Disease Management in Quebec,Amédé Gogovor; Michelle Savoie; Yola Moride; Marilyn Krelenbaum; Terrence Montague,10.12927/hcq.2013.19495,2088-01-15,Healthcare Quarterly,
Crossref,valvular heart disease,Chronic Disease Prevention and Management: Implications for Health Human Resources in 2020,Margo Orchard; Esther Green; Terrence Sullivan; Anna Greenberg; Verna Mai,10.12927/hcq.2013.19496,2088-01-15,Healthcare Quarterly,
Crossref,valvular heart disease,What a Study on Ultraprocessed Fake Meat and Heart Disease Really Found,Lori Y,10.1038/scientificamerican072077-2xmzfca9smsvxelw1jobgf,2077-07,Scientific American,
Crossref,valvular heart disease,Woman Receives Genetically Modified Pig Kidney Transplant after Heart Pump Surgery,Tanya L,10.1038/scientificamerican072077-4hozib8kpx2m6wjvhqi1zz,2077-07,Scientific American,
Crossref,valvular heart disease,Water Lily or Camelotte Sign in Pulmonary Hydatid Cyst – An Orphan Disease,Sudheer Tale; Soibampahel M; Mrudula K; Ritisha B; Subodh K; Girish S,10.23880/cclsj-16000132,2028-11-11,Cell &amp; Cellular Life Sciences Journal,"A 20 – year – old male without any previous comorbidity presented to pulmonary medicine outpatient department with complaints of dull aching chest pain on right side, dry cough and shortness of breath for the pastone year. He was non vegetarian and had no addictions. On general physical examination his vitals were stableand respiratory system examination revealed decreased breath sounds in the right hemithorax. All his routineblood investigations were normal. Chest radiograph revealed homogenous opacity in the right middle andlower zones. Contrast enhanced computed tomography of thorax and abdomen showed a well defined encapsulatedcystic lesion of size 12x10x14cm with internal floating membranes (water lily sign or Camelotte sign) with masseffect on adjacent lung parenchyma causing atelectasis and compression of adjacent vessels (Figure 1). Hydatid serology (IgG) was positive. Patient was treated symptomatically and referred for surgical intervention."
Crossref,valvular heart disease,RELATION OF HEART WEIGHT WITH AGE AND WEIGHT OF CADAVER,Jolly Agarwal; Virendra Kumar,10.21761/jms.v2i01.10838,2027-07-25,SRMS JOURNAL OF MEDICAL SCIENCE,"Introduction: Height, weight, and age of person has significant impact on the normal size of&#x0D; heart. These parameters need to be considered when cut-off values indicating the need for&#x0D; treatment or even surgery are established. The aim of present work is to study the relation of&#x0D; weight of the heart with age and weight of cadaver.&#x0D; Material and Methods: The study was performed in the Department of Anatomy, Shri Ram&#x0D; Murti Smarak Institute of Medical Sciences, Bareilly on 30 hearts from embalmed cadavers.&#x0D; The hearts were procured from the cadavers available in our department. The heart was&#x0D; thoroughly cleaned and measurements were taken.&#x0D; Results: The mean heart weight was 223.37 ± 57.78 g. Significant relationship between age of&#x0D; the cadaver and weight of the heart (p=0.0004), weight of cadaver and weight of heart&#x0D; (p=0.0001) was observed.&#x0D; Conclusion: The above study provides valuable data of the heart in our geographical location,&#x0D; which may be useful for cardiac surgeons and physicians."
Crossref,valvular heart disease,Improving Citrus Leaf Disease Segmentation and Classification with a Game Theoretical U-Net Convolutional LightGBM model,K. Rama Gangi Reddy; K.S. Thirunavukkarasu,10.1504/ijiei.2027.10072915,2027,International Journal of Intelligent Engineering Informatics,
Crossref,valvular heart disease,An Intelligent Approach with Integrated Feature Selection for Accurate Parkinson's Disease Diagnosis,Pravin Madhukar Dhanrao; B.K. Madhavi; Haard Patel; Debabrata Swain; Sashikala Mishra; Het Prajapati; Shrey Joshi,10.1504/ijims.2027.10072985,2027,International Journal of Internet Manufacturing and Services,
Crossref,valvular heart disease,Augmentation of comorbidity assessment of peripheral artery disease using gait biomechanics with self-organization based learning model,Nazia Sultana; PK Kumar,10.1016/j.ijcce.2025.07.002,2026-12,International Journal of Cognitive Computing in Engineering,
Crossref,valvular heart disease,A hybrid deep learning approach based on optimized feature selection on environmental multi-disease predictive models,Selvi. S; Vanathi. A,10.1016/j.ijcce.2025.11.006,2026-12,International Journal of Cognitive Computing in Engineering,
Crossref,valvular heart disease,Disease-related communication difficulties and dyadic coping among patients with breast cancer and their spouses: An actor–partner interdependence model,Lingling Yang; Xi Zhang; Meina Yang; Liping Zhang; Rong Wang; Ting Wang,10.1016/j.apjon.2025.100829,2026-12,Asia-Pacific Journal of Oncology Nursing,
Crossref,valvular heart disease,Fitness and exercise effects on brain age: A randomized clinical trial,Lu Wan; Cristina Molina-Hidalgo; Mary E. Crisafio; George Grove; Regina L. Leckie; Thomas W. Kamarck; Chaeryon Kang; Mia DeCataldo; Anna L. Marsland; Matthew F. Muldoon; Mark R. Scudder; Javier Rasero; Peter J. Gianaros; Kirk I. Erickson,10.1016/j.jshs.2025.101079,2026-12,Journal of Sport and Health Science,
Crossref,valvular heart disease,"Methanol extract of Smritisagara Rasa attenuates neurobehavior, neurochemical and stress indicators in rotenone-induced Drosophila model of Parkinson's disease",G Gopinath; Ramesha Hanumanthappa; Raifa Abdul Aziz; P.C. Kiran; Hemalatha Nanjaiah; Iranna B. Kotturshetty; Shamprasad Varija Raghu; Manjunath Ajanal; Devaraju Kuramkote Shivanna,10.1016/j.abst.2025.11.003,2026-11,Advances in Biomarker Sciences and Technology,
Crossref,valvular heart disease,Multi-omics integration and machine learning reveal biomarker networks and therapeutic targets in Alzheimer's disease,Shreya Satyanarayan Bhat; Vidya Niranjan; Trilok Chandran; Spoorthi R. Kulkarni; Samridhi Makkar; Vishwam Dixit; Cherishma K. Subhasa; Adarsh Vishal,10.1016/j.abst.2025.12.004,2026-11,Advances in Biomarker Sciences and Technology,
Crossref,valvular heart disease,"Investigating the Relationship Between Postpartum Depression, Antenatal Depression, Corona Disease Anxiety, and Personality Traits During the COVID-19 Pandemic",Hanieh Soltani Nejad; Fatemeh Mohtasham; Mahjoubeh Ramezanzadeh; Azam Zare Arashlouei; Atefeh Ahmadi; Adele Dadvar; Saleheh Iranmanesh; Motahare Mirmahmoodi,10.2174/0126667975320431240915165722,2026-10,Coronaviruses,"Introduction and Aim:                     Postpartum depression has a profound impact, both physically and psychologically, on both the mother and her newborn. With a focus on the prevalent psychological complications following the onset of this condition, this study aimed to explore the correlation between antenatal depression and Corona disease anxiety, personality traits, and postpartum depression during the COVID-19 pandemic.                                                           Materials and Methods:                     This cross-sectional descriptive-analytical study investigated women receiving care at health centers affiliated with Kerman University of Medical Sciences during the last month of their pregnancy and the postpartum period in 2022. Following the acquisition of informed consent, participants were assessed using various measures, including demographic and obstetric information, the Edinburgh Postnatal Depression Scale, the Corona Disease Anxiety Scale (CDAS), and the NEO Personality Inventory-Revised during their third trimester of pregnancy. The same group of participants completed the Edinburgh Depression Scale and the Corona Disease Anxiety Scale (CDAS) 4-6 weeks after childbirth.                                                           Results and Discussion:                     There was a significant correlation between family income, unwanted pregnancy as perceived by both the mother and father, and antenatal depression. Additionally, marital satisfaction played a significant role in postpartum depression. Furthermore, antenatal depression was significantly associated with neuroticism, agreeableness, and physical symptoms related to Corona disease anxiety. Personality traits, with the exception of extroversion and conscientiousness, and various domains of Corona disease anxiety, excluding psychological symptoms, were also significantly associated with postpartum depression.                                                           Conclusion:                     During pandemics or epidemics, such as the COVID-19 outbreak, experiencing mental distress during pregnancy can contribute to mental health issues during the postpartum period. This risk is particularly true in individuals with unique personality traits, emphasizing the need for increased focus on mental health within prenatal care during these crises."
