source,keyword,title,authors,doi,publication_date,journal,abstract
Crossref,valvular heart disease,"Investigating the Relationship Between Postpartum Depression, Antenatal Depression, Corona Disease Anxiety, and Personality Traits During the COVID-19 Pandemic",Hanieh Soltani Nejad; Fatemeh Mohtasham; Mahjoubeh Ramezanzadeh; Azam Zare Arashlouei; Atefeh Ahmadi; Adele Dadvar; Saleheh Iranmanesh; Motahare Mirmahmoodi,10.2174/0126667975320431240915165722,2026-10,Coronaviruses,"Introduction and Aim:                     Postpartum depression has a profound impact, both physically and psychologically, on both the mother and her newborn. With a focus on the prevalent psychological complications following the onset of this condition, this study aimed to explore the correlation between antenatal depression and Corona disease anxiety, personality traits, and postpartum depression during the COVID-19 pandemic.                                                           Materials and Methods:                     This cross-sectional descriptive-analytical study investigated women receiving care at health centers affiliated with Kerman University of Medical Sciences during the last month of their pregnancy and the postpartum period in 2022. Following the acquisition of informed consent, participants were assessed using various measures, including demographic and obstetric information, the Edinburgh Postnatal Depression Scale, the Corona Disease Anxiety Scale (CDAS), and the NEO Personality Inventory-Revised during their third trimester of pregnancy. The same group of participants completed the Edinburgh Depression Scale and the Corona Disease Anxiety Scale (CDAS) 4-6 weeks after childbirth.                                                           Results and Discussion:                     There was a significant correlation between family income, unwanted pregnancy as perceived by both the mother and father, and antenatal depression. Additionally, marital satisfaction played a significant role in postpartum depression. Furthermore, antenatal depression was significantly associated with neuroticism, agreeableness, and physical symptoms related to Corona disease anxiety. Personality traits, with the exception of extroversion and conscientiousness, and various domains of Corona disease anxiety, excluding psychological symptoms, were also significantly associated with postpartum depression.                                                           Conclusion:                     During pandemics or epidemics, such as the COVID-19 outbreak, experiencing mental distress during pregnancy can contribute to mental health issues during the postpartum period. This risk is particularly true in individuals with unique personality traits, emphasizing the need for increased focus on mental health within prenatal care during these crises."
Crossref,valvular heart disease,The Severity of Disease and Hospital Length of Stay for the First and Second Admission of COVID-19 Patients: An Observational Study from Southeastern Iran,Milad Ahmadi Gohari; Mohammad Hossein Mehrolhassani; Shoboo Rahmati; Elham Sharifpoor; Hossein Mirzaei; Yunes Jahani,10.2174/0126667975341163241129050027,2026-10,Coronaviruses,"Background:                     This study aimed to investigate the severity of disease and length of hospital stay for COVID-19 patients admitted to a hospital in southeastern Iran.                                                           Method:                     This cross-sectional study was conducted in Kerman, Iran. Data were collected from patients who visited Afzalipour Hospital in Kerman more than twice during the COVID-19 epidemic from the end of February 2020 to March 21, 2021. We conducted two key analyses: 1. Mixed effect logistic regression was used to check the relationship between the variables and COVID-19 severity. 2. Mixed effect linear regression was used to check the relationship between the variables and the length of stay in the hospital.                                                           Results:                     The findings indicated that the most important risk factors for the severity of COVID-19 were heart diseases (OR=1.67,95%CI:1.20-2.30), increasing age (OR=2.23 for age&gt;54, 95%CI:1.70- 2.90), male gender (OR=1.47,95%CI:1.10-1.96), respiratory diseases other than asthma, and frequency of admission (OR=1.60,95%CI:1.20-2.15). All patients who underwent readmission experienced a shorter duration of hospitalization during their subsequent admission (OR=0.94,95%CI:0.91,0.96) and had a higher mortality rate (30% within 14 days, 26.6% between 14-90 days). Patients readmitted at intervals of 14-90 days and greater than 90 days exhibited lower disease severity compared to those readmitted within the 0-14 day period.                                                           Conclusion:                     Examining readmissions, the severity of COVID-19, and the length of hospital stay in affected patients are important factors for planning and allocating resources for COVID-19 management and treatment. These factors can help policymakers develop effective clinical guidelines for hospitalization or outpatient treatment of COVID-19 patients and contribute to reducing the burden of disease in the community."
Crossref,valvular heart disease,An evolutionarily conserved module links TIR signaling to disease resistance,XiaoFei Du; Yu Zhang; Hailong Guo,10.1016/j.ncrops.2025.100083,2026-10,New Crops,
Crossref,deep learning,Learner profiles and the process of Learning in the Higher Educational Context,Christos Skourlas; Petros Belsis,10.15556/ijiim.02.01.003,2115-03-05,International Journal on Integrated Information Management,
Crossref,deep learning,WEB-BASED COLLABORATIVE LEARNING AND KNOWLEDGE SHARING IN INFORMAL BUSINESS NETWORKS,George Stalidis; Costis Papadimitrakopoulos; Theocharis Tsakiris,10.15556/ijiim.01.02.002,2114-12-10,International Journal on Integrated Information Management,
Crossref,deep learning,Availability and Utilization of Tools and Equipment for Teaching and Learning Garment Making Trade in the Senior Secondary Schools in Edo State,,10.20431/2349-0381.0303002,2106,"International Journal of Humanities, Social Sciences and Education",
Crossref,deep learning,Title Pending 7452,,10.3998/mjcsl.7452,2036-01-19,Michigan Journal of Community Service Learning,
Crossref,deep learning,Title Pending 6294,,10.3998/mjcsl.6294,2034-12-20,Michigan Journal of Community Service Learning,
Crossref,deep learning,Title Pending 5730,,10.3998/mjcsl.5730,2034-11-18,Michigan Journal of Community Service Learning,
Crossref,deep learning,Title Pending 3643,,10.3998/mjcsl.3643,2033-09-06,Michigan Journal of Community Service Learning,
Crossref,deep learning,Title Pending 4120,,10.3998/mjcsl.4120,2033-03-28,Michigan Journal of Community Service Learning,
Crossref,deep learning,Title Pending 2741,,10.3998/mjcsl.2741,2032-09-28,Michigan Journal of Community Service Learning,
Crossref,deep learning,Integration of Biomechanics and Digital Technology: Using Kinovea for Motion Analysis and Learning for Beginner Athletes,Muhammad Nur Hudha; Riezky Maya Probosari; Annisa Nur Khasanah; Supurwoko; Salsabila Kholifahtun Nisa’; Gifran Rihla Gifarka Latief,10.58524/jcss.v4i2.890,2029-11-29,Journal of Coaching and Sports Science,"Background: The integration of biomechanics with digital motion-analysis technologies has introduced new approaches for examining movement efficiency, kinematic characteristics, and technical patterns in walking and running activities. Kinovea, as an accessible motion-analysis software, provides both visual and quantitative feedback. However, its application in supporting technique development among beginner athletes remains insufficiently explored. Aim: This study aims to describe the use of Kinovea in biomechanics training and examine its contribution to the awareness of kinematic characteristics and movement techniques among beginner athletes. Methods: A descriptive qualitative design involved 72 beginner athletes aged 18–25 years selected through purposive sampling. Data were collected over 16 weeks through interviews, field observations, and motion video recordings analyzed using Kinovea. Kinematic data focused on joint angles, stride behavior, and movement phases during walking, running, and the flight phase. Qualitative data were analyzed using content analysis with NVivo 12, while kinematic results were interpreted descriptively to identify performance patterns and areas for technical refinement. Result: Kinematic analysis showed coordinated joint-angle patterns across all phases. Walking analysis identified arm swing angles of 50.9°–58.8° and leg separation angles of 64.3°–67.2°, indicating a stable gait rhythm. The running analysis revealed knee angles of 68.8°–69.8° and elbow angles of 87.6°–89.1°, indicating efficient propulsive mechanics. The flight phase demonstrated knee angles of 81.2°–87.8° and elbow angles of 80.4°–88.3°, suggesting effective momentum use and postural stability. These measurements supported stride-efficiency assessment and technique evaluation. Qualitative findings revealed that Kinovea enabled athletes to interpret movement phases and identify technical inefficiencies through slow-motion and frame-by-frame visualization. Conclusion: Kinovea supports basic motion analysis by providing clear kinematic information and helping beginner athletes observe and refine their movement techniques. The findings also offer practical value for coaches by enabling more precise identification of inefficient patterns and guiding targeted corrections during early-stage training."
Crossref,deep learning,Distributed Algorithms for High-Dimensional Statistical Inference and Structure Learning with Heterogeneous Data,Hongru Zhao; Xiaotong Shen,10.5705/ss.202025.0087,2028,Statistica Sinica,
Crossref,deep learning,Botnet Detection in Network Security by means of Deep Neural Network - DBoTPM,Sankarsan Panda; Julia Faith S; C. Manonmani; Sheshang Degadwala,10.1504/ijcis.2028.10073178,2028,International Journal of Critical Infrastructures,
Crossref,deep learning,Zero-Day Intrusion Detection System: Training on Small Datasets with Advanced Data Augmentation and Ensemble Learning,Mehaboob Mujawar; Aasheesh Raizada; Abdullah Gubbi,10.1504/ijims.2028.10075219,2028,International Journal of Internet Manufacturing and Services,
Crossref,deep learning,Doubly Robust Transfer Learning Under Sub-group Shift for Cohort-level Missing Indicator Covariates,Huali Zhao; Tianying Wang,10.5705/ss.202025.0245,2028,Statistica Sinica,
Crossref,deep learning,Simultaneous Estimation and Dataset Selection for Transfer Learning in High Dimensions by a Non-convex Penalty,Zeyu Li; Dong Liu; Yong He; Xinsheng Zhang,10.5705/ss.202024.0423,2028,Statistica Sinica,
Crossref,deep learning,Enhancing Real Time Decision Intelligence through Federated Learning Integration in Edge Computing Networks,M.S. Bennet Praba; M.Vinay Kumar; K.B. Anusha; Nitin Tiwari; Nidal Al Said; K. Kandan,10.1504/ijcis.2028.10073919,2028,International Journal of Critical Infrastructures,
Crossref,deep learning,Uncertainty Quantification for Large-Scale Deep Neural Networks via Post-StoNet Modeling,Yan Sun; Faming Liang,10.5705/ss.202024.0294,2028,Statistica Sinica,
Crossref,deep learning,Dancing in the Rain: The Effectiveness of Mobile Platform for Learning Ten Qira’at,Muhammad Shahrizan Shahrudin; Mu’azah Md. Aziz; Ainul Maulid Ahmad; Abdul Hakim Mahadzir; Muhd Thoriq Asshiddiq Che Ahmad,10.6007/ijarbss/v14-i5/21493,2027-05-02,International Journal of Academic Research in Business and Social Sciences,
Crossref,deep learning,Harnessing IoT anu Machine Learning for Predictive Smart Irrigation Systems: Optimising Water Use and Crop Yield,D. Prathyusha; Pranusha Dogga; Dogga Aswani; Selvani Deepthi,10.1504/ijsse.2027.10068719,2027,International Journal of System of Systems Engineering,
Crossref,deep learning,Efficient Learning of DAG Structures in Heavy-tailed Data,Wei Zhou; Xueqian Kang; Wei Zhong; Junhui Wang,10.5705/ss.202024.0199,2027,Statistica Sinica,
OpenAlex,aortic stenosis,[Analysis of optimizing indications for fetal pulmonary valvuloplasty based on a multi-parameter scoring system].,Y Wang; Y Sun; G Luo; S L Pan,,2026-02-02,PubMed,"<b>Objective:</b> To establish a multi-parametric scoring system for predicting postnatal circulatory outcomes in fetuses with critical pulmonary stenosis (CPS) and pulmonary atresia (PA) with intact ventricular septum (IVS), in order to optimize the indications for fetal pulmonary valvuloplasty (FPV). <b>Methods:</b> This was a retrospective cohort study. A total of 96 fetuses diagnosed with CPS-IVS or PA-IVS at Women and Children's Hospital, Qingdao University between July 2018 and June 2021 were included. Fetuses who did not undergo FPV constituted the modeling cohort, while those who underwent FPV constituted the validation cohort. Fetuses were classified into biventricular and non-biventricular circulation groups based on postnatal circulatory outcomes. Prenatal fetal echocardiographic parameters were compared between groups using independent-samples <i>t</i> test, Mann-Whitney <i>U</i> test, <i>χ</i><sup>2</sup> test or Fisher exact test. Based on inter-group differences, parameters associated with postnatal circulatory outcomes were screened in the modeling cohort. For continuous variables, optimal cut-off values were determined using receiver operating characteristic (ROC) curve and the Youden index and then dichotomized. Right ventricular endocardial fibroelastosis (EFE) was graded as 0, 1 or 2 according to severity. <i>OR</i> of each parameter were calculated, and a multiparametric scoring system was constructed. ROC curve was used to evaluate its predictive performance. Post-FPV outcome improvement was assessed in the validation cohort. <b>Results:</b> Among the 96 fetuses, 78 were assigned to the modeling cohort and 18 to the validation cohort. Postnatally, biventricular circulation was achieved in 56 cases (72%) in the modeling cohort and 13 cases in the validation cohort. In the modeling cohort, the right ventricular long-axis/left ventricular long-axis (RV/LV), tricuspid annulus diameter/mitral annulus diameter (TV/MV) and pulmonary valve annulus/aortic valve annulus (PV/AV) in the non-biventricular group were lower than that in the biventricular group (all <i>P</i><0.05). The optimal cut-off values for predicting postnatal circulatory outcomes were 0.65, 0.82 and 0.78, respectively. There was statistically significant difference in the distribution of circulatory outcomes between fetuses with grade 2 EFE and those with no or grade 1 EFE (<i>χ</i><sup>2</sup>=21.28, <i>P</i><0.001). Therefore, right ventricular EFE was dichotomized in the model as ""none or grade 1"" versus ""grade 2"". Each parameter was assigned a corresponding weight based on its <i>OR</i> value, and an integer score was obtained to construct the scoring system: grade 2 right ventricular EFE was assigned 5 points, RV/LV≤0.65 was assigned 2 points, TV/MV≤0.82 was assigned 2 points, and PV/AV≤0.78 was assigned 1 point, with a maximum total score of 10 points. At cut-off scores of 3, 4, and 5 points, the areas under the curve were 0.88, 0.91, and 0.88, respectively, with the highest specificity (0.95, 95% <i>CI</i> 0.84-0.99) observed at a score threshold of 5 points. In the validation cohort, 15 fetuses had scores ≥5 points, among whom 10 fetuses achieved biventricular circulation after birth, whereas in the modeling cohort, only 1 of 18 fetuses achieved biventricular circulation after birth. <b>Conclusions:</b> A multiparametric scoring system based on prenatal fetal echocardiographic parameters can effectively predict non-biventricular postnatal outcomes in fetuses with CPS-IVS and PA-IVS. By identifying high-risk patients, the indications for FPV can be optimized."
OpenAlex,aortic stenosis,Can Acute Kidney Injury After Transcatheter Aortic Valve Replacement Alone Predict Poor Prognosis in Diabetic Patients?,Nur Ozer Sensoy; Fatih Levent; Ece Çelebi Coşkun; Günseli Demir; Mustafa Yılmaz,10.37990/medr.1654048,2026-01-31,Medical Records,"Aim: Transcatheter aortic valve implantation (TAVI) has become a well-recognized treatment option for patients with symptomatic severe aortic stenosis (AS) who are deemed to have a higher risk for surgical intervention. Due to underlying comorbidities, acute kidney injury (AKI) continues to be a common complication, especially in patients with diabetes mellitus after TAVR. The aim of this study is to evaluate the effect of postoperative AKI development in diabetic patients undergoing TAVR on the development of mortality and major adverse cardiac events (MACE) in these patients. Material and Method: A total of 141 patients who underwent TAVR between January 2015 and January 2020 were grouped according to whether they developed AKI and whether they had MACE. MACE and 5-year mortality status were compared according to whether the patients developed AKI. Results: A total of 35 patients were observed to develop AKI (24.8%). Additionally, MACE was observed in 36 patients (25.5%). Five-year mortality rates (42.9% vs. 15.1%; p = 0.002) and MACE rates (54.3% vs. 16%; p &lt; 0.001) were significantly higher in the AKI group. Univariate and multivariate logistic regression analyses identified AKI as a significant independent predictor of MACE development, regardless of other associated parameters (OR = 3.92, 95% CI: 1.28–12.02; p = 0.017). Conclusion: The most important result obtained in this study is that AKI development in diabetic patients who underwent TAVR with the diagnosis of advanced aortic stenosis has an effect on the development of MACE and long-term mortality independently of other parameters."
OpenAlex,aortic stenosis,"Accuracy of fetal echocardiography in detecting lesions associated with, and predicting surgical plan for, dextro‐transposition of the great arteries and double outlet right ventricle with subpulmonary ventricular septal defect and predicted transposition physiology",Hamsika Chandrasekar; Michelle Kaplinski; S. A. Maskatia; M. J. Beattie; D. Y. Ho; C. D. Reddy; Rajesh Punn,10.1002/uog.70169,2026-01-30,Ultrasound in Obstetrics and Gynecology,"ABSTRACT Objectives In dextro‐transposition of the great arteries (D‐TGA) and double outlet right ventricle with subpulmonary ventricular septal defect (DORV‐SPV) and predicted transposition physiology, the presence of associated lesions, such as ventricular septal defect (VSD), coarctation of the aorta (CoA) or pulmonary stenosis (PS), impacts prenatal counseling and complicates neonatal surgery. This study aimed to evaluate the diagnostic accuracy of fetal echocardiography (FE) and its ability to predict the postnatal surgical plan in fetuses with D‐TGA or DORV‐SPV. Methods This was a single‐center retrospective cohort study of fetuses with D‐TGA or DORV‐SPV who were liveborn, had a recorded plan for postnatal intervention and were managed at Lucile Packard Children's Hospital, Palo Alto, CA, USA, between January 2013 and January 2024. In cases with serial FE examinations, all available FE reports were included in the analysis, in addition to the first postnatal echocardiogram report. For echocardiograms with incomplete measurement data, a single reader retrospectively obtained FE and postnatal echocardiogram measurements while blinded to clinical outcomes. Prenatal predictions for postnatal surgical repair were extracted from the fetal cardiology consultation notes and postnatal clinical data were obtained by chart review. Final FE and postnatal echocardiogram diagnoses, as well as prenatal surgical‐plan predictions and subsequent postnatal surgical repairs performed, were compared and the percentage concordance was calculated to obtain FE diagnostic accuracy. Receiver‐operating‐characteristics (ROC) curves were generated to evaluate the association of FE aortic and pulmonary measurements with postnatal CoA repair. Results The study included 99 fetuses, of which 45 were diagnosed postnatally with simple D‐TGA with no associated lesions (i.e. D‐TGA with intact ventricular septum), 38 with complex D‐TGA with associated lesions and 15 with DORV, and one neonate was diagnosed prenatally with DORV‐SPV but postnatally diagnosed with truncus arteriosus. In the majority (65%) of patients, serial FE was performed. The percentage concordance between fetal and postnatal echocardiogram diagnoses was high for simple D‐TGA (95% (42/44)) and D‐TGA with VSD and PS (100% (3/3)). The concordance was progressively lower for diagnoses of D‐TGA with VSD (93% (25/27)), DORV‐SPV (60% (3/5)), DORV‐SPV with CoA (40% (4/10)), D‐TGA with VSD and CoA (29% (2/7)), D‐TGA with isolated CoA (0% (0/2)) and DORV‐SPV with PS (0% (0/1)). Similarly, surgical‐plan accuracy between prenatal prediction and postnatal repair performed was highest for cases of simple D‐TGA and D‐TGA with VSD and PS, while it was lower for other diagnoses. Qualitative descriptions of VSD size changed frequently over serial FE examinations, with VSDs generally described as larger on later FE. However, between the final FE and postnatal echocardiogram, in those with discordance, the description of VSD size usually became smaller. Only 50% of small VSDs identified on postnatal echocardiography required repair. All patients who underwent postnatal repair of CoA had a VSD present. All area under the ROC curve values for aortic measurements and for ratios of aortic‐to‐pulmonary dimensions in predicting the need for postnatal CoA repair were greater than 0.9. Conclusions Challenges remain in the accurate diagnosis and prediction of the postnatal surgical plan in fetuses with complex D‐TGA and DORV‐SPV. The assessment of qualitative VSD size description changed frequently over serial FE evaluations, and between final FE and postnatal echocardiogram, with small defects often not requiring repair. Aortic and aortic‐to‐pulmonary ratio measurements in fetuses with D‐TGA or DORV‐SPV appear to have improved the discriminatory ability in identifying cases that undergo postnatal CoA repair relative to fetuses with isolated CoA. © 2026 International Society of Ultrasound in Obstetrics and Gynecology."
OpenAlex,aortic stenosis,Delayed complete atrioventricular block 11 months after transcatheter aortic valve replacement in a patient with a short membranous septum: a case report,Jian Xiong; Djandan Tadum Arthur Vithran; Zhixiao Wang; Zheng Cao; Xiaoyong Hu,10.3389/fcvm.2026.1703981,2026-01-30,Frontiers in Cardiovascular Medicine,"Conduction disturbances are among the most frequent complications of transcatheter aortic valve replacement (TAVR), typically occurring within the first 72 h after implantation. However, delayed complete atrioventricular (AV) block is rare and may present late with serious clinical consequences. We describe the case of a 72-year-old man with hypertension who developed complete AV block nearly 1 year after TAVR, underscoring the importance of long-term surveillance in patients with high-risk anatomy. The patient initially presented with progressive exertional dyspnea and was diagnosed with severe low-flow, low-gradient aortic stenosis, with a left ventricular ejection fraction of 33%. Preprocedural computed tomography demonstrated a short membranous septum (4.0 mm) and an annulus–membranous septum distance of 1.2 mm, both of which are recognized predictors of conduction disturbances. He underwent transfemoral TAVR with a self-expanding Qiming L26 valve implanted at a depth of approximately 5 mm. Early recovery was uneventful, aside from a small paravalvular leak, which resolved by the 8-month follow-up, at which time echocardiography showed recovery of systolic function to 60%, and sinus rhythm was observed on electrocardiography. At 11 months following TAVR, a community screening ECG revealed 2:1 AV block, and 3 weeks later, he presented with symptomatic complete AV block and a ventricular escape rhythm at 30 bpm. Repeat CT showed increased frame depth (7.6 and 9.8 mm), suggesting possible valve–septum interaction; however, causal attribution is limited by the absence of immediate/serial CT and electrophysiological mapping, and age-related conduction system disease may have contributed to this finding. A dual-chamber permanent pacemaker was implanted, resulting in complete symptomatic recovery and a stable prosthetic valve function. This case report highlights a rare but clinically important phenomenon of very late conduction block after TAVR and supports a risk-stratified approach to anatomical assessment and long-term rhythm monitoring. However, this inference remains hypothesis-generating, given its single-patient nature."
