source,keyword,title,authors,doi,publication_date,journal,abstract
PubMed,aortic stenosis,Fatal Complications in Candida parapsilosis Endocarditis-A Case Report.,Sebastian George Smadu; Simona Camelia Tetradov; Luminita Ene; Simin Aysel Florescu; Dragos Stefan Lazar,10.3390/jof11110817,2025-11-18,"Journal of fungi (Basel, Switzerland)","Fungal endocarditis, despite being a rare diagnosis, has a higher morbidity and mortality rate compared to bacterial endocarditis. Candida species are the most common isolated pathogens involved in fungal endocarditis. Diagnosis is suspected in patients with underlying conditions such as cancer, myelodysplastic syndrome, diabetes, or intravascular catheters, where the modified Duke criteria apply. Management of the patient requires a multidisciplinary team (cardiologist, infectious diseases consultant, cardiac surgeon) along with antifungal treatment. We present the case of a 60-year-old male with biological prosthetic aortic valve replacement in the previous year for bicuspid aortic stenosis, admitted for a 5-day history of fever, nausea and minor urinary symptoms. The blood cultures were positive for Candida parapsilosis. Transthoracic cardiac ultrasound revealed a hypoechogenic mass attached to the aortic valve at the prosthetic fixation site. Although diagnosis was rapidly confirmed and treatment was administered shortly after first suspected, the patient developed, at first, cavernous sinus thrombosis and, later, fatal ST elevation myocardial infarction. The patient died despite efficient antifungal therapy, initially with Anidulafungin in monotherapy and later in combination with Fluconazole. The reported case emphasizes the importance of managing fungal endocarditis, the need for urgent diagnostic attention and multidisciplinary team approach by infectious diseases specialist, cardiologist, neurologist and heart surgeon."
PubMed,aortic stenosis,Human Plasma in Calcific Aortic Valve Disease: Not Simply a Depot of Biomarkers.,Yen-Chun Ho; Ian Y Chen,10.1161/JAHA.125.046421,2025-11-26,Journal of the American Heart Association,
PubMed,aortic stenosis,Detrimental Effect of Plasma From Patients With Severe Aortic Stenosis on Valvular Endothelial Cells: Role of Proinflammatory Cytokines and Factor Xa.,Antonin Trimaille; Sandy Hmadeh; Shinnosuke Kikuchi; Ali Mroueh; Adrien Carmona; Benjamin Marchandot; Francis Beras; Dinh Phi Truong; Manh Cuong Vu; Amandine Granier; Laurence Jesel; Patrick Ohlmann; Laurent Sattler; Valérie Schini-Kerth; Olivier Morel,10.1161/JAHA.125.041701,2025-11-26,Journal of the American Heart Association,"The role of plasma and its components in the progression of aortic stenosis (AS) remains insufficiently investigated. This study aimed to assess whether plasma from patients with AS induces oxidative stress and contributes to valvular endothelial cells (VECs) dysfunction.
Human plasma samples were obtained from patients with severe AS (AS+, n=110), patients with cardiovascular risk factors without AS (n=30), and healthy individuals (n=15). Plasma levels of proinflammatory cytokines (IL [interleukin]-1β, IL-6, TNF [tumor necrosis factor]-α, and factor Xa [FXa]) were measured. Porcine aortic VECs were then incubated with plasma (10%, 24 hours). Oxidative stress levels were assessed using dihydroethidium staining, NO formation with 4-amino-5-methylamino-2',7'-difluororescein diacetate, mRNA expression by quantitative reverse transcription-polymerase chain reaction, and protein expression levels by Western blot analyses. Platelets and monocytes adhesion as well as thrombin generation were determined. Different pharmacological inhibitors were used to explore the underlying pathways.
Plasma from patients with AS+ exhibited elevated levels of IL-1β, IL-6, TNF-α, and FXa activity. Incubation of VECs with AS+ plasma induced a pro-oxidant response mediated by proinflammatory cytokines, the angiotensin system-SGLT2 (sodium-glucose transport protein 2) pathway, and FXa. AS+ plasma also triggered VEC dysfunction, inflammation, monocytes and platelets adhesion, and thrombin generation. These detrimental effects were mitigated by empagliflozin, losartan, neutralizing antibodies targeting proinflammatory cytokines, and dabigatran and rivaroxaban.
Patients with AS displayed subclinical systemic inflammation and increased FXa activity. These processes contributed to aortic VEC dysfunction, inflammation, monocytes and platelets adhesion, and thrombin generation upon exposure to AS+ plasma."
PubMed,aortic stenosis,Relevance of Clonal Hematopoiesis in Immune Cells for Degenerative Aortic Valve Stenosis.,Silvia Mas-Peiro; Stefanie Dimmeler; Andreas M Zeiher,10.1161/JAHA.125.044406,2025-11-26,Journal of the American Heart Association,"Clonal hematopoiesis of indeterminate potential (CHIP), defined as the presence of somatic mutations in subjects without other hematologic abnormalities has been recently associated with several cardiovascular diseases. Degenerative aortic valve stenosis (AVS), a prototypical cardiovascular age-related disorder resulting from calcification and inflammation processes for which no medical treatment is currently available, has become the subject of scientific research in this field. In this review we describe the clinical relevance of CHIP in patients with AVS, as well as its effects on left ventricular dysfunction and heart failure, particularly about compensatory hypertrophy and diastolic dysfunction assessed by echocardiographic parameters. CHIP-driver mutations DNMT3A and TET2 have been found in a third of all patients with severe AVS undergoing transcatheter aortic valve replacement in most studies; and several short-term and long-term studies have reported an increased mortality rate associated with the presence of CHIP in these patients. Additionally, we discuss potential mechanistic insights involving inflammatory pathways both from a clinical and from an experimental approach. These include primarily fluorescence-activated cell sorting (FACS) analyses or single-cell RNA sequencing (sc-RNA-seq) analyses from circulating leukocytes of patients with AVS, showing an increase in proinflammatory interleukines, and analyses on valve tissue exhibiting higher transcript levels of immunoglobulins, as well as murine models mimicking the consequences of AVS that could shed some light on potential causal link between CHIP and AVS. Lastly, we summarize prospects for novel therapeutic strategies, with efforts focusing on developing both general and more specific inflammatory therapies targeting inflammatory pathways. Future research will need to assess the incidence and progression of milder stages of aortic stenosis and evaluate potential interactions with different types of acquired mutations."
PubMed,aortic stenosis,Nordic consensus document on Evolut FX+ transcatheter aortic valve implantation: optimizing index implantation and longer-term outcomes.,Arif A Khokhar; Mikko Savontaus; Ahmed Al-Ani; Christian Juhl Terkselsen; Gintautas Bieliauskas; Annemieke van der Heijden; Azad Alhasan Alhaj Amin; Stefan James; Kristoffer Russell; Ole De Backer,10.3389/fcvm.2025.1682714,2025,Frontiers in cardiovascular medicine,"Transcatheter aortic valve replacement (TAVI) is an established treatment strategy for patients with severe symptomatic aortic stenosis (AS). Multiple landmark randomized controlled trials have consistently demonstrated the safety, efficacy, and longer-term durability of the CoreValve/Evolut (Medtronic, MN, USA) transcatheter aortic valve (TAV) platform in treating severe AS. These findings have supported the expansion of TAVI to younger patients with longer life expectancy, in whom an optimized index valve implantation can significantly impact both acute procedural results and longer-term outcomes. In this technical narrative, we aim to describe how iterative changes in the latest-generation Evolut FX(+) TAV can be utilized to achieve an optimized index valve implantation."
PubMed,aortic stenosis,Efficacy and safety of emergent balloon aortic valvuloplasty as a rescue therapy for cardiogenic shock due to severe aortic stenosis in non-TAVI centers.,Mayuka Masuda; Wataru Fujimoto; Masamichi Iwasaki; Kenzo Uzu; Takuma Sawa; Amane Kozuki; Ryo Nishio; Noritoshi Hiranuma; Makoto Takemoto; Koji Kuroda; Soichiro Yamashita; Junichi Imanishi; Takafumi Todoroki; Masanori Okuda; Hiromasa Otake,10.1186/s12872-025-05310-6,2025-11-25,BMC cardiovascular disorders,"The prognosis of aortic stenosis (AS) with cardiogenic shock remains poor, and optimal initial treatment remains unclear. Emergent balloon aortic valvuloplasty (BAV) is a treatment option for salvage and recent studies have reported that early release of valve obstruction by emergent BAV could improve prognosis. This study aimed to assess the efficacy and safety of emergent BAV for severe AS with cardiogenic shock.
Among 8,230 patients hospitalized for heart failure, 7924 patients with heart failure unrelated to severe AS were excluded. Among the remaining 306 patients, 256 patients who developed cardiogenic shock due to other causes except severe AS were further excluded. Finally, a total of 41 patients with severe AS in cardiogenic shock were enrolled and divided into the emergent (underwent BAV within 6 h of admission, n = 9) and non-emergent (underwent BAV more than 6 h after admission, n = 16) groups, after excluding 16 patients who did not undergo BAV. The primary endpoints were the 30-day mortality rate and procedural complications. The secondary endpoints were days to withdrawal from the mechanical support device, days to initial rehabilitation, and clinical frailty scale (CFS) score at discharge.
In the emergent group, the time from admission to BAV was 3.0 ± 1.4 h, whereas BAV was performed 4.5 days (median) after admission in the non-emergent group. The 30-day mortality rate was not significantly different between the emergent and non-emergent groups (0% vs. 25%, p = 0.260); furthermore, there was no statistically significant difference regarding the incidence of procedural complications (0% in the emergent vs. 12.5% in the non-emergent group, p = 0.520). The days to withdrawal from mechanical support device and to start rehabilitation were earlier in emergent group (2.9 ± 1.2 days vs. 7.8 ± 4.6 days; p = 0.008, 4.2 ± 1.9 days vs. 10.8 ± 6.5 days; p = 0.004). The CFS score at discharge in the emergent group was maintained compared to before admission (from 3.8 ± 1.0 to 3.9 ± 1.1; p = 0.347), whereas worsened in the non-emergent group (from 3.8 ± 0.9 to 4.6 ± 1.2; p = 0.032).
Emergent BAV for cardiogenic shock is feasible, and earlier BAV may support faster recovery and help prevent deterioration of frailty."
PubMed,valvular heart disease,Early favorable outcomes of valve repair in congenital heart surgery.,Muhammed Ikbal Aydin; Eiri Kisamori; Mitchell Haverty; Rittal Mehta; Aybala Tongut; Manan Desai; Gerard Martin; Wayne Jay Franklin; Yves d'Udekem,10.1093/icvts/ivaf273,2025-11-26,Interdisciplinary cardiovascular and thoracic surgery,"Mechanical valve replacement is often used as the therapeutic option in valvular heart surgery in children. Evidence suggests that this should change to provide optimal long-term survival for this growing population. We reviewed our current practice in valve repair in congenital heart disease and analyzed its outcomes.
A total of 90 patients (30 semilunar valve, 60 atrioventricular valve) underwent valve repair between September 2020 and December 2024. Operative data and follow-up information were gathered retrospectively. Kaplan-Meier calculations were used for survival and freedom from reoperation analysis. Cox regression analysis was used to assess risk factors for mortality (single ventricle physiology, age and weight at time of surgery, bicuspid aortic valve, and complexity of repair). Complexity of repair was defined as the application of three or more repair techniques.
Estimated survival at 12 months for semilunar and AV valve groups was 95.2% and 95%, respectively. Estimated freedom from reoperation at 12 months for repair of semilunar and AV valves was 95.8% and 95.6%, respectively. Single ventricle morphology (HR: 5.2, 95% CI 1.3-20.8; p = 0.0198) and younger age at time of surgery (HR: 0.7, 95% CI 0.6-0.9; p = 0.0223) were associated with increased risk of mortality.
Valve repair in congenital heart disease provides reliable early outcomes in this complex population. The worst outcomes are expected in patients with single ventricle requiring surgery in early life."
PubMed,valvular heart disease,Importance of Preoperative Left Ventricle Volume Assessment in Asymptomatic Tetralogy of Fallot Infants.,Akinori Hirano; Takaya Hoashi; Shigeki Yoshiba; Ryusuke Hosoda; Yuji Fuchigami; Yukino Iijima; Takaaki Suzuki,10.5761/atcs.oa.25-00077,2025,Annals of thoracic and cardiovascular surgery : official journal of the Association of Thoracic and Cardiovascular Surgeons of Asia,"The study investigated the importance of left ventricular volume assessment before primary repair in asymptomatic tetralogy of Fallot (TOF) patients.
Forty-two asymptomatic TOF patients who underwent preoperative cardiac catheterization at a median age of 4.7 months interquartile range [IQR], 4.0-5.3) between 2013 and 2023 were enrolled. Asymptomatic TOF was defined as room air oxygen saturation ≥85% without duct-dependent circulation. Left ventricular end-diastolic volume (LVEDV) as a percentage of predicted normal (LVEDV%N) was measured using the single-plane area-length method. Correlation with echocardiographic parameters was assessed.
The median LVEDV%N was 107% (IQR, 87.5-139.5). Five patients (11.6%) had LVEDV%N ≤80%. One patient with the lowest LVEDV%N (62%) underwent a modified Blalock-Taussig shunt instead of primary repair. The remaining four patients had a small pulmonary valve annulus (PVA) (Z-score -4.2 to -6.6) and underwent transannular patch repair. Seven additional patients underwent transannular patch repair due to total conal ventricular septal defect (n = 5) or patent ductus arteriosus with small PVA (n = 2). LVEDV%N showed a weak correlation with 1-month echocardiographic parameters (R2 = 0.27-0.347).
Left ventricular volume assessment prior to primary repair is essential in asymptomatic TOF patients. There were cases with small LV for whom primary repair was deferred, or whose PVA was also small; therefore, transannular patch repair was selected."
PubMed,valvular heart disease,Beyond the Heart: Marfan Syndrome From the Cardiologist's Perspective.,Kayanne Toutounji; Dalia Safi; Issam El Rassi; Mariam Arabi,10.1097/CRD.0000000000001131,2025-11-20,Cardiology in review,"Marfan syndrome is a multisystem connective tissue condition that results in extracellular matrix breakdown and dysregulated transforming growth factor-beta signaling caused by FBN1 mutations. The principal focus of clinical surveillance and research is the aortic root aneurysm. However, with cardiovascular factors being the main sources of morbidity and mortality, they necessitate equal consideration. This narrative review provides a comprehensive overview of the pathophysiology, range of cardiac involvement, advancements in diagnosis, and therapeutic approaches. Certain forms of FBN1 mutations affect the risk and rate of progression of aortic root dilatation. Marfan syndrome is also characterized by valvular diseases, such as tricuspid and mitral valve prolapse, the latter of which may be an early indicator of serious pediatric illness. Independent of valvular disease, new data also indicate intrinsic cardiac dysfunction and an increased risk of ventricular arrhythmias. Echocardiography is used for diagnosis, and new measures such as the aortic root ratio improve screening for children. For the detection of mitral annular disjunction and myocardial fibrosis, cardiac magnetic resonance imaging is essential. Given the strong links between genotype and phenotype, genetic testing helps with risk stratification and verifies the diagnosis. Prophylactic aortic surgery based on predetermined thresholds, beta-blocker or angiotensin-receptor blocker medication, and lifelong observation are all part of management. This narrative review emphasizes that to enhance outcomes and quality of life for patients with Marfan syndrome, comprehensive cardiac treatment necessitates a multidisciplinary approach and vigilance for the complete range of cardiovascular sequelae."
PubMed,valvular heart disease,Stress imaging in paediatric and congenital heart disease patients.,Suzan Hatipoglu; Inga Voges; Kuberan Pushparajah; Elettra Pomiato; Raad Mohiaddin; Cemil Izgi; Dudley J Pennell; Sylvia Krupickova; Giovanni Di Salvo,10.1093/ehjci/jeaf332,2025-11-26,European heart journal. Cardiovascular Imaging,"Stress imaging in paediatric cardiology and congenital heart disease patients has an increasing role for functional assessment. Indications include coronary artery anomalies and disease in association with anomalous aortic origin of coronary arteries, Kawasaki disease or surgical manipulation of the coronary ostia, as well as assessment of elevated filling pressures, dynamic left ventricular outflow obstruction or significance of valvular heart disease. This review provides practical guidance focused on commonly used stress echocardiography and stress cardiovascular magnetic resonance in context of their clinical indications for this age group."
PubMed,valvular heart disease,Determinants of recovery from right ventricular dysfunction after transcatheter edge-to-edge tricuspid valve repair.,Felix Ausbuettel; Christian Waechter; Ulrich Luesebrink; Georgios Chatzis; Harald Schuett; Carlo-Federico Fichera; Dimitar Divchev; Bernhard Schieffer; Harald Lapp; Bjoern Goebel; Carsten Salomon; Elizabeth Costello-Boerrigter; Mathias Lange; Katharina Otto; Sebastian Kerber; Karin Nentwich; Martina Hautmann; Sebastian Barth,10.2459/JCM.0000000000001802,2025-11-01,"Journal of cardiovascular medicine (Hagerstown, Md.)","Transcatheter edge-to-edge tricuspid valve repair (T-TEER) has emerged as a well tolerated and efficacious treatment modality among patients with tricuspid valve regurgitation. Right ventricular dysfunction (RVD) has been observed in up to 22% of patients undergoing T-TEER. Currently, the determinants of RVD recovery are not sufficiently understood.
All patients in four German tertiary cardiac centers scheduled for T-TEER were included for analysis. Patients were divided according to concomitant RVD at the time of T-TEER. RVD was defined as impairment of either tricuspid plane systolic excursion (TAPSE) or right ventricular fractional area change (RV-FAC). The primary endpoint of the study was recovery from RVD during follow-up 3 months after T-TEER. Predictors of RVD recovery were identified via univariable and multivariable logistic regression analyses.
A total of 105 patients were included. Concomitant RVD was present in 43.8% of the patients (46/105). Recovery from RVD was observed in 47.8% (22/46) of patients, particularly in patients with mild RVD at baseline according to the TAPSE. A sufficient reduction in tricuspid valve regurgitation to mild severity likewise constituted a predictor of RVD recovery and emerged as a surrogate parameter of reduced right ventricular volume overload.
Recovery from RVD was most likely in patients who presented with mild RVD and a sufficient reduction in tricuspid valve regurgitation to mild severity according to T-TEER. Early identification and interventional treatment of today's patients with high-grade tricuspid valve regurgitation and RVD represent key factors in providing relief for this particular cohort of patients."
PubMed,valvular heart disease,Improvement in Severe Mitral Regurgitation and Left Ventricular Dysfunction with Intravenous Iron in Severe Anemia: A Case Report.,Pawan Kumar; Himanshu Jindal; Urvashi Arora; Sakshi Agarwal,10.59556/japi.73.1224,2025-11,The Journal of the Association of Physicians of India,"Anemia and iron deficiency are frequently observed in patients with heart failure (HF) and are independently linked to adverse outcomes. Although intravenous (IV) iron supplementation is well studied in HF with reduced ejection fraction, its impact on coexisting significant valvular disease remains poorly understood.
A 67-year-old female with a known history of coronary artery disease, diabetes, hypertension, hypothyroidism, and chronic kidney disease presented with exertional breathlessness and fatigue. Workup revealed severe anemia (hemoglobin 6.1 gm/dL), reduced left ventricular ejection fraction (LVEF 45%), severe mitral regurgitation (MR), and mild tricuspid regurgitation (TR). She was managed conservatively with IV iron and two units of leukocyte-depleted packed red blood cells (LD PRBCs). Over the next few days, the patient experienced marked clinical improvement. Repeat echocardiography demonstrated normalization of LVEF, downgrading of MR severity from severe to mild, regression of TR, and complete resolution of pericardial effusion. Her hemoglobin improved to 8.0 gm/dL.
This case underscores the role of severe anemia as a modifiable factor contributing to cardiac dysfunction, including reversible valvular insufficiency and reduced systolic performance. Restoration of hemoglobin levels led to significant clinical and echocardiographic recovery, pointing to anemia as a potential therapeutic target in such cases. The use of IV iron proved beneficial in facilitating this improvement.
In older patients with multiple comorbidities and new or worsening cardiac dysfunction, severe anemia should be considered a treatable cause. Early diagnosis and targeted therapy using IV iron and transfusion can result in substantial clinical gains and may help avoid unnecessary invasive procedures."
PubMed,valvular heart disease,"Development of 2023 ACR/EULAR Antiphospholipid Syndrome Classification Criteria, Phase III-A/B Report: Defining and Structuring the Clinical and Laboratory Domains.",Medha Barbhaiya; Stephane Zuily; Mary-Carmen Amigo; Tadej Avcin; Maria Laura Bertolaccini; D Ware Branch; Guilherme Ramires de Jesus; Katrien M J Devreese; Camille Frances; David Garcia; Francis Guillemin; Steven R Levine; Roger A Levy; Michael D Lockshin; Thomas L Ortel; Surya V Seshan; Maria G Tektonidou; Denis Wahl; Rohan Willis; Allison Hendry; Ray Naden; Karen H Costenbader; Doruk Erkan; New APS Classification Criteria Collaborators,10.1007/s11926-025-01202-y,2025-11-26,Current rheumatology reports,"An international multi-disciplinary initiative resulted in the development of 2023 ACR/EULAR Antiphospholipid Syndrome (APS) Classification Criteria to identify patients with high likelihood of APS for research. Phase I/II resulted in 27 candidate criteria organized into six clinical and laboratory domains. Here, we summarize early Phase III efforts to better define and structure candidate criteria within clinical and laboratory domains.
Using comprehensive literature reviews and expert consensus, domain subcommittees developed definitions for candidate criteria. Prevalence information was incorporated when available. Definitions were finalized and approved by the Steering Committee for future use during real-world case collection (derivation cohort), multi-criteria decision analysis, and validation. Clinical domain items defined were: (a) macrovascular thrombosis (venous thromboembolism including superficial venous thrombosis, arterial thrombosis, and transient ischemic attack) and associated provoking risk factors; (b) microvascular disease (livedo racemosa, livedoid vasculopathy, antiphospholipid-antibody-nephropathy, diffuse alveolar hemorrhage, cardiac microthrombosis, adrenal hemorrhage, and acute ischemic encephalopathy); (c) pregnancy morbidity (pre-fetal death, fetal death, and pre-eclampsia and placental insufficiency with severe features); (d) cardiac valve disease (thickening or vegetation); and (e) thrombocytopenia. Laboratory domain items defined were coagulation-based functional assay (lupus anticoagulant) and solid phase-based assays (anticardiolipin antibody IgG/M and anti-β2-Glycoportein-I antibody IgG/M). Based on comprehensive literature review and Steering Committee consensus, we defined and structured APS clinical and laboratory domains. Preliminary definitions were subsequently evaluated and confirmed in late Phase III using the derivation cohort and multicriteria decision analysis prior to validation the 2023 ACR/EULAR APS Classification Criteria."
